EED_vs_zCtl,Unnamed: 1,Unnamed: 2,Unnamed: 3,Unnamed: 4,Unnamed: 5,Unnamed: 6,Unnamed: 7,Unnamed: 8,Unnamed: 9,Unnamed: 10,Unnamed: 11,Unnamed: 12,Unnamed: 13,Unnamed: 14,Unnamed: 15
,,,,,,,,,,,,,,,
Gene_names,logFC (EED_vs_zCtl),P_Value (EED_vs_zCtl),isDifferential (EED_vs_zCtl),Protein_IDs,Majority_protein_IDs,Peptide_counts__all_,Peptide_counts__razor_unique_,Peptide_counts__unique_,Protein_names,Gene_names,Fasta_headers,Peptides,Unique_peptides,Sequence_coverage____,Sequence_length
HDLBP,-0.1852996293,0.225724699998735,0,Q00341;A0A024R4E5;C9JHZ8;H7C0A4;C9JIZ1;C9J5E5;C9JZI8;C9JES8;C9JHS7;H0Y394;C9JK79;C9JT62;C9JHN6;C9JEJ8;C9JBS3;C9JQ82;C9JMQ6;C9J739;C9JHS9,Q00341;A0A024R4E5;C9JHZ8;H7C0A4;C9JIZ1;C9J5E5;C9JZI8;C9JES8;C9JHS7,7;7;4;4;4;4;4;4;4;3;3;3;2;2;2;2;2;1;1,7;7;4;4;4;4;4;4;4;3;3;3;2;2;2;2;2;1;1,7;7;4;4;4;4;4;4;4;3;3;3;2;2;2;2;2;1;1,Vigilin,HDLBP,"sp|Q00341|VIGLN_HUMAN Vigilin OS=Homo sapiens OX=9606 GN=HDLBP PE=1 SV=2;tr|A0A024R4E5|A0A024R4E5_HUMAN High density lipoprotein binding protein (Vigilin), isoform CRA_a OS=Homo sapiens OX=9606 GN=HDLBP PE=1 SV=1;tr|C9JHZ8|C9JHZ8_HUMAN Vigilin (Fragment) O",7,7,6.9,1268
PSMA2,-0.4962446897,0.0282481390689299,0,P25787;A0A024RA52;C9JCK5;H3BT36;H7C402,P25787;A0A024RA52,10;10;4;3;1,10;10;4;3;1,10;10;4;3;1,Proteasome subunit alpha type-2;Proteasome subunit alpha type,PSMA2,sp|P25787|PSA2_HUMAN Proteasome subunit alpha type-2 OS=Homo sapiens OX=9606 GN=PSMA2 PE=1 SV=2;tr|A0A024RA52|A0A024RA52_HUMAN Proteasome subunit alpha type OS=Homo sapiens OX=9606 GN=PSMA2 PE=1 SV=1,10,10,53.8,234
BAG6;BAT3,0.3805569015,0.293589877392767,0,P46379;A0A0G2JL47;A0A024RCR6;A0A0G2JK23;F6S6P2;X6REW1;A0A0G2JJM1,P46379;A0A0G2JL47;A0A024RCR6;A0A0G2JK23;F6S6P2;X6REW1;A0A0G2JJM1,3;3;3;3;2;2;2,3;3;3;3;2;2;2,3;3;3;3;2;2;2,Large proline-rich protein BAG6,BAG6;BAT3,sp|P46379|BAG6_HUMAN Large proline-rich protein BAG6 OS=Homo sapiens OX=9606 GN=BAG6 PE=1 SV=2;tr|A0A0G2JL47|A0A0G2JL47_HUMAN Large proline-rich protein BAG6 OS=Homo sapiens OX=9606 GN=BAG6 PE=1 SV=1;tr|A0A024RCR6|A0A024RCR6_HUMAN BAG6 OS=Homo sapiens OX=9,3,3,3.7,1132
TAF15,-0.1408079713,0.386817153545712,0,Q92804;A0A075B7D9;A0A075B7F4;A0A075B7F2,Q92804;A0A075B7D9,4;4;1;1,3;3;1;1,3;3;1;1,TATA-binding protein-associated factor 2N,TAF15,sp|Q92804|RBP56_HUMAN TATA-binding protein-associated factor 2N OS=Homo sapiens OX=9606 GN=TAF15 PE=1 SV=1;tr|A0A075B7D9|A0A075B7D9_HUMAN TATA-binding protein-associated factor 2N OS=Homo sapiens OX=9606 GN=TAF15 PE=1 SV=1,4,3,9.5,592
TXNRD1,0.0663095324,0.69166772399276,0,Q16881;F8W809;A0A087WSY9;A0A182DWI3;A0A087WSW9;E9PIR7;E2QRB9;E9PKD3;A0A0B4J225;E9PIZ5;E9PLT3;E9PKI4;E9PQI3;E9PRI8;A0A182DWF2;D3YTF8;A0A182DWF3;Q9NNW7;E7EWK1;A0A096LPD9;A0A096LPK7,Q16881;F8W809;A0A087WSY9;A0A182DWI3;A0A087WSW9;E9PIR7;E2QRB9;E9PKD3,19;19;19;19;19;19;16;11;6;6;4;4;3;2;1;1;1;1;1;1;1,19;19;19;19;19;19;16;11;6;6;4;4;3;2;1;1;1;1;1;1;1,19;19;19;19;19;19;16;11;6;6;4;4;3;2;1;1;1;1;1;1;1,"Thioredoxin reductase 1, cytoplasmic",TXNRD1,"sp|Q16881|TRXR1_HUMAN Thioredoxin reductase 1, cytoplasmic OS=Homo sapiens OX=9606 GN=TXNRD1 PE=1 SV=3;tr|F8W809|F8W809_HUMAN Thioredoxin reductase 1, cytoplasmic OS=Homo sapiens OX=9606 GN=TXNRD1 PE=1 SV=1;tr|A0A087WSY9|A0A087WSY9_HUMAN Thioredoxin reduct",19,19,38.5,649
HMOX2,-0.0502270888,0.79073240715417,0,P30519;I3L159;I3L1F5;A0A087WT44;I3L1Y2,P30519;I3L159;I3L1F5;A0A087WT44,4;4;4;4;1,4;4;4;4;1,4;4;4;4;1,Heme oxygenase 2,HMOX2,sp|P30519|HMOX2_HUMAN Heme oxygenase 2 OS=Homo sapiens OX=9606 GN=HMOX2 PE=1 SV=2;tr|I3L159|I3L159_HUMAN Heme oxygenase 2 (Fragment) OS=Homo sapiens OX=9606 GN=HMOX2 PE=1 SV=1;tr|I3L1F5|I3L1F5_HUMAN Heme oxygenase 2 (Fragment) OS=Homo sapiens OX=9606 GN=HM,4,4,13,316
KHSRP,-0.0951970403,0.499243521403657,0,Q92945;A0A087WTP3;M0R0I5;M0QYH3;M0QXW7;M0R3J3,Q92945;A0A087WTP3;M0R0I5,19;19;12;8;5;2,17;17;10;6;4;2,17;17;10;6;4;2,Far upstream element-binding protein 2,KHSRP,sp|Q92945|FUBP2_HUMAN Far upstream element-binding protein 2 OS=Homo sapiens OX=9606 GN=KHSRP PE=1 SV=4;tr|A0A087WTP3|A0A087WTP3_HUMAN Far upstream element-binding protein 2 OS=Homo sapiens OX=9606 GN=KHSRP PE=1 SV=1;tr|M0R0I5|M0R0I5_HUMAN Far upstream ele,19,17,31.4,711
PYCR2,-0.3727340038,0.483291445667939,0,Q96C36;A0A087WTV6;J3KR12;A0A087WX69;A0A087WZF0;A0A087WZR9,Q96C36;A0A087WTV6;J3KR12,5;5;5;1;1;1,4;4;4;1;1;0,4;4;4;1;1;0,Pyrroline-5-carboxylate reductase 2,PYCR2,sp|Q96C36|P5CR2_HUMAN Pyrroline-5-carboxylate reductase 2 OS=Homo sapiens OX=9606 GN=PYCR2 PE=1 SV=1;tr|A0A087WTV6|A0A087WTV6_HUMAN Pyrroline-5-carboxylate reductase 2 OS=Homo sapiens OX=9606 GN=PYCR2 PE=1 SV=1;tr|J3KR12|J3KR12_HUMAN Uncharacterized protei,5,4,20.3,320
POLA1,0.1332869128,0.358164342735564,0,P09884;A0A087WU64;A6NMQ1,P09884;A0A087WU64;A6NMQ1,1;1;1,1;1;1,1;1;1,DNA polymerase alpha catalytic subunit;DNA polymerase,POLA1,sp|P09884|DPOLA_HUMAN DNA polymerase alpha catalytic subunit OS=Homo sapiens OX=9606 GN=POLA1 PE=1 SV=2;tr|A0A087WU64|A0A087WU64_HUMAN DNA polymerase OS=Homo sapiens OX=9606 GN=POLA1 PE=1 SV=1;tr|A6NMQ1|A6NMQ1_HUMAN DNA polymerase OS=Homo sapiens OX=9606 G,1,1,0.5,1462
CTNNBL1,-0.1855036038,0.173220928415906,0,Q8WYA6;A0A087WUB9;A2A2P1,Q8WYA6;A0A087WUB9,6;6;1,6;6;1,6;6;1,Beta-catenin-like protein 1,CTNNBL1,sp|Q8WYA6|CTBL1_HUMAN Beta-catenin-like protein 1 OS=Homo sapiens OX=9606 GN=CTNNBL1 PE=1 SV=1;tr|A0A087WUB9|A0A087WUB9_HUMAN Beta-catenin-like protein 1 OS=Homo sapiens OX=9606 GN=CTNNBL1 PE=1 SV=1,6,6,13.1,563
SPCS2,-0.0674030367,0.600868769431894,0,Q15005;E9PL01;A0A087WUC6;E9PI68;E9PRB9;H0YE04,Q15005;E9PL01;A0A087WUC6;E9PI68;E9PRB9;H0YE04,2;2;2;2;1;1,2;2;2;2;1;1,2;2;2;2;1;1,Signal peptidase complex subunit 2,SPCS2,sp|Q15005|SPCS2_HUMAN Signal peptidase complex subunit 2 OS=Homo sapiens OX=9606 GN=SPCS2 PE=1 SV=3;tr|E9PL01|E9PL01_HUMAN Signal peptidase complex subunit 2 OS=Homo sapiens OX=9606 GN=SPCS2 PE=1 SV=1;tr|A0A087WUC6|A0A087WUC6_HUMAN Signal peptidase complex,2,2,11.9,226
HNRNPDL,-0.2467820063,0.14638812355407,0,O14979;A0A087WUK2,O14979;A0A087WUK2,17;17,15;15,14;14,Heterogeneous nuclear ribonucleoprotein D-like,HNRNPDL,sp|O14979|HNRDL_HUMAN Heterogeneous nuclear ribonucleoprotein D-like OS=Homo sapiens OX=9606 GN=HNRNPDL PE=1 SV=3;tr|A0A087WUK2|A0A087WUK2_HUMAN Heterogeneous nuclear ribonucleoprotein D-like OS=Homo sapiens OX=9606 GN=HNRNPDL PE=1 SV=1,17,14,23.6,420
EIF5B,0.3106576851,0.293116321101223,0,O60841;A0A087WUT6,O60841;A0A087WUT6,6;6,6;6,6;6,Eukaryotic translation initiation factor 5B,EIF5B,sp|O60841|IF2P_HUMAN Eukaryotic translation initiation factor 5B OS=Homo sapiens OX=9606 GN=EIF5B PE=1 SV=4;tr|A0A087WUT6|A0A087WUT6_HUMAN Eukaryotic translation initiation factor 5B OS=Homo sapiens OX=9606 GN=EIF5B PE=1 SV=1,6,6,9.1,1220
SPTBN1,-0.365903874,0.0790470859340168,0,Q01082;A0A087WUZ3;F8W6C1,Q01082;A0A087WUZ3,38;38;9,38;38;9,38;38;9,"Spectrin beta chain, non-erythrocytic 1",SPTBN1,"sp|Q01082|SPTB2_HUMAN Spectrin beta chain, non-erythrocytic 1 OS=Homo sapiens OX=9606 GN=SPTBN1 PE=1 SV=2;tr|A0A087WUZ3|A0A087WUZ3_HUMAN Spectrin beta chain OS=Homo sapiens OX=9606 GN=SPTBN1 PE=1 SV=1",38,38,22.8,2364
MTHFD1L,-0.0608037437,0.613713012629757,0,Q6UB35;A0A087WVM4;B7ZM99;Q4VXM1;Q4VXM0;Q5JYA8;Q5JYA3;H0Y327,Q6UB35;A0A087WVM4;B7ZM99,10;10;10;1;1;1;1;1,8;8;8;1;1;1;1;1,8;8;8;1;1;1;1;1,"Monofunctional C1-tetrahydrofolate synthase, mitochondrial",MTHFD1L,"sp|Q6UB35|C1TM_HUMAN Monofunctional C1-tetrahydrofolate synthase, mitochondrial OS=Homo sapiens OX=9606 GN=MTHFD1L PE=1 SV=1;tr|A0A087WVM4|A0A087WVM4_HUMAN Monofunctional C1-tetrahydrofolate synthase, mitochondrial OS=Homo sapiens OX=9606 GN=MTHFD1L PE=1 S",10,8,11.8,978
NOMO2;NOMO1;NOMO3,-0.2311631127,0.483096477984364,0,Q5JPE7;Q15155;P69849;A0A0G2JP90;A0A087WW46;J3KN36;A0A0G2JN29;A0A087X117;H3BUC9;A0A087WTD5,Q5JPE7;Q15155;P69849;A0A0G2JP90;A0A087WW46;J3KN36;A0A0G2JN29;A0A087X117,3;3;3;3;3;3;3;3;1;1,3;3;3;3;3;3;3;3;1;1,3;3;3;3;3;3;3;3;1;1,Nodal modulator 2;Nodal modulator 1;Nodal modulator 3,NOMO2;NOMO1;NOMO3,sp|Q5JPE7|NOMO2_HUMAN Nodal modulator 2 OS=Homo sapiens OX=9606 GN=NOMO2 PE=1 SV=1;sp|Q15155|NOMO1_HUMAN Nodal modulator 1 OS=Homo sapiens OX=9606 GN=NOMO1 PE=1 SV=5;sp|P69849|NOMO3_HUMAN Nodal modulator 3 OS=Homo sapiens OX=9606 GN=NOMO3 PE=1 SV=2;tr|A0A0,3,3,4.3,1267
TPM3,0.2331220766,0.12638900831992,0,A0A087WWU8;D6R904;A0A494C0G0;A0A2R8YEU4;A0A2R8YH90;A0A2R8YE05;K7ENT6;A0A2R8YHD2;Q5VU61;A0A5F9UN72,A0A087WWU8;D6R904,25;14;8;7;7;7;7;7;6;1,25;14;8;7;7;7;7;7;6;1,9;9;3;0;0;0;0;0;6;0,,TPM3,tr|A0A087WWU8|A0A087WWU8_HUMAN Tropomyosin alpha-3 chain OS=Homo sapiens OX=9606 GN=TPM3 PE=1 SV=1;tr|D6R904|D6R904_HUMAN Tropomyosin alpha-3 chain OS=Homo sapiens OX=9606 GN=TPM3 PE=1 SV=1,25,9,79.3,227
RPL17;RPL17-C18orf32,0.3472331585,0.106617183751377,0,P18621;A0A087WXM6;J3QQT2;J3KRX5;A0A0A6YYL6;J3KRB3;A0A087WWH0;J3QS96;A0A087WY81;J3QLC8;A0A0A0MRF8;J3KSJ0,P18621;A0A087WXM6;J3QQT2;J3KRX5;A0A0A6YYL6;J3KRB3;A0A087WWH0;J3QS96;A0A087WY81;J3QLC8;A0A0A0MRF8,13;13;13;13;13;12;12;12;10;10;9;5,13;13;13;13;13;12;12;12;10;10;9;5,13;13;13;13;13;12;12;12;10;10;9;5,60S ribosomal protein L17,RPL17;RPL17-C18orf32,sp|P18621|RL17_HUMAN 60S ribosomal protein L17 OS=Homo sapiens OX=9606 GN=RPL17 PE=1 SV=3;tr|A0A087WXM6|A0A087WXM6_HUMAN 60S ribosomal protein L17 (Fragment) OS=Homo sapiens OX=9606 GN=RPL17 PE=1 SV=1;tr|J3QQT2|J3QQT2_HUMAN 60S ribosomal protein L17 (Fragm,13,13,60.3,184
ITGB6,0.3778091932,0.0733703036762438,0,P18564;A0A087WXP3;E9PEE8,P18564;A0A087WXP3;E9PEE8,1;1;1,1;1;1,1;1;1,Integrin beta-6;Integrin beta,ITGB6,sp|P18564|ITB6_HUMAN Integrin beta-6 OS=Homo sapiens OX=9606 GN=ITGB6 PE=1 SV=2;tr|A0A087WXP3|A0A087WXP3_HUMAN Integrin beta OS=Homo sapiens OX=9606 GN=ITGB6 PE=1 SV=1;tr|E9PEE8|E9PEE8_HUMAN Integrin beta OS=Homo sapiens OX=9606 GN=ITGB6 PE=1 SV=1,1,1,1.1,788
AP2M1,0.1405904895,0.710840632071965,0,Q96CW1;A0A087WY71;E9PFW3;H7C4C3,Q96CW1;A0A087WY71;E9PFW3;H7C4C3,2;2;2;1,2;2;2;1,2;2;2;1,AP-2 complex subunit mu,AP2M1,sp|Q96CW1|AP2M1_HUMAN AP-2 complex subunit mu OS=Homo sapiens OX=9606 GN=AP2M1 PE=1 SV=2;tr|A0A087WY71|A0A087WY71_HUMAN AP-2 complex subunit mu OS=Homo sapiens OX=9606 GN=AP2M1 PE=1 SV=1;tr|E9PFW3|E9PFW3_HUMAN AP-2 complex subunit mu OS=Homo sapiens OX=960,2,2,8.3,435
UBE2D3;UBE2D2,-0.6924798525,0.014918082683957,0,P61077;P62837;D6RFM0;D6RAH7;H9KV45;A0A0A0MQU3;A0A087WY85;D6RAW0;Q9Y2X8;P51668;D6RA11;A0A087WW00;C9J9H9,P61077;P62837;D6RFM0;D6RAH7;H9KV45;A0A0A0MQU3;A0A087WY85;D6RAW0,3;3;3;3;3;3;3;2;1;1;1;1;1,3;3;3;3;3;3;3;2;1;1;1;1;1,3;3;3;3;3;3;3;2;1;1;1;1;1,Ubiquitin-conjugating enzyme E2 D3;Ubiquitin-conjugating enzyme E2 D2,UBE2D3;UBE2D2,sp|P61077|UB2D3_HUMAN Ubiquitin-conjugating enzyme E2 D3 OS=Homo sapiens OX=9606 GN=UBE2D3 PE=1 SV=1;sp|P62837|UB2D2_HUMAN Ubiquitin-conjugating enzyme E2 D2 OS=Homo sapiens OX=9606 GN=UBE2D2 PE=1 SV=1;tr|D6RFM0|D6RFM0_HUMAN Ubiquitin-conjugating enzyme E2,3,3,36.1,147
EIF3H,0.0648878925,0.847891123865836,0,O15372;A0A087WZK9;B3KS98;E5RGU4,O15372;A0A087WZK9;B3KS98,3;3;3;1,3;3;3;1,1;1;1;0,Eukaryotic translation initiation factor 3 subunit H,EIF3H,sp|O15372|EIF3H_HUMAN Eukaryotic translation initiation factor 3 subunit H OS=Homo sapiens OX=9606 GN=EIF3H PE=1 SV=1;tr|A0A087WZK9|A0A087WZK9_HUMAN Eukaryotic translation initiation factor 3 subunit H OS=Homo sapiens OX=9606 GN=EIF3H PE=1 SV=1;tr|B3KS98|B,3,1,15.6,352
HYOU1,-0.1048157485,0.443227444221601,0,Q9Y4L1;A0A087X054;A0A494C039;E9PJ21;A0A087WWI4;K7EQK2;J3KTF1;Q9BST8;J3QQH7;J3QLE9;J3QL06,Q9Y4L1;A0A087X054;A0A494C039;E9PJ21;A0A087WWI4;K7EQK2,14;14;14;12;12;12;3;2;2;2;2,14;14;14;12;12;12;3;2;2;2;2,14;14;14;12;12;12;3;2;2;2;2,Hypoxia up-regulated protein 1,HYOU1,sp|Q9Y4L1|HYOU1_HUMAN Hypoxia up-regulated protein 1 OS=Homo sapiens OX=9606 GN=HYOU1 PE=1 SV=1;tr|A0A087X054|A0A087X054_HUMAN Hypoxia up-regulated protein 1 OS=Homo sapiens OX=9606 GN=HYOU1 PE=1 SV=1;tr|A0A494C039|A0A494C039_HUMAN Hypoxia up-regulated pro,14,14,17.8,999
ACOT1;ACOT2,-0.2423613201,0.179878645178718,0,Q86TX2;A0A087X0W7;P49753;G3V4F2;A0A087WT95;A0A2R8Y7H3,Q86TX2;A0A087X0W7;P49753;G3V4F2;A0A087WT95,10;10;9;9;9;2,10;10;9;9;9;2,10;10;9;9;9;2,"Acyl-coenzyme A thioesterase 1;Acyl-coenzyme A thioesterase 2, mitochondrial",ACOT1;ACOT2,"sp|Q86TX2|ACOT1_HUMAN Acyl-coenzyme A thioesterase 1 OS=Homo sapiens OX=9606 GN=ACOT1 PE=1 SV=1;tr|A0A087X0W7|A0A087X0W7_HUMAN Acyl-coenzyme A thioesterase 2, mitochondrial OS=Homo sapiens OX=9606 GN=ACOT2 PE=1 SV=1;sp|P49753|ACOT2_HUMAN Acyl-coenzyme A th",10,10,32.5,421
AP2B1,-0.1058217947,0.568639201758875,0,P63010;A0A087X253;A0A087WYD1;A0A087WU93;A0A087WZQ6,P63010;A0A087X253;A0A087WYD1;A0A087WU93;A0A087WZQ6,10;10;5;5;5,10;10;5;5;5,5;5;1;1;1,AP-2 complex subunit beta,AP2B1,sp|P63010|AP2B1_HUMAN AP-2 complex subunit beta OS=Homo sapiens OX=9606 GN=AP2B1 PE=1 SV=1;tr|A0A087X253|A0A087X253_HUMAN AP complex subunit beta OS=Homo sapiens OX=9606 GN=AP2B1 PE=1 SV=1;tr|A0A087WYD1|A0A087WYD1_HUMAN AP-2 complex subunit beta (Fragment),10,5,11.4,937
BSG,-0.0574884822,0.702002256870347,0,P35613;A0A087X2B5;A0A087WUV8;I3L192;R4GMX5;R4GN83;A0A2R8YDZ0,P35613;A0A087X2B5;A0A087WUV8;I3L192;R4GMX5,6;6;5;4;3;2;1,6;6;5;4;3;2;1,6;6;5;4;3;2;1,Basigin,BSG,sp|P35613|BASI_HUMAN Basigin OS=Homo sapiens OX=9606 GN=BSG PE=1 SV=2;tr|A0A087X2B5|A0A087X2B5_HUMAN Basigin (Fragment) OS=Homo sapiens OX=9606 GN=BSG PE=1 SV=1;tr|A0A087WUV8|A0A087WUV8_HUMAN Basigin OS=Homo sapiens OX=9606 GN=BSG PE=1 SV=1;tr|I3L192|I3L19,6,6,21.8,385
SRSF3,0.0824486957,0.55331911533556,0,P84103;A0A087X2D0,P84103;A0A087X2D0,6;6,6;6,6;6,Serine/arginine-rich splicing factor 3,SRSF3,sp|P84103|SRSF3_HUMAN Serine/arginine-rich splicing factor 3 OS=Homo sapiens OX=9606 GN=SRSF3 PE=1 SV=1;tr|A0A087X2D0|A0A087X2D0_HUMAN Serine/arginine-rich-splicing factor 3 OS=Homo sapiens OX=9606 GN=SRSF3 PE=1 SV=1,6,6,38.4,164
MRPL45,1.079562391,0.0528839218322041,0,Q9BRJ2;A0A087X2D5;A0A0G2JMS5;A0A087WU62,Q9BRJ2;A0A087X2D5;A0A0G2JMS5;A0A087WU62,3;3;2;2,3;3;2;2,3;3;2;2,"39S ribosomal protein L45, mitochondrial",MRPL45,"sp|Q9BRJ2|RM45_HUMAN 39S ribosomal protein L45, mitochondrial OS=Homo sapiens OX=9606 GN=MRPL45 PE=1 SV=2;tr|A0A087X2D5|A0A087X2D5_HUMAN 39S ribosomal protein L45, mitochondrial OS=Homo sapiens OX=9606 GN=MRPL45 PE=1 SV=1;tr|A0A0G2JMS5|A0A0G2JMS5_HUMAN 39S",3,3,16.3,306
GPS1,-1.0258430756,0.0451222816360108,1,Q13098;C9JFE4;A0A096LP07;A0A096LPJ3;A8K070;J3QS84;J3QS88;J3KTB0;J3QLE8;J3QLT0;J3QL53;J3KRE8;J3KSA5;J3KRJ4;J3QQX0,Q13098;C9JFE4;A0A096LP07;A0A096LPJ3;A8K070;J3QS84;J3QS88;J3KTB0;J3QLE8;J3QLT0;J3QL53;J3KRE8;J3KSA5;J3KRJ4,4;4;4;4;4;3;3;3;3;3;3;3;3;3;1,4;4;4;4;4;3;3;3;3;3;3;3;3;3;1,4;4;4;4;4;3;3;3;3;3;3;3;3;3;1,COP9 signalosome complex subunit 1,GPS1,sp|Q13098|CSN1_HUMAN COP9 signalosome complex subunit 1 OS=Homo sapiens OX=9606 GN=GPS1 PE=1 SV=4;tr|C9JFE4|C9JFE4_HUMAN COP9 signalosome complex subunit 1 OS=Homo sapiens OX=9606 GN=GPS1 PE=1 SV=2;tr|A0A096LP07|A0A096LP07_HUMAN COP9 signalosome complex su,4,4,8.4,491
PYCRL,-0.0147539207,0.926398785297445,0,Q53H96;A0A0A0MQS1;F8WEI0;B5MD87,Q53H96;A0A0A0MQS1;F8WEI0;B5MD87,2;2;1;1,2;2;1;1,2;2;1;1,Pyrroline-5-carboxylate reductase 3;Pyrroline-5-carboxylate reductase,PYCRL,sp|Q53H96|P5CR3_HUMAN Pyrroline-5-carboxylate reductase 3 OS=Homo sapiens OX=9606 GN=PYCR3 PE=1 SV=3;tr|A0A0A0MQS1|A0A0A0MQS1_HUMAN Pyrroline-5-carboxylate reductase OS=Homo sapiens OX=9606 GN=PYCR3 PE=1 SV=1;tr|F8WEI0|F8WEI0_HUMAN Pyrroline-5-carboxylate ,2,2,8.8,274
WDR18,-0.4892529318,0.378876614123249,0,Q9BV38;U3KQC1;A0A0A0MQU0;K7EIR0;A0A087X237;K7EKX5;K7EML4,Q9BV38;U3KQC1;A0A0A0MQU0;K7EIR0,3;3;3;2;1;1;1,3;3;3;2;1;1;1,3;3;3;2;1;1;1,WD repeat-containing protein 18,WDR18,sp|Q9BV38|WDR18_HUMAN WD repeat-containing protein 18 OS=Homo sapiens OX=9606 GN=WDR18 PE=1 SV=2;tr|U3KQC1|U3KQC1_HUMAN WD repeat-containing protein 18 (Fragment) OS=Homo sapiens OX=9606 GN=WDR18 PE=1 SV=1;tr|A0A0A0MQU0|A0A0A0MQU0_HUMAN WD repeat-containin,3,3,8.1,432
NSA2,-0.4661747978,0.0774724476697441,0,O95478;A0A0A0MQZ6;H0YAI9,O95478;A0A0A0MQZ6;H0YAI9,2;2;1,2;2;1,2;2;1,Ribosome biogenesis protein NSA2 homolog,NSA2,sp|O95478|NSA2_HUMAN Ribosome biogenesis protein NSA2 homolog OS=Homo sapiens OX=9606 GN=NSA2 PE=1 SV=1;tr|A0A0A0MQZ6|A0A0A0MQZ6_HUMAN Ribosome biogenesis protein NSA2 homolog OS=Homo sapiens OX=9606 GN=NSA2 PE=1 SV=1;tr|H0YAI9|H0YAI9_HUMAN Ribosome biogen,2,2,7.7,260
HNRNPUL1,-0.7276879771,0.0119128299461049,0,Q9BUJ2;M0R3F1;A0A0A0MRA5;B7Z4B8;M0QYZ0;M0QYM5;M0R0K8;M0QYI8,Q9BUJ2;M0R3F1;A0A0A0MRA5;B7Z4B8;M0QYZ0,10;10;10;10;6;1;1;1,10;10;10;10;6;1;1;1,10;10;10;10;6;1;1;1,Heterogeneous nuclear ribonucleoprotein U-like protein 1,HNRNPUL1,sp|Q9BUJ2|HNRL1_HUMAN Heterogeneous nuclear ribonucleoprotein U-like protein 1 OS=Homo sapiens OX=9606 GN=HNRNPUL1 PE=1 SV=2;tr|M0R3F1|M0R3F1_HUMAN Heterogeneous nuclear ribonucleoprotein U-like protein 1 (Fragment) OS=Homo sapiens OX=9606 GN=HNRNPUL1 PE=1,10,10,14.1,856
NOLC1,0.2130563072,0.229318935611888,0,Q14978;A0A0A0MRM9;S4R349;S4R402;S4R3C2,Q14978;A0A0A0MRM9,11;11;4;3;1,11;11;4;3;1,8;8;1;0;1,Nucleolar and coiled-body phosphoprotein 1,NOLC1,sp|Q14978|NOLC1_HUMAN Nucleolar and coiled-body phosphoprotein 1 OS=Homo sapiens OX=9606 GN=NOLC1 PE=1 SV=2;tr|A0A0A0MRM9|A0A0A0MRM9_HUMAN Nucleolar and coiled-body phosphoprotein 1 (Fragment) OS=Homo sapiens OX=9606 GN=NOLC1 PE=1 SV=1,11,8,13.6,699
PRDX1,-0.1477848691,0.293883430399004,0,Q06830;A0A0A0MSI0;A0A0A0MRQ5,Q06830;A0A0A0MSI0,27;27;7,27;27;7,24;24;4,Peroxiredoxin-1,PRDX1,sp|Q06830|PRDX1_HUMAN Peroxiredoxin-1 OS=Homo sapiens OX=9606 GN=PRDX1 PE=1 SV=1;tr|A0A0A0MSI0|A0A0A0MSI0_HUMAN Peroxiredoxin-1 (Fragment) OS=Homo sapiens OX=9606 GN=PRDX1 PE=1 SV=1,27,24,65.3,199
PLS3,1.4993237467,0.00041384724391658,1,P13797;A0A0A0MSQ0;H7C4N2;Q5TBN3,P13797;A0A0A0MSQ0,6;6;2;1,6;6;2;1,3;3;1;0,Plastin-3,PLS3,sp|P13797|PLST_HUMAN Plastin-3 OS=Homo sapiens OX=9606 GN=PLS3 PE=1 SV=4;tr|A0A0A0MSQ0|A0A0A0MSQ0_HUMAN Plastin-3 OS=Homo sapiens OX=9606 GN=PLS3 PE=1 SV=1,6,3,11.1,630
SMARCA4,0.3274358325,0.358442786901994,0,P51532;Q9HBD4;A0A0A0MT49;A0A2R8Y4P4;A0A2R8Y7S2;A0A2R8YGP5;A0A2R8YCY3;A0A2R8YGG3;A0A2R8YG32;A0A2R8Y440;A0A2R8Y7F3;A0A2R8Y6N0;A0A2R8Y7Y7;A0A2R8Y526;A0A2R8YF58;A0A2R8Y4C5;A0A2R8Y6V2;A0A2R8YDA1;A0A2R8YF80;P51531;A0A0U1RQZ9;A0A2R8Y523;A0A2R8YFV8,P51532;Q9HBD4;A0A0A0MT49;A0A2R8Y4P4;A0A2R8Y7S2;A0A2R8YGP5;A0A2R8YCY3;A0A2R8YGG3;A0A2R8YG32;A0A2R8Y440;A0A2R8Y7F3;A0A2R8Y6N0;A0A2R8Y7Y7;A0A2R8Y526;A0A2R8YF58;A0A2R8Y4C5;A0A2R8Y6V2;A0A2R8YDA1;A0A2R8YF80,3;3;3;3;3;3;2;2;2;2;2;2;2;2;2;2;2;2;2;1;1;1;1,3;3;3;3;3;3;2;2;2;2;2;2;2;2;2;2;2;2;2;1;1;1;1,2;2;2;2;2;2;1;1;1;1;1;1;1;1;1;1;1;1;1;0;0;0;0,Transcription activator BRG1,SMARCA4,sp|P51532|SMCA4_HUMAN Transcription activator BRG1 OS=Homo sapiens OX=9606 GN=SMARCA4 PE=1 SV=2;tr|Q9HBD4|Q9HBD4_HUMAN SMARCA4 isoform 2 OS=Homo sapiens OX=9606 GN=SMARCA4 PE=1 SV=1;tr|A0A0A0MT49|A0A0A0MT49_HUMAN Transcription activator BRG1 OS=Homo sapien,3,2,2.6,1647
IVD,0.2840923783,0.312885380879057,0,P26440;A0A0A0MT83;A0A0S2Z4K7;H0YLC3;H7C4G6;H0YKV0;H0YN10;A0A087WVD3,P26440;A0A0A0MT83;A0A0S2Z4K7;H0YLC3;H7C4G6,8;8;7;5;4;3;2;1,8;8;7;5;4;3;2;1,8;8;7;5;4;3;2;1,"Isovaleryl-CoA dehydrogenase, mitochondrial",IVD,"sp|P26440|IVD_HUMAN Isovaleryl-CoA dehydrogenase, mitochondrial OS=Homo sapiens OX=9606 GN=IVD PE=1 SV=2;tr|A0A0A0MT83|A0A0A0MT83_HUMAN Isovaleryl-CoA dehydrogenase isoform 1 OS=Homo sapiens OX=9606 GN=IVD PE=1 SV=2;tr|A0A0S2Z4K7|A0A0S2Z4K7_HUMAN Isovalery",8,8,21.8,426
ILK,-0.0632587502,0.619219147453495,0,Q13418;A0A0A0MTH3;A0A087WWY6,Q13418;A0A0A0MTH3;A0A087WWY6,2;2;1,2;2;1,2;2;1,Integrin-linked protein kinase,ILK,sp|Q13418|ILK_HUMAN Integrin-linked protein kinase OS=Homo sapiens OX=9606 GN=ILK PE=1 SV=2;tr|A0A0A0MTH3|A0A0A0MTH3_HUMAN Integrin-linked protein kinase OS=Homo sapiens OX=9606 GN=ILK PE=1 SV=1;tr|A0A087WWY6|A0A087WWY6_HUMAN Integrin-linked protein kinase,2,2,5.3,452
ELOVL5,-0.441108603,0.0244831655543306,0,Q9NYP7;A0A0A0MTI6,Q9NYP7;A0A0A0MTI6,1;1,1;1,1;1,Elongation of very long chain fatty acids protein 5;Elongation of very long chain fatty acids protein,ELOVL5,sp|Q9NYP7|ELOV5_HUMAN Elongation of very long chain fatty acids protein 5 OS=Homo sapiens OX=9606 GN=ELOVL5 PE=1 SV=1;tr|A0A0A0MTI6|A0A0A0MTI6_HUMAN Elongation of very long chain fatty acids protein OS=Homo sapiens OX=9606 GN=ELOVL5 PE=1 SV=1,1,1,4.3,299
FKBP8,-0.1051642939,0.717196017333859,0,Q14318;U3KQI1;A0A0A0MTJ1,Q14318;U3KQI1;A0A0A0MTJ1,1;1;1,1;1;1,1;1;1,Peptidyl-prolyl cis-trans isomerase FKBP8,FKBP8,sp|Q14318|FKBP8_HUMAN Peptidyl-prolyl cis-trans isomerase FKBP8 OS=Homo sapiens OX=9606 GN=FKBP8 PE=1 SV=2;tr|U3KQI1|U3KQI1_HUMAN Peptidyl-prolyl cis-trans isomerase FKBP8 (Fragment) OS=Homo sapiens OX=9606 GN=FKBP8 PE=1 SV=1;tr|A0A0A0MTJ1|A0A0A0MTJ1_HUMAN,1,1,3.9,412
TTN,-0.952479464,0.0241113023471341,0,A0A0A0MTS7;Q8WZ42;A0A0A0MRA3;H7C0U7,A0A0A0MTS7;Q8WZ42;A0A0A0MRA3,5;4;4;1,5;4;4;1,5;4;4;1,Titin,TTN,tr|A0A0A0MTS7|A0A0A0MTS7_HUMAN Titin OS=Homo sapiens OX=9606 GN=TTN PE=1 SV=1;sp|Q8WZ42|TITIN_HUMAN Titin OS=Homo sapiens OX=9606 GN=TTN PE=1 SV=4;tr|A0A0A0MRA3|A0A0A0MRA3_HUMAN Titin OS=Homo sapiens OX=9606 GN=TTN PE=1 SV=1,5,5,0.2,35991
ADSL,1.1497254274,0.126376720789354,0,P30566;A0A1B0GWJ0;A0A1B0GTJ7;A0A0A6YY92;A0A096LNY6;A0A096LNY5;A0A1B0GTG9;A0A1B0GWF8;B4DEP1;A0A1W2PRX2;A0A096LP72;A0A096LNY4;V9GY96;A0A096LP92;A0A096LP76;A0A096LPA2,P30566;A0A1B0GWJ0;A0A1B0GTJ7;A0A0A6YY92;A0A096LNY6;A0A096LNY5;A0A1B0GTG9;A0A1B0GWF8,6;6;6;6;4;3;3;3;2;2;2;2;1;1;1;1,6;6;6;6;4;3;3;3;2;2;2;2;1;1;1;1,6;6;6;6;4;3;3;3;2;2;2;2;1;1;1;1,Adenylosuccinate lyase,ADSL,sp|P30566|PUR8_HUMAN Adenylosuccinate lyase OS=Homo sapiens OX=9606 GN=ADSL PE=1 SV=2;tr|A0A1B0GWJ0|A0A1B0GWJ0_HUMAN Adenylosuccinate lyase OS=Homo sapiens OX=9606 GN=ADSL PE=1 SV=1;tr|A0A1B0GTJ7|A0A1B0GTJ7_HUMAN Adenylosuccinate lyase OS=Homo sapiens OX=9,6,6,17.6,484
TMED7;TMED7-TICAM2,0.1099462351,0.375537361640028,0,Q9Y3B3;A0A0A6YYA0,Q9Y3B3;A0A0A6YYA0,2;2,2;2,2;2,Transmembrane emp24 domain-containing protein 7,TMED7;TMED7-TICAM2,sp|Q9Y3B3|TMED7_HUMAN Transmembrane emp24 domain-containing protein 7 OS=Homo sapiens OX=9606 GN=TMED7 PE=1 SV=2;tr|A0A0A6YYA0|A0A0A6YYA0_HUMAN Protein TMED7-TICAM2 OS=Homo sapiens OX=9606 GN=TMED7-TICAM2 PE=3 SV=1,2,2,10.3,224
NAA15,-0.0191303187,0.931676202505404,0,Q9BXJ9;A0A0B4J1W3;Q6N069,Q9BXJ9;A0A0B4J1W3,4;4;1,4;4;1,4;4;1,"N-alpha-acetyltransferase 15, NatA auxiliary subunit",NAA15,"sp|Q9BXJ9|NAA15_HUMAN N-alpha-acetyltransferase 15, NatA auxiliary subunit OS=Homo sapiens OX=9606 GN=NAA15 PE=1 SV=1;tr|A0A0B4J1W3|A0A0B4J1W3_HUMAN N-alpha-acetyltransferase 15, NatA auxiliary subunit OS=Homo sapiens OX=9606 GN=NAA15 PE=1 SV=1",4,4,4.6,866
SRSF7,-0.3653098536,0.0315044162026074,0,Q16629;A0A0B4J1Z1;C9JAB2,Q16629;A0A0B4J1Z1;C9JAB2,8;8;8,8;8;8,8;8;8,Serine/arginine-rich splicing factor 7,SRSF7,sp|Q16629|SRSF7_HUMAN Serine/arginine-rich splicing factor 7 OS=Homo sapiens OX=9606 GN=SRSF7 PE=1 SV=1;tr|A0A0B4J1Z1|A0A0B4J1Z1_HUMAN Serine/arginine-rich-splicing factor 7 OS=Homo sapiens OX=9606 GN=SRSF7 PE=1 SV=1;tr|C9JAB2|C9JAB2_HUMAN Serine/arginine-,8,8,31.9,238
TCEB2,-0.2539218012,0.153638891262356,0,Q15370;A0A0B4J296;B8ZZU8;I3L0M9,Q15370;A0A0B4J296,3;3;1;1,3;3;1;1,3;3;1;1,Transcription elongation factor B polypeptide 2,TCEB2,sp|Q15370|ELOB_HUMAN Elongin-B OS=Homo sapiens OX=9606 GN=ELOB PE=1 SV=1;tr|A0A0B4J296|A0A0B4J296_HUMAN Elongin-B OS=Homo sapiens OX=9606 GN=ELOB PE=1 SV=1,3,3,13.6,118
RPS15,-0.0656574659,0.876870169620447,0,P62841;K7EM56;A0A0B4J2B4;S4R417;K7ELC2;S4R456;K7EJ78;K7EQJ5,P62841;K7EM56;A0A0B4J2B4;S4R417;K7ELC2;S4R456;K7EJ78;K7EQJ5,3;3;3;3;3;2;2;2,3;3;3;3;3;2;2;2,3;3;3;3;3;2;2;2,40S ribosomal protein S15,RPS15,sp|P62841|RS15_HUMAN 40S ribosomal protein S15 OS=Homo sapiens OX=9606 GN=RPS15 PE=1 SV=2;tr|K7EM56|K7EM56_HUMAN 40S ribosomal protein S15 OS=Homo sapiens OX=9606 GN=RPS15 PE=1 SV=2;tr|A0A0B4J2B4|A0A0B4J2B4_HUMAN 40S ribosomal protein S15 OS=Homo sapiens O,3,3,40,145
PWP2,-0.3345154034,0.0348356409152878,0,Q15269;A0A0B4J2E5;C9J544,Q15269;A0A0B4J2E5,6;6;2,6;6;2,4;4;2,Periodic tryptophan protein 2 homolog,PWP2,sp|Q15269|PWP2_HUMAN Periodic tryptophan protein 2 homolog OS=Homo sapiens OX=9606 GN=PWP2 PE=2 SV=2;tr|A0A0B4J2E5|A0A0B4J2E5_HUMAN Uncharacterized protein OS=Homo sapiens OX=9606 GN=LOC102724159 PE=1 SV=1,6,4,6.1,919
GSTZ1,0.509167413,0.170161524388454,0,O43708;G3V267;G3V5T0;A0A0C4DFM0;A0A0A0MR33;G3V3B9;H0YJN8,O43708;G3V267;G3V5T0;A0A0C4DFM0;A0A0A0MR33;G3V3B9,5;5;5;5;4;3;1,5;5;5;5;4;3;1,1;1;1;1;1;0;0,Maleylacetoacetate isomerase,GSTZ1,sp|O43708|MAAI_HUMAN Maleylacetoacetate isomerase OS=Homo sapiens OX=9606 GN=GSTZ1 PE=1 SV=3;tr|G3V267|G3V267_HUMAN Maleylacetoacetate isomerase OS=Homo sapiens OX=9606 GN=GSTZ1 PE=1 SV=1;tr|G3V5T0|G3V5T0_HUMAN Maleylacetoacetate isomerase OS=Homo sapiens ,5,1,34.3,216
SET;SETSIP,-0.2324253857,0.184583791399377,0,Q01105;A0A0C4DFV9;P0DME0;A0A087X027,Q01105;A0A0C4DFV9;P0DME0;A0A087X027,12;12;8;8,12;12;8;8,12;12;8;8,Protein SET;Protein SETSIP,SET;SETSIP,sp|Q01105|SET_HUMAN Protein SET OS=Homo sapiens OX=9606 GN=SET PE=1 SV=3;tr|A0A0C4DFV9|A0A0C4DFV9_HUMAN Protein SET OS=Homo sapiens OX=9606 GN=SET PE=1 SV=1;sp|P0DME0|SETLP_HUMAN Protein SETSIP OS=Homo sapiens OX=9606 GN=SETSIP PE=1 SV=1;tr|A0A087X027|A0A0,12,12,32.1,290
RPSA,0.1162581319,0.401742038337897,0,P08865;C9J9K3;A0A0C4DG17;F8WD59,P08865;C9J9K3;A0A0C4DG17;F8WD59,24;24;24;14,24;24;24;14,24;24;24;14,40S ribosomal protein SA,RPSA,sp|P08865|RSSA_HUMAN 40S ribosomal protein SA OS=Homo sapiens OX=9606 GN=RPSA PE=1 SV=4;tr|C9J9K3|C9J9K3_HUMAN 40S ribosomal protein SA (Fragment) OS=Homo sapiens OX=9606 GN=RPSA PE=1 SV=8;tr|A0A0C4DG17|A0A0C4DG17_HUMAN 40S ribosomal protein SA OS=Homo sap,24,24,68.8,295
DDX46,0.0447996794,0.797844563754686,0,Q7L014;A0A0C4DG89;D6RJA6,Q7L014;A0A0C4DG89,10;10;2,10;10;2,10;10;2,Probable ATP-dependent RNA helicase DDX46,DDX46,sp|Q7L014|DDX46_HUMAN Probable ATP-dependent RNA helicase DDX46 OS=Homo sapiens OX=9606 GN=DDX46 PE=1 SV=2;tr|A0A0C4DG89|A0A0C4DG89_HUMAN Probable ATP-dependent RNA helicase DDX46 OS=Homo sapiens OX=9606 GN=DDX46 PE=1 SV=1,10,10,10.2,1031
