POLDIP3;PDIP46,-0.6065776563,0.0818969261314159,0,Q9BY77;Q8WUT1;F8WCX5;F6VRR5;Q6R954;F8WEE2,Q9BY77;Q8WUT1;F8WCX5;F6VRR5;Q6R954;F8WEE2,2;2;2;2;1;1,2;2;2;2;1;1,2;2;2;2;1;1,Polymerase delta-interacting protein 3,POLDIP3;PDIP46,sp|Q9BY77|PDIP3_HUMAN Polymerase delta-interacting protein 3 OS=Homo sapiens OX=9606 GN=POLDIP3 PE=1 SV=2;tr|Q8WUT1|Q8WUT1_HUMAN POLDIP3 protein OS=Homo sapiens OX=9606 GN=POLDIP3 PE=1 SV=1;tr|F8WCX5|F8WCX5_HUMAN Polymerase delta-interacting protein 3 OS=H,2,2,7.4,421
RANBP1,0.194402569,0.263008001004448,0,P43487;F6WQW2;C9JXG8;C9JGV6;C9JJ34;C9JDM3;C9JIC6,P43487;F6WQW2;C9JXG8;C9JGV6;C9JJ34;C9JDM3,8;8;7;7;6;4;3,8;8;7;7;6;4;3,8;8;7;7;6;4;3,Ran-specific GTPase-activating protein,RANBP1,sp|P43487|RANG_HUMAN Ran-specific GTPase-activating protein OS=Homo sapiens OX=9606 GN=RANBP1 PE=1 SV=1;tr|F6WQW2|F6WQW2_HUMAN Ran-specific GTPase-activating protein OS=Homo sapiens OX=9606 GN=RANBP1 PE=1 SV=1;tr|C9JXG8|C9JXG8_HUMAN Ran-specific GTPase-act,8,8,43.3,201
CAD,-0.1150253553,0.364390665064417,0,P27708;F8VPD4;H7C2E4;H7BZB3,P27708;F8VPD4,29;29;6;3,29;29;6;3,29;29;6;3,CAD protein;Glutamine-dependent carbamoyl-phosphate synthase;Aspartate carbamoyltransferase;Dihydroorotase,CAD,sp|P27708|PYR1_HUMAN CAD protein OS=Homo sapiens OX=9606 GN=CAD PE=1 SV=3;tr|F8VPD4|F8VPD4_HUMAN CAD protein OS=Homo sapiens OX=9606 GN=CAD PE=1 SV=1,29,29,17.4,2225
LIMA1,0.1196095747,0.322763910135453,0,Q9UHB6;F8VQE1;F8VS07;F8VRN8,Q9UHB6;F8VQE1;F8VS07,13;13;10;4,13;13;10;4,13;13;10;4,LIM domain and actin-binding protein 1,LIMA1,sp|Q9UHB6|LIMA1_HUMAN LIM domain and actin-binding protein 1 OS=Homo sapiens OX=9606 GN=LIMA1 PE=1 SV=1;tr|F8VQE1|F8VQE1_HUMAN LIM domain and actin-binding protein 1 OS=Homo sapiens OX=9606 GN=LIMA1 PE=1 SV=1;tr|F8VS07|F8VS07_HUMAN LIM domain and actin-bin,13,13,19.8,759
UBE2N,2.2194439897,0.0251512045312447,1,P61088;F8VSD4;F8VV71;F8VZ29;F8VQQ8;Q5JXB2,P61088;F8VSD4;F8VV71;F8VZ29;F8VQQ8,4;4;3;2;2;1,4;4;3;2;2;1,4;4;3;2;2;1,Ubiquitin-conjugating enzyme E2 N,UBE2N,sp|P61088|UBE2N_HUMAN Ubiquitin-conjugating enzyme E2 N OS=Homo sapiens OX=9606 GN=UBE2N PE=1 SV=1;tr|F8VSD4|F8VSD4_HUMAN Ubiquitin-conjugating enzyme E2 N OS=Homo sapiens OX=9606 GN=UBE2N PE=1 SV=1;tr|F8VV71|F8VV71_HUMAN Ubiquitin-conjugating enzyme E2 N ,4,4,37.5,152
SLC25A3,0.0449450341,0.698264254030467,0,F8VVM2;F8VWQ0;F8VZL5;F8VWR4,F8VVM2,13;4;3;3,13;4;3;3,2;1;0;0,,SLC25A3,"tr|F8VVM2|F8VVM2_HUMAN Phosphate carrier protein, mitochondrial OS=Homo sapiens OX=9606 GN=SLC25A3 PE=1 SV=1",13,2,37.3,324
PPP1CC,-0.3532243145,0.187223121819197,0,P36873;F8VYE8;F8W0W8;F8VR82;A0A087WYY5,P36873;F8VYE8;F8W0W8;F8VR82,11;11;10;9;3,1;1;0;1;1,1;1;0;1;1,Serine/threonine-protein phosphatase PP1-gamma catalytic subunit;Serine/threonine-protein phosphatase,PPP1CC,sp|P36873|PP1G_HUMAN Serine/threonine-protein phosphatase PP1-gamma catalytic subunit OS=Homo sapiens OX=9606 GN=PPP1CC PE=1 SV=1;tr|F8VYE8|F8VYE8_HUMAN Serine/threonine-protein phosphatase OS=Homo sapiens OX=9606 GN=PPP1CC PE=1 SV=1;tr|F8W0W8|F8W0W8_HUMAN,11,1,33.1,323
AK2,-0.0189146893,0.873073144171415,0,P54819;F8W1A4;F8VY04;A0A5K1VW67;G3V213;F8VZG5;A0A5F9ZHP2;F8VPP1,P54819;F8W1A4;F8VY04;A0A5K1VW67;G3V213;F8VZG5;A0A5F9ZHP2,13;13;10;10;9;9;9;3,13;13;10;10;9;9;9;3,13;13;10;10;9;9;9;3,"Adenylate kinase 2, mitochondrial;Adenylate kinase 2, mitochondrial, N-terminally processed;Adenylate kinase 2, mitochondrial",AK2,"sp|P54819|KAD2_HUMAN Adenylate kinase 2, mitochondrial OS=Homo sapiens OX=9606 GN=AK2 PE=1 SV=2;tr|F8W1A4|F8W1A4_HUMAN Adenylate kinase 2, mitochondrial OS=Homo sapiens OX=9606 GN=AK2 PE=1 SV=1;tr|F8VY04|F8VY04_HUMAN Adenylate kinase 2, mitochondrial OS=Ho",13,13,61.1,239
MYL6,0.3366822086,0.0636820595480923,0,P60660;F8W1R7;G3V1V0;J3KND3;G8JLA2;B7Z6Z4;F8VPF3;G3V1Y7;P14649;F8VZU9;F8W1I5;F8W180;F8VXL3;H0YI43,P60660;F8W1R7;G3V1V0;J3KND3;G8JLA2;B7Z6Z4;F8VPF3,13;13;13;11;11;11;9;5;3;3;3;3;1;1,13;13;13;11;11;11;9;5;3;3;3;3;1;1,13;13;13;11;11;11;9;5;3;3;3;3;1;1,Myosin light polypeptide 6,MYL6,sp|P60660|MYL6_HUMAN Myosin light polypeptide 6 OS=Homo sapiens OX=9606 GN=MYL6 PE=1 SV=2;tr|F8W1R7|F8W1R7_HUMAN Myosin light polypeptide 6 OS=Homo sapiens OX=9606 GN=MYL6 PE=1 SV=1;tr|G3V1V0|G3V1V0_HUMAN Myosin light polypeptide 6 OS=Homo sapiens OX=9606 ,13,13,67.5,151
HNRNPA1,-0.0479161656,0.752153576055542,0,P09651;F8W6I7;F8VZ49;F8VTQ5;F8W646;F8VYN5,P09651;F8W6I7;F8VZ49;F8VTQ5;F8W646,24;24;18;12;12;9,24;24;18;12;12;9,2;2;0;2;2;0,"Heterogeneous nuclear ribonucleoprotein A1;Heterogeneous nuclear ribonucleoprotein A1, N-terminally processed",HNRNPA1,sp|P09651|ROA1_HUMAN Heterogeneous nuclear ribonucleoprotein A1 OS=Homo sapiens OX=9606 GN=HNRNPA1 PE=1 SV=5;tr|F8W6I7|F8W6I7_HUMAN Heterogeneous nuclear ribonucleoprotein A1 OS=Homo sapiens OX=9606 GN=HNRNPA1 PE=1 SV=2;tr|F8VZ49|F8VZ49_HUMAN Heterogeneous,24,2,56.5,372
MRE11A,-0.3881432005,0.038602233720366,0,P49959;F8W7U8;F5GXT0,P49959;F8W7U8,6;6;2,6;6;2,6;6;2,Double-strand break repair protein MRE11A,MRE11A,sp|P49959|MRE11_HUMAN Double-strand break repair protein MRE11 OS=Homo sapiens OX=9606 GN=MRE11 PE=1 SV=3;tr|F8W7U8|F8W7U8_HUMAN Double-strand break repair protein OS=Homo sapiens OX=9606 GN=MRE11 PE=1 SV=1,6,6,11,708
EIF2A,-0.2537644379,0.346775182793236,0,Q9BY44;F8WAE5;C9IZE1;F8WF18;F8WAT3;H7C5Q3;H7C5R5,Q9BY44;F8WAE5;C9IZE1,5;5;3;2;2;2;2,5;5;3;2;2;2;2,5;5;3;2;2;2;2,"Eukaryotic translation initiation factor 2A;Eukaryotic translation initiation factor 2A, N-terminally processed",EIF2A,sp|Q9BY44|EIF2A_HUMAN Eukaryotic translation initiation factor 2A OS=Homo sapiens OX=9606 GN=EIF2A PE=1 SV=3;tr|F8WAE5|F8WAE5_HUMAN Eukaryotic translation initiation factor 2A OS=Homo sapiens OX=9606 GN=EIF2A PE=1 SV=1;tr|C9IZE1|C9IZE1_HUMAN Eukaryotic tra,5,5,12.5,585
NDUFA5,0.5162033233,0.0174170454633109,0,Q16718;F8WAS3,Q16718;F8WAS3,2;2,2;2,2;2,NADH dehydrogenase [ubiquinone] 1 alpha subcomplex subunit 5,NDUFA5,sp|Q16718|NDUA5_HUMAN NADH dehydrogenase [ubiquinone] 1 alpha subcomplex subunit 5 OS=Homo sapiens OX=9606 GN=NDUFA5 PE=1 SV=3;tr|F8WAS3|F8WAS3_HUMAN NADH dehydrogenase [ubiquinone] 1 alpha subcomplex subunit 5 OS=Homo sapiens OX=9606 GN=NDUFA5 PE=1 SV=1,2,2,19,116
PARP2,-0.6097507175,0.0521767495277796,0,Q9UGN5;H0YH02;G3V167,Q9UGN5;H0YH02;G3V167,1;1;1,1;1;1,1;1;1,Poly [ADP-ribose] polymerase 2,PARP2,sp|Q9UGN5|PARP2_HUMAN Poly [ADP-ribose] polymerase 2 OS=Homo sapiens OX=9606 GN=PARP2 PE=1 SV=2;tr|H0YH02|H0YH02_HUMAN Poly [ADP-ribose] polymerase (Fragment) OS=Homo sapiens OX=9606 GN=PARP2 PE=1 SV=1;tr|G3V167|G3V167_HUMAN Poly [ADP-ribose] polymerase OS,1,1,2.2,583
API5,0.2203243501,0.453710749830607,0,Q9BZZ5;G3V1C3;E9PQK6;H0YER7,Q9BZZ5;G3V1C3,6;6;2;1,6;6;2;1,6;6;2;1,Apoptosis inhibitor 5,API5,sp|Q9BZZ5|API5_HUMAN Apoptosis inhibitor 5 OS=Homo sapiens OX=9606 GN=API5 PE=1 SV=3;tr|G3V1C3|G3V1C3_HUMAN Apoptosis inhibitor 5 OS=Homo sapiens OX=9606 GN=API5 PE=1 SV=1,6,6,12.8,524
LIN7C,0.0119278704,0.960159751379259,0,Q9NUP9;G3V1D4,Q9NUP9;G3V1D4,2;2,2;2,2;2,Protein lin-7 homolog C,LIN7C,"sp|Q9NUP9|LIN7C_HUMAN Protein lin-7 homolog C OS=Homo sapiens OX=9606 GN=LIN7C PE=1 SV=1;tr|G3V1D4|G3V1D4_HUMAN Lin-7 homolog C (C. elegans), isoform CRA_b OS=Homo sapiens OX=9606 GN=LIN7C PE=1 SV=1",2,2,11.2,197
GOLT1B,-0.0080169056,0.946690924632274,0,Q9Y3E0;G3V1U5;F5H6U7,Q9Y3E0;G3V1U5;F5H6U7,3;3;2,3;3;2,3;3;2,Vesicle transport protein GOT1B,GOLT1B,"sp|Q9Y3E0|GOT1B_HUMAN Vesicle transport protein GOT1B OS=Homo sapiens OX=9606 GN=GOLT1B PE=1 SV=1;tr|G3V1U5|G3V1U5_HUMAN Golgi transport 1 homolog B (S. cerevisiae), isoform CRA_c OS=Homo sapiens OX=9606 GN=GOLT1B PE=1 SV=1;tr|F5H6U7|F5H6U7_HUMAN Vesicle t",3,3,20.3,138
SNW1,-0.3363580129,0.0534665754519097,0,Q13573;G3V3A4;G3V4X8;G3V5R3,Q13573;G3V3A4;G3V4X8,6;6;4;2,6;6;4;2,6;6;4;2,SNW domain-containing protein 1,SNW1,sp|Q13573|SNW1_HUMAN SNW domain-containing protein 1 OS=Homo sapiens OX=9606 GN=SNW1 PE=1 SV=1;tr|G3V3A4|G3V3A4_HUMAN SNW domain-containing protein 1 OS=Homo sapiens OX=9606 GN=SNW1 PE=1 SV=1;tr|G3V4X8|G3V4X8_HUMAN SNW domain-containing protein 1 OS=Homo s,6,6,18.7,536
NUMB,0.187119163,0.208797169879744,0,P49757;G3V3M5;G3V3R1;G3V3Z8;Q9Y6R0;M0QXQ4;M0QYC2;A0A0C4DGH3,P49757;G3V3M5;G3V3R1;G3V3Z8,3;3;3;2;1;1;1;1,3;3;3;2;1;1;1;1,3;3;3;2;1;1;1;1,Protein numb homolog,NUMB,sp|P49757|NUMB_HUMAN Protein numb homolog OS=Homo sapiens OX=9606 GN=NUMB PE=1 SV=2;tr|G3V3M5|G3V3M5_HUMAN Protein numb homolog (Fragment) OS=Homo sapiens OX=9606 GN=NUMB PE=1 SV=8;tr|G3V3R1|G3V3R1_HUMAN Protein numb homolog (Fragment) OS=Homo sapiens OX=9,3,3,7.2,651
PSMA6,-0.155194994,0.274210866087222,0,P60900;G3V5Z7;G3V295;G3V3I1;G3V3U4;G3V4S5;G3V2S7;H0YJC4,P60900;G3V5Z7;G3V295;G3V3I1,11;11;10;9;5;3;3;1,11;11;10;9;5;3;3;1,11;11;10;9;5;3;3;1,Proteasome subunit alpha type-6;Proteasome subunit alpha type,PSMA6,sp|P60900|PSA6_HUMAN Proteasome subunit alpha type-6 OS=Homo sapiens OX=9606 GN=PSMA6 PE=1 SV=1;tr|G3V5Z7|G3V5Z7_HUMAN Proteasome subunit alpha type OS=Homo sapiens OX=9606 GN=PSMA6 PE=1 SV=1;tr|G3V295|G3V295_HUMAN Proteasome subunit alpha type OS=Homo sap,11,11,44.3,246
MRPS22,0.5099830639,0.0969019172199707,0,P82650;G5E9W7;G5E9V5;H7C5L9;H7C5H3;H7C5F2,P82650;G5E9W7;G5E9V5;H7C5L9;H7C5H3,6;6;6;5;3;1,6;6;6;5;3;1,6;6;6;5;3;1,"28S ribosomal protein S22, mitochondrial",MRPS22,"sp|P82650|RT22_HUMAN 28S ribosomal protein S22, mitochondrial OS=Homo sapiens OX=9606 GN=MRPS22 PE=1 SV=1;tr|G5E9W7|G5E9W7_HUMAN 28S ribosomal protein S22, mitochondrial OS=Homo sapiens OX=9606 GN=MRPS22 PE=1 SV=1;tr|G5E9V5|G5E9V5_HUMAN 28S ribosomal prote",6,6,13.6,360
CPSF3,-0.6467316147,0.0580314791894221,0,Q9UKF6;G5E9W3,Q9UKF6;G5E9W3,3;3,3;3,3;3,Cleavage and polyadenylation specificity factor subunit 3,CPSF3,"sp|Q9UKF6|CPSF3_HUMAN Cleavage and polyadenylation specificity factor subunit 3 OS=Homo sapiens OX=9606 GN=CPSF3 PE=1 SV=1;tr|G5E9W3|G5E9W3_HUMAN Cleavage and polyadenylation specific factor 3, 73kDa, isoform CRA_b OS=Homo sapiens OX=9606 GN=CPSF3 PE=1 SV=",3,3,4.4,684
CELF1,-0.19915727,0.154422502883578,0,Q92879;G5EA30;O95319;F5H4Y5;E9PQK4;E9PSH0;F5H0D8;E9PKU1;V9GYD9;Q5VZZ6;A0A0J9YX66;A0A1B0GU44;E9PC62;A0A1B0GUN8;A0A0J9YXJ0;E9PKA1,Q92879;G5EA30,6;6;2;2;2;2;2;2;2;2;2;2;2;2;2;1,6;6;2;2;2;2;2;2;2;2;2;2;2;2;2;1,6;6;2;2;2;2;2;2;2;2;2;2;2;2;2;1,CUGBP Elav-like family member 1,CELF1,"sp|Q92879|CELF1_HUMAN CUGBP Elav-like family member 1 OS=Homo sapiens OX=9606 GN=CELF1 PE=1 SV=2;tr|G5EA30|G5EA30_HUMAN CUG triplet repeat, RNA binding protein 1, isoform CRA_c OS=Homo sapiens OX=9606 GN=CELF1 PE=1 SV=1",6,6,12.3,486
SEC24C,0.1689588611,0.299452910538941,0,P53992;G5EA31,P53992;G5EA31,6;6,6;6,6;6,Protein transport protein Sec24C,SEC24C,sp|P53992|SC24C_HUMAN Protein transport protein Sec24C OS=Homo sapiens OX=9606 GN=SEC24C PE=1 SV=3;tr|G5EA31|G5EA31_HUMAN Protein transport protein Sec24C OS=Homo sapiens OX=9606 GN=SEC24C PE=1 SV=1,6,6,6.9,1094
HNRNPH1,-0.2428070376,0.115844157071813,0,P31943;G8JLB6;E9PCY7;D6RBM0;E5RGV0;H0YB39;D6RIU0;D6RIT2;D6RAM1;D6R9T0;D6RFM3;D6RDU3;D6RJ04;D6RIH9;E7EN40;E7EQJ0;E5RGH4;H0YBG7;H0YBD7;H0YAQ2;D6RDL0;D6RF17;D6R9D3;E5RJ94,P31943;G8JLB6;E9PCY7;D6RBM0;E5RGV0;H0YB39;D6RIU0;D6RIT2,17;17;16;11;10;9;9;9;8;8;8;8;8;8;7;7;6;5;5;4;4;4;3;2,15;15;14;11;10;7;9;9;8;8;8;8;8;8;7;7;6;3;3;4;4;4;3;2,9;9;8;6;5;3;6;7;6;6;6;6;6;6;4;6;2;2;2;2;4;4;3;2,"Heterogeneous nuclear ribonucleoprotein H;Heterogeneous nuclear ribonucleoprotein H, N-terminally processed",HNRNPH1,sp|P31943|HNRH1_HUMAN Heterogeneous nuclear ribonucleoprotein H OS=Homo sapiens OX=9606 GN=HNRNPH1 PE=1 SV=4;tr|G8JLB6|G8JLB6_HUMAN Heterogeneous nuclear ribonucleoprotein H OS=Homo sapiens OX=9606 GN=HNRNPH1 PE=1 SV=1;tr|E9PCY7|E9PCY7_HUMAN Heterogeneous ,17,9,41.6,449
ZYX,0.9923449984,0.147378177220495,0,Q15942;H0Y2Y8;C9IZ41;H7C3D3;C9JJK5,Q15942;H0Y2Y8,5;5;2;2;1,5;5;2;2;1,5;5;2;2;1,Zyxin,ZYX,sp|Q15942|ZYX_HUMAN Zyxin OS=Homo sapiens OX=9606 GN=ZYX PE=1 SV=1;tr|H0Y2Y8|H0Y2Y8_HUMAN Zyxin (Fragment) OS=Homo sapiens OX=9606 GN=ZYX PE=1 SV=1,5,5,15,572
HNRNPD,-0.0010938075,0.992858418937265,0,Q14103;H0YA96;H0Y8G5;D6RAF8;D6RF44;D6RBQ9;D6RD83,Q14103;H0YA96;H0Y8G5;D6RAF8;D6RF44,19;19;19;12;11;8;5,19;19;19;12;11;8;5,17;17;17;10;9;6;5,Heterogeneous nuclear ribonucleoprotein D0,HNRNPD,sp|Q14103|HNRPD_HUMAN Heterogeneous nuclear ribonucleoprotein D0 OS=Homo sapiens OX=9606 GN=HNRNPD PE=1 SV=1;tr|H0YA96|H0YA96_HUMAN Heterogeneous nuclear ribonucleoprotein D0 (Fragment) OS=Homo sapiens OX=9606 GN=HNRNPD PE=1 SV=1;tr|H0Y8G5|H0Y8G5_HUMAN Het,19,17,34.6,355
HADHA,0.0520275823,0.684636583038563,0,P40939;H0YFD6;A0A2R8Y4F5;A0A2R8YG21;A0A2R8Y688,P40939;H0YFD6;A0A2R8Y4F5;A0A2R8YG21,40;40;33;24;14,40;40;33;24;14,40;40;33;24;14,"Trifunctional enzyme subunit alpha, mitochondrial;Long-chain enoyl-CoA hydratase;Long chain 3-hydroxyacyl-CoA dehydrogenase",HADHA,"sp|P40939|ECHA_HUMAN Trifunctional enzyme subunit alpha, mitochondrial OS=Homo sapiens OX=9606 GN=HADHA PE=1 SV=2;tr|H0YFD6|H0YFD6_HUMAN Trifunctional enzyme subunit alpha, mitochondrial OS=Homo sapiens OX=9606 GN=HADHA PE=1 SV=2;tr|A0A2R8Y4F5|A0A2R8Y4F5_H",40,40,51.6,763
TMOD3,0.6092805043,0.0355171635084403,0,Q9NYL9;H0YKU1;H0YNJ8,Q9NYL9;H0YKU1;H0YNJ8,2;2;2,2;2;2,2;2;2,Tropomodulin-3,TMOD3,sp|Q9NYL9|TMOD3_HUMAN Tropomodulin-3 OS=Homo sapiens OX=9606 GN=TMOD3 PE=1 SV=1;tr|H0YKU1|H0YKU1_HUMAN Tropomodulin-3 (Fragment) OS=Homo sapiens OX=9606 GN=TMOD3 PE=1 SV=1;tr|H0YNJ8|H0YNJ8_HUMAN Tropomodulin-3 OS=Homo sapiens OX=9606 GN=TMOD3 PE=1 SV=1,2,2,8.8,352
RPS27;RPS27L,-0.1485412931,0.342633796320894,0,P42677;Q71UM5;H0YMV8;C9JLI6;C9J1C5,P42677;Q71UM5;H0YMV8;C9JLI6,3;3;3;2;1,3;3;3;2;1,3;3;3;2;1,40S ribosomal protein S27;40S ribosomal protein S27-like,RPS27;RPS27L,sp|P42677|RS27_HUMAN 40S ribosomal protein S27 OS=Homo sapiens OX=9606 GN=RPS27 PE=1 SV=3;sp|Q71UM5|RS27L_HUMAN 40S ribosomal protein S27-like OS=Homo sapiens OX=9606 GN=RPS27L PE=1 SV=3;tr|H0YMV8|H0YMV8_HUMAN 40S ribosomal protein S27 OS=Homo sapiens OX=9,3,3,26.2,84
RNPS1,-0.374983832,0.0459424854846014,0,Q15287;H3BV80;H3BMM9;H3BTC0;H3BPG5;H3BMS0,Q15287;H3BV80;H3BMM9;H3BTC0;H3BPG5;H3BMS0,4;4;4;4;3;3,4;4;4;4;3;3,4;4;4;4;3;3,RNA-binding protein with serine-rich domain 1,RNPS1,sp|Q15287|RNPS1_HUMAN RNA-binding protein with serine-rich domain 1 OS=Homo sapiens OX=9606 GN=RNPS1 PE=1 SV=1;tr|H3BV80|H3BV80_HUMAN RNA-binding protein with serine-rich domain 1 OS=Homo sapiens OX=9606 GN=RNPS1 PE=1 SV=2;tr|H3BMM9|H3BMM9_HUMAN RNA-bindin,4,4,11.5,305
,-0.6643677546,0.0086558473144319,0,H3BN98;Q15041;H3BPJ2,H3BN98,12;4;4,4;4;4,4;4;4,,,tr|H3BN98|H3BN98_HUMAN Uncharacterized protein (Fragment) OS=Homo sapiens OX=9606 PE=4 SV=2,12,4,35.9,237
RPS17,0.1090139281,0.478879175736515,0,P08708;H3BNC9;H0YN88;A0A075B716;H0YN73;A0A0J9YYC4,P08708;H3BNC9;H0YN88;A0A075B716,13;13;11;11;6;2,13;13;11;11;6;2,13;13;11;11;6;2,40S ribosomal protein S17,RPS17,sp|P08708|RS17_HUMAN 40S ribosomal protein S17 OS=Homo sapiens OX=9606 GN=RPS17 PE=1 SV=2;tr|H3BNC9|H3BNC9_HUMAN Uncharacterized protein OS=Homo sapiens OX=9606 PE=3 SV=2;tr|H0YN88|H0YN88_HUMAN 40S ribosomal protein S17 OS=Homo sapiens OX=9606 GN=RPS17 PE=,13,13,71.9,135
HEXA,-0.3336027115,0.0416114118612122,0,P06865;H3BS10;H3BP20;H3BU85;H3BTD4,P06865;H3BS10;H3BP20;H3BU85;H3BTD4,2;2;2;1;1,2;2;2;1;1,2;2;2;1;1,Beta-hexosaminidase subunit alpha;Beta-hexosaminidase,HEXA,sp|P06865|HEXA_HUMAN Beta-hexosaminidase subunit alpha OS=Homo sapiens OX=9606 GN=HEXA PE=1 SV=2;tr|H3BS10|H3BS10_HUMAN Beta-hexosaminidase OS=Homo sapiens OX=9606 GN=HEXA PE=1 SV=1;tr|H3BP20|H3BP20_HUMAN Beta-hexosaminidase OS=Homo sapiens OX=9606 GN=HEXA,2,2,4.2,529
MACF1,0.3023621716,0.518652554003372,0,Q9UPN3;H3BPE1;H3BQK9;H0Y390;A0A590UJG2;A0A0A6YYJ5,Q9UPN3;H3BPE1;H3BQK9;H0Y390;A0A590UJG2,5;5;5;4;4;2,4;4;4;4;4;2,4;4;4;4;4;2,"Microtubule-actin cross-linking factor 1, isoforms 1/2/3/5",MACF1,"sp|Q9UPN3|MACF1_HUMAN Microtubule-actin cross-linking factor 1, isoforms 1/2/3/5 OS=Homo sapiens OX=9606 GN=MACF1 PE=1 SV=4;tr|H3BPE1|H3BPE1_HUMAN Microtubule-actin cross-linking factor 1, isoforms 1/2/3/5 OS=Homo sapiens OX=9606 GN=MACF1 PE=1 SV=1;tr|H3BQ",5,4,1,7388
FUS,0.1127425517,0.355546114541906,0,P35637;H3BPE7,P35637;H3BPE7,8;8,8;8,7;7,RNA-binding protein FUS,FUS,sp|P35637|FUS_HUMAN RNA-binding protein FUS OS=Homo sapiens OX=9606 GN=FUS PE=1 SV=1;tr|H3BPE7|H3BPE7_HUMAN RNA-binding protein FUS OS=Homo sapiens OX=9606 GN=FUS PE=1 SV=1,8,7,15,526
NDUFB10,-0.1730118668,0.216556883210243,0,O96000;H3BPJ9;H3BV16,O96000;H3BPJ9,3;3;1,3;3;1,3;3;1,NADH dehydrogenase [ubiquinone] 1 beta subcomplex subunit 10,NDUFB10,sp|O96000|NDUBA_HUMAN NADH dehydrogenase [ubiquinone] 1 beta subcomplex subunit 10 OS=Homo sapiens OX=9606 GN=NDUFB10 PE=1 SV=3;tr|H3BPJ9|H3BPJ9_HUMAN NADH dehydrogenase [ubiquinone] 1 beta subcomplex subunit 10 OS=Homo sapiens OX=9606 GN=NDUFB10 PE=1 SV=1,3,3,17.4,172
HACD3,-0.1497432189,0.243817004372,0,Q9P035;H3BS72,Q9P035;H3BS72,1;1,1;1,1;1,Very-long-chain (3R)-3-hydroxyacyl-CoA dehydratase 3,HACD3,sp|Q9P035|HACD3_HUMAN Very-long-chain (3R)-3-hydroxyacyl-CoA dehydratase 3 OS=Homo sapiens OX=9606 GN=HACD3 PE=1 SV=2;tr|H3BS72|H3BS72_HUMAN Very-long-chain (3R)-3-hydroxyacyl-CoA dehydratase OS=Homo sapiens OX=9606 GN=HACD3 PE=1 SV=1,1,1,4.1,362
DHX30,0.1202056166,0.385955693967804,0,Q7L2E3;H7BXY3,Q7L2E3;H7BXY3,13;13,13;13,13;13,Putative ATP-dependent RNA helicase DHX30,DHX30,sp|Q7L2E3|DHX30_HUMAN ATP-dependent RNA helicase DHX30 OS=Homo sapiens OX=9606 GN=DHX30 PE=1 SV=1;tr|H7BXY3|H7BXY3_HUMAN ATP-dependent RNA helicase DHX30 OS=Homo sapiens OX=9606 GN=DHX30 PE=1 SV=1,13,13,13.6,1194
PDIA3,-0.0506360479,0.67219678226389,0,H7BZJ3,H7BZJ3,10,1,1,,PDIA3,tr|H7BZJ3|H7BZJ3_HUMAN Protein disulfide-isomerase A3 (Fragment) OS=Homo sapiens OX=9606 GN=PDIA3 PE=1 SV=1,10,1,57.7,123
EBNA1BP2,0.3599853316,0.0287859399820055,0,Q99848;H7C2Q8,Q99848;H7C2Q8,3;3,3;3,3;3,Probable rRNA-processing protein EBP2,EBNA1BP2,"sp|Q99848|EBP2_HUMAN Probable rRNA-processing protein EBP2 OS=Homo sapiens OX=9606 GN=EBNA1BP2 PE=1 SV=2;tr|H7C2Q8|H7C2Q8_HUMAN EBNA1 binding protein 2, isoform CRA_d OS=Homo sapiens OX=9606 GN=EBNA1BP2 PE=1 SV=1",3,3,12.4,306
NSF,-0.0799943877,0.642146358318859,0,P46459;I3L0N3;I3L2G1;K7EQD6;I3L0L3,P46459;I3L0N3,9;9;2;2;1,9;9;2;2;1,9;9;2;2;1,Vesicle-fusing ATPase,NSF,sp|P46459|NSF_HUMAN Vesicle-fusing ATPase OS=Homo sapiens OX=9606 GN=NSF PE=1 SV=3;tr|I3L0N3|I3L0N3_HUMAN Vesicle-fusing ATPase OS=Homo sapiens OX=9606 GN=NSF PE=1 SV=1,9,9,15.6,744
SLC25A11,-0.4181801882,0.0567106911961012,0,Q02978;I3L1P8,Q02978;I3L1P8,3;3,3;3,3;3,Mitochondrial 2-oxoglutarate/malate carrier protein,SLC25A11,sp|Q02978|M2OM_HUMAN Mitochondrial 2-oxoglutarate/malate carrier protein OS=Homo sapiens OX=9606 GN=SLC25A11 PE=1 SV=3;tr|I3L1P8|I3L1P8_HUMAN Mitochondrial 2-oxoglutarate/malate carrier protein (Fragment) OS=Homo sapiens OX=9606 GN=SLC25A11 PE=1 SV=1,3,3,14,314
EIF5A;EIF5A2;EIF5AL1,-0.0589886186,0.635871020721809,0,P63241;I3L397;I3L504;Q9GZV4;Q6IS14;F8WCJ1;C9J7B5;C9J4W5,P63241;I3L397;I3L504;Q9GZV4;Q6IS14;F8WCJ1;C9J7B5;C9J4W5,13;13;13;10;10;10;10;10,13;13;13;10;10;10;10;10,13;13;13;10;10;10;10;10,Eukaryotic translation initiation factor 5A-1;Eukaryotic translation initiation factor 5A;Eukaryotic translation initiation factor 5A-2;Eukaryotic translation initiation factor 5A-1-like,EIF5A;EIF5A2;EIF5AL1,sp|P63241|IF5A1_HUMAN Eukaryotic translation initiation factor 5A-1 OS=Homo sapiens OX=9606 GN=EIF5A PE=1 SV=2;tr|I3L397|I3L397_HUMAN Eukaryotic translation initiation factor 5A (Fragment) OS=Homo sapiens OX=9606 GN=EIF5A PE=1 SV=8;tr|I3L504|I3L504_HUMAN E,13,13,64.9,154
PSMD13,-0.0838763193,0.516351625975782,0,Q9UNM6;J3KNQ3;A0A087WUL9;H0YD73;E9PL38;E9PQG3,Q9UNM6;J3KNQ3;A0A087WUL9;H0YD73;E9PL38,8;8;7;4;4;1,8;8;7;4;4;1,8;8;7;4;4;1,26S proteasome non-ATPase regulatory subunit 13,PSMD13,sp|Q9UNM6|PSD13_HUMAN 26S proteasome non-ATPase regulatory subunit 13 OS=Homo sapiens OX=9606 GN=PSMD13 PE=1 SV=2;tr|J3KNQ3|J3KNQ3_HUMAN 26S proteasome non-ATPase regulatory subunit 13 OS=Homo sapiens OX=9606 GN=PSMD13 PE=1 SV=1;tr|A0A087WUL9|A0A087WUL9_HU,8,8,30.9,376
SRSF2,-0.0165709992,0.916524323732627,0,Q01130;J3QL05;J3KP15;Q9BRL6,Q01130;J3QL05;J3KP15,7;7;7;1,7;7;7;1,7;7;7;1,Serine/arginine-rich splicing factor 2,SRSF2,sp|Q01130|SRSF2_HUMAN Serine/arginine-rich splicing factor 2 OS=Homo sapiens OX=9606 GN=SRSF2 PE=1 SV=4;tr|J3QL05|J3QL05_HUMAN Serine/arginine-rich-splicing factor 2 (Fragment) OS=Homo sapiens OX=9606 GN=SRSF2 PE=1 SV=1;tr|J3KP15|J3KP15_HUMAN Serine/argini,7,7,26.2,221
SUMF2,-0.0557201205,0.640452913366772,0,J3KQJ1;Q8NBJ7;A0A494C1B1;F8WA42;C9JL30;A8MXB9;C9J660;H7C3B2;E9PBT8;J3QT17;F8WEX5;E9PG02;F8WEV7;F8WES7,J3KQJ1;Q8NBJ7;A0A494C1B1;F8WA42;C9JL30;A8MXB9;C9J660;H7C3B2,7;6;6;6;5;5;5;4;3;3;2;2;1;1,7;6;6;6;5;5;5;4;3;3;2;2;1;1,7;6;6;6;5;5;5;4;3;3;2;2;1;1,Sulfatase-modifying factor 2,SUMF2,tr|J3KQJ1|J3KQJ1_HUMAN Inactive C-alpha-formylglycine-generating enzyme 2 OS=Homo sapiens OX=9606 GN=SUMF2 PE=1 SV=1;sp|Q8NBJ7|SUMF2_HUMAN Inactive C-alpha-formylglycine-generating enzyme 2 OS=Homo sapiens OX=9606 GN=SUMF2 PE=1 SV=2;tr|A0A494C1B1|A0A494C1B,7,7,22.8,320
RPL36AL;RPL36A;RPL36A-HNRNPH2,0.2692078701,0.193947036559687,0,Q969Q0;P83881;J3KQN4;H0Y5B4;H7BZ11;R4GN19,Q969Q0;P83881;J3KQN4;H0Y5B4;H7BZ11,4;4;4;3;3;1,4;4;4;3;3;1,4;4;4;3;3;1,60S ribosomal protein L36a-like;60S ribosomal protein L36a,RPL36AL;RPL36A;RPL36A-HNRNPH2,sp|Q969Q0|RL36L_HUMAN 60S ribosomal protein L36a-like OS=Homo sapiens OX=9606 GN=RPL36AL PE=1 SV=3;sp|P83881|RL36A_HUMAN 60S ribosomal protein L36a OS=Homo sapiens OX=9606 GN=RPL36A PE=1 SV=2;tr|J3KQN4|J3KQN4_HUMAN 60S ribosomal protein L36a OS=Homo sapien,4,4,19.8,106
IARS,0.3000176548,0.0588858099598823,0,P41252;J3KR24;A0A0A0MSX9;Q5TCD1;Q5TCC6,P41252;J3KR24;A0A0A0MSX9,20;20;19;2;1,20;20;19;2;1,20;20;19;2;1,"Isoleucine--tRNA ligase, cytoplasmic",IARS,"sp|P41252|SYIC_HUMAN Isoleucine--tRNA ligase, cytoplasmic OS=Homo sapiens OX=9606 GN=IARS1 PE=1 SV=2;tr|J3KR24|J3KR24_HUMAN Isoleucine--tRNA ligase, cytoplasmic OS=Homo sapiens OX=9606 GN=IARS1 PE=1 SV=1;tr|A0A0A0MSX9|A0A0A0MSX9_HUMAN Isoleucine--tRNA liga",20,20,16.9,1262
DCXR,0.017979286,0.882469405491878,0,Q7Z4W1;J3KRZ4;J3KS22;J3QS45;J3KSZ5;J3QL34;J3QS36,Q7Z4W1;J3KRZ4;J3KS22,3;3;3;1;1;1;1,3;3;3;1;1;1;1,3;3;3;1;1;1;1,L-xylulose reductase,DCXR,sp|Q7Z4W1|DCXR_HUMAN L-xylulose reductase OS=Homo sapiens OX=9606 GN=DCXR PE=1 SV=2;tr|J3KRZ4|J3KRZ4_HUMAN L-xylulose reductase (Fragment) OS=Homo sapiens OX=9606 GN=DCXR PE=1 SV=1;tr|J3KS22|J3KS22_HUMAN L-xylulose reductase (Fragment) OS=Homo sapiens OX=9,3,3,8.2,244
CBX1,-0.0407910783,0.802146302663296,0,P83916;J3KS05;K7ELA4;B5MD17;C9JWS9,P83916;J3KS05;K7ELA4;B5MD17,3;3;2;2;1,2;2;1;1;1,2;2;1;1;1,Chromobox protein homolog 1,CBX1,sp|P83916|CBX1_HUMAN Chromobox protein homolog 1 OS=Homo sapiens OX=9606 GN=CBX1 PE=1 SV=1;tr|J3KS05|J3KS05_HUMAN Chromobox protein homolog 1 (Fragment) OS=Homo sapiens OX=9606 GN=CBX1 PE=1 SV=8;tr|K7ELA4|K7ELA4_HUMAN Chromobox protein homolog 1 OS=Homo sa,3,2,19.5,185
ZNF207,0.7897409348,0.10373679220298,0,O43670;J3KS31;J3QRS9;X6R4W8,O43670;J3KS31;J3QRS9;X6R4W8,3;3;3;3,3;3;3;3,3;3;3;3,BUB3-interacting and GLEBS motif-containing protein ZNF207,ZNF207,sp|O43670|ZN207_HUMAN BUB3-interacting and GLEBS motif-containing protein ZNF207 OS=Homo sapiens OX=9606 GN=ZNF207 PE=1 SV=1;tr|J3KS31|J3KS31_HUMAN BUB3-interacting and GLEBS motif-containing protein ZNF207 (Fragment) OS=Homo sapiens OX=9606 GN=ZNF207 PE=1,3,3,9.4,478
MRPS7,-0.172904604,0.429301611370338,0,Q9Y2R9;J3KSI8;J3QQS1;J3QLS3;J3QKW2,Q9Y2R9;J3KSI8;J3QQS1;J3QLS3;J3QKW2,4;4;4;4;3,4;4;4;4;3,4;4;4;4;3,"28S ribosomal protein S7, mitochondrial",MRPS7,"sp|Q9Y2R9|RT07_HUMAN 28S ribosomal protein S7, mitochondrial OS=Homo sapiens OX=9606 GN=MRPS7 PE=1 SV=2;tr|J3KSI8|J3KSI8_HUMAN 28S ribosomal protein S7, mitochondrial (Fragment) OS=Homo sapiens OX=9606 GN=MRPS7 PE=1 SV=1;tr|J3QQS1|J3QQS1_HUMAN 28S ribosoma",4,4,21.1,242
NUP85,-0.567133798,0.052886985324195,0,Q9BW27;J3KT10;J3KSH3;J3KRC0;F5H0W7;J3QLH0;J3QL54;J3QS63;J3QL91;J3QLD4,Q9BW27;J3KT10;J3KSH3;J3KRC0;F5H0W7;J3QLH0;J3QL54,4;4;2;2;2;2;2;1;1;1,4;4;2;2;2;2;2;1;1;1,4;4;2;2;2;2;2;1;1;1,Nuclear pore complex protein Nup85,NUP85,sp|Q9BW27|NUP85_HUMAN Nuclear pore complex protein Nup85 OS=Homo sapiens OX=9606 GN=NUP85 PE=1 SV=1;tr|J3KT10|J3KT10_HUMAN Nuclear pore complex protein Nup85 OS=Homo sapiens OX=9606 GN=NUP85 PE=1 SV=1;tr|J3KSH3|J3KSH3_HUMAN Nuclear pore complex protein Nup,4,4,7.6,656
DDX5,-0.557644781,0.00856122876443345,0,P17844;J3KTA4;J3KRZ1;J3QSF1;J3QRQ7;J3KRX8;J3KTQ4;X6RLV5;J3QR02;J3QRN5,P17844;J3KTA4,43;43;18;15;11;4;4;3;3;1,43;43;18;15;11;4;4;3;3;1,30;30;6;9;7;4;4;3;3;1,Probable ATP-dependent RNA helicase DDX5,DDX5,sp|P17844|DDX5_HUMAN Probable ATP-dependent RNA helicase DDX5 OS=Homo sapiens OX=9606 GN=DDX5 PE=1 SV=1;tr|J3KTA4|J3KTA4_HUMAN Probable ATP-dependent RNA helicase DDX5 OS=Homo sapiens OX=9606 GN=DDX5 PE=1 SV=1,43,30,51.3,614
RPL19,-0.0110647471,0.934743278356765,0,P84098;J3QR09;J3KTE4,P84098;J3QR09;J3KTE4,17;17;17,17;17;17,17;17;17,60S ribosomal protein L19;Ribosomal protein L19,RPL19,sp|P84098|RL19_HUMAN 60S ribosomal protein L19 OS=Homo sapiens OX=9606 GN=RPL19 PE=1 SV=1;tr|J3QR09|J3QR09_HUMAN Ribosomal protein L19 OS=Homo sapiens OX=9606 GN=RPL19 PE=1 SV=1;tr|J3KTE4|J3KTE4_HUMAN Ribosomal protein L19 OS=Homo sapiens OX=9606 GN=RPL19 ,17,17,50.5,196
SRSF1,0.0320526945,0.802080362548344,0,Q07955;J3KTL2;J3KSR8;J3QQV5;J3KSW7,Q07955;J3KTL2,15;15;7;5;5,15;15;7;5;5,14;14;7;5;5,Serine/arginine-rich splicing factor 1,SRSF1,sp|Q07955|SRSF1_HUMAN Serine/arginine-rich splicing factor 1 OS=Homo sapiens OX=9606 GN=SRSF1 PE=1 SV=2;tr|J3KTL2|J3KTL2_HUMAN Serine/arginine-rich-splicing factor 1 OS=Homo sapiens OX=9606 GN=SRSF1 PE=1 SV=1,15,14,62.5,248
