VDAC1,0.2383679768,0.0987676818060493,0,P21796;C9JI87,P21796;C9JI87,33;20,33;20,33;20,Voltage-dependent anion-selective channel protein 1,VDAC1,sp|P21796|VDAC1_HUMAN Voltage-dependent anion-selective channel protein 1 OS=Homo sapiens OX=9606 GN=VDAC1 PE=1 SV=2;tr|C9JI87|C9JI87_HUMAN Voltage-dependent anion-selective channel protein 1 (Fragment) OS=Homo sapiens OX=9606 GN=VDAC1 PE=1 SV=6,33,33,94,283
SDHB,-0.1888856009,0.496350917157302,0,P21912;A0A087WWT1;A0A087WXX8,P21912;A0A087WWT1;A0A087WXX8,8;5;4,8;5;4,8;5;4,"Succinate dehydrogenase [ubiquinone] iron-sulfur subunit, mitochondrial",SDHB,"sp|P21912|SDHB_HUMAN Succinate dehydrogenase [ubiquinone] iron-sulfur subunit, mitochondrial OS=Homo sapiens OX=9606 GN=SDHB PE=1 SV=3;tr|A0A087WWT1|A0A087WWT1_HUMAN Succinate dehydrogenase [ubiquinone] iron-sulfur subunit, mitochondrial (Fragment) OS=Homo",8,8,33.2,280
TGM2,0.3202591817,0.0765835919003704,0,P21980;A2A299;A2A2A0,P21980,30;10;5,30;10;5,30;10;5,Protein-glutamine gamma-glutamyltransferase 2,TGM2,sp|P21980|TGM2_HUMAN Protein-glutamine gamma-glutamyltransferase 2 OS=Homo sapiens OX=9606 GN=TGM2 PE=1 SV=2,30,30,42.4,687
FBL,0.118859602,0.387525082826644,0,P22087;M0QXL5;M0R2Q4;M0R0P1;M0R2U2;M0R1H0;M0R2B0,P22087;M0QXL5;M0R2Q4;M0R0P1,17;16;15;14;7;7;7,17;16;15;14;7;7;7,2;1;1;1;1;1;1,rRNA 2-O-methyltransferase fibrillarin,FBL,sp|P22087|FBRL_HUMAN rRNA 2-O-methyltransferase fibrillarin OS=Homo sapiens OX=9606 GN=FBL PE=1 SV=2;tr|M0QXL5|M0QXL5_HUMAN rRNA 2-O-methyltransferase fibrillarin (Fragment) OS=Homo sapiens OX=9606 GN=FBL PE=1 SV=1;tr|M0R2Q4|M0R2Q4_HUMAN rRNA 2-O-methyl,17,2,61.4,321
GART,0.1129820769,0.383172844414711,0,P22102;F8WD69;C9JBJ1;C9JTV6;C9JZG2;C9JKQ7;H7C366;A0A140TA71,P22102,30;12;10;10;6;6;4;2,30;12;10;10;6;6;4;2,30;12;10;10;6;6;4;2,Trifunctional purine biosynthetic protein adenosine-3;Phosphoribosylamine--glycine ligase;Phosphoribosylformylglycinamidine cyclo-ligase;Phosphoribosylglycinamide formyltransferase,GART,sp|P22102|PUR2_HUMAN Trifunctional purine biosynthetic protein adenosine-3 OS=Homo sapiens OX=9606 GN=GART PE=1 SV=1,30,30,43.3,1010
PAICS,0.2738042967,0.0941173110720279,0,P22234;E9PBS1;D6RF62,P22234;E9PBS1;D6RF62,31;30;22,31;30;22,31;30;22,Multifunctional protein ADE2;Phosphoribosylaminoimidazole-succinocarboxamide synthase;Phosphoribosylaminoimidazole carboxylase,PAICS,sp|P22234|PUR6_HUMAN Multifunctional protein ADE2 OS=Homo sapiens OX=9606 GN=PAICS PE=1 SV=3;tr|E9PBS1|E9PBS1_HUMAN Multifunctional protein ADE2 (Fragment) OS=Homo sapiens OX=9606 GN=PAICS PE=1 SV=1;tr|D6RF62|D6RF62_HUMAN Multifunctional protein ADE2 OS=Ho,31,31,67.5,425
SCP2,-0.251466563,0.0771656319777913,0,P22307;H0YF61;H0YCB0;E9PLD1,P22307,10;4;1;1,10;4;1;1,10;4;1;1,Non-specific lipid-transfer protein,SCP2,sp|P22307|NLTP_HUMAN Non-specific lipid-transfer protein OS=Homo sapiens OX=9606 GN=SCP2 PE=1 SV=2,10,10,18.1,547
UBA1,-0.2488343105,0.0942327483319695,0,P22314;Q5JRR6;Q5JRR9;Q5JRS0;Q5JRS1;Q5JRS3;Q5JRS2,P22314,52;19;12;12;10;10;10,52;19;12;12;10;10;10,52;19;12;12;10;10;10,Ubiquitin-like modifier-activating enzyme 1,UBA1,sp|P22314|UBA1_HUMAN Ubiquitin-like modifier-activating enzyme 1 OS=Homo sapiens OX=9606 GN=UBA1 PE=1 SV=3,52,52,57.8,1058
FDXR,-0.116432774,0.682159391739998,0,P22570;A0A0C4DFN8;A0A0A0MSZ4;A0A0A0MTR6;A0A0C4DGN7;A0A0A0MT64;A0A0A0MTN9;J3QQX3;J3QKZ8;J3QQW7;J3KS64,P22570;A0A0C4DFN8;A0A0A0MSZ4;A0A0A0MTR6;A0A0C4DGN7;A0A0A0MT64;A0A0A0MTN9;J3QQX3,37;34;34;33;32;32;31;28;7;4;1,37;34;34;33;32;32;31;28;7;4;1,37;34;34;33;32;32;31;28;7;4;1,"NADPH:adrenodoxin oxidoreductase, mitochondrial",FDXR,"sp|P22570|ADRO_HUMAN NADPH:adrenodoxin oxidoreductase, mitochondrial OS=Homo sapiens OX=9606 GN=FDXR PE=1 SV=3;tr|A0A0C4DFN8|A0A0C4DFN8_HUMAN NADPH:adrenodoxin oxidoreductase, mitochondrial OS=Homo sapiens OX=9606 GN=FDXR PE=1 SV=1;tr|A0A0A0MSZ4|A0A0A0MSZ4",37,37,76.4,491
HNRNPA2B1,-0.0128106855,0.919247144491862,0,P22626;A0A087WUI2,P22626;A0A087WUI2,39;29,39;29,39;29,Heterogeneous nuclear ribonucleoproteins A2/B1,HNRNPA2B1,sp|P22626|ROA2_HUMAN Heterogeneous nuclear ribonucleoproteins A2/B1 OS=Homo sapiens OX=9606 GN=HNRNPA2B1 PE=1 SV=2;tr|A0A087WUI2|A0A087WUI2_HUMAN Heterogeneous nuclear ribonucleoproteins A2/B1 OS=Homo sapiens OX=9606 GN=HNRNPA2B1 PE=1 SV=1,39,39,77.1,353
UQCRC2,0.2177761354,0.278324929122766,0,P22695;H3BRG4;H3BSJ9;H3BP04;H3BUE4;H3BUI9;A0A087WVZ4,P22695;H3BRG4;H3BSJ9;H3BP04,21;20;19;11;6;6;3,21;20;19;11;6;6;3,21;20;19;11;6;6;3,"Cytochrome b-c1 complex subunit 2, mitochondrial",UQCRC2,"sp|P22695|QCR2_HUMAN Cytochrome b-c1 complex subunit 2, mitochondrial OS=Homo sapiens OX=9606 GN=UQCRC2 PE=1 SV=3;tr|H3BRG4|H3BRG4_HUMAN Cytochrome b-c1 complex subunit 2, mitochondrial OS=Homo sapiens OX=9606 GN=UQCRC2 PE=1 SV=1;tr|H3BSJ9|H3BSJ9_HUMAN Cyt",21,21,58.9,453
ITGA6,1.5668111427,0.000278835025293894,1,P23229;C9JXX7;H7BZ97,P23229,13;2;2,13;2;2,13;2;2,Integrin alpha-6;Integrin alpha-6 heavy chain;Integrin alpha-6 light chain;Processed integrin alpha-6,ITGA6,sp|P23229|ITA6_HUMAN Integrin alpha-6 OS=Homo sapiens OX=9606 GN=ITGA6 PE=1 SV=5,13,13,15.3,1130
SFPQ,-0.2083404886,0.163109731349909,0,P23246;H0Y9K7;H0Y9U2,P23246,40;10;3,40;10;3,38;10;3,"Splicing factor, proline- and glutamine-rich",SFPQ,"sp|P23246|SFPQ_HUMAN Splicing factor, proline- and glutamine-rich OS=Homo sapiens OX=9606 GN=SFPQ PE=1 SV=2",40,38,47.4,707
TUBG1;TUBG2,-0.0031156758,0.987981313602162,0,P23258;Q9NRH3;K7EIS0;K7EKE5,P23258;Q9NRH3;K7EIS0;K7EKE5,4;4;3;2,4;4;3;2,4;4;3;2,Tubulin gamma-1 chain;Tubulin gamma-2 chain;Tubulin gamma chain,TUBG1;TUBG2,sp|P23258|TBG1_HUMAN Tubulin gamma-1 chain OS=Homo sapiens OX=9606 GN=TUBG1 PE=1 SV=2;sp|Q9NRH3|TBG2_HUMAN Tubulin gamma-2 chain OS=Homo sapiens OX=9606 GN=TUBG2 PE=2 SV=1;tr|K7EIS0|K7EIS0_HUMAN Tubulin gamma chain (Fragment) OS=Homo sapiens OX=9606 GN=TUB,4,4,15.3,451
PPIB,0.0856757297,0.489415646325658,0,P23284,P23284,26,26,26,Peptidyl-prolyl cis-trans isomerase B,PPIB,sp|P23284|PPIB_HUMAN Peptidyl-prolyl cis-trans isomerase B OS=Homo sapiens OX=9606 GN=PPIB PE=1 SV=2,26,26,71.8,216
ME2,-0.1360047788,0.306921627874761,0,P23368;A0A1W2PQT3;A0A1W2PPH1;A0A1W2PQY8;A0A1W2PR68;A0A1W2PQH3;A0A1W2PQF8;A0A1W2PQ37;A0A1W2PRS2;A0A1W2PRY9;A0A1W2PQH4;A0A1W2PPY2;A0A1W2PRH1,P23368;A0A1W2PQT3;A0A1W2PPH1;A0A1W2PQY8;A0A1W2PR68;A0A1W2PQH3;A0A1W2PQF8;A0A1W2PQ37,16;15;15;15;14;14;13;11;4;4;4;2;2,16;15;15;15;14;14;13;11;4;4;4;2;2,16;15;15;15;14;14;13;11;4;4;4;2;2,"NAD-dependent malic enzyme, mitochondrial",ME2,"sp|P23368|MAOM_HUMAN NAD-dependent malic enzyme, mitochondrial OS=Homo sapiens OX=9606 GN=ME2 PE=1 SV=1;tr|A0A1W2PQT3|A0A1W2PQT3_HUMAN Malic enzyme OS=Homo sapiens OX=9606 GN=ME2 PE=1 SV=1;tr|A0A1W2PPH1|A0A1W2PPH1_HUMAN Malic enzyme OS=Homo sapiens OX=9606",16,16,39.7,584
WARS,0.126125367,0.332383888875854,0,P23381;G3V277;G3V3H8;G3V3Y5;G3V423;G3V5U1;G3V456;H0YJP3;G3V5W1;G3V3S7;G3V3X0;G3V3P2;G3V227;G3V2Y7,P23381,9;4;4;4;3;3;3;3;1;1;1;1;1;1,9;4;4;4;3;3;3;3;1;1;1;1;1;1,9;4;4;4;3;3;3;3;1;1;1;1;1;1,"Tryptophan--tRNA ligase, cytoplasmic;T1-TrpRS;T2-TrpRS",WARS,"sp|P23381|SYWC_HUMAN Tryptophan--tRNA ligase, cytoplasmic OS=Homo sapiens OX=9606 GN=WARS1 PE=1 SV=2",9,9,33.3,471
RPS3,0.2377787653,0.121380207022296,0,P23396;E9PL09;E9PPU1;F2Z2S8;H0YCJ7;H0YEU2;H0YF32;E9PQ96;E9PJH4;E9PK82;E9PSF4;E9PQX2;H0YES8,P23396;E9PL09;E9PPU1;F2Z2S8;H0YCJ7,37;32;25;23;21;18;16;15;15;15;10;7;1,37;32;25;23;21;18;16;15;15;15;10;7;1,37;32;25;23;21;18;16;15;15;15;10;7;1,40S ribosomal protein S3,RPS3,sp|P23396|RS3_HUMAN 40S ribosomal protein S3 OS=Homo sapiens OX=9606 GN=RPS3 PE=1 SV=2;tr|E9PL09|E9PL09_HUMAN 40S ribosomal protein S3 OS=Homo sapiens OX=9606 GN=RPS3 PE=1 SV=1;tr|E9PPU1|E9PPU1_HUMAN 40S ribosomal protein S3 OS=Homo sapiens OX=9606 GN=RPS3,37,37,92.2,243
AHCY,0.0366155006,0.780822479203918,0,P23526,P23526,24,24,24,Adenosylhomocysteinase,AHCY,sp|P23526|SAHH_HUMAN Adenosylhomocysteinase OS=Homo sapiens OX=9606 GN=AHCY PE=1 SV=4,24,24,49.5,432
CFL1,0.0106196996,0.942046957347666,0,P23528;E9PP50;E9PK25;G3V1A4;E9PQB7;E9PS23;E9PLJ3,P23528;E9PP50;E9PK25;G3V1A4;E9PQB7,21;19;18;17;13;9;7,21;19;18;17;13;9;7,12;10;9;9;5;8;5,Cofilin-1,CFL1,sp|P23528|COF1_HUMAN Cofilin-1 OS=Homo sapiens OX=9606 GN=CFL1 PE=1 SV=3;tr|E9PP50|E9PP50_HUMAN Cofilin-1 (Fragment) OS=Homo sapiens OX=9606 GN=CFL1 PE=1 SV=8;tr|E9PK25|E9PK25_HUMAN Cofilin-1 OS=Homo sapiens OX=9606 GN=CFL1 PE=1 SV=1;tr|G3V1A4|G3V1A4_HUMAN,21,12,91.6,166
DTYMK,-0.2115828637,0.123178914670173,0,P23919;G5E9E9;H7C3A4;H7BZ20;H7C312,P23919;G5E9E9,5;4;2;2;1,5;4;2;2;1,5;4;2;2;1,Thymidylate kinase,DTYMK,"sp|P23919|KTHY_HUMAN Thymidylate kinase OS=Homo sapiens OX=9606 GN=DTYMK PE=1 SV=4;tr|G5E9E9|G5E9E9_HUMAN Deoxythymidylate kinase (Thymidylate kinase), isoform CRA_d OS=Homo sapiens OX=9606 GN=DTYMK PE=1 SV=1",5,5,20.8,212
RRM1,0.0921071698,0.653636429727209,0,P23921;E9PL69;E9PP77;H0YCY7,P23921;E9PL69,7;5;1;1,7;5;1;1,7;5;1;1,Ribonucleoside-diphosphate reductase large subunit,RRM1,sp|P23921|RIR1_HUMAN Ribonucleoside-diphosphate reductase large subunit OS=Homo sapiens OX=9606 GN=RRM1 PE=1 SV=1;tr|E9PL69|E9PL69_HUMAN Ribonucleoside-diphosphate reductase large subunit OS=Homo sapiens OX=9606 GN=RRM1 PE=1 SV=1,7,7,14.9,792
EEF1B2,0.1376691929,0.521782423871679,0,P24534;F2Z2G2;C9JZW3;F8WF65,P24534,10;3;3;2,9;3;3;2,9;3;3;2,Elongation factor 1-beta,EEF1B2,sp|P24534|EF1B_HUMAN Elongation factor 1-beta OS=Homo sapiens OX=9606 GN=EEF1B2 PE=1 SV=3,10,9,48.4,225
ATP5F1,-0.1855722564,0.16951422106448,0,P24539;Q5QNZ2,P24539;Q5QNZ2,10;9,10;9,10;9,"ATP synthase F(0) complex subunit B1, mitochondrial",ATP5F1,"sp|P24539|AT5F1_HUMAN ATP synthase F(0) complex subunit B1, mitochondrial OS=Homo sapiens OX=9606 GN=ATP5PB PE=1 SV=2;tr|Q5QNZ2|Q5QNZ2_HUMAN ATP synthase F(0) complex subunit B1, mitochondrial OS=Homo sapiens OX=9606 GN=ATP5PB PE=1 SV=1",10,10,46.1,256
ACAT1,0.0377819702,0.805817761043938,0,P24752;A0A5F9ZHL1;A0A5F9ZHJ7;A0A5F9ZHJ0;A0A5F9ZHD4;A0A5F9ZI66;A0A5F9ZHH9;H0YEL7;A0A5F9ZHL7;E9PRQ6,P24752;A0A5F9ZHL1;A0A5F9ZHJ7;A0A5F9ZHJ0;A0A5F9ZHD4;A0A5F9ZI66,20;18;17;15;13;13;9;7;5;5,20;18;17;15;13;13;9;7;5;5,20;18;17;15;13;13;9;7;5;5,"Acetyl-CoA acetyltransferase, mitochondrial",ACAT1,"sp|P24752|THIL_HUMAN Acetyl-CoA acetyltransferase, mitochondrial OS=Homo sapiens OX=9606 GN=ACAT1 PE=1 SV=1;tr|A0A5F9ZHL1|A0A5F9ZHL1_HUMAN Acetyl-CoA acetyltransferase, mitochondrial OS=Homo sapiens OX=9606 GN=ACAT1 PE=1 SV=1;tr|A0A5F9ZHJ7|A0A5F9ZHJ7_HUMAN",20,20,57.6,427
MCM3,-0.5102613827,0.0139775261376822,0,P25205;J3KQ69;A0A499FHX9;Q7Z6P5,P25205;J3KQ69;A0A499FHX9,36;28;28;5,36;28;28;5,36;28;28;5,DNA replication licensing factor MCM3,MCM3,sp|P25205|MCM3_HUMAN DNA replication licensing factor MCM3 OS=Homo sapiens OX=9606 GN=MCM3 PE=1 SV=3;tr|J3KQ69|J3KQ69_HUMAN DNA replication licensing factor MCM3 OS=Homo sapiens OX=9606 GN=MCM3 PE=1 SV=3;tr|A0A499FHX9|A0A499FHX9_HUMAN DNA replication licen,36,36,46.7,808
RPS12,0.0801276618,0.631439847354045,0,P25398,P25398,15,15,15,40S ribosomal protein S12,RPS12,sp|P25398|RS12_HUMAN 40S ribosomal protein S12 OS=Homo sapiens OX=9606 GN=RPS12 PE=1 SV=3,15,15,84.1,132
DNAJB1,0.0765590428,0.646365111531001,0,P25685;M0R080;M0QYT3;M0QXK0;M0R128;A0A1B0GX60;M0R1D6;M0QZD0,P25685;M0R080,7;4;2;2;1;1;1;1,7;4;2;2;1;1;1;1,7;4;2;2;1;1;1;1,DnaJ homolog subfamily B member 1,DNAJB1,sp|P25685|DNJB1_HUMAN DnaJ homolog subfamily B member 1 OS=Homo sapiens OX=9606 GN=DNAJB1 PE=1 SV=4;tr|M0R080|M0R080_HUMAN DnaJ homolog subfamily B member 1 (Fragment) OS=Homo sapiens OX=9606 GN=DNAJB1 PE=1 SV=1,7,7,25.3,340
ATP5A1,0.0229755011,0.852173888158279,0,P25705;K7EK77;K7ENJ4;K7ERX7;K7EJP1;K7EQH4;K7ESA0,P25705;K7EK77,51;28;21;20;16;10;2,51;28;21;20;16;10;2,51;28;21;20;16;10;2,"ATP synthase subunit alpha, mitochondrial",ATP5A1,"sp|P25705|ATPA_HUMAN ATP synthase subunit alpha, mitochondrial OS=Homo sapiens OX=9606 GN=ATP5F1A PE=1 SV=1;tr|K7EK77|K7EK77_HUMAN ATP synthase subunit alpha, mitochondrial (Fragment) OS=Homo sapiens OX=9606 GN=ATP5F1A PE=1 SV=1",51,51,66.7,553
PSMA1,0.1569709217,0.22509989782477,0,P25786;F5GX11;B4DEV8,P25786;F5GX11;B4DEV8,19;15;10,19;15;10,19;15;10,Proteasome subunit alpha type-1;Proteasome subunit alpha type,PSMA1,sp|P25786|PSA1_HUMAN Proteasome subunit alpha type-1 OS=Homo sapiens OX=9606 GN=PSMA1 PE=1 SV=1;tr|F5GX11|F5GX11_HUMAN Proteasome endopeptidase complex OS=Homo sapiens OX=9606 GN=PSMA1 PE=1 SV=1;tr|B4DEV8|B4DEV8_HUMAN Proteasome subunit alpha type OS=Homo ,19,19,87.5,263
PSMA3,-0.1441712871,0.403830374516213,0,P25788;G3V4X5;G3V3W4;G3V5N4;H0YJ03,P25788,13;6;2;2;1,13;6;2;2;1,13;6;2;2;1,Proteasome subunit alpha type-3,PSMA3,sp|P25788|PSA3_HUMAN Proteasome subunit alpha type-3 OS=Homo sapiens OX=9606 GN=PSMA3 PE=1 SV=2,13,13,58.8,255
ITGA3,0.376139554,0.0542187891999365,0,P26006;D6R9X8;K7EMU3;H0YA32;H0YA49,P26006,15;5;3;2;1,15;5;3;2;1,15;5;3;2;1,Integrin alpha-3;Integrin alpha-3 heavy chain;Integrin alpha-3 light chain,ITGA3,sp|P26006|ITA3_HUMAN Integrin alpha-3 OS=Homo sapiens OX=9606 GN=ITGA3 PE=1 SV=5,15,15,18.6,1051
MSN,0.2283669078,0.112088943595288,0,P26038;V9GZ54,P26038,52;10,52;10,36;7,Moesin,MSN,sp|P26038|MOES_HUMAN Moesin OS=Homo sapiens OX=9606 GN=MSN PE=1 SV=3,52,36,75.6,577
DDX6,-0.0396770532,0.794229723228028,0,P26196;Q8IV96,P26196,14;5,14;5,14;5,Probable ATP-dependent RNA helicase DDX6,DDX6,sp|P26196|DDX6_HUMAN Probable ATP-dependent RNA helicase DDX6 OS=Homo sapiens OX=9606 GN=DDX6 PE=1 SV=2,14,14,45.5,483
RPL13,0.3614109246,0.037193281150552,0,P26373;J3QSB4;H3BTH3;H3BUK8;J3KS98,P26373;J3QSB4,19;14;6;2;2,19;14;6;2;2,19;14;6;2;2,60S ribosomal protein L13,RPL13,sp|P26373|RL13_HUMAN 60S ribosomal protein L13 OS=Homo sapiens OX=9606 GN=RPL13 PE=1 SV=4;tr|J3QSB4|J3QSB4_HUMAN 60S ribosomal protein L13 (Fragment) OS=Homo sapiens OX=9606 GN=RPL13 PE=1 SV=1,19,19,61.1,211
HMGB2,0.0678384266,0.592272108138125,0,P26583;D6R9A6,P26583;D6R9A6,15;10,10;7,10;7,High mobility group protein B2,HMGB2,sp|P26583|HMGB2_HUMAN High mobility group protein B2 OS=Homo sapiens OX=9606 GN=HMGB2 PE=1 SV=2;tr|D6R9A6|D6R9A6_HUMAN High mobility group protein B2 (Fragment) OS=Homo sapiens OX=9606 GN=HMGB2 PE=1 SV=1,15,10,45.9,209
PTBP1,-0.0606067951,0.645848692231329,0,P26599;A0A0U1RRM4;A6NLN1;A0A0D9SF20;K7EKJ7;K7EK45;K7ES59;A0A087WUW5;K7ELW5;A0A087WU68,P26599;A0A0U1RRM4;A6NLN1;A0A0D9SF20,31;30;29;16;11;10;9;5;5;5,31;30;29;16;11;10;9;5;5;5,27;26;25;16;9;8;7;5;3;3,Polypyrimidine tract-binding protein 1,PTBP1,sp|P26599|PTBP1_HUMAN Polypyrimidine tract-binding protein 1 OS=Homo sapiens OX=9606 GN=PTBP1 PE=1 SV=1;tr|A0A0U1RRM4|A0A0U1RRM4_HUMAN Polypyrimidine tract-binding protein 1 OS=Homo sapiens OX=9606 GN=PTBP1 PE=1 SV=1;tr|A6NLN1|A6NLN1_HUMAN Polypyrimidine t,31,27,65,531
TARS,0.2752383368,0.0897834117034879,0,P26639;D6R9F8;A2RTX5;D6RCA5;D6RDJ6;B7ZLP8;D6RJ97;D6RHV7;D6RCS6,P26639,30;4;3;3;3;2;1;1;1,30;4;3;3;3;2;1;1;1,29;4;3;3;3;2;1;1;1,"Threonine--tRNA ligase, cytoplasmic",TARS,"sp|P26639|SYTC_HUMAN Threonine--tRNA ligase 1, cytoplasmic OS=Homo sapiens OX=9606 GN=TARS1 PE=1 SV=3",30,29,45.6,723
VARS,0.361639297,0.0320911775661532,0,P26640;A0A140T936;A0A140T954;A2ABF4;A0A0G2JJT9;A0A140T904;H0Y426,P26640;A0A140T936,32;29;8;5;5;2;2,32;29;8;5;5;2;2,32;29;8;5;5;2;2,Valine--tRNA ligase,VARS,sp|P26640|SYVC_HUMAN Valine--tRNA ligase OS=Homo sapiens OX=9606 GN=VARS1 PE=1 SV=4;tr|A0A140T936|A0A140T936_HUMAN Valine--tRNA ligase (Fragment) OS=Homo sapiens OX=9606 GN=VARS1 PE=1 SV=1,32,32,35.7,1264
EEF1G,0.2152837909,0.116167028704166,0,P26641,P26641,29,29,29,Elongation factor 1-gamma,EEF1G,sp|P26641|EF1G_HUMAN Elongation factor 1-gamma OS=Homo sapiens OX=9606 GN=EEF1G PE=1 SV=3,29,29,59.3,437
STOM,0.3782746919,0.0986601460449859,0,P27105;F8VSL7,P27105,3;1,3;1,3;1,Erythrocyte band 7 integral membrane protein,STOM,sp|P27105|STOM_HUMAN Erythrocyte band 7 integral membrane protein OS=Homo sapiens OX=9606 GN=STOM PE=1 SV=3,3,3,13.5,288
AK4,0.2333248187,0.175693179814415,0,P27144;F8VS11,P27144;F8VS11,8;5,8;5,8;5,"Adenylate kinase 4, mitochondrial",AK4,"sp|P27144|KAD4_HUMAN Adenylate kinase 4, mitochondrial OS=Homo sapiens OX=9606 GN=AK4 PE=1 SV=1;tr|F8VS11|F8VS11_HUMAN Adenylate kinase 4, mitochondrial OS=Homo sapiens OX=9606 GN=AK4 PE=1 SV=1",8,8,35.4,223
YWHAQ,0.0813867708,0.527337926713955,0,P27348;E9PG15,P27348;E9PG15,25;19,19;16,19;16,14-3-3 protein theta,YWHAQ,sp|P27348|1433T_HUMAN 14-3-3 protein theta OS=Homo sapiens OX=9606 GN=YWHAQ PE=1 SV=1;tr|E9PG15|E9PG15_HUMAN 14-3-3 protein theta (Fragment) OS=Homo sapiens OX=9606 GN=YWHAQ PE=1 SV=1,25,19,61.6,245
RPL10,0.4366856821,0.0261068109406654,0,P27635;X1WI28;F8W7C6;A0A087WV22;H7C123;H7C2C5;Q96L21;B8A6G2;A6QRI9;H7C2U2,P27635;X1WI28;F8W7C6;A0A087WV22,23;20;19;19;10;10;9;7;7;1,23;20;19;19;10;10;9;7;7;1,23;20;19;19;10;10;9;7;7;1,60S ribosomal protein L10,RPL10,sp|P27635|RL10_HUMAN 60S ribosomal protein L10 OS=Homo sapiens OX=9606 GN=RPL10 PE=1 SV=4;tr|X1WI28|X1WI28_HUMAN 60S ribosomal protein L10 (Fragment) OS=Homo sapiens OX=9606 GN=RPL10 PE=1 SV=7;tr|F8W7C6|F8W7C6_HUMAN 60S ribosomal protein L10 OS=Homo sapien,23,23,74.8,214
RPA1,0.0686691601,0.705658647691099,0,P27694;I3L4R8;I3L524;I3L2M5,P27694,11;5;2;2,11;5;2;2,11;5;2;2,"Replication protein A 70 kDa DNA-binding subunit;Replication protein A 70 kDa DNA-binding subunit, N-terminally processed",RPA1,sp|P27694|RFA1_HUMAN Replication protein A 70 kDa DNA-binding subunit OS=Homo sapiens OX=9606 GN=RPA1 PE=1 SV=2,11,11,28.2,616
APEX1,0.0702555141,0.620878599746264,0,P27695;G3V5Q1;G3V3M6;H7C4A8;A0A0C4DGK8;G3V3C7;G3V5M0;G3V359;G3V5D9,P27695;G3V5Q1;G3V3M6;H7C4A8,16;12;12;9;7;7;6;6;4,16;12;12;9;7;7;6;6;4,16;12;12;9;7;7;6;6;4,"DNA-(apurinic or apyrimidinic site) lyase;DNA-(apurinic or apyrimidinic site) lyase, mitochondrial",APEX1,sp|P27695|APEX1_HUMAN DNA-(apurinic or apyrimidinic site) endonuclease OS=Homo sapiens OX=9606 GN=APEX1 PE=1 SV=2;tr|G3V5Q1|G3V5Q1_HUMAN DNA-(apurinic or apyrimidinic site) lyase (Fragment) OS=Homo sapiens OX=9606 GN=APEX1 PE=1 SV=1;tr|G3V3M6|G3V3M6_HUMAN ,16,16,62.6,318
CALR,-0.3163274705,0.0488057381469362,0,P27797;K7EJB9;K7EL50,P27797;K7EJB9,22;15;3,22;15;3,22;15;3,Calreticulin,CALR,sp|P27797|CALR_HUMAN Calreticulin OS=Homo sapiens OX=9606 GN=CALR PE=1 SV=1;tr|K7EJB9|K7EJB9_HUMAN Calreticulin (Fragment) OS=Homo sapiens OX=9606 GN=CALR PE=1 SV=1,22,22,64.7,417
CANX,0.0902257164,0.485674953638687,0,P27824;D6RDP7;H0Y9Q7;D6RAU8;D6RB85;D6RAQ8;D6RFL1;D6RGY2;H0Y9H1;D6RHJ3;D6RD16,P27824;D6RDP7;H0Y9Q7,17;9;9;8;8;6;5;5;3;2;2,17;9;9;8;8;6;5;5;3;2;2,17;9;9;8;8;6;5;5;3;2;2,Calnexin,CANX,sp|P27824|CALX_HUMAN Calnexin OS=Homo sapiens OX=9606 GN=CANX PE=1 SV=2;tr|D6RDP7|D6RDP7_HUMAN Calnexin (Fragment) OS=Homo sapiens OX=9606 GN=CANX PE=1 SV=1;tr|H0Y9Q7|H0Y9Q7_HUMAN Calnexin (Fragment) OS=Homo sapiens OX=9606 GN=CANX PE=1 SV=1,17,17,28.5,592
PSMA5,-0.4712491545,0.0427754925299478,0,P28066,P28066,13,13,13,Proteasome subunit alpha type-5,PSMA5,sp|P28066|PSA5_HUMAN Proteasome subunit alpha type-5 OS=Homo sapiens OX=9606 GN=PSMA5 PE=1 SV=3,13,13,63.1,241
PSMB4,0.1092213067,0.416639603117573,0,P28070,P28070,9,9,9,Proteasome subunit beta type-4,PSMB4,sp|P28070|PSB4_HUMAN Proteasome subunit beta type-4 OS=Homo sapiens OX=9606 GN=PSMB4 PE=1 SV=4,9,9,44.7,264
PSMB6,0.2729838354,0.0773982550741336,0,P28072;A0A087X2I4;I3L3X7,P28072,9;4;3,9;4;3,9;4;3,Proteasome subunit beta type-6,PSMB6,sp|P28072|PSB6_HUMAN Proteasome subunit beta type-6 OS=Homo sapiens OX=9606 GN=PSMB6 PE=1 SV=4,9,9,46.9,239
PSMB5,0.4149208674,0.0300014120567912,0,P28074;H0YJM8,P28074,11;4,11;4,11;4,Proteasome subunit beta type-5,PSMB5,sp|P28074|PSB5_HUMAN Proteasome subunit beta type-5 OS=Homo sapiens OX=9606 GN=PSMB5 PE=1 SV=3,11,11,44.9,263
NDUFS1,0.3116044504,0.13160457749021,0,P28331;B4DJ81;C9JPQ5;F8WDL5,P28331;B4DJ81,17;14;3;2,17;14;3;2,17;14;3;2,"NADH-ubiquinone oxidoreductase 75 kDa subunit, mitochondrial",NDUFS1,"sp|P28331|NDUS1_HUMAN NADH-ubiquinone oxidoreductase 75 kDa subunit, mitochondrial OS=Homo sapiens OX=9606 GN=NDUFS1 PE=1 SV=3;tr|B4DJ81|B4DJ81_HUMAN NADH-ubiquinone oxidoreductase 75 kDa subunit, mitochondrial OS=Homo sapiens OX=9606 GN=NDUFS1 PE=1 SV=1",17,17,32,727
MAPK1,-0.0766063492,0.60358494246454,0,P28482,P28482,11,11,9,Mitogen-activated protein kinase 1,MAPK1,sp|P28482|MK01_HUMAN Mitogen-activated protein kinase 1 OS=Homo sapiens OX=9606 GN=MAPK1 PE=1 SV=3,11,9,39.4,360
LAP3,-0.0653474713,0.698777477492965,0,P28838;H0Y9Q1;H0Y983,P28838,19;9;1,19;9;1,19;9;1,Cytosol aminopeptidase,LAP3,sp|P28838|AMPL_HUMAN Cytosol aminopeptidase OS=Homo sapiens OX=9606 GN=LAP3 PE=1 SV=3,19,19,50.3,519
EPHA2,-0.4979556636,0.032301478897135,0,P29317,P29317,13,13,12,Ephrin type-A receptor 2,EPHA2,sp|P29317|EPHA2_HUMAN Ephrin type-A receptor 2 OS=Homo sapiens OX=9606 GN=EPHA2 PE=1 SV=2,13,12,15.4,976
TKT,-0.0682323519,0.616922967738265,0,P29401;A0A0B4J1R6;E9PFF2;F8W888;F8WAX4,P29401;A0A0B4J1R6,41;34;20;6;2,41;34;20;6;2,41;34;20;6;2,Transketolase,TKT,sp|P29401|TKT_HUMAN Transketolase OS=Homo sapiens OX=9606 GN=TKT PE=1 SV=3;tr|A0A0B4J1R6|A0A0B4J1R6_HUMAN Transketolase OS=Homo sapiens OX=9606 GN=TKT PE=1 SV=1,41,41,78.8,623
ERP29,-0.1767963078,0.269630805761343,0,P30040;F8VY02;F8W1G0,P30040;F8VY02,18;13;3,18;13;3,18;13;3,Endoplasmic reticulum resident protein 29,ERP29,sp|P30040|ERP29_HUMAN Endoplasmic reticulum resident protein 29 OS=Homo sapiens OX=9606 GN=ERP29 PE=1 SV=4;tr|F8VY02|F8VY02_HUMAN Endoplasmic reticulum resident protein 29 OS=Homo sapiens OX=9606 GN=ERP29 PE=1 SV=1,18,18,59,261
PRDX6,0.0784146394,0.577292619320843,0,P30041,P30041,21,21,21,Peroxiredoxin-6,PRDX6,sp|P30041|PRDX6_HUMAN Peroxiredoxin-6 OS=Homo sapiens OX=9606 GN=PRDX6 PE=1 SV=3,21,21,87.1,224
BLVRB,0.08409086,0.552854619423524,0,P30043;M0R192;A0A2R8YEP4;A0A2R8Y7Y9;M0QZL1,P30043;M0R192;A0A2R8YEP4,5;4;4;1;1,5;4;4;1;1,5;4;4;1;1,Flavin reductase (NADPH),BLVRB,sp|P30043|BLVRB_HUMAN Flavin reductase (NADPH) OS=Homo sapiens OX=9606 GN=BLVRB PE=1 SV=3;tr|M0R192|M0R192_HUMAN Flavin reductase (NADPH) OS=Homo sapiens OX=9606 GN=BLVRB PE=1 SV=1;tr|A0A2R8YEP4|A0A2R8YEP4_HUMAN Flavin reductase (NADPH) OS=Homo sapiens OX=,5,5,27.2,206
PRDX5,-0.2018665419,0.256752305743528,0,P30044,P30044,13,13,13,"Peroxiredoxin-5, mitochondrial",PRDX5,"sp|P30044|PRDX5_HUMAN Peroxiredoxin-5, mitochondrial OS=Homo sapiens OX=9606 GN=PRDX5 PE=1 SV=4",13,13,46.3,214
PRDX3,0.0307523791,0.832307625724025,0,P30048,P30048,16,16,16,"Thioredoxin-dependent peroxide reductase, mitochondrial",PRDX3,"sp|P30048|PRDX3_HUMAN Thioredoxin-dependent peroxide reductase, mitochondrial OS=Homo sapiens OX=9606 GN=PRDX3 PE=1 SV=3",16,16,46.9,256
ATP5D,-0.2071771643,0.303085007449124,0,P30049,P30049,4,4,4,"ATP synthase subunit delta, mitochondrial",ATP5D,"sp|P30049|ATPD_HUMAN ATP synthase subunit delta, mitochondrial OS=Homo sapiens OX=9606 GN=ATP5F1D PE=1 SV=2",4,4,39.3,168
RPL12,0.3865825203,0.0398544606947277,0,P30050,P30050,12,12,12,60S ribosomal protein L12,RPL12,sp|P30050|RL12_HUMAN 60S ribosomal protein L12 OS=Homo sapiens OX=9606 GN=RPL12 PE=1 SV=1,12,12,72.7,165
ECHS1,-0.0349798083,0.840181440187057,0,P30084,P30084,17,17,17,"Enoyl-CoA hydratase, mitochondrial",ECHS1,"sp|P30084|ECHM_HUMAN Enoyl-CoA hydratase, mitochondrial OS=Homo sapiens OX=9606 GN=ECHS1 PE=1 SV=4",17,17,62.1,290
PEBP1,0.0708197117,0.55818031917961,0,P30086,P30086,11,11,11,Phosphatidylethanolamine-binding protein 1;Hippocampal cholinergic neurostimulating peptide,PEBP1,sp|P30086|PEBP1_HUMAN Phosphatidylethanolamine-binding protein 1 OS=Homo sapiens OX=9606 GN=PEBP1 PE=1 SV=3,11,11,83.4,187
PDIA3,-0.0943084502,0.51629021152238,0,P30101,P30101,51,51,42,Protein disulfide-isomerase A3,PDIA3,sp|P30101|PDIA3_HUMAN Protein disulfide-isomerase A3 OS=Homo sapiens OX=9606 GN=PDIA3 PE=1 SV=4,51,42,75,505
PPP2R1A,-0.1939751746,0.176230383709812,0,P30153;B3KQV6;C9J9C1;E9PH38;E9PPI5;E9PNM7;E9PHZ6,P30153;B3KQV6;C9J9C1,26;16;15;6;3;3;3,26;16;15;6;3;3;3,19;13;11;6;0;0;0,Serine/threonine-protein phosphatase 2A 65 kDa regulatory subunit A alpha isoform,PPP2R1A,sp|P30153|2AAA_HUMAN Serine/threonine-protein phosphatase 2A 65 kDa regulatory subunit A alpha isoform OS=Homo sapiens OX=9606 GN=PPP2R1A PE=1 SV=4;tr|B3KQV6|B3KQV6_HUMAN Serine/threonine-protein phosphatase 2A 65 kDa regulatory subunit A alpha isoform OS=,26,19,48.4,589
PPP2R1B,-0.1457743859,0.43261772297742,0,P30154;H0YDG7,P30154,11;5,4;2,4;2,Serine/threonine-protein phosphatase 2A 65 kDa regulatory subunit A beta isoform,PPP2R1B,sp|P30154|2AAB_HUMAN Serine/threonine-protein phosphatase 2A 65 kDa regulatory subunit A beta isoform OS=Homo sapiens OX=9606 GN=PPP2R1B PE=1 SV=3,11,4,21.1,601
PPIF,0.3081660938,0.116232383982693,0,P30405;R4GN99;H0Y548,P30405;R4GN99;H0Y548,13;9;9,13;9;9,13;9;9,"Peptidyl-prolyl cis-trans isomerase F, mitochondrial;Peptidyl-prolyl cis-trans isomerase",PPIF,"sp|P30405|PPIF_HUMAN Peptidyl-prolyl cis-trans isomerase F, mitochondrial OS=Homo sapiens OX=9606 GN=PPIF PE=1 SV=1;tr|R4GN99|R4GN99_HUMAN Peptidyl-prolyl cis-trans isomerase OS=Homo sapiens OX=9606 GN=PPIF PE=1 SV=1;tr|H0Y548|H0Y548_HUMAN Peptidyl-prolyl ",13,13,74.4,207
NMT1,-0.0183440256,0.895602490526165,0,P30419;K7EN82;B7Z8J4;O60551;Q5VUC6,P30419,9;2;2;1;1,9;2;2;1;1,9;2;2;1;1,Glycylpeptide N-tetradecanoyltransferase 1,NMT1,sp|P30419|NMT1_HUMAN Glycylpeptide N-tetradecanoyltransferase 1 OS=Homo sapiens OX=9606 GN=NMT1 PE=1 SV=2,9,9,23.6,496
ALDH1B1,-0.1042341608,0.40298900746174,0,P30837;A0A0U1RQK9;P00352;P47895;O94788;H0Y2X5;H0YMG7,P30837,21;2;1;1;1;1;1,21;2;1;1;1;1;1,20;2;0;0;0;0;0,"Aldehyde dehydrogenase X, mitochondrial",ALDH1B1,"sp|P30837|AL1B1_HUMAN Aldehyde dehydrogenase X, mitochondrial OS=Homo sapiens OX=9606 GN=ALDH1B1 PE=1 SV=3",21,20,58.6,517
SDHA,-0.3717713046,0.0337272139874873,0,P31040;D6RFM5;A0A087X1I3;A0A494C1T6;H0Y8X1,P31040;D6RFM5;A0A087X1I3;A0A494C1T6,23;20;15;14;1,23;20;15;14;1,23;20;15;14;1,"Succinate dehydrogenase [ubiquinone] flavoprotein subunit, mitochondrial",SDHA,"sp|P31040|SDHA_HUMAN Succinate dehydrogenase [ubiquinone] flavoprotein subunit, mitochondrial OS=Homo sapiens OX=9606 GN=SDHA PE=1 SV=2;tr|D6RFM5|D6RFM5_HUMAN Succinate dehydrogenase [ubiquinone] flavoprotein subunit, mitochondrial OS=Homo sapiens OX=9606 ",23,23,49.1,664
