EBNA1BP2,-0.0096095402,0.962855981148724,0,Q99848;H7C2Q8,Q99848;H7C2Q8,6;6,6;6,6;6,Probable rRNA-processing protein EBP2,EBNA1BP2,"sp|Q99848|EBP2_HUMAN Probable rRNA-processing protein EBP2 OS=Homo sapiens OX=9606 GN=EBNA1BP2 PE=1 SV=2;tr|H7C2Q8|H7C2Q8_HUMAN EBNA1 binding protein 2, isoform CRA_d OS=Homo sapiens OX=9606 GN=EBNA1BP2 PE=1 SV=1",6,6,27.1,306
NSF,-0.2720127951,0.108239762611114,0,I3L0N3;P46459;I3L0L3;I3L2G1;K7EQD6;I3L338;I3L4Q9,I3L0N3;P46459,22;21;5;3;3;2;1,22;21;5;3;3;2;1,22;21;5;3;3;2;1,Vesicle-fusing ATPase,NSF,tr|I3L0N3|I3L0N3_HUMAN Vesicle-fusing ATPase OS=Homo sapiens OX=9606 GN=NSF PE=1 SV=1;sp|P46459|NSF_HUMAN Vesicle-fusing ATPase OS=Homo sapiens OX=9606 GN=NSF PE=1 SV=3,22,22,36,739
SLC25A11,0.1030844942,0.506058248199304,0,Q02978;I3L1P8,Q02978;I3L1P8,5;5,5;5,5;5,Mitochondrial 2-oxoglutarate/malate carrier protein,SLC25A11,sp|Q02978|M2OM_HUMAN Mitochondrial 2-oxoglutarate/malate carrier protein OS=Homo sapiens OX=9606 GN=SLC25A11 PE=1 SV=3;tr|I3L1P8|I3L1P8_HUMAN Mitochondrial 2-oxoglutarate/malate carrier protein (Fragment) OS=Homo sapiens OX=9606 GN=SLC25A11 PE=1 SV=1,5,5,19.7,314
EIF5A;EIF5AL1,0.1355095074,0.354314304258441,0,P63241;I3L397;I3L504;Q6IS14,P63241;I3L397;I3L504;Q6IS14,18;18;18;11,18;18;18;11,7;7;7;2,Eukaryotic translation initiation factor 5A-1;Eukaryotic translation initiation factor 5A;Eukaryotic translation initiation factor 5A-1-like,EIF5A;EIF5AL1,sp|P63241|IF5A1_HUMAN Eukaryotic translation initiation factor 5A-1 OS=Homo sapiens OX=9606 GN=EIF5A PE=1 SV=2;tr|I3L397|I3L397_HUMAN Eukaryotic translation initiation factor 5A (Fragment) OS=Homo sapiens OX=9606 GN=EIF5A PE=1 SV=8;tr|I3L504|I3L504_HUMAN E,18,7,76,154
NOMO2;NOMO3;NOMO1,-0.5960517824,0.215289534239885,0,Q5JPE7;P69849;J3KN36;Q15155;A0A0G2JN29;A0A087X117;A0A0G2JP90;A0A087WW46;A0A087WTD5;H3BPS9;H3BUC9,Q5JPE7;P69849;J3KN36;Q15155;A0A0G2JN29;A0A087X117;A0A0G2JP90;A0A087WW46,18;18;18;17;17;17;16;16;5;3;2,18;18;18;17;17;17;16;16;5;3;2,18;18;18;17;17;17;16;16;5;3;2,Nodal modulator 2;Nodal modulator 3;Nodal modulator 1,NOMO2;NOMO3;NOMO1,sp|Q5JPE7|NOMO2_HUMAN Nodal modulator 2 OS=Homo sapiens OX=9606 GN=NOMO2 PE=1 SV=1;sp|P69849|NOMO3_HUMAN Nodal modulator 3 OS=Homo sapiens OX=9606 GN=NOMO3 PE=1 SV=2;tr|J3KN36|J3KN36_HUMAN Nodal modulator 3 OS=Homo sapiens OX=9606 GN=NOMO3 PE=1 SV=1;sp|Q15,18,18,23.8,1267
SRSF2,-0.1719710367,0.211788600732268,0,Q01130;J3QL05;J3KP15;Q9BRL6,Q01130;J3QL05;J3KP15,7;7;7;1,7;7;7;1,7;7;7;1,Serine/arginine-rich splicing factor 2,SRSF2,sp|Q01130|SRSF2_HUMAN Serine/arginine-rich splicing factor 2 OS=Homo sapiens OX=9606 GN=SRSF2 PE=1 SV=4;tr|J3QL05|J3QL05_HUMAN Serine/arginine-rich-splicing factor 2 (Fragment) OS=Homo sapiens OX=9606 GN=SRSF2 PE=1 SV=1;tr|J3KP15|J3KP15_HUMAN Serine/argini,7,7,26.2,221
OLA1,0.3275846788,0.037472101179255,0,Q9NTK5;J3KQ32;C9JTK6;C9JCJ9,Q9NTK5;J3KQ32,12;12;4;3,12;12;4;3,12;12;4;3,Obg-like ATPase 1,OLA1,sp|Q9NTK5|OLA1_HUMAN Obg-like ATPase 1 OS=Homo sapiens OX=9606 GN=OLA1 PE=1 SV=2;tr|J3KQ32|J3KQ32_HUMAN Obg-like ATPase 1 OS=Homo sapiens OX=9606 GN=OLA1 PE=1 SV=1,12,12,42.9,396
PTRH2,-0.1436593105,0.280958803994256,0,Q9Y3E5;J3KQ48,Q9Y3E5;J3KQ48,7;7,7;7,7;7,"Peptidyl-tRNA hydrolase 2, mitochondrial",PTRH2,"sp|Q9Y3E5|PTH2_HUMAN Peptidyl-tRNA hydrolase 2, mitochondrial OS=Homo sapiens OX=9606 GN=PTRH2 PE=1 SV=1;tr|J3KQ48|J3KQ48_HUMAN Peptidyl-tRNA hydrolase 2, mitochondrial OS=Homo sapiens OX=9606 GN=PTRH2 PE=1 SV=1",7,7,54.2,179
SUMF2,-0.2915032232,0.103666564419126,0,Q8NBJ7;J3KQJ1;C9JL30;A8MXB9;A0A494C1B1;C9J660;H7C3B2;F8WA42;E9PBT8;J3QT17;F8WEX5;E9PG02;F8WEV7;F8WES7,Q8NBJ7;J3KQJ1;C9JL30;A8MXB9;A0A494C1B1;C9J660;H7C3B2;F8WA42;E9PBT8;J3QT17,8;8;7;7;7;7;6;6;5;4;3;3;2;2,8;8;7;7;7;7;6;6;5;4;3;3;2;2,8;8;7;7;7;7;6;6;5;4;3;3;2;2,Sulfatase-modifying factor 2,SUMF2,sp|Q8NBJ7|SUMF2_HUMAN Inactive C-alpha-formylglycine-generating enzyme 2 OS=Homo sapiens OX=9606 GN=SUMF2 PE=1 SV=2;tr|J3KQJ1|J3KQJ1_HUMAN Inactive C-alpha-formylglycine-generating enzyme 2 OS=Homo sapiens OX=9606 GN=SUMF2 PE=1 SV=1;tr|C9JL30|C9JL30_HUMAN ,8,8,32.9,301
APOL2,-0.4000894073,0.313877909074158,0,J3KQL8;Q9BQE5;E9PM95,J3KQL8;Q9BQE5,5;4;1,5;4;1,5;4;1,Apolipoprotein L2,APOL2,tr|J3KQL8|J3KQL8_HUMAN Apolipoprotein L2 OS=Homo sapiens OX=9606 GN=APOL2 PE=1 SV=2;sp|Q9BQE5|APOL2_HUMAN Apolipoprotein L2 OS=Homo sapiens OX=9606 GN=APOL2 PE=1 SV=1,5,5,17.6,449
RPL36AL;RPL36A;RPL36A-HNRNPH2,0.3209493698,0.0403840810314859,0,Q969Q0;P83881;J3KQN4;H0Y5B4;H7BZ11;R4GN19,Q969Q0;P83881;J3KQN4;H0Y5B4;H7BZ11,4;4;4;3;3;1,4;4;4;3;3;1,4;4;4;3;3;1,60S ribosomal protein L36a-like;60S ribosomal protein L36a,RPL36AL;RPL36A;RPL36A-HNRNPH2,sp|Q969Q0|RL36L_HUMAN 60S ribosomal protein L36a-like OS=Homo sapiens OX=9606 GN=RPL36AL PE=1 SV=3;sp|P83881|RL36A_HUMAN 60S ribosomal protein L36a OS=Homo sapiens OX=9606 GN=RPL36A PE=1 SV=2;tr|J3KQN4|J3KQN4_HUMAN 60S ribosomal protein L36a OS=Homo sapien,4,4,19.8,106
TBCD,-0.2404951903,0.124887440114018,0,Q9BTW9;J3KR97;A0A0J9YWI5;A0A0J9YVR1;A0A0J9YYG2;A0A0J9YVU1;I3L0V3;I3L163;I3L439;I3L120;A0A0J9YXU4,Q9BTW9;J3KR97;A0A0J9YWI5;A0A0J9YVR1,3;3;2;2;1;1;1;1;1;1;1,3;3;2;2;1;1;1;1;1;1;1,3;3;2;2;1;1;1;1;1;1;1,Tubulin-specific chaperone D,TBCD,sp|Q9BTW9|TBCD_HUMAN Tubulin-specific chaperone D OS=Homo sapiens OX=9606 GN=TBCD PE=1 SV=2;tr|J3KR97|J3KR97_HUMAN Tubulin-specific chaperone D OS=Homo sapiens OX=9606 GN=TBCD PE=1 SV=1;tr|A0A0J9YWI5|A0A0J9YWI5_HUMAN Tubulin-specific chaperone D (Fragment),3,3,3.2,1192
CBX1,-0.0951276274,0.67392824340613,0,P83916;J3KS05;B5MD17;K7ELA4;C9JWS9,P83916;J3KS05;B5MD17;K7ELA4;C9JWS9,9;9;8;7;5,8;8;7;6;5,8;8;7;6;5,Chromobox protein homolog 1,CBX1,sp|P83916|CBX1_HUMAN Chromobox protein homolog 1 OS=Homo sapiens OX=9606 GN=CBX1 PE=1 SV=1;tr|J3KS05|J3KS05_HUMAN Chromobox protein homolog 1 (Fragment) OS=Homo sapiens OX=9606 GN=CBX1 PE=1 SV=8;tr|B5MD17|B5MD17_HUMAN Chromobox protein homolog 1 (Fragment),9,8,57.8,185
DCXR,-0.0310812067,0.800907705448195,0,Q7Z4W1;J3KS22;J3KRZ4;J3QS36;J3QS45;J3KSZ5;J3QL34,Q7Z4W1;J3KS22;J3KRZ4;J3QS36,4;4;3;2;1;1;1,4;4;3;2;1;1;1,4;4;3;2;1;1;1,L-xylulose reductase,DCXR,sp|Q7Z4W1|DCXR_HUMAN L-xylulose reductase OS=Homo sapiens OX=9606 GN=DCXR PE=1 SV=2;tr|J3KS22|J3KS22_HUMAN L-xylulose reductase (Fragment) OS=Homo sapiens OX=9606 GN=DCXR PE=1 SV=8;tr|J3KRZ4|J3KRZ4_HUMAN L-xylulose reductase (Fragment) OS=Homo sapiens OX=9,4,4,12.3,244
NUP85,-0.9279284051,0.00522193058696281,0,Q9BW27;J3KT10;J3QL54;J3KSH3;J3KRC0;F5H0W7;J3QLD4;J3QLH0;J3QLV0;J3QS63;J3KS87;J3KTC7;J3QL91,Q9BW27;J3KT10;J3QL54,10;10;6;4;4;4;4;4;2;1;1;1;1,10;10;6;4;4;4;4;4;2;1;1;1;1,10;10;6;4;4;4;4;4;2;1;1;1;1,Nuclear pore complex protein Nup85,NUP85,sp|Q9BW27|NUP85_HUMAN Nuclear pore complex protein Nup85 OS=Homo sapiens OX=9606 GN=NUP85 PE=1 SV=1;tr|J3KT10|J3KT10_HUMAN Nuclear pore complex protein Nup85 OS=Homo sapiens OX=9606 GN=NUP85 PE=1 SV=1;tr|J3QL54|J3QL54_HUMAN Nuclear pore complex protein Nup,10,10,19.8,656
HN1,0.0718283025,0.684947991995848,0,Q9UK76;J3KT51;F2Z3M5;J3KSH8,Q9UK76;J3KT51,6;6;2;2,6;6;2;2,6;6;2;2,"Hematological and neurological expressed 1 protein;Hematological and neurological expressed 1 protein, N-terminally processed",HN1,sp|Q9UK76|JUPI1_HUMAN Jupiter microtubule associated homolog 1 OS=Homo sapiens OX=9606 GN=JPT1 PE=1 SV=3;tr|J3KT51|J3KT51_HUMAN Jupiter microtubule-associated homolog 1 OS=Homo sapiens OX=9606 GN=JPT1 PE=1 SV=1,6,6,50.6,154
DDX5,-0.4901314532,0.0155484733194538,0,P17844;J3KTA4;J3KRZ1;J3QSF1;J3QRQ7;J3KRX8;J3KTQ4;X6RLV5;J3QR02;J3QRN5;J3QLG9;J3QR62,P17844;J3KTA4,51;51;20;16;15;6;6;5;5;2;1;1,51;51;20;16;15;6;6;5;5;2;1;1,35;35;6;9;10;6;6;5;5;2;1;1,Probable ATP-dependent RNA helicase DDX5,DDX5,sp|P17844|DDX5_HUMAN Probable ATP-dependent RNA helicase DDX5 OS=Homo sapiens OX=9606 GN=DDX5 PE=1 SV=1;tr|J3KTA4|J3KTA4_HUMAN Probable ATP-dependent RNA helicase DDX5 OS=Homo sapiens OX=9606 GN=DDX5 PE=1 SV=1,51,35,59.4,614
RPL19,0.0076071395,0.963676489721766,0,P84098;J3QR09;J3KTE4,P84098;J3QR09;J3KTE4,19;19;19,19;19;19,19;19;19,60S ribosomal protein L19;Ribosomal protein L19,RPL19,sp|P84098|RL19_HUMAN 60S ribosomal protein L19 OS=Homo sapiens OX=9606 GN=RPL19 PE=1 SV=1;tr|J3QR09|J3QR09_HUMAN Ribosomal protein L19 OS=Homo sapiens OX=9606 GN=RPL19 PE=1 SV=1;tr|J3KTE4|J3KTE4_HUMAN Ribosomal protein L19 OS=Homo sapiens OX=9606 GN=RPL19 ,19,19,51.5,196
SRSF1,-0.1839176853,0.19857861444443,0,Q07955;J3KTL2;J3KSR8;J3QQV5;J3KSW7,Q07955;J3KTL2,20;20;8;7;7,20;20;8;7;7,19;19;8;7;7,Serine/arginine-rich splicing factor 1,SRSF1,sp|Q07955|SRSF1_HUMAN Serine/arginine-rich splicing factor 1 OS=Homo sapiens OX=9606 GN=SRSF1 PE=1 SV=2;tr|J3KTL2|J3KTL2_HUMAN Serine/arginine-rich-splicing factor 1 OS=Homo sapiens OX=9606 GN=SRSF1 PE=1 SV=1,20,19,60.5,248
SNRPB;SNRPN,-0.1443421501,0.278903309007961,0,P14678;P63162;J3QLE5;J3KRY3;S4R3P3,P14678;P63162;J3QLE5;J3KRY3;S4R3P3,10;10;10;7;7,10;10;10;7;7,10;10;10;7;7,Small nuclear ribonucleoprotein-associated proteins B and B;Small nuclear ribonucleoprotein-associated protein N,SNRPB;SNRPN,sp|P14678|RSMB_HUMAN Small nuclear ribonucleoprotein-associated proteins B and B OS=Homo sapiens OX=9606 GN=SNRPB PE=1 SV=2;sp|P63162|RSMN_HUMAN Small nuclear ribonucleoprotein-associated protein N OS=Homo sapiens OX=9606 GN=SNRPN PE=1 SV=1;tr|J3QLE5|J3QL,10,10,29.2,240
MRPS23,-0.0198898391,0.880879786394469,0,Q9Y3D9;J3QLR8,Q9Y3D9;J3QLR8,7;7,7;7,7;7,"28S ribosomal protein S23, mitochondrial",MRPS23,"sp|Q9Y3D9|RT23_HUMAN 28S ribosomal protein S23, mitochondrial OS=Homo sapiens OX=9606 GN=MRPS23 PE=1 SV=2;tr|J3QLR8|J3QLR8_HUMAN 28S ribosomal protein S23, mitochondrial OS=Homo sapiens OX=9606 GN=MRPS23 PE=1 SV=1",7,7,30,190
RPL18,0.5778586999,0.00533794622370825,0,Q07020;J3QQ67;G3V203;H0YHA7;F8VUA6;F8VYV2;A0A075B7A0;F8VXR6,Q07020;J3QQ67;G3V203;H0YHA7;F8VUA6;F8VYV2;A0A075B7A0,20;20;19;18;14;13;13;1,20;20;19;18;14;13;13;1,20;20;19;18;14;13;13;1,60S ribosomal protein L18,RPL18,sp|Q07020|RL18_HUMAN 60S ribosomal protein L18 OS=Homo sapiens OX=9606 GN=RPL18 PE=1 SV=2;tr|J3QQ67|J3QQ67_HUMAN 60S ribosomal protein L18 (Fragment) OS=Homo sapiens OX=9606 GN=RPL18 PE=1 SV=1;tr|G3V203|G3V203_HUMAN 60S ribosomal protein L18 OS=Homo sapien,20,20,59.6,188
MYL12B;MYL12A;MYL9,0.2378419966,0.148539887741522,0,O14950;P19105;J3QRS3;P24844;J3KTJ1,O14950;P19105;J3QRS3;P24844;J3KTJ1,11;11;11;7;6,11;11;11;7;6,11;11;11;7;6,Myosin regulatory light chain 12B;Myosin regulatory light chain 12A;Myosin regulatory light polypeptide 9,MYL12B;MYL12A;MYL9,sp|O14950|ML12B_HUMAN Myosin regulatory light chain 12B OS=Homo sapiens OX=9606 GN=MYL12B PE=1 SV=2;sp|P19105|ML12A_HUMAN Myosin regulatory light chain 12A OS=Homo sapiens OX=9606 GN=MYL12A PE=1 SV=2;tr|J3QRS3|J3QRS3_HUMAN Myosin regulatory light chain 12A,11,11,51.2,172
ZNF207,0.0315829823,0.931895128414022,0,O43670;J3QRS9;X6R4W8;J3KS31,O43670;J3QRS9;X6R4W8;J3KS31,3;3;3;2,3;3;3;2,3;3;3;2,BUB3-interacting and GLEBS motif-containing protein ZNF207,ZNF207,sp|O43670|ZN207_HUMAN BUB3-interacting and GLEBS motif-containing protein ZNF207 OS=Homo sapiens OX=9606 GN=ZNF207 PE=1 SV=1;tr|J3QRS9|J3QRS9_HUMAN BUB3-interacting and GLEBS motif-containing protein ZNF207 OS=Homo sapiens OX=9606 GN=ZNF207 PE=1 SV=1;tr|X6,3,3,6.3,478
YES1;SRC,-0.4433207062,0.0165064764534085,0,P07947;J3QRU1;P12931;P06241;P06239;P07948;P08631;E5RFS5;Q573B4;H0Y3C5;J3KPD6,P07947;J3QRU1;P12931,13;13;7;5;1;1;1;1;1;1;1,13;13;7;5;1;1;1;1;1;1;1,13;13;7;5;1;1;1;1;1;1;1,Tyrosine-protein kinase Yes;Non-specific protein-tyrosine kinase;Proto-oncogene tyrosine-protein kinase Src,YES1;SRC,sp|P07947|YES_HUMAN Tyrosine-protein kinase Yes OS=Homo sapiens OX=9606 GN=YES1 PE=1 SV=3;tr|J3QRU1|J3QRU1_HUMAN Tyrosine-protein kinase OS=Homo sapiens OX=9606 GN=YES1 PE=1 SV=1;sp|P12931|SRC_HUMAN Proto-oncogene tyrosine-protein kinase Src OS=Homo sapien,13,13,27.6,543
BUB3,-0.393123,0.0349020703119504,0,O43684;J3QT28;J3QSX4,O43684;J3QT28,13;13;6,13;13;6,13;13;6,Mitotic checkpoint protein BUB3,BUB3,sp|O43684|BUB3_HUMAN Mitotic checkpoint protein BUB3 OS=Homo sapiens OX=9606 GN=BUB3 PE=1 SV=1;tr|J3QT28|J3QT28_HUMAN Mitotic checkpoint protein BUB3 (Fragment) OS=Homo sapiens OX=9606 GN=BUB3 PE=1 SV=1,13,13,49.1,328
KATNAL2,0.0050446894,0.968773758390583,0,Q8IYT4;K7EM02;K7EIJ8,Q8IYT4;K7EM02;K7EIJ8,1;1;1,1;1;1,1;1;1,Katanin p60 ATPase-containing subunit A-like 2,KATNAL2,sp|Q8IYT4|KATL2_HUMAN Katanin p60 ATPase-containing subunit A-like 2 OS=Homo sapiens OX=9606 GN=KATNAL2 PE=1 SV=3;tr|K7EM02|K7EM02_HUMAN Katanin p60 ATPase-containing subunit A-like 2 (Fragment) OS=Homo sapiens OX=9606 GN=KATNAL2 PE=1 SV=1;tr|K7EIJ8|K7EIJ8,1,1,2.2,538
LONP1,-0.1017038867,0.554074276523774,0,K7EJE8;K7EKE6;P36776;K7ER27;K7ERR6;K7EQF8;K7ER56,K7EJE8;K7EKE6;P36776,21;21;20;6;3;2;1,21;21;20;6;3;2;1,21;21;20;6;3;2;1,"Lon protease homolog, mitochondrial",LONP1,"tr|K7EJE8|K7EJE8_HUMAN Lon protease homolog, mitochondrial OS=Homo sapiens OX=9606 GN=LONP1 PE=1 SV=1;tr|K7EKE6|K7EKE6_HUMAN Lon protease homolog, mitochondrial OS=Homo sapiens OX=9606 GN=LONP1 PE=1 SV=1;sp|P36776|LONM_HUMAN Lon protease homolog, mitochond",21,21,37.2,829
PRKCSH,0.2068724964,0.161476612005177,0,P14314;K7ELL7;K7EPW7;A0A0C4DGP4;K7EKX1;K7EJ70;K7EIP3;K7EL27,P14314;K7ELL7,18;18;8;6;4;4;1;1,18;18;8;6;4;4;1;1,18;18;8;6;4;4;1;1,Glucosidase 2 subunit beta,PRKCSH,sp|P14314|GLU2B_HUMAN Glucosidase 2 subunit beta OS=Homo sapiens OX=9606 GN=PRKCSH PE=1 SV=2;tr|K7ELL7|K7ELL7_HUMAN Glucosidase 2 subunit beta OS=Homo sapiens OX=9606 GN=PRKCSH PE=1 SV=1,18,18,29.2,528
PARK7,-0.1430775376,0.277247412054472,0,Q99497;K7ELW0;K7EN27,Q99497;K7ELW0,13;13;6,13;13;6,13;13;6,Protein deglycase DJ-1,PARK7,sp|Q99497|PARK7_HUMAN Parkinson disease protein 7 OS=Homo sapiens OX=9606 GN=PARK7 PE=1 SV=2;tr|K7ELW0|K7ELW0_HUMAN Parkinson disease protein 7 OS=Homo sapiens OX=9606 GN=PARK7 PE=1 SV=1,13,13,74.1,189
EIF1,0.3527325318,0.0441856918099937,0,P41567;K7EM18;K7EQP2,P41567;K7EM18,7;7;2,7;7;2,4;4;0,Eukaryotic translation initiation factor 1,EIF1,sp|P41567|EIF1_HUMAN Eukaryotic translation initiation factor 1 OS=Homo sapiens OX=9606 GN=EIF1 PE=1 SV=1;tr|K7EM18|K7EM18_HUMAN Eukaryotic translation initiation factor 1 OS=Homo sapiens OX=9606 GN=EIF1 PE=1 SV=1,7,4,81.4,113
PIN1,-0.1217909375,0.607987627122513,0,Q13526;K7EN45;K7EMU7,Q13526;K7EN45,3;3;1,3;3;1,3;3;1,Peptidyl-prolyl cis-trans isomerase NIMA-interacting 1,PIN1,sp|Q13526|PIN1_HUMAN Peptidyl-prolyl cis-trans isomerase NIMA-interacting 1 OS=Homo sapiens OX=9606 GN=PIN1 PE=1 SV=1;tr|K7EN45|K7EN45_HUMAN Peptidyl-prolyl cis-trans isomerase (Fragment) OS=Homo sapiens OX=9606 GN=PIN1 PE=1 SV=1,3,3,30.1,163
U2AF2,0.2114680345,0.259425322909202,0,K7ENG2,K7ENG2,9,9,1,,U2AF2,tr|K7ENG2|K7ENG2_HUMAN U2 snRNP auxiliary factor large subunit OS=Homo sapiens OX=9606 GN=U2AF2 PE=1 SV=1,9,1,42.7,307
TBCB,0.0821745637,0.5996880163665,0,Q99426;K7EP07;K7EK42;A0A494C0X0,Q99426;K7EP07;K7EK42;A0A494C0X0,3;3;2;2,3;3;2;2,3;3;2;2,Tubulin-folding cofactor B,TBCB,sp|Q99426|TBCB_HUMAN Tubulin-folding cofactor B OS=Homo sapiens OX=9606 GN=TBCB PE=1 SV=2;tr|K7EP07|K7EP07_HUMAN Tubulin-folding cofactor B (Fragment) OS=Homo sapiens OX=9606 GN=TBCB PE=1 SV=8;tr|K7EK42|K7EK42_HUMAN Tubulin-folding cofactor B OS=Homo sapie,3,3,15.2,244
DNAJC7,-0.3745564613,0.0390083241938583,0,Q99615;K7EPP7;K7ESP1;K7EIH8;K7ER44;K7EJE9;K7EJL5;K7EN19;K7EJV7;K7EK03;K7ELJ8;K7EJ24,Q99615;K7EPP7;K7ESP1;K7EIH8;K7ER44,6;6;6;5;3;2;2;2;2;2;2;1,6;6;6;5;3;2;2;2;2;2;2;1,6;6;6;5;3;2;2;2;2;2;2;1,DnaJ homolog subfamily C member 7,DNAJC7,sp|Q99615|DNJC7_HUMAN DnaJ homolog subfamily C member 7 OS=Homo sapiens OX=9606 GN=DNAJC7 PE=1 SV=2;tr|K7EPP7|K7EPP7_HUMAN DnaJ homolog subfamily C member 7 OS=Homo sapiens OX=9606 GN=DNAJC7 PE=1 SV=1;tr|K7ESP1|K7ESP1_HUMAN DnaJ homolog subfamily C member ,6,6,14.6,494
TXNL1,-0.558328422,0.278603476132973,0,O43396;K7ER96;K7EME7,O43396;K7ER96;K7EME7,2;2;1,2;2;1,2;2;1,Thioredoxin-like protein 1,TXNL1,sp|O43396|TXNL1_HUMAN Thioredoxin-like protein 1 OS=Homo sapiens OX=9606 GN=TXNL1 PE=1 SV=3;tr|K7ER96|K7ER96_HUMAN Thioredoxin-like protein 1 (Fragment) OS=Homo sapiens OX=9606 GN=TXNL1 PE=1 SV=1;tr|K7EME7|K7EME7_HUMAN Thioredoxin-like protein 1 (Fragment),2,2,9.7,289
EIF3K,-0.0991511189,0.479053252948851,0,Q9UBQ5;K7ERF1;K7ES31;A0A087WVB9;K7EQM4;K7EK53,Q9UBQ5;K7ERF1;K7ES31,7;7;6;3;2;1,7;7;6;3;2;1,7;7;6;3;2;1,Eukaryotic translation initiation factor 3 subunit K,EIF3K,sp|Q9UBQ5|EIF3K_HUMAN Eukaryotic translation initiation factor 3 subunit K OS=Homo sapiens OX=9606 GN=EIF3K PE=1 SV=1;tr|K7ERF1|K7ERF1_HUMAN Eukaryotic translation initiation factor 3 subunit K OS=Homo sapiens OX=9606 GN=EIF3K PE=1 SV=1;tr|K7ES31|K7ES31_HU,7,7,38.5,218
AP2S1,-0.4154382197,0.0335825172227323,0,P53680;M0R0N4;X6R390;M0QYZ2,P53680;M0R0N4;X6R390;M0QYZ2,1;1;1;1,1;1;1;1,1;1;1;1,AP-2 complex subunit sigma,AP2S1,sp|P53680|AP2S1_HUMAN AP-2 complex subunit sigma OS=Homo sapiens OX=9606 GN=AP2S1 PE=1 SV=2;tr|M0R0N4|M0R0N4_HUMAN AP complex subunit sigma OS=Homo sapiens OX=9606 GN=AP2S1 PE=1 SV=1;tr|X6R390|X6R390_HUMAN AP complex subunit sigma OS=Homo sapiens OX=9606 G,1,1,4.9,142
RPS5,0.2936785338,0.054983017942243,0,P46782;M0R0F0;M0R0R2;M0QZN2,P46782;M0R0F0;M0R0R2;M0QZN2,16;16;15;11,16;16;15;11,16;16;15;11,"40S ribosomal protein S5;40S ribosomal protein S5, N-terminally processed",RPS5,sp|P46782|RS5_HUMAN 40S ribosomal protein S5 OS=Homo sapiens OX=9606 GN=RPS5 PE=1 SV=4;tr|M0R0F0|M0R0F0_HUMAN 40S ribosomal protein S5 (Fragment) OS=Homo sapiens OX=9606 GN=RPS5 PE=1 SV=1;tr|M0R0R2|M0R0R2_HUMAN 40S ribosomal protein S5 OS=Homo sapiens OX=9,16,16,55.9,204
RPL18A,0.3738681651,0.0415459456420454,0,Q02543;M0R1A7;M0R3D6;M0R117;M0R0P7,Q02543;M0R1A7;M0R3D6;M0R117;M0R0P7,20;20;19;19;14,20;20;19;19;14,20;20;19;19;14,60S ribosomal protein L18a,RPL18A,sp|Q02543|RL18A_HUMAN 60S ribosomal protein L18a OS=Homo sapiens OX=9606 GN=RPL18A PE=1 SV=2;tr|M0R1A7|M0R1A7_HUMAN 60S ribosomal protein L18a OS=Homo sapiens OX=9606 GN=RPL18A PE=1 SV=1;tr|M0R3D6|M0R3D6_HUMAN 60S ribosomal protein L18a (Fragment) OS=Homo ,20,20,65.3,176
AGPS,-0.0552076109,0.718553561458703,0,O00116;A0A1B0GWA2;A0A2R8YEL0;B8ZZ81,O00116;A0A1B0GWA2;A0A2R8YEL0,17;12;11;5,17;12;11;5,17;12;11;5,"Alkyldihydroxyacetonephosphate synthase, peroxisomal",AGPS,"sp|O00116|ADAS_HUMAN Alkyldihydroxyacetonephosphate synthase, peroxisomal OS=Homo sapiens OX=9606 GN=AGPS PE=1 SV=1;tr|A0A1B0GWA2|A0A1B0GWA2_HUMAN Alkylglycerone-phosphate synthase (Fragment) OS=Homo sapiens OX=9606 GN=AGPS PE=1 SV=1;tr|A0A2R8YEL0|A0A2R8YE",17,17,35.3,658
DDX39A,0.51767531,0.0921172949510436,0,O00148;K7EQN7;K7EPJ3;A0A0D9SEM9;K7EN69;K7ENP6;K7EL56;K7EIL8,O00148;K7EQN7,22;11;9;5;5;4;4;4,7;4;2;3;0;0;0;0,7;4;2;3;0;0;0;0,ATP-dependent RNA helicase DDX39A,DDX39A,sp|O00148|DX39A_HUMAN ATP-dependent RNA helicase DDX39A OS=Homo sapiens OX=9606 GN=DDX39A PE=1 SV=2;tr|K7EQN7|K7EQN7_HUMAN ATP-dependent RNA helicase DDX39A (Fragment) OS=Homo sapiens OX=9606 GN=DDX39A PE=1 SV=1,22,7,51.5,427
ACOT7,0.0372331888,0.824714388915556,0,O00154;K7EKP8,O00154;K7EKP8,7;5,7;5,7;5,Cytosolic acyl coenzyme A thioester hydrolase,ACOT7,sp|O00154|BACH_HUMAN Cytosolic acyl coenzyme A thioester hydrolase OS=Homo sapiens OX=9606 GN=ACOT7 PE=1 SV=3;tr|K7EKP8|K7EKP8_HUMAN Cytosolic acyl coenzyme A thioester hydrolase (Fragment) OS=Homo sapiens OX=9606 GN=ACOT7 PE=1 SV=8,7,7,26.1,380
HAX1,0.4633274418,0.0171379225530511,0,O00165;Q5VYD6;E9PIQ7,O00165;Q5VYD6,4;3;1,4;3;1,4;3;1,HCLS1-associated protein X-1,HAX1,sp|O00165|HAX1_HUMAN HCLS1-associated protein X-1 OS=Homo sapiens OX=9606 GN=HAX1 PE=1 SV=2;tr|Q5VYD6|Q5VYD6_HUMAN HCLS1-associated protein X-1 (Fragment) OS=Homo sapiens OX=9606 GN=HAX1 PE=1 SV=1,4,4,19,279
AIP,-0.1540182139,0.505286384655794,0,O00170;E9PMH2,O00170,3;1,3;1,3;1,AH receptor-interacting protein,AIP,sp|O00170|AIP_HUMAN AH receptor-interacting protein OS=Homo sapiens OX=9606 GN=AIP PE=1 SV=2,3,3,15.2,330
AP3B1,-0.2390513714,0.205549705089367,0,O00203,O00203,4,4,3,AP-3 complex subunit beta-1,AP3B1,sp|O00203|AP3B1_HUMAN AP-3 complex subunit beta-1 OS=Homo sapiens OX=9606 GN=AP3B1 PE=1 SV=3,4,3,5.6,1094
PSMD11,-0.2861617203,0.100856736933905,0,O00231;J3QRY4;J3QS13;J3KSW3,O00231,22;8;3;2,22;8;3;2,22;8;3;2,26S proteasome non-ATPase regulatory subunit 11,PSMD11,sp|O00231|PSD11_HUMAN 26S proteasome non-ATPase regulatory subunit 11 OS=Homo sapiens OX=9606 GN=PSMD11 PE=1 SV=3,22,22,54.3,422
PSMD12,-0.7060974696,0.193533253355693,0,O00232,O00232,12,12,12,26S proteasome non-ATPase regulatory subunit 12,PSMD12,sp|O00232|PSD12_HUMAN 26S proteasome non-ATPase regulatory subunit 12 OS=Homo sapiens OX=9606 GN=PSMD12 PE=1 SV=3,12,12,28.3,456
PGRMC1,-0.0626792304,0.697905822625289,0,O00264;U3KQM0,O00264,17;1,17;1,16;0,Membrane-associated progesterone receptor component 1,PGRMC1,sp|O00264|PGRC1_HUMAN Membrane-associated progesterone receptor component 1 OS=Homo sapiens OX=9606 GN=PGRMC1 PE=1 SV=3,17,16,60,195
SUPT5H,-0.0001600338,0.99908024982872,0,O00267,O00267,7,7,7,Transcription elongation factor SPT5,SUPT5H,sp|O00267|SPT5H_HUMAN Transcription elongation factor SPT5 OS=Homo sapiens OX=9606 GN=SUPT5H PE=1 SV=1,7,7,10.7,1087
DFFA,-0.0990809679,0.608683815754455,0,O00273;K7ERT1,O00273,5;1,5;1,5;1,DNA fragmentation factor subunit alpha,DFFA,sp|O00273|DFFA_HUMAN DNA fragmentation factor subunit alpha OS=Homo sapiens OX=9606 GN=DFFA PE=1 SV=1,5,5,23,331
CLIC1,0.1670365628,0.23016829357638,0,O00299,O00299,24,24,24,Chloride intracellular channel protein 1,CLIC1,sp|O00299|CLIC1_HUMAN Chloride intracellular channel protein 1 OS=Homo sapiens OX=9606 GN=CLIC1 PE=1 SV=4,24,24,78.4,241
EIF3F,0.0244779806,0.847923973317223,0,O00303;E9PQV8;A0A1W2PP79,O00303,14;2;2,14;2;2,11;2;2,Eukaryotic translation initiation factor 3 subunit F,EIF3F,sp|O00303|EIF3F_HUMAN Eukaryotic translation initiation factor 3 subunit F OS=Homo sapiens OX=9606 GN=EIF3F PE=1 SV=1,14,11,51,357
IPO5,0.1841474704,0.181782515612629,0,O00410;H0Y8C6;E7ETV3;H0Y3V4;E7EQT5;E7EV12;E7EWK4;E7EX05;E7ESZ1;E7ETV8;C9JZD8;C9JQT6;C9J875;C9JXE0;O60518;F8WF30;C9JZ53;C9J583,O00410;H0Y8C6,29;27;6;4;4;4;3;3;3;3;3;3;3;2;1;1;1;1,29;27;6;4;4;4;3;3;3;3;3;3;3;2;1;1;1;1,29;27;6;4;4;4;3;3;3;3;3;3;3;2;1;1;1;1,Importin-5,IPO5,sp|O00410|IPO5_HUMAN Importin-5 OS=Homo sapiens OX=9606 GN=IPO5 PE=1 SV=4;tr|H0Y8C6|H0Y8C6_HUMAN Importin-5 (Fragment) OS=Homo sapiens OX=9606 GN=IPO5 PE=1 SV=1,29,29,38.7,1097
SAP18,-0.3925835093,0.0265894438508851,0,O00422;U3KQ12;U3KPY7;H7BZW6,O00422,3;1;1;1,3;1;1;1,3;1;1;1,Histone deacetylase complex subunit SAP18,SAP18,sp|O00422|SAP18_HUMAN Histone deacetylase complex subunit SAP18 OS=Homo sapiens OX=9606 GN=SAP18 PE=1 SV=1,3,3,19.6,153
DNM1L,0.1011681875,0.503488904403455,0,O00429;F8VZ52;B4DDQ3;B4DPZ9;F8W1W3;F8VUJ9;F8VR28;F8VYL3;H0YHY4;H0YI79,O00429,29;12;8;7;7;7;5;5;3;1,29;12;8;7;7;7;5;5;3;1,29;12;8;7;7;7;5;5;3;1,Dynamin-1-like protein,DNM1L,sp|O00429|DNM1L_HUMAN Dynamin-1-like protein OS=Homo sapiens OX=9606 GN=DNM1L PE=1 SV=2,29,29,53.5,736
PSMD14,0.0204566773,0.88610457780043,0,O00487;C9JW37,O00487,8;1,8;1,8;1,26S proteasome non-ATPase regulatory subunit 14,PSMD14,sp|O00487|PSDE_HUMAN 26S proteasome non-ATPase regulatory subunit 14 OS=Homo sapiens OX=9606 GN=PSMD14 PE=1 SV=1,8,8,46.1,310
KPNA3,-0.3242347772,0.0570335776148934,0,O00505;H0Y4S9,O00505,8;1,8;1,5;1,Importin subunit alpha-4,KPNA3,sp|O00505|IMA4_HUMAN Importin subunit alpha-4 OS=Homo sapiens OX=9606 GN=KPNA3 PE=1 SV=2,8,5,26.3,521
PODXL,0.0495539713,0.837259001270062,0,O00592,O00592,7,7,7,Podocalyxin,PODXL,sp|O00592|PODXL_HUMAN Podocalyxin OS=Homo sapiens OX=9606 GN=PODXL PE=1 SV=2,7,7,19.9,558
PPP6C,-0.1244574033,0.44082746048685,0,O00743;Q5T1S7,O00743,3;1,3;1,3;1,"Serine/threonine-protein phosphatase 6 catalytic subunit;Serine/threonine-protein phosphatase 6 catalytic subunit, N-terminally processed",PPP6C,sp|O00743|PPP6_HUMAN Serine/threonine-protein phosphatase 6 catalytic subunit OS=Homo sapiens OX=9606 GN=PPP6C PE=1 SV=1,3,3,13.1,305
PDXK,-0.2453798285,0.287399285679301,0,O00764;F2Z2Y4;A8MV33,O00764;F2Z2Y4,9;7;2,9;7;2,9;7;2,Pyridoxal kinase,PDXK,sp|O00764|PDXK_HUMAN Pyridoxal kinase OS=Homo sapiens OX=9606 GN=PDXK PE=1 SV=1;tr|F2Z2Y4|F2Z2Y4_HUMAN Pyridoxal kinase OS=Homo sapiens OX=9606 GN=PDXK PE=1 SV=1,9,9,43.3,312
COPE,0.0691604848,0.641221951231811,0,O14579;M0QXB4;M0R061,O14579;M0QXB4;M0R061,9;8;6,9;8;6,9;8;6,Coatomer subunit epsilon,COPE,"sp|O14579|COPE_HUMAN Coatomer subunit epsilon OS=Homo sapiens OX=9606 GN=COPE PE=1 SV=3;tr|M0QXB4|M0QXB4_HUMAN Coatomer protein complex, subunit epsilon, isoform CRA_g OS=Homo sapiens OX=9606 GN=COPE PE=1 SV=1;tr|M0R061|M0R061_HUMAN Coatomer subunit epsilo",9,9,34.1,308
PDCD5,0.3408974594,0.162260842442667,0,O14737;K7EQA1;K7ESJ4;Q3HM38;X6R2P6,O14737;K7EQA1,5;4;2;1;1,5;4;2;1;1,5;4;2;1;1,Programmed cell death protein 5,PDCD5,sp|O14737|PDCD5_HUMAN Programmed cell death protein 5 OS=Homo sapiens OX=9606 GN=PDCD5 PE=1 SV=3;tr|K7EQA1|K7EQA1_HUMAN Programmed cell death protein 5 OS=Homo sapiens OX=9606 GN=PDCD5 PE=1 SV=1,5,5,45.6,125
PRMT5,0.2940811103,0.0934847003173312,0,O14744;H0YJX6;G3V580;G3V2L6;G3V5L5;C9JSX3;G3V2X6;H0YJ77;H0YJD3;H7BZ44;G3V507;G3V2F5;G3V5T6,O14744,13;6;5;5;4;4;3;2;2;2;1;1;1,13;6;5;5;4;4;3;2;2;2;1;1;1,13;6;5;5;4;4;3;2;2;2;1;1;1,"Protein arginine N-methyltransferase 5;Protein arginine N-methyltransferase 5, N-terminally processed",PRMT5,sp|O14744|ANM5_HUMAN Protein arginine N-methyltransferase 5 OS=Homo sapiens OX=9606 GN=PRMT5 PE=1 SV=4,13,13,25.1,637
SLC9A3R1,-0.1365409778,0.322481202816517,0,O14745;J3QRP6;J3QRA3,O14745;J3QRP6,11;7;1,11;7;1,11;7;1,Na(+)/H(+) exchange regulatory cofactor NHE-RF1,SLC9A3R1,sp|O14745|NHRF1_HUMAN Na(+)/H(+) exchange regulatory cofactor NHE-RF1 OS=Homo sapiens OX=9606 GN=SLC9A3R1 PE=1 SV=4;tr|J3QRP6|J3QRP6_HUMAN Na(+)/H(+) exchange regulatory cofactor NHE-RF1 (Fragment) OS=Homo sapiens OX=9606 GN=SLC9A3R1 PE=1 SV=1,11,11,42.2,358
TCERG1,-0.8839783283,0.0119440783617158,0,O14776;G3V220;Q5VWI1,O14776;G3V220,17;13;1,17;13;1,17;13;1,Transcription elongation regulator 1,TCERG1,sp|O14776|TCRG1_HUMAN Transcription elongation regulator 1 OS=Homo sapiens OX=9606 GN=TCERG1 PE=1 SV=2;tr|G3V220|G3V220_HUMAN Transcription elongation regulator 1 OS=Homo sapiens OX=9606 GN=TCERG1 PE=1 SV=1,17,17,21.5,1098
