CSNK2B;CSNK2B-LY6G5B-1181;CSNK2B-LY6G5B--991,1.6099559282,0.120009927059203,0,P67870;Q5SRQ6;Q5SRQ3;N0E472;A0A0G2JM12;N0E644;A0A0G2JM58,P67870;Q5SRQ6;Q5SRQ3;N0E472;A0A0G2JM12,5;5;4;4;4;1;1,5;5;4;4;4;1;1,5;5;4;4;4;1;1,Casein kinase II subunit beta,CSNK2B;CSNK2B-LY6G5B-1181;CSNK2B-LY6G5B--991,sp|P67870|CSK2B_HUMAN Casein kinase II subunit beta OS=Homo sapiens OX=9606 GN=CSNK2B PE=1 SV=1;tr|Q5SRQ6|Q5SRQ6_HUMAN Casein kinase II subunit beta OS=Homo sapiens OX=9606 GN=CSNK2B PE=1 SV=2;tr|Q5SRQ3|Q5SRQ3_HUMAN Casein kinase II subunit beta OS=Homo sa,5,5,30.7,215
ACTC1;ACTA1,0.0767841324,0.59014286960891,0,P68032;P68133;A6NL76,P68032;P68133;A6NL76,35;34;26,7;6;5,2;2;2,"Actin, alpha cardiac muscle 1;Actin, alpha skeletal muscle",ACTC1;ACTA1,"sp|P68032|ACTC_HUMAN Actin, alpha cardiac muscle 1 OS=Homo sapiens OX=9606 GN=ACTC1 PE=1 SV=1;sp|P68133|ACTS_HUMAN Actin, alpha skeletal muscle OS=Homo sapiens OX=9606 GN=ACTA1 PE=1 SV=1;tr|A6NL76|A6NL76_HUMAN Actin, alpha skeletal muscle OS=Homo sapiens O",35,2,54.6,377
EEF1A1;EEF1A1P5,0.0919569397,0.529967083848264,0,P68104;Q5VTE0;A0A087WVQ9;A0A087WV01;Q5JR01;A6PW80,P68104;Q5VTE0;A0A087WVQ9;A0A087WV01,41;39;37;29;12;11,41;39;37;29;12;11,20;19;20;14;4;4,Elongation factor 1-alpha 1;Putative elongation factor 1-alpha-like 3;Elongation factor 1-alpha,EEF1A1;EEF1A1P5,sp|P68104|EF1A1_HUMAN Elongation factor 1-alpha 1 OS=Homo sapiens OX=9606 GN=EEF1A1 PE=1 SV=1;sp|Q5VTE0|EF1A3_HUMAN Putative elongation factor 1-alpha-like 3 OS=Homo sapiens OX=9606 GN=EEF1A1P5 PE=5 SV=1;tr|A0A087WVQ9|A0A087WVQ9_HUMAN Elongation factor 1-a,41,20,79.9,462
TUBB4B,0.050064356,0.677335671410776,0,P68371,P68371,43,43,2,Tubulin beta-4B chain,TUBB4B,sp|P68371|TBB4B_HUMAN Tubulin beta-4B chain OS=Homo sapiens OX=9606 GN=TUBB4B PE=1 SV=1,43,2,70.8,445
PAFAH1B2,-0.2058813753,0.209428156903927,0,P68402;J3KNE3,P68402;J3KNE3,4;2,4;2,4;2,Platelet-activating factor acetylhydrolase IB subunit beta,PAFAH1B2,sp|P68402|PA1B2_HUMAN Platelet-activating factor acetylhydrolase IB subunit beta OS=Homo sapiens OX=9606 GN=PAFAH1B2 PE=1 SV=1;tr|J3KNE3|J3KNE3_HUMAN Platelet-activating factor acetylhydrolase IB subunit beta (Fragment) OS=Homo sapiens OX=9606 GN=PAFAH1B2 ,4,4,41.5,229
EIF4G2,-0.0980732888,0.529420517377243,0,P78344;D3DQV9;H0Y3P2;E9PKF8;H0YCH5;H0YE22;H0YD77;H0YEC5,P78344;D3DQV9;H0Y3P2,19;18;16;7;6;3;3;1,19;18;16;7;6;3;3;1,19;18;16;7;6;3;3;1,Eukaryotic translation initiation factor 4 gamma 2,EIF4G2,sp|P78344|IF4G2_HUMAN Eukaryotic translation initiation factor 4 gamma 2 OS=Homo sapiens OX=9606 GN=EIF4G2 PE=1 SV=1;tr|D3DQV9|D3DQV9_HUMAN Eukaryotic translation initiation factor 4 gamma 2 (Fragment) OS=Homo sapiens OX=9606 GN=EIF4G2 PE=1 SV=1;tr|H0Y3P2|,19,19,25.9,907
CCT2,-0.0120363687,0.929903586250824,0,P78371;F5GWF6;F8VQ14,P78371;F5GWF6;F8VQ14,48;44;39,48;44;39,48;44;39,T-complex protein 1 subunit beta,CCT2,sp|P78371|TCPB_HUMAN T-complex protein 1 subunit beta OS=Homo sapiens OX=9606 GN=CCT2 PE=1 SV=4;tr|F5GWF6|F5GWF6_HUMAN T-complex protein 1 subunit beta OS=Homo sapiens OX=9606 GN=CCT2 PE=1 SV=2;tr|F8VQ14|F8VQ14_HUMAN T-complex protein 1 subunit beta OS=Hom,48,48,83.7,535
GSTO1,0.0973921568,0.724497780123924,0,P78417;Q5TA02;Q5TA01,P78417;Q5TA02;Q5TA01,12;10;8,12;10;8,12;10;8,Glutathione S-transferase omega-1,GSTO1,sp|P78417|GSTO1_HUMAN Glutathione S-transferase omega-1 OS=Homo sapiens OX=9606 GN=GSTO1 PE=1 SV=2;tr|Q5TA02|Q5TA02_HUMAN Glutathione S-transferase omega-1 (Fragment) OS=Homo sapiens OX=9606 GN=GSTO1 PE=1 SV=1;tr|Q5TA01|Q5TA01_HUMAN Glutathione S-transfera,12,12,51.9,241
PRKDC,-0.195590155,0.256306539192336,0,P78527;H0YG84;F5GX40,P78527,142;4;3,142;4;3,142;4;3,DNA-dependent protein kinase catalytic subunit,PRKDC,sp|P78527|PRKDC_HUMAN DNA-dependent protein kinase catalytic subunit OS=Homo sapiens OX=9606 GN=PRKDC PE=1 SV=3,142,142,38.9,4128
MRPS25,0.2500136515,0.203102104174455,0,P82663;E7EPW2,P82663;E7EPW2,7;6,7;6,7;6,"28S ribosomal protein S25, mitochondrial",MRPS25,"sp|P82663|RT25_HUMAN 28S ribosomal protein S25, mitochondrial OS=Homo sapiens OX=9606 GN=MRPS25 PE=1 SV=1;tr|E7EPW2|E7EPW2_HUMAN 28S ribosomal protein S25, mitochondrial OS=Homo sapiens OX=9606 GN=MRPS25 PE=1 SV=1",7,7,37,173
MRPS35,0.4235685016,0.388324131258775,0,P82673;H0YG82,P82673;H0YG82,4;3,4;3,4;3,"28S ribosomal protein S35, mitochondrial",MRPS35,"sp|P82673|RT35_HUMAN 28S ribosomal protein S35, mitochondrial OS=Homo sapiens OX=9606 GN=MRPS35 PE=1 SV=1;tr|H0YG82|H0YG82_HUMAN 28S ribosomal protein S35, mitochondrial (Fragment) OS=Homo sapiens OX=9606 GN=MRPS35 PE=1 SV=1",4,4,21.7,323
MRPS5,0.380985719,0.109534682993582,0,P82675,P82675,4,4,4,"28S ribosomal protein S5, mitochondrial",MRPS5,"sp|P82675|RT05_HUMAN 28S ribosomal protein S5, mitochondrial OS=Homo sapiens OX=9606 GN=MRPS5 PE=1 SV=2",4,4,12.3,430
MRPS9,0.1420605138,0.29635640775175,0,P82933,P82933,16,16,16,"28S ribosomal protein S9, mitochondrial",MRPS9,"sp|P82933|RT09_HUMAN 28S ribosomal protein S9, mitochondrial OS=Homo sapiens OX=9606 GN=MRPS9 PE=1 SV=2",16,16,49.5,396
SARNP,-0.2909160484,0.100352308266066,0,P82979;F8VZQ9;H0YHG0;F8VS12,P82979;F8VZQ9;H0YHG0,11;10;9;4,11;10;9;4,11;10;9;4,SAP domain-containing ribonucleoprotein,SARNP,sp|P82979|SARNP_HUMAN SAP domain-containing ribonucleoprotein OS=Homo sapiens OX=9606 GN=SARNP PE=1 SV=3;tr|F8VZQ9|F8VZQ9_HUMAN SAP domain-containing ribonucleoprotein OS=Homo sapiens OX=9606 GN=SARNP PE=1 SV=1;tr|H0YHG0|H0YHG0_HUMAN Uncharacterized protei,11,11,51.9,210
LACTB,-0.1878927836,0.21302960654631,0,P83111;H0YNN5,P83111,7;2,7;2,7;2,"Serine beta-lactamase-like protein LACTB, mitochondrial",LACTB,"sp|P83111|LACTB_HUMAN Serine beta-lactamase-like protein LACTB, mitochondrial OS=Homo sapiens OX=9606 GN=LACTB PE=1 SV=2",7,7,15,547
RPL24,0.2802775108,0.0739893968582041,0,P83731;C9JXB8;C9JNW5,P83731;C9JXB8;C9JNW5,12;11;11,12;11;11,12;11;11,60S ribosomal protein L24,RPL24,sp|P83731|RL24_HUMAN 60S ribosomal protein L24 OS=Homo sapiens OX=9606 GN=RPL24 PE=1 SV=1;tr|C9JXB8|C9JXB8_HUMAN 60S ribosomal protein L24 OS=Homo sapiens OX=9606 GN=RPL24 PE=1 SV=1;tr|C9JNW5|C9JNW5_HUMAN 60S ribosomal protein L24 OS=Homo sapiens OX=9606 G,12,12,47.1,157
ARF1;ARF3,-0.2121898011,0.283461106468748,0,P84077;P61204;F5H423;F5H0C7;C9J1Z8;H0YGG7;F5H1V1;F5H6T5;F8WDB3,P84077;P61204;F5H423,16;13;10;6;5;3;1;1;1,16;13;10;6;5;3;1;1;1,11;8;5;2;0;3;0;0;0,ADP-ribosylation factor 1;ADP-ribosylation factor 3,ARF1;ARF3,sp|P84077|ARF1_HUMAN ADP-ribosylation factor 1 OS=Homo sapiens OX=9606 GN=ARF1 PE=1 SV=2;sp|P61204|ARF3_HUMAN ADP-ribosylation factor 3 OS=Homo sapiens OX=9606 GN=ARF3 PE=1 SV=2;tr|F5H423|F5H423_HUMAN Uncharacterized protein OS=Homo sapiens OX=9606 PE=3 SV,16,11,92.8,181
ERH,0.172524061,0.321265705909181,0,P84090;G3V279,P84090,9;4,9;4,9;4,Enhancer of rudimentary homolog,ERH,sp|P84090|ERH_HUMAN Enhancer of rudimentary homolog OS=Homo sapiens OX=9606 GN=ERH PE=1 SV=1,9,9,62.5,104
RHOG,-0.194361166,0.190436640851904,0,P84095,P84095,5,4,4,Rho-related GTP-binding protein RhoG,RHOG,sp|P84095|RHOG_HUMAN Rho-related GTP-binding protein RhoG OS=Homo sapiens OX=9606 GN=RHOG PE=1 SV=1,5,4,41.9,191
SRSF3,-0.021003749,0.873312473384082,0,P84103;A0A087X2D0,P84103;A0A087X2D0,8;7,7;6,7;6,Serine/arginine-rich splicing factor 3,SRSF3,sp|P84103|SRSF3_HUMAN Serine/arginine-rich splicing factor 3 OS=Homo sapiens OX=9606 GN=SRSF3 PE=1 SV=1;tr|A0A087X2D0|A0A087X2D0_HUMAN Serine/arginine-rich-splicing factor 3 OS=Homo sapiens OX=9606 GN=SRSF3 PE=1 SV=1,8,7,45.1,164
FOXK1,0.0631728426,0.734935122938698,0,P85037,P85037,8,8,8,Forkhead box protein K1,FOXK1,sp|P85037|FOXK1_HUMAN Forkhead box protein K1 OS=Homo sapiens OX=9606 GN=FOXK1 PE=1 SV=1,8,8,13.8,733
RBM10,-0.6629896518,0.0358241510906597,0,P98175;P78332;E9PGM9,P98175,6;1;1,6;1;1,6;1;1,RNA-binding protein 10,RBM10,sp|P98175|RBM10_HUMAN RNA-binding protein 10 OS=Homo sapiens OX=9606 GN=RBM10 PE=1 SV=3,6,6,10.2,930
RBM3,-0.040224692,0.820163245691336,0,P98179,P98179,10,10,10,RNA-binding protein 3,RBM3,sp|P98179|RBM3_HUMAN RNA-binding protein 3 OS=Homo sapiens OX=9606 GN=RBM3 PE=1 SV=1,10,10,66.2,157
TFAM,-0.3895243428,0.0196423586438732,0,Q00059;H7BYN3,Q00059;H7BYN3,12;8,12;8,12;8,"Transcription factor A, mitochondrial",TFAM,"sp|Q00059|TFAM_HUMAN Transcription factor A, mitochondrial OS=Homo sapiens OX=9606 GN=TFAM PE=1 SV=1;tr|H7BYN3|H7BYN3_HUMAN Transcription factor A, mitochondrial (Fragment) OS=Homo sapiens OX=9606 GN=TFAM PE=1 SV=1",12,12,38.2,246
SLC25A3,0.2754815672,0.0671251353092487,0,Q00325,Q00325,20,20,4,"Phosphate carrier protein, mitochondrial",SLC25A3,"sp|Q00325|MPCP_HUMAN Phosphate carrier protein, mitochondrial OS=Homo sapiens OX=9606 GN=SLC25A3 PE=1 SV=2",20,4,39.8,362
PURA,-0.0067080891,0.961526053526709,0,Q00577,Q00577,5,5,5,Transcriptional activator protein Pur-alpha,PURA,sp|Q00577|PURA_HUMAN Transcriptional activator protein Pur-alpha OS=Homo sapiens OX=9606 GN=PURA PE=1 SV=2,5,5,23.6,322
CLTC,-0.1651286561,0.207960995148198,0,Q00610;A0A087WVQ6;J3KS13;P53675;A0A087WX41;K7EJJ5;J3KSQ2;J3KRF5;J3QL20;A0A087WV74;A0A087WXH4;F5H5N6,Q00610;A0A087WVQ6,108;107;39;19;17;13;9;8;6;2;2;1,108;107;39;19;17;13;9;8;6;2;2;1,108;107;39;19;17;13;9;8;6;2;2;1,Clathrin heavy chain 1;Clathrin heavy chain,CLTC,sp|Q00610|CLH1_HUMAN Clathrin heavy chain 1 OS=Homo sapiens OX=9606 GN=CLTC PE=1 SV=5;tr|A0A087WVQ6|A0A087WVQ6_HUMAN Clathrin heavy chain OS=Homo sapiens OX=9606 GN=CLTC PE=1 SV=1,108,108,67,1675
NFKB2,-0.9191171696,0.0720748777126704,0,Q00653,Q00653,5,5,5,Nuclear factor NF-kappa-B p100 subunit;Nuclear factor NF-kappa-B p52 subunit,NFKB2,sp|Q00653|NFKB2_HUMAN Nuclear factor NF-kappa-B p100 subunit OS=Homo sapiens OX=9606 GN=NFKB2 PE=1 SV=4,5,5,8.7,900
FKBP3,-0.048807157,0.766928474543716,0,Q00688;G3V5F2,Q00688,16;2,16;2,16;2,Peptidyl-prolyl cis-trans isomerase FKBP3,FKBP3,sp|Q00688|FKBP3_HUMAN Peptidyl-prolyl cis-trans isomerase FKBP3 OS=Homo sapiens OX=9606 GN=FKBP3 PE=1 SV=1,16,16,61.6,224
SORD,-0.0078410643,0.955952074536089,0,Q00796;H0YLA4;H0YKB3,Q00796;H0YLA4,15;12;5,15;12;5,15;12;5,Sorbitol dehydrogenase,SORD,sp|Q00796|DHSO_HUMAN Sorbitol dehydrogenase OS=Homo sapiens OX=9606 GN=SORD PE=1 SV=4;tr|H0YLA4|H0YLA4_HUMAN Sorbitol dehydrogenase OS=Homo sapiens OX=9606 GN=SORD PE=1 SV=1,15,15,56.6,357
HNRNPU,-0.2297234034,0.100003701857003,0,Q00839;A0A1W2PPS1;A0A1X7SBS1;A0A1W2PP35;Q5RI18;A0A1W2PPH7;A0A1W2PQL0;A0A1W2PP34;A0A1W2PPL4;A0A1W2PQ74;A0A1W2PRZ7;A0A1W2PQD4;A0A1W2PPE9;A0A1W2PRI6;A0A1W2PP22;A0A1W2PNG3,Q00839;A0A1W2PPS1;A0A1X7SBS1;A0A1W2PP35;Q5RI18;A0A1W2PPH7;A0A1W2PQL0;A0A1W2PP34;A0A1W2PPL4;A0A1W2PQ74;A0A1W2PRZ7;A0A1W2PQD4,59;58;56;54;51;48;47;47;46;45;43;33;6;5;3;2,59;58;56;54;51;48;47;47;46;45;43;33;6;5;3;2,59;58;56;54;51;48;47;47;46;45;43;33;6;5;3;2,Heterogeneous nuclear ribonucleoprotein U,HNRNPU,sp|Q00839|HNRPU_HUMAN Heterogeneous nuclear ribonucleoprotein U OS=Homo sapiens OX=9606 GN=HNRNPU PE=1 SV=6;tr|A0A1W2PPS1|A0A1W2PPS1_HUMAN Heterogeneous nuclear ribonucleoprotein U OS=Homo sapiens OX=9606 GN=HNRNPU PE=1 SV=1;tr|A0A1X7SBS1|A0A1X7SBS1_HUMAN ,59,59,53.5,825
SPTBN1,-0.5121308729,0.010964565416677,0,Q01082;A0A087WUZ3;F8W6C1;O15020;A4QPE4,Q01082;A0A087WUZ3,76;75;25;3;3,76;75;25;3;3,74;73;23;1;1,"Spectrin beta chain, non-erythrocytic 1",SPTBN1,"sp|Q01082|SPTB2_HUMAN Spectrin beta chain, non-erythrocytic 1 OS=Homo sapiens OX=9606 GN=SPTBN1 PE=1 SV=2;tr|A0A087WUZ3|A0A087WUZ3_HUMAN Spectrin beta chain OS=Homo sapiens OX=9606 GN=SPTBN1 PE=1 SV=1",76,74,43.4,2364
FABP5,0.2085245609,0.301633304328818,0,Q01469;I6L8B7;A8MUU1,Q01469;I6L8B7,17;9;3,17;9;3,17;9;3,"Fatty acid-binding protein, epidermal",FABP5,sp|Q01469|FABP5_HUMAN Fatty acid-binding protein 5 OS=Homo sapiens OX=9606 GN=FABP5 PE=1 SV=3;tr|I6L8B7|I6L8B7_HUMAN Fatty acid-binding protein 5 OS=Homo sapiens OX=9606 GN=FABP5 PE=1 SV=1,17,17,94.8,135
CAP1,-0.1473864606,0.275763036239988,0,Q01518;Q5T0R1;Q5T0R7;Q5T0R6;Q5T0R5;Q5T0R4;Q5T0R3;Q5T0R2;Q5T0R9;Q5T0S3;Q5T0R8,Q01518;Q5T0R1;Q5T0R7;Q5T0R6;Q5T0R5;Q5T0R4;Q5T0R3;Q5T0R2;Q5T0R9,31;17;16;16;16;16;16;16;16;6;5,31;17;16;16;16;16;16;16;16;6;5,30;17;16;16;16;16;16;16;16;6;5,Adenylyl cyclase-associated protein 1;Adenylyl cyclase-associated protein,CAP1,sp|Q01518|CAP1_HUMAN Adenylyl cyclase-associated protein 1 OS=Homo sapiens OX=9606 GN=CAP1 PE=1 SV=5;tr|Q5T0R1|Q5T0R1_HUMAN Adenylyl cyclase-associated protein 1 (Fragment) OS=Homo sapiens OX=9606 GN=CAP1 PE=1 SV=1;tr|Q5T0R7|Q5T0R7_HUMAN Adenylyl cyclase-a,31,30,69.3,475
HMGCS1,-0.6212400541,0.00368174739497733,0,Q01581;D6RIW1;P54868,Q01581,28;6;2,28;6;2,28;6;2,"Hydroxymethylglutaryl-CoA synthase, cytoplasmic",HMGCS1,"sp|Q01581|HMCS1_HUMAN Hydroxymethylglutaryl-CoA synthase, cytoplasmic OS=Homo sapiens OX=9606 GN=HMGCS1 PE=1 SV=2",28,28,75.6,520
DR1,0.2286264036,0.649382404220147,0,Q01658,Q01658,3,3,3,Protein Dr1,DR1,sp|Q01658|NC2B_HUMAN Protein Dr1 OS=Homo sapiens OX=9606 GN=DR1 PE=1 SV=1,3,3,21,176
PFKP,-0.1524158482,0.344168091773886,0,Q01813;B1APP6;Q5VSR5;H0Y757;V9GYV7;H0Y3Y3,Q01813;B1APP6,14;9;4;3;3;3,14;9;4;3;3;3,12;9;3;3;3;3,"ATP-dependent 6-phosphofructokinase, platelet type",PFKP,"sp|Q01813|PFKAP_HUMAN ATP-dependent 6-phosphofructokinase, platelet type OS=Homo sapiens OX=9606 GN=PFKP PE=1 SV=2;tr|B1APP6|B1APP6_HUMAN ATP-dependent 6-phosphofructokinase, platelet type OS=Homo sapiens OX=9606 GN=PFKP PE=1 SV=2",14,12,23.2,784
PLCB3,-0.5712612592,0.062010660701109,0,Q01970,Q01970,6,6,6,"1-phosphatidylinositol 4,5-bisphosphate phosphodiesterase beta-3",PLCB3,"sp|Q01970|PLCB3_HUMAN 1-phosphatidylinositol 4,5-bisphosphate phosphodiesterase beta-3 OS=Homo sapiens OX=9606 GN=PLCB3 PE=1 SV=2",6,6,7.1,1234
OGDH,-0.1764094594,0.343447513607399,0,Q02218;E9PDF2;E9PCR7;A0A0D9SFS3;E9PFG7;Q9ULD0;C9J4G7,Q02218;E9PDF2;E9PCR7;A0A0D9SFS3;E9PFG7,30;29;29;28;24;6;5,30;29;29;28;24;6;5,30;29;29;28;24;6;5,"2-oxoglutarate dehydrogenase, mitochondrial",OGDH,"sp|Q02218|ODO1_HUMAN 2-oxoglutarate dehydrogenase, mitochondrial OS=Homo sapiens OX=9606 GN=OGDH PE=1 SV=3;tr|E9PDF2|E9PDF2_HUMAN 2-oxoglutarate dehydrogenase, mitochondrial OS=Homo sapiens OX=9606 GN=OGDH PE=1 SV=1;tr|E9PCR7|E9PCR7_HUMAN 2-oxoglutarate de",30,30,40.1,1023
ALDH6A1,-0.5878464623,0.0674734783080849,0,Q02252;G3V4Z4,Q02252,6;2,6;2,6;2,"Methylmalonate-semialdehyde dehydrogenase [acylating], mitochondrial",ALDH6A1,"sp|Q02252|MMSA_HUMAN Methylmalonate-semialdehyde dehydrogenase [acylating], mitochondrial OS=Homo sapiens OX=9606 GN=ALDH6A1 PE=1 SV=2",6,6,24.5,535
FKBP4,0.0699502321,0.650371969380834,0,Q02790;H0YFG2;F5H1U3;F5H120,Q02790,39;8;6;2,39;8;6;2,39;8;6;2,"Peptidyl-prolyl cis-trans isomerase FKBP4;Peptidyl-prolyl cis-trans isomerase FKBP4, N-terminally processed",FKBP4,sp|Q02790|FKBP4_HUMAN Peptidyl-prolyl cis-trans isomerase FKBP4 OS=Homo sapiens OX=9606 GN=FKBP4 PE=1 SV=3,39,39,73.4,459
PLOD1,-0.0591792489,0.780260461884642,0,Q02809;Q5JXB8;Q5JXB7,Q02809,20;3;3,20;3;3,20;3;3,"Procollagen-lysine,2-oxoglutarate 5-dioxygenase 1",PLOD1,"sp|Q02809|PLOD1_HUMAN Procollagen-lysine,2-oxoglutarate 5-dioxygenase 1 OS=Homo sapiens OX=9606 GN=PLOD1 PE=1 SV=2",20,20,35.8,727
RPL6,0.2266861515,0.125410445168475,0,Q02878;F8VZ45;U3KQR5;F8VR69;F8VZA3;F8VWR1;F8VU16,Q02878,26;6;6;3;3;3;3,26;6;6;3;3;3;3,26;6;6;3;3;3;3,60S ribosomal protein L6,RPL6,sp|Q02878|RL6_HUMAN 60S ribosomal protein L6 OS=Homo sapiens OX=9606 GN=RPL6 PE=1 SV=3,26,26,55.6,288
LMNB2,-0.1177131661,0.54425478825421,0,Q03252,Q03252,33,27,27,Lamin-B2,LMNB2,sp|Q03252|LMNB2_HUMAN Lamin-B2 OS=Homo sapiens OX=9606 GN=LMNB2 PE=1 SV=4,33,27,51.8,620
GBE1,-0.4354945846,0.0125805355547017,0,Q04446;E9PGM4,Q04446;E9PGM4,4;3,4;3,4;3,"1,4-alpha-glucan-branching enzyme",GBE1,"sp|Q04446|GLGB_HUMAN 1,4-alpha-glucan-branching enzyme OS=Homo sapiens OX=9606 GN=GBE1 PE=1 SV=3;tr|E9PGM4|E9PGM4_HUMAN 1,4-alpha-glucan-branching enzyme OS=Homo sapiens OX=9606 GN=GBE1 PE=1 SV=1",4,4,8.1,702
GLO1,-0.0759778764,0.587751679322831,0,Q04760,Q04760,8,8,8,Lactoylglutathione lyase,GLO1,sp|Q04760|LGUL_HUMAN Lactoylglutathione lyase OS=Homo sapiens OX=9606 GN=GLO1 PE=1 SV=4,8,8,40.8,184
SSBP1,-0.0733493227,0.726034970902601,0,Q04837;A0A0G2JLD8;E7EUY5;C9K0U8,Q04837;A0A0G2JLD8;E7EUY5;C9K0U8,11;9;9;7,11;9;9;7,11;9;9;7,"Single-stranded DNA-binding protein, mitochondrial",SSBP1,"sp|Q04837|SSBP_HUMAN Single-stranded DNA-binding protein, mitochondrial OS=Homo sapiens OX=9606 GN=SSBP1 PE=1 SV=1;tr|A0A0G2JLD8|A0A0G2JLD8_HUMAN Single-stranded DNA-binding protein, mitochondrial (Fragment) OS=Homo sapiens OX=9606 GN=SSBP1 PE=1 SV=1;tr|E7",11,11,62.8,148
YWHAH,0.2687947907,0.0899126842478932,0,Q04917;A2IDB2;F8WEB6;A2IDB1,Q04917;A2IDB2,14;7;3;3,9;3;3;3,9;3;3;3,14-3-3 protein eta,YWHAH,sp|Q04917|1433F_HUMAN 14-3-3 protein eta OS=Homo sapiens OX=9606 GN=YWHAH PE=1 SV=4;tr|A2IDB2|A2IDB2_HUMAN 14-3-3 protein eta (Fragment) OS=Homo sapiens OX=9606 GN=YWHAH PE=1 SV=1,14,9,48,246
CSTF1,-0.8731608699,0.00607930323703892,0,Q05048;A0A0A0MSZ9;A3KFI9,Q05048;A0A0A0MSZ9,8;6;1,8;6;1,8;6;1,Cleavage stimulation factor subunit 1,CSTF1,sp|Q05048|CSTF1_HUMAN Cleavage stimulation factor subunit 1 OS=Homo sapiens OX=9606 GN=CSTF1 PE=1 SV=1;tr|A0A0A0MSZ9|A0A0A0MSZ9_HUMAN Cleavage stimulation factor subunit 1 (Fragment) OS=Homo sapiens OX=9606 GN=CSTF1 PE=1 SV=1,8,8,29.2,431
SRSF11,-0.0178715761,0.907658129653079,0,Q05519;Q5T760;B4DWT1;S4R3C4;Q5T757,Q05519;Q5T760;B4DWT1,4;4;2;1;1,4;4;2;1;1,4;4;2;1;1,Serine/arginine-rich splicing factor 11,SRSF11,sp|Q05519|SRS11_HUMAN Serine/arginine-rich splicing factor 11 OS=Homo sapiens OX=9606 GN=SRSF11 PE=1 SV=1;tr|Q5T760|Q5T760_HUMAN Serine/arginine-rich-splicing factor 11 (Fragment) OS=Homo sapiens OX=9606 GN=SRSF11 PE=1 SV=1;tr|B4DWT1|B4DWT1_HUMAN Serine/ar,4,4,12.4,484
PPAT,0.2704597345,0.062799487727251,0,Q06203;D6RCC8;D6RE15,Q06203,15;6;1,15;6;1,15;6;1,Amidophosphoribosyltransferase,PPAT,sp|Q06203|PUR1_HUMAN Amidophosphoribosyltransferase OS=Homo sapiens OX=9606 GN=PPAT PE=1 SV=1,15,15,36.6,517
GFPT1,0.0786700214,0.549542138767776,0,Q06210;O94808;E5RJP4,Q06210,18;5;2,18;5;2,18;5;2,Glutamine--fructose-6-phosphate aminotransferase [isomerizing] 1,GFPT1,sp|Q06210|GFPT1_HUMAN Glutamine--fructose-6-phosphate aminotransferase [isomerizing] 1 OS=Homo sapiens OX=9606 GN=GFPT1 PE=1 SV=3,18,18,31.8,699
PSME1,-0.4380213359,0.0241542550077625,0,Q06323;H0YKK6;H0YLU2,Q06323;H0YKK6,12;6;4,12;6;4,12;6;4,Proteasome activator complex subunit 1,PSME1,sp|Q06323|PSME1_HUMAN Proteasome activator complex subunit 1 OS=Homo sapiens OX=9606 GN=PSME1 PE=1 SV=1;tr|H0YKK6|H0YKK6_HUMAN Proteasome activator complex subunit 1 OS=Homo sapiens OX=9606 GN=PSME1 PE=1 SV=1,12,12,43.8,249
RING1,-0.079757233,0.641808993313573,0,Q06587,Q06587,2,2,1,E3 ubiquitin-protein ligase RING1,RING1,sp|Q06587|RING1_HUMAN E3 ubiquitin-protein ligase RING1 OS=Homo sapiens OX=9606 GN=RING1 PE=1 SV=2,2,1,6.9,406
PRDX1,0.0996856353,0.438726717760125,0,Q06830;A0A0A0MSI0;A0A0A0MRQ5,Q06830;A0A0A0MSI0,29;28;8,29;28;8,26;25;5,Peroxiredoxin-1,PRDX1,sp|Q06830|PRDX1_HUMAN Peroxiredoxin-1 OS=Homo sapiens OX=9606 GN=PRDX1 PE=1 SV=1;tr|A0A0A0MSI0|A0A0A0MSI0_HUMAN Peroxiredoxin-1 (Fragment) OS=Homo sapiens OX=9606 GN=PRDX1 PE=1 SV=1,29,26,91.5,199
C1QBP,0.3146206545,0.040562321597073,0,Q07021;I3L3Q7;I3L3B0,Q07021;I3L3Q7;I3L3B0,6;5;5,6;5;5,6;5;5,"Complement component 1 Q subcomponent-binding protein, mitochondrial",C1QBP,"sp|Q07021|C1QBP_HUMAN Complement component 1 Q subcomponent-binding protein, mitochondrial OS=Homo sapiens OX=9606 GN=C1QBP PE=1 SV=1;tr|I3L3Q7|I3L3Q7_HUMAN Complement component 1 Q subcomponent-binding protein, mitochondrial (Fragment) OS=Homo sapiens OX=",6,6,33.7,282
CKAP4,0.0225502039,0.884260041691265,0,Q07065,Q07065,22,22,22,Cytoskeleton-associated protein 4,CKAP4,sp|Q07065|CKAP4_HUMAN Cytoskeleton-associated protein 4 OS=Homo sapiens OX=9606 GN=CKAP4 PE=1 SV=2,22,22,49.2,602
KHDRBS1,-0.0580327051,0.65369958412751,0,Q07666,Q07666,15,15,13,"KH domain-containing, RNA-binding, signal transduction-associated protein 1",KHDRBS1,"sp|Q07666|KHDR1_HUMAN KH domain-containing, RNA-binding, signal transduction-associated protein 1 OS=Homo sapiens OX=9606 GN=KHDRBS1 PE=1 SV=1",15,13,28,443
BAX,-0.4574577971,0.110169536605798,0,Q07812;K4JQN1,Q07812;K4JQN1,2;1,2;1,2;1,Apoptosis regulator BAX,BAX,sp|Q07812|BAX_HUMAN Apoptosis regulator BAX OS=Homo sapiens OX=9606 GN=BAX PE=1 SV=1;tr|K4JQN1|K4JQN1_HUMAN Apoptosis regulator BAX OS=Homo sapiens OX=9606 GN=BAX PE=1 SV=1,2,2,13.5,192
ARHGAP1,-0.306574319,0.190873780378832,0,Q07960;H0YE29;E9PNR6,Q07960;H0YE29,9;7;3,9;7;3,9;7;3,Rho GTPase-activating protein 1,ARHGAP1,sp|Q07960|RHG01_HUMAN Rho GTPase-activating protein 1 OS=Homo sapiens OX=9606 GN=ARHGAP1 PE=1 SV=1;tr|H0YE29|H0YE29_HUMAN Rho GTPase-activating protein 1 (Fragment) OS=Homo sapiens OX=9606 GN=ARHGAP1 PE=1 SV=1,9,9,29.2,439
PPP3CA,0.3975013698,0.022415712593344,0,Q08209;E7ETC2;E9PPC8;E9PK68;P48454;H0YC26,Q08209;E7ETC2;E9PPC8;E9PK68,6;4;3;3;2;2,6;4;3;3;2;2,3;1;2;2;0;0,Serine/threonine-protein phosphatase 2B catalytic subunit alpha isoform;Serine/threonine-protein phosphatase,PPP3CA,sp|Q08209|PP2BA_HUMAN Serine/threonine-protein phosphatase 2B catalytic subunit alpha isoform OS=Homo sapiens OX=9606 GN=PPP3CA PE=1 SV=1;tr|E7ETC2|E7ETC2_HUMAN Serine/threonine-protein phosphatase OS=Homo sapiens OX=9606 GN=PPP3CA PE=1 SV=1;tr|E9PPC8|E9PP,6,3,10.7,521
DHX9,-0.0939040521,0.485002425447355,0,Q08211,Q08211,65,65,65,ATP-dependent RNA helicase A,DHX9,sp|Q08211|DHX9_HUMAN ATP-dependent RNA helicase A OS=Homo sapiens OX=9606 GN=DHX9 PE=1 SV=4,65,65,49.4,1270
LGALS3BP,0.2000771126,0.436396730158319,0,Q08380,Q08380,5,5,5,Galectin-3-binding protein,LGALS3BP,sp|Q08380|LG3BP_HUMAN Galectin-3-binding protein OS=Homo sapiens OX=9606 GN=LGALS3BP PE=1 SV=1,5,5,12.8,585
PPID,-0.1285809119,0.397347240811026,0,Q08752,Q08752,5,5,5,Peptidyl-prolyl cis-trans isomerase D,PPID,sp|Q08752|PPID_HUMAN Peptidyl-prolyl cis-trans isomerase D OS=Homo sapiens OX=9606 GN=PPID PE=1 SV=3,5,5,16.8,370
SSRP1,-0.2835121273,0.0723754199480387,0,Q08945;E9PMD4;A0A0U1RRK2,Q08945,23;7;4,23;7;4,23;7;4,FACT complex subunit SSRP1,SSRP1,sp|Q08945|SSRP1_HUMAN FACT complex subunit SSRP1 OS=Homo sapiens OX=9606 GN=SSRP1 PE=1 SV=1,23,23,34.4,709
NSUN2,0.4606907675,0.0353468632984941,0,Q08J23;A0A140T9Y7,Q08J23,16;1,16;1,16;1,tRNA (cytosine(34)-C(5))-methyltransferase,NSUN2,sp|Q08J23|NSUN2_HUMAN RNA cytosine C(5)-methyltransferase NSUN2 OS=Homo sapiens OX=9606 GN=NSUN2 PE=1 SV=2,16,16,24.9,767
RBBP4,-0.320441495,0.0522941475427083,0,Q09028;H0YCT5;H0YF10;H0YDK2;H0YEU5;E9PNS6;E9PNS2;E9PIC4,Q09028;H0YCT5;H0YF10;H0YDK2,13;7;7;7;5;2;1;1,13;7;7;7;5;2;1;1,9;3;3;3;2;2;1;1,Histone-binding protein RBBP4,RBBP4,sp|Q09028|RBBP4_HUMAN Histone-binding protein RBBP4 OS=Homo sapiens OX=9606 GN=RBBP4 PE=1 SV=3;tr|H0YCT5|H0YCT5_HUMAN Histone-binding protein RBBP4 (Fragment) OS=Homo sapiens OX=9606 GN=RBBP4 PE=1 SV=1;tr|H0YF10|H0YF10_HUMAN Histone-binding protein RBBP4 (,13,9,64.2,425
AHNAK,-0.0832270956,0.81092379593859,0,Q09666;E9PLK4;E9PJZ0;E9PKR9;E9PJC6;E9PQE3,Q09666,234;6;5;5;5;4,234;6;5;5;5;4,234;6;5;5;5;4,Neuroblast differentiation-associated protein AHNAK,AHNAK,sp|Q09666|AHNK_HUMAN Neuroblast differentiation-associated protein AHNAK OS=Homo sapiens OX=9606 GN=AHNAK PE=1 SV=2,234,234,66.1,5890
AP1B1,-0.0105365093,0.934136012898114,0,Q10567;C9J1E7;K7EJX1,Q10567;C9J1E7,12;6;1,8;3;0,8;3;0,AP-1 complex subunit beta-1,AP1B1,sp|Q10567|AP1B1_HUMAN AP-1 complex subunit beta-1 OS=Homo sapiens OX=9606 GN=AP1B1 PE=1 SV=2;tr|C9J1E7|C9J1E7_HUMAN AP-1 complex subunit beta-1 (Fragment) OS=Homo sapiens OX=9606 GN=AP1B1 PE=1 SV=1,12,8,13.6,949
CPSF1,-0.5774131382,0.272653481914287,0,Q10570;A0A087X101;E9PIM1;A0A087WTV4,Q10570,14;3;1;1,14;3;1;1,14;3;1;1,Cleavage and polyadenylation specificity factor subunit 1,CPSF1,sp|Q10570|CPSF1_HUMAN Cleavage and polyadenylation specificity factor subunit 1 OS=Homo sapiens OX=9606 GN=CPSF1 PE=1 SV=2,14,14,13.3,1443
PMPCA,0.1581367736,0.469720256198178,0,Q10713;Q5SXN9,Q10713,15;4,15;4,15;4,Mitochondrial-processing peptidase subunit alpha,PMPCA,sp|Q10713|MPPA_HUMAN Mitochondrial-processing peptidase subunit alpha OS=Homo sapiens OX=9606 GN=PMPCA PE=1 SV=2,15,15,38.3,525
SCRN1,0.0254488957,0.877444373179216,0,Q12765;B8ZZP4;C9J7U9;C9K052,Q12765,4;1;1;1,4;1;1;1,4;1;1;1,Secernin-1,SCRN1,sp|Q12765|SCRN1_HUMAN Secernin-1 OS=Homo sapiens OX=9606 GN=SCRN1 PE=1 SV=2,4,4,11.8,414
TWF1,0.1026040212,0.644753150237934,0,Q12792;F8VS81;F8VRG3,Q12792;F8VS81,6;4;1,5;3;1,5;3;1,Twinfilin-1,TWF1,sp|Q12792|TWF1_HUMAN Twinfilin-1 OS=Homo sapiens OX=9606 GN=TWF1 PE=1 SV=3;tr|F8VS81|F8VS81_HUMAN Twinfilin-1 (Fragment) OS=Homo sapiens OX=9606 GN=TWF1 PE=1 SV=1,6,5,22,350
SF3A3,0.1393042814,0.325803633976407,0,Q12874,Q12874,17,17,17,Splicing factor 3A subunit 3,SF3A3,sp|Q12874|SF3A3_HUMAN Splicing factor 3A subunit 3 OS=Homo sapiens OX=9606 GN=SF3A3 PE=1 SV=1,17,17,44.5,501
AIMP1,-0.0805761926,0.522451951430232,0,Q12904;A0A5F9ZHC5;D6R937,Q12904;A0A5F9ZHC5,13;11;4,13;11;4,13;11;4,Aminoacyl tRNA synthase complex-interacting multifunctional protein 1;Endothelial monocyte-activating polypeptide 2,AIMP1,sp|Q12904|AIMP1_HUMAN Aminoacyl tRNA synthase complex-interacting multifunctional protein 1 OS=Homo sapiens OX=9606 GN=AIMP1 PE=1 SV=2;tr|A0A5F9ZHC5|A0A5F9ZHC5_HUMAN Aminoacyl tRNA synthase complex-interacting multifunctional protein 1 OS=Homo sapiens OX=9,13,13,60.3,312
ILF2,-0.0306202526,0.805251733523092,0,Q12905;B4DY09;X6R6Z1;A0A0A0MRL0,Q12905;B4DY09;X6R6Z1;A0A0A0MRL0,16;15;8;8,16;15;8;8,16;15;8;8,Interleukin enhancer-binding factor 2,ILF2,sp|Q12905|ILF2_HUMAN Interleukin enhancer-binding factor 2 OS=Homo sapiens OX=9606 GN=ILF2 PE=1 SV=2;tr|B4DY09|B4DY09_HUMAN Interleukin enhancer-binding factor 2 OS=Homo sapiens OX=9606 GN=ILF2 PE=1 SV=1;tr|X6R6Z1|X6R6Z1_HUMAN Interleukin enhancer-binding ,16,16,58.7,390
ILF3,-0.0907164842,0.487395819589221,0,Q12906;K7EKJ9;K7EQR9;K7EKY0;K7ER69;K7EJ09;K7EPG3;K7ERM6;K7ENK6;K7EM82;K7ELV3,Q12906,37;12;10;6;5;4;3;2;2;2;2,37;12;10;6;5;4;3;2;2;2;2,34;12;10;6;5;4;3;2;2;2;2,Interleukin enhancer-binding factor 3,ILF3,sp|Q12906|ILF3_HUMAN Interleukin enhancer-binding factor 3 OS=Homo sapiens OX=9606 GN=ILF3 PE=1 SV=3,37,34,44.7,894
