CRBN_vs_zBirA,Unnamed: 1,Unnamed: 2,Unnamed: 3,Unnamed: 4,Unnamed: 5,Unnamed: 6,Unnamed: 7,Unnamed: 8,Unnamed: 9,Unnamed: 10,Unnamed: 11,Unnamed: 12,Unnamed: 13,Unnamed: 14,Unnamed: 15
,,,,,,,,,,,,,,,
Gene_names,logFC (CRBN_vs_zBirA),P_Value (CRBN_vs_zBirA),isDifferential (CRBN_vs_zBirA),Protein_IDs,Majority_protein_IDs,Peptide_counts__all_,Peptide_counts__razor_unique_,Peptide_counts__unique_,Protein_names,Gene_names,Fasta_headers,Peptides,Unique_peptides,Sequence_coverage____,Sequence_length
SERPINB6,-0.5887016567,0.00539834553665816,0,A0A024QZX5;A0A087X1N8;P35237;A0A2R8Y6A7;A0A2R8YD12,A0A024QZX5;A0A087X1N8;P35237;A0A2R8Y6A7;A0A2R8YD12,2;2;1;1;1,2;2;1;1;1,2;2;1;1;1,Serpin B6,SERPINB6,tr|A0A024QZX5|A0A024QZX5_HUMAN Serpin B6 OS=Homo sapiens OX=9606 GN=SERPINB6 PE=1 SV=1;tr|A0A087X1N8|A0A087X1N8_HUMAN Serpin B6 OS=Homo sapiens OX=9606 GN=SERPINB6 PE=1 SV=1;sp|P35237|SPB6_HUMAN Serpin B6 OS=Homo sapiens OX=9606 GN=SERPINB6 PE=1 SV=3;tr|A0,2,2,8.9,380
HDLBP,-0.4276892916,0.0238385795671386,0,Q00341;A0A024R4E5;H0Y394;H7C0A4;C9JIZ1;C9J5E5;C9JZI8;C9JK79;C9JES8;C9JHZ8;C9JHS7;C9JT62;C9JHN6;C9JEJ8;C9JBS3;C9JQ82;C9JMQ6;C9J739;H7BZC3;H7C2D1;C9JHS9,Q00341;A0A024R4E5;H0Y394,11;11;8;5;5;4;4;3;3;3;3;3;2;2;2;2;2;1;1;1;1,11;11;8;5;5;4;4;3;3;3;3;3;2;2;2;2;2;1;1;1;1,11;11;8;5;5;4;4;3;3;3;3;3;2;2;2;2;2;1;1;1;1,Vigilin,HDLBP,"sp|Q00341|VIGLN_HUMAN Vigilin OS=Homo sapiens OX=9606 GN=HDLBP PE=1 SV=2;tr|A0A024R4E5|A0A024R4E5_HUMAN High density lipoprotein binding protein (Vigilin), isoform CRA_a OS=Homo sapiens OX=9606 GN=HDLBP PE=1 SV=1;tr|H0Y394|H0Y394_HUMAN Vigilin (Fragment) O",11,11,13.5,1268
PSMA2,-0.1326899575,0.302926093916402,0,P25787;A0A024RA52;C9JCK5;H3BT36;H7C402,P25787;A0A024RA52;C9JCK5,13;13;7;3;1,13;13;7;3;1,13;13;7;3;1,Proteasome subunit alpha type-2;Proteasome subunit alpha type,PSMA2,sp|P25787|PSA2_HUMAN Proteasome subunit alpha type-2 OS=Homo sapiens OX=9606 GN=PSMA2 PE=1 SV=2;tr|A0A024RA52|A0A024RA52_HUMAN Proteasome subunit alpha type OS=Homo sapiens OX=9606 GN=PSMA2 PE=1 SV=1;tr|C9JCK5|C9JCK5_HUMAN Proteasome endopeptidase complex ,13,13,56.8,234
BAG6;BAT3,0.2219260758,0.201321645822515,0,P46379;A0A0G2JK23;A0A024RCR6;A0A0G2JL47;A0A0G2JJM1;X6REW1;F6S6P2;F6X9W3;F6U341;F6VEM6;F6UR09;F6WML8;A0A1B0GX79;A0A0G2JJR8;F6XTU0;F6U1F2;H0Y710;H0Y4L1,P46379;A0A0G2JK23;A0A024RCR6;A0A0G2JL47;A0A0G2JJM1;X6REW1;F6S6P2,7;7;7;7;4;4;4;2;2;2;2;2;2;2;2;2;1;1,7;7;7;7;4;4;4;2;2;2;2;2;2;2;2;2;1;1,7;7;7;7;4;4;4;2;2;2;2;2;2;2;2;2;1;1,Large proline-rich protein BAG6,BAG6;BAT3,sp|P46379|BAG6_HUMAN Large proline-rich protein BAG6 OS=Homo sapiens OX=9606 GN=BAG6 PE=1 SV=2;tr|A0A0G2JK23|A0A0G2JK23_HUMAN Large proline-rich protein BAG6 OS=Homo sapiens OX=9606 GN=BAG6 PE=1 SV=1;tr|A0A024RCR6|A0A024RCR6_HUMAN BAG6 OS=Homo sapiens OX=9,7,7,8.7,1132
TAF15,-0.0690946275,0.631990999001991,0,Q92804;A0A075B7D9;A0A075B7F4,Q92804;A0A075B7D9,7;7;1,4;4;1,4;4;1,TATA-binding protein-associated factor 2N,TAF15,sp|Q92804|RBP56_HUMAN TATA-binding protein-associated factor 2N OS=Homo sapiens OX=9606 GN=TAF15 PE=1 SV=1;tr|A0A075B7D9|A0A075B7D9_HUMAN TATA-binding protein-associated factor 2N OS=Homo sapiens OX=9606 GN=TAF15 PE=1 SV=1,7,4,17.7,592
TXNRD1,0.3469309714,0.123308771079959,0,Q16881;A0A087WSY9;A0A087WSW9;A0A182DWI3;E9PIR7;F8W809;E2QRB9;E9PKD3;A0A0B4J225;E9PIZ5;E9PLT3;E9PKI4;E9PQI3;D3YTF8;A0A182DWF3;E9PRI8;A0A182DWF2;Q9NNW7;E7EWK1;A0A096LPD9;A0A096LPK7,Q16881;A0A087WSY9;A0A087WSW9;A0A182DWI3;E9PIR7;F8W809;E2QRB9;E9PKD3,19;19;19;18;18;18;15;11;6;6;4;4;3;1;1;1;1;1;1;1;1,19;19;19;18;18;18;15;11;6;6;4;4;3;1;1;1;1;1;1;1;1,19;19;19;18;18;18;15;11;6;6;4;4;3;1;1;1;1;1;1;1;1,"Thioredoxin reductase 1, cytoplasmic",TXNRD1,"sp|Q16881|TRXR1_HUMAN Thioredoxin reductase 1, cytoplasmic OS=Homo sapiens OX=9606 GN=TXNRD1 PE=1 SV=3;tr|A0A087WSY9|A0A087WSY9_HUMAN Thioredoxin reductase 1, cytoplasmic OS=Homo sapiens OX=9606 GN=TXNRD1 PE=1 SV=2;tr|A0A087WSW9|A0A087WSW9_HUMAN Thioredoxi",19,19,41.6,649
HMOX2,0.000462064,0.997387716579193,0,P30519;A0A087WT44;I3L159;I3L1F5;I3L4P8;A0A1B0GXH0;I3L463;I3L276;I3L1Y2,P30519;A0A087WT44;I3L159;I3L1F5;I3L4P8;A0A1B0GXH0;I3L463,12;12;10;10;6;6;6;5;3,12;12;10;10;6;6;6;5;3,12;12;10;10;6;6;6;5;3,Heme oxygenase 2,HMOX2,sp|P30519|HMOX2_HUMAN Heme oxygenase 2 OS=Homo sapiens OX=9606 GN=HMOX2 PE=1 SV=2;tr|A0A087WT44|A0A087WT44_HUMAN Heme oxygenase 2 OS=Homo sapiens OX=9606 GN=HMOX2 PE=1 SV=1;tr|I3L159|I3L159_HUMAN Heme oxygenase 2 (Fragment) OS=Homo sapiens OX=9606 GN=HMOX2,12,12,56,316
EIF2B4,-0.9885566872,0.137184081340407,0,Q9UI10;A0A087WTA5;E7ERK9;H7C2L8;A0A087WW69;F8W8L6,Q9UI10;A0A087WTA5;E7ERK9,8;8;8;3;3;1,8;8;8;3;3;1,8;8;8;3;3;1,Translation initiation factor eIF-2B subunit delta,EIF2B4,sp|Q9UI10|EI2BD_HUMAN Translation initiation factor eIF-2B subunit delta OS=Homo sapiens OX=9606 GN=EIF2B4 PE=1 SV=2;tr|A0A087WTA5|A0A087WTA5_HUMAN Translation initiation factor eIF-2B subunit delta OS=Homo sapiens OX=9606 GN=EIF2B4 PE=1 SV=1;tr|E7ERK9|E7E,8,8,25.4,523
NDUFS7,0.1142965461,0.445448993084829,0,O75251;F5H5N1;A0A087WXF6;A0A087WTI3;F5GXJ1,O75251;F5H5N1;A0A087WXF6;A0A087WTI3;F5GXJ1,3;3;3;3;3,3;3;3;3;3,3;3;3;3;3,"NADH dehydrogenase [ubiquinone] iron-sulfur protein 7, mitochondrial",NDUFS7,"sp|O75251|NDUS7_HUMAN NADH dehydrogenase [ubiquinone] iron-sulfur protein 7, mitochondrial OS=Homo sapiens OX=9606 GN=NDUFS7 PE=1 SV=3;tr|F5H5N1|F5H5N1_HUMAN NADH dehydrogenase [ubiquinone] iron-sulfur protein 7, mitochondrial OS=Homo sapiens OX=9606 GN=ND",3,3,16,213
KHSRP,-0.0797354508,0.539475323947088,0,Q92945;A0A087WTP3;M0R0I5;M0QYH3;M0QXW7;M0R3J3;M0QYG1;M0R0C6;M0R251;M0R263,Q92945;A0A087WTP3;M0R0I5,29;29;16;10;5;4;3;3;2;2,24;24;13;7;4;2;1;1;0;0,24;24;13;7;4;2;1;1;0;0,Far upstream element-binding protein 2,KHSRP,sp|Q92945|FUBP2_HUMAN Far upstream element-binding protein 2 OS=Homo sapiens OX=9606 GN=KHSRP PE=1 SV=4;tr|A0A087WTP3|A0A087WTP3_HUMAN Far upstream element-binding protein 2 OS=Homo sapiens OX=9606 GN=KHSRP PE=1 SV=1;tr|M0R0I5|M0R0I5_HUMAN Far upstream ele,29,24,46.1,711
HNRNPDL,-0.6490387742,0.00934222152914568,0,A0A087WU03,A0A087WU03,2,2,2,,HNRNPDL,tr|A0A087WU03|A0A087WU03_HUMAN Heterogeneous nuclear ribonucleoprotein D-like OS=Homo sapiens OX=9606 GN=HNRNPDL PE=1 SV=1,2,2,40.4,57
MRPL45,0.0642798002,0.878134731027901,0,Q9BRJ2;A0A0G2JMS5;A0A087WU62;A0A087X2D5,Q9BRJ2;A0A0G2JMS5;A0A087WU62;A0A087X2D5,5;5;5;5,5;5;5;5,5;5;5;5,"39S ribosomal protein L45, mitochondrial",MRPL45,"sp|Q9BRJ2|RM45_HUMAN 39S ribosomal protein L45, mitochondrial OS=Homo sapiens OX=9606 GN=MRPL45 PE=1 SV=2;tr|A0A0G2JMS5|A0A0G2JMS5_HUMAN 39S ribosomal protein L45, mitochondrial OS=Homo sapiens OX=9606 GN=MRPL45 PE=1 SV=1;tr|A0A087WU62|A0A087WU62_HUMAN 39S",5,5,21.2,306
POLA1,-0.0244398958,0.862655189584936,0,P09884;A0A087WU64;A6NMQ1,P09884;A0A087WU64;A6NMQ1,1;1;1,1;1;1,1;1;1,DNA polymerase alpha catalytic subunit;DNA polymerase,POLA1,sp|P09884|DPOLA_HUMAN DNA polymerase alpha catalytic subunit OS=Homo sapiens OX=9606 GN=POLA1 PE=1 SV=2;tr|A0A087WU64|A0A087WU64_HUMAN DNA polymerase OS=Homo sapiens OX=9606 GN=POLA1 PE=1 SV=1;tr|A6NMQ1|A6NMQ1_HUMAN DNA polymerase OS=Homo sapiens OX=9606 G,1,1,0.5,1462
CTNNBL1,-0.1960431339,0.164767527690264,0,Q8WYA6;A0A087WUB9;A2A2P1,Q8WYA6;A0A087WUB9,8;8;1,8;8;1,8;8;1,Beta-catenin-like protein 1,CTNNBL1,sp|Q8WYA6|CTBL1_HUMAN Beta-catenin-like protein 1 OS=Homo sapiens OX=9606 GN=CTNNBL1 PE=1 SV=1;tr|A0A087WUB9|A0A087WUB9_HUMAN Beta-catenin-like protein 1 OS=Homo sapiens OX=9606 GN=CTNNBL1 PE=1 SV=1,8,8,15.8,563
SPCS2,1.0949376345,0.0558405787199854,0,Q15005;E9PRB9;E9PL01;A0A087WUC6;E9PI68,Q15005;E9PRB9;E9PL01;A0A087WUC6;E9PI68,2;2;2;2;2,2;2;2;2;2,2;2;2;2;2,Signal peptidase complex subunit 2,SPCS2,sp|Q15005|SPCS2_HUMAN Signal peptidase complex subunit 2 OS=Homo sapiens OX=9606 GN=SPCS2 PE=1 SV=3;tr|E9PRB9|E9PRB9_HUMAN Signal peptidase complex subunit 2 OS=Homo sapiens OX=9606 GN=SPCS2 PE=1 SV=1;tr|E9PL01|E9PL01_HUMAN Signal peptidase complex subunit,2,2,11.5,226
HNRNPDL,-0.4615126959,0.0148761717922958,0,O14979;A0A087WUK2,O14979;A0A087WUK2,21;21,19;19,19;19,Heterogeneous nuclear ribonucleoprotein D-like,HNRNPDL,sp|O14979|HNRDL_HUMAN Heterogeneous nuclear ribonucleoprotein D-like OS=Homo sapiens OX=9606 GN=HNRNPDL PE=1 SV=3;tr|A0A087WUK2|A0A087WUK2_HUMAN Heterogeneous nuclear ribonucleoprotein D-like OS=Homo sapiens OX=9606 GN=HNRNPDL PE=1 SV=1,21,19,38.3,420
EIF5B,0.0355291999,0.832293985373393,0,O60841;A0A087WUT6,O60841;A0A087WUT6,15;15,15;15,15;15,Eukaryotic translation initiation factor 5B,EIF5B,sp|O60841|IF2P_HUMAN Eukaryotic translation initiation factor 5B OS=Homo sapiens OX=9606 GN=EIF5B PE=1 SV=4;tr|A0A087WUT6|A0A087WUT6_HUMAN Eukaryotic translation initiation factor 5B OS=Homo sapiens OX=9606 GN=EIF5B PE=1 SV=1,15,15,21.8,1220
MTHFD1L,-0.3242066676,0.0880278474046141,0,Q6UB35;A0A087WVM4;B7ZM99;H0Y327;Q5JYA8;Q5JYA3;Q4VXM1;Q4VXM0;Q4VXV2,Q6UB35;A0A087WVM4;B7ZM99,19;19;19;6;2;2;1;1;1,18;18;18;6;2;2;1;1;1,18;18;18;6;2;2;1;1;1,"Monofunctional C1-tetrahydrofolate synthase, mitochondrial",MTHFD1L,"sp|Q6UB35|C1TM_HUMAN Monofunctional C1-tetrahydrofolate synthase, mitochondrial OS=Homo sapiens OX=9606 GN=MTHFD1L PE=1 SV=1;tr|A0A087WVM4|A0A087WVM4_HUMAN Monofunctional C1-tetrahydrofolate synthase, mitochondrial OS=Homo sapiens OX=9606 GN=MTHFD1L PE=1 S",19,18,30.3,978
RRBP1,0.1624152422,0.234976666841746,0,Q9P2E9;A0A087WVV2;F8W7S5,Q9P2E9;A0A087WVV2;F8W7S5,21;21;20,21;21;20,14;14;13,Ribosome-binding protein 1,RRBP1,sp|Q9P2E9|RRBP1_HUMAN Ribosome-binding protein 1 OS=Homo sapiens OX=9606 GN=RRBP1 PE=1 SV=5;tr|A0A087WVV2|A0A087WVV2_HUMAN Ribosome-binding protein 1 OS=Homo sapiens OX=9606 GN=RRBP1 PE=1 SV=1;tr|F8W7S5|F8W7S5_HUMAN Ribosome-binding protein 1 OS=Homo sapie,21,14,19.7,1410
POLR2E,-0.5076200118,0.0745990584637144,0,P19388;A0A087WVZ9;A0A0A0MQR7;A0A087WVN5;A0A087WWX0,P19388;A0A087WVZ9;A0A0A0MQR7,3;3;3;1;1,3;3;3;1;1,3;3;3;1;1,"DNA-directed RNA polymerases I, II, and III subunit RPABC1",POLR2E,"sp|P19388|RPAB1_HUMAN DNA-directed RNA polymerases I, II, and III subunit RPABC1 OS=Homo sapiens OX=9606 GN=POLR2E PE=1 SV=4;tr|A0A087WVZ9|A0A087WVZ9_HUMAN DNA-directed RNA polymerases I, II, and III subunit RPABC1 OS=Homo sapiens OX=9606 GN=POLR2E PE=1 SV",3,3,27.6,210
POLD2,0.4237539643,0.274935398624527,0,P49005;F8W8R3;A0A087WWF6;C9IZD2;C9J8Z7;C9JLE1;C9JHC7;H7C1B3,P49005;F8W8R3;A0A087WWF6;C9IZD2;C9J8Z7;C9JLE1;C9JHC7,4;4;4;2;2;2;2;1,4;4;4;2;2;2;2;1,4;4;4;2;2;2;2;1,DNA polymerase delta subunit 2,POLD2,sp|P49005|DPOD2_HUMAN DNA polymerase delta subunit 2 OS=Homo sapiens OX=9606 GN=POLD2 PE=1 SV=1;tr|F8W8R3|F8W8R3_HUMAN DNA polymerase delta subunit 2 OS=Homo sapiens OX=9606 GN=POLD2 PE=1 SV=1;tr|A0A087WWF6|A0A087WWF6_HUMAN DNA polymerase delta subunit 2 O,4,4,10.7,469
TPM3,0.1260103453,0.318095503371668,0,A0A087WWU8;D6R904;A0A494C0G0;Q5VU61,A0A087WWU8;D6R904,34;19;11;8,34;19;11;8,12;12;4;8,,TPM3,tr|A0A087WWU8|A0A087WWU8_HUMAN Tropomyosin alpha-3 chain OS=Homo sapiens OX=9606 GN=TPM3 PE=1 SV=1;tr|D6R904|D6R904_HUMAN Tropomyosin alpha-3 chain OS=Homo sapiens OX=9606 GN=TPM3 PE=1 SV=1,34,12,82.8,227
TARDBP;TDP43,-0.3359562534,0.0361671358277858,0,Q13148;A0A087WX29;A0A087WYY0;A0A087X260;G3V162;B1AKP7;A0A0A0N0M3;K7EJM5;A0A087WXQ5;A0A087WV68;K7EN94;A0A1W2PNU8;A0A087WXV3;A0A087WX67;A0A087WW61;K7EL26;A0A087WZC9;A0A087WYE7;A0A0A0MSV7;K7EJ99;A0A087WTZ4,Q13148;A0A087WX29;A0A087WYY0;A0A087X260;G3V162;B1AKP7;A0A0A0N0M3;K7EJM5;A0A087WXQ5;A0A087WV68;K7EN94,12;12;10;10;10;10;8;8;7;7;7;5;4;3;3;2;2;2;2;2;2,12;12;10;10;10;10;8;8;7;7;7;5;4;3;3;2;2;2;2;2;2,12;12;10;10;10;10;8;8;7;7;7;5;4;3;3;2;2;2;2;2;2,TAR DNA-binding protein 43,TARDBP;TDP43,sp|Q13148|TADBP_HUMAN TAR DNA-binding protein 43 OS=Homo sapiens OX=9606 GN=TARDBP PE=1 SV=1;tr|A0A087WX29|A0A087WX29_HUMAN TAR DNA-binding protein 43 (Fragment) OS=Homo sapiens OX=9606 GN=TARDBP PE=1 SV=1;tr|A0A087WYY0|A0A087WYY0_HUMAN TAR DNA-binding pro,12,12,32.4,414
RPL17;RPL17-C18orf32,0.3356348326,0.10344844051695,0,P18621;A0A087WXM6;J3QQT2;J3KRX5;A0A0A6YYL6;J3QLC8;J3KRB3;A0A087WWH0;J3QS96;A0A0A0MRF8;A0A087WY81;J3KSJ0,P18621;A0A087WXM6;J3QQT2;J3KRX5;A0A0A6YYL6;J3QLC8;J3KRB3;A0A087WWH0;J3QS96;A0A0A0MRF8;A0A087WY81,21;21;21;21;21;18;17;17;17;17;12;5,21;21;21;21;21;18;17;17;17;17;12;5,21;21;21;21;21;18;17;17;17;17;12;5,60S ribosomal protein L17,RPL17;RPL17-C18orf32,sp|P18621|RL17_HUMAN 60S ribosomal protein L17 OS=Homo sapiens OX=9606 GN=RPL17 PE=1 SV=3;tr|A0A087WXM6|A0A087WXM6_HUMAN 60S ribosomal protein L17 (Fragment) OS=Homo sapiens OX=9606 GN=RPL17 PE=1 SV=1;tr|J3QQT2|J3QQT2_HUMAN 60S ribosomal protein L17 (Fragm,21,21,71.2,184
ITGB6,0.1655484954,0.285031172224501,0,P18564;A0A087WXP3;E9PEE8,P18564;A0A087WXP3;E9PEE8,1;1;1,1;1;1,1;1;1,Integrin beta-6;Integrin beta,ITGB6,sp|P18564|ITB6_HUMAN Integrin beta-6 OS=Homo sapiens OX=9606 GN=ITGB6 PE=1 SV=2;tr|A0A087WXP3|A0A087WXP3_HUMAN Integrin beta OS=Homo sapiens OX=9606 GN=ITGB6 PE=1 SV=1;tr|E9PEE8|E9PEE8_HUMAN Integrin beta OS=Homo sapiens OX=9606 GN=ITGB6 PE=1 SV=1,1,1,1.1,788
VTA1,0.2682302648,0.0822076544816645,0,Q9NP79;A0A087WY55,Q9NP79;A0A087WY55,4;4,4;4,2;2,Vacuolar protein sorting-associated protein VTA1 homolog,VTA1,"sp|Q9NP79|VTA1_HUMAN Vacuolar protein sorting-associated protein VTA1 homolog OS=Homo sapiens OX=9606 GN=VTA1 PE=1 SV=1;tr|A0A087WY55|A0A087WY55_HUMAN Chromosome 6 open reading frame 55, isoform CRA_b OS=Homo sapiens OX=9606 GN=VTA1 PE=1 SV=1",4,2,16,307
AP2M1,-0.431988697,0.189168460972766,0,Q96CW1;A0A087WY71;E9PFW3;H7C4C3;C9JJ47,Q96CW1;A0A087WY71;E9PFW3,4;4;4;1;1,4;4;4;1;1,4;4;4;1;1,AP-2 complex subunit mu,AP2M1,sp|Q96CW1|AP2M1_HUMAN AP-2 complex subunit mu OS=Homo sapiens OX=9606 GN=AP2M1 PE=1 SV=2;tr|A0A087WY71|A0A087WY71_HUMAN AP-2 complex subunit mu OS=Homo sapiens OX=9606 GN=AP2M1 PE=1 SV=1;tr|E9PFW3|E9PFW3_HUMAN AP-2 complex subunit mu OS=Homo sapiens OX=960,4,4,14.7,435
UBE2D3;UBE2D2,0.0930861274,0.760738298935451,0,P61077;P62837;D6RFM0;D6RAH7;H9KV45;A0A0A0MQU3;A0A087WY85;D6RAW0;D6RA11,P61077;P62837;D6RFM0;D6RAH7;H9KV45;A0A0A0MQU3;A0A087WY85;D6RAW0,3;3;3;3;3;3;3;2;1,3;3;3;3;3;3;3;2;1,2;2;2;2;2;2;2;1;0,Ubiquitin-conjugating enzyme E2 D3;Ubiquitin-conjugating enzyme E2 D2,UBE2D3;UBE2D2,sp|P61077|UB2D3_HUMAN Ubiquitin-conjugating enzyme E2 D3 OS=Homo sapiens OX=9606 GN=UBE2D3 PE=1 SV=1;sp|P62837|UB2D2_HUMAN Ubiquitin-conjugating enzyme E2 D2 OS=Homo sapiens OX=9606 GN=UBE2D2 PE=1 SV=1;tr|D6RFM0|D6RFM0_HUMAN Ubiquitin-conjugating enzyme E2,3,2,36.1,147
POLD1,0.2959816205,0.183593211706355,0,P28340;A0A087WYJ2;M0R2B7;M0QZR8;A0A2R8Y705;A0A2R8Y7K6;M0QXE6;M0QXQ2;M0R3H8,P28340;A0A087WYJ2;M0R2B7;M0QZR8;A0A2R8Y705;A0A2R8Y7K6,5;5;5;4;3;3;2;1;1,5;5;5;4;3;3;2;1;1,5;5;5;4;3;3;2;1;1,DNA polymerase delta catalytic subunit;DNA polymerase,POLD1,sp|P28340|DPOD1_HUMAN DNA polymerase delta catalytic subunit OS=Homo sapiens OX=9606 GN=POLD1 PE=1 SV=2;tr|A0A087WYJ2|A0A087WYJ2_HUMAN DNA polymerase OS=Homo sapiens OX=9606 GN=POLD1 PE=1 SV=1;tr|M0R2B7|M0R2B7_HUMAN DNA polymerase OS=Homo sapiens OX=9606 G,5,5,7.4,1107
UGP2,-0.2141597785,0.187977255319228,0,Q16851;A0A087WYS1;E7EUC7;C9JNZ1;C9JVG3;C9JQU9;C9JWG0;C9JTZ5;C9JUW1;F2Z3H1,Q16851;A0A087WYS1;E7EUC7;C9JNZ1,16;16;16;10;6;6;5;4;4;1,16;16;16;10;6;6;5;4;4;1,16;16;16;10;6;6;5;4;4;1,UTP--glucose-1-phosphate uridylyltransferase,UGP2,sp|Q16851|UGPA_HUMAN UTP--glucose-1-phosphate uridylyltransferase OS=Homo sapiens OX=9606 GN=UGP2 PE=1 SV=5;tr|A0A087WYS1|A0A087WYS1_HUMAN UTP--glucose-1-phosphate uridylyltransferase OS=Homo sapiens OX=9606 GN=UGP2 PE=1 SV=1;tr|E7EUC7|E7EUC7_HUMAN UTP--gl,16,16,36,508
EIF3H,-0.4251659475,0.0219535742952514,0,O15372;A0A087WZK9;B3KS98;E5RGU4;E5RFH0,O15372;A0A087WZK9;B3KS98,8;8;8;2;1,8;8;8;2;1,3;3;3;0;0,Eukaryotic translation initiation factor 3 subunit H,EIF3H,sp|O15372|EIF3H_HUMAN Eukaryotic translation initiation factor 3 subunit H OS=Homo sapiens OX=9606 GN=EIF3H PE=1 SV=1;tr|A0A087WZK9|A0A087WZK9_HUMAN Eukaryotic translation initiation factor 3 subunit H OS=Homo sapiens OX=9606 GN=EIF3H PE=1 SV=1;tr|B3KS98|B,8,3,37.5,352
OGFR,-0.1011733409,0.643006995179353,0,Q9NZT2;A0A087X028;A0A0A0MRN5,Q9NZT2;A0A087X028;A0A0A0MRN5,4;4;4,4;4;4,4;4;4,Opioid growth factor receptor,OGFR,sp|Q9NZT2|OGFR_HUMAN Opioid growth factor receptor OS=Homo sapiens OX=9606 GN=OGFR PE=1 SV=3;tr|A0A087X028|A0A087X028_HUMAN Opioid growth factor receptor OS=Homo sapiens OX=9606 GN=OGFR PE=1 SV=1;tr|A0A0A0MRN5|A0A0A0MRN5_HUMAN Opioid growth factor receptor,4,4,7.2,677
HYOU1,-0.1306811199,0.42905075241071,0,Q9Y4L1;A0A087X054;A0A494C039;E9PJ21;A0A087WWI4;K7EQK2;J3KTF1;J3QL06;Q9BST8;J3QQH7;J3QLE9;A0A087WW13;A0A087X214;Q9BXT5;A0A2R8Y358;A0A1W2PS94,Q9Y4L1;A0A087X054;A0A494C039;E9PJ21;A0A087WWI4;K7EQK2,31;31;31;21;21;21;8;7;6;6;6;4;3;1;1;1,31;31;31;21;21;21;8;7;6;6;6;4;3;1;1;1,31;31;31;21;21;21;8;7;6;6;6;4;3;1;1;1,Hypoxia up-regulated protein 1,HYOU1,sp|Q9Y4L1|HYOU1_HUMAN Hypoxia up-regulated protein 1 OS=Homo sapiens OX=9606 GN=HYOU1 PE=1 SV=1;tr|A0A087X054|A0A087X054_HUMAN Hypoxia up-regulated protein 1 OS=Homo sapiens OX=9606 GN=HYOU1 PE=1 SV=1;tr|A0A494C039|A0A494C039_HUMAN Hypoxia up-regulated pro,31,31,37.7,999
SLC4A1AP,-0.5583119966,0.0161455618767957,0,Q9BWU0;A0A087X0M4;A0A087WWF4,Q9BWU0;A0A087X0M4;A0A087WWF4,2;2;1,2;2;1,2;2;1,Kanadaptin,SLC4A1AP,sp|Q9BWU0|NADAP_HUMAN Kanadaptin OS=Homo sapiens OX=9606 GN=SLC4A1AP PE=1 SV=1;tr|A0A087X0M4|A0A087X0M4_HUMAN Kanadaptin OS=Homo sapiens OX=9606 GN=SLC4A1AP PE=1 SV=1;tr|A0A087WWF4|A0A087WWF4_HUMAN Kanadaptin (Fragment) OS=Homo sapiens OX=9606 GN=SLC4A1AP ,2,2,2.6,796
ACOT2;ACOT1,-0.2682749616,0.291822414249763,0,A0A087X0W7;P49753;Q86TX2;A0A087WT95;G3V4F2;A0A2R8Y7H3,A0A087X0W7;P49753;Q86TX2;A0A087WT95;G3V4F2,17;16;16;16;14;2,17;16;16;16;14;2,17;16;16;16;14;2,"Acyl-coenzyme A thioesterase 2, mitochondrial;Acyl-coenzyme A thioesterase 1",ACOT2;ACOT1,"tr|A0A087X0W7|A0A087X0W7_HUMAN Acyl-coenzyme A thioesterase 2, mitochondrial OS=Homo sapiens OX=9606 GN=ACOT2 PE=1 SV=1;sp|P49753|ACOT2_HUMAN Acyl-coenzyme A thioesterase 2, mitochondrial OS=Homo sapiens OX=9606 GN=ACOT2 PE=1 SV=6;sp|Q86TX2|ACOT1_HUMAN Acy",17,17,62.9,421
SEPT8,-0.101161139,0.64640856718503,0,Q92599;A0A087X142;A6NMH6;A6NFQ9;F8W8I8;C9JV02;A0A0A0MRP8;C9J4G8,Q92599;A0A087X142;A6NMH6;A6NFQ9;F8W8I8,9;9;9;9;9;3;1;1,5;5;5;5;5;1;1;1,5;5;5;5;5;1;1;1,Septin-8,SEPT8,sp|Q92599|SEPT8_HUMAN Septin-8 OS=Homo sapiens OX=9606 GN=SEPTIN8 PE=1 SV=4;tr|A0A087X142|A0A087X142_HUMAN Septin-8 OS=Homo sapiens OX=9606 GN=SEPTIN8 PE=1 SV=1;tr|A6NMH6|A6NMH6_HUMAN Septin-8 OS=Homo sapiens OX=9606 GN=SEPTIN8 PE=1 SV=1;tr|A6NFQ9|A6NFQ9_H,9,5,30.4,483
RAB18,0.0647789601,0.76206271112034,0,Q9NP72;A0A087X163;Q5W0J0;H0Y6T8,Q9NP72;A0A087X163;Q5W0J0;H0Y6T8,6;6;4;3,6;6;4;3,6;6;4;3,Ras-related protein Rab-18,RAB18,sp|Q9NP72|RAB18_HUMAN Ras-related protein Rab-18 OS=Homo sapiens OX=9606 GN=RAB18 PE=1 SV=1;tr|A0A087X163|A0A087X163_HUMAN Ras-related protein Rab-18 OS=Homo sapiens OX=9606 GN=RAB18 PE=1 SV=1;tr|Q5W0J0|Q5W0J0_HUMAN Ras-related protein Rab-18 OS=Homo sapie,6,6,33.5,206
PSME2,-0.4363364648,0.019197928955366,0,Q9UL46;A0A087X1Z3;H0YM70;H0YKU2,Q9UL46;A0A087X1Z3;H0YM70,9;9;7;1,9;9;7;1,9;9;7;1,Proteasome activator complex subunit 2,PSME2,sp|Q9UL46|PSME2_HUMAN Proteasome activator complex subunit 2 OS=Homo sapiens OX=9606 GN=PSME2 PE=1 SV=4;tr|A0A087X1Z3|A0A087X1Z3_HUMAN Proteasome activator complex subunit 2 OS=Homo sapiens OX=9606 GN=PSME2 PE=1 SV=1;tr|H0YM70|H0YM70_HUMAN Proteasome activ,9,9,50.6,239
BSG,-0.1831196356,0.340006223899935,0,P35613;A0A087X2B5;A0A087WUV8;I3L192;R4GMX5;R4GN83;A0A2R8YDZ0,P35613;A0A087X2B5;A0A087WUV8;I3L192;R4GMX5,6;6;5;4;3;2;1,6;6;5;4;3;2;1,6;6;5;4;3;2;1,Basigin,BSG,sp|P35613|BASI_HUMAN Basigin OS=Homo sapiens OX=9606 GN=BSG PE=1 SV=2;tr|A0A087X2B5|A0A087X2B5_HUMAN Basigin (Fragment) OS=Homo sapiens OX=9606 GN=BSG PE=1 SV=1;tr|A0A087WUV8|A0A087WUV8_HUMAN Basigin OS=Homo sapiens OX=9606 GN=BSG PE=1 SV=1;tr|I3L192|I3L19,6,6,21,385
GPS1,-0.4571261285,0.0600681113281583,0,Q13098;C9JFE4;A0A096LP07;A0A096LPJ3;A8K070;J3QS84;J3QS88;J3KTB0;J3QLE8;J3QLT0;J3QL53;J3KRE8;J3KSA5;J3KRJ4;J3QQX0,Q13098;C9JFE4;A0A096LP07;A0A096LPJ3;A8K070;J3QS84;J3QS88;J3KTB0;J3QLE8;J3QLT0;J3QL53;J3KRE8;J3KSA5;J3KRJ4,5;5;5;5;5;3;3;3;3;3;3;3;3;3;1,5;5;5;5;5;3;3;3;3;3;3;3;3;3;1,5;5;5;5;5;3;3;3;3;3;3;3;3;3;1,COP9 signalosome complex subunit 1,GPS1,sp|Q13098|CSN1_HUMAN COP9 signalosome complex subunit 1 OS=Homo sapiens OX=9606 GN=GPS1 PE=1 SV=4;tr|C9JFE4|C9JFE4_HUMAN COP9 signalosome complex subunit 1 OS=Homo sapiens OX=9606 GN=GPS1 PE=1 SV=2;tr|A0A096LP07|A0A096LP07_HUMAN COP9 signalosome complex su,5,5,10.4,491
C21orf33,-0.4498875466,0.268523168903053,0,A0A096LPI6;P0DPI2;A0A0B4J2D5;A0A096LNH5;A0A096LNJ1;A0A096LP73;A0A2R8Y6K9;H7C1F6;A0A2R8YDR7;H7C2G3;F2Z2Q0;A0A096LP12,A0A096LPI6;P0DPI2;A0A0B4J2D5;A0A096LNH5;A0A096LNJ1;A0A096LP73;A0A2R8Y6K9;H7C1F6;A0A2R8YDR7;H7C2G3;F2Z2Q0;A0A096LP12,6;5;5;4;3;3;3;3;3;3;3;3,5;5;5;4;3;3;3;3;3;3;3;3,5;5;5;4;3;3;3;3;3;3;3;3,,C21orf33,"tr|A0A096LPI6|A0A096LPI6_HUMAN Utp12 domain-containing protein (Fragment) OS=Homo sapiens OX=9606 PE=4 SV=2;sp|P0DPI2|GAL3A_HUMAN Glutamine amidotransferase-like class 1 domain-containing protein 3A, mitochondrial OS=Homo sapiens OX=9606 GN=GATD3A PE=1 SV=",6,5,39.8,279
WDR18,-1.5506221132,0.0234097773311803,1,Q9BV38;U3KQC1;A0A0A0MQU0;K7EIR0;K7EML4;A0A087X237;K7EKX5,Q9BV38;U3KQC1;A0A0A0MQU0;K7EIR0,6;6;6;5;2;1;1,6;6;6;5;2;1;1,6;6;6;5;2;1;1,WD repeat-containing protein 18,WDR18,sp|Q9BV38|WDR18_HUMAN WD repeat-containing protein 18 OS=Homo sapiens OX=9606 GN=WDR18 PE=1 SV=2;tr|U3KQC1|U3KQC1_HUMAN WD repeat-containing protein 18 (Fragment) OS=Homo sapiens OX=9606 GN=WDR18 PE=1 SV=1;tr|A0A0A0MQU0|A0A0A0MQU0_HUMAN WD repeat-containin,6,6,19,432
CUL4A,-0.8321668902,0.00103194562315189,0,Q13619;A0A0A0MR50,Q13619;A0A0A0MR50,9;9,9;9,4;4,Cullin-4A,CUL4A,sp|Q13619|CUL4A_HUMAN Cullin-4A OS=Homo sapiens OX=9606 GN=CUL4A PE=1 SV=3;tr|A0A0A0MR50|A0A0A0MR50_HUMAN Cullin-4A OS=Homo sapiens OX=9606 GN=CUL4A PE=1 SV=1,9,4,14.1,759
HNRNPUL1,-0.5054885245,0.149048437628644,0,Q9BUJ2;A0A0A0MRA5;B7Z4B8;M0R3F1;M0QYZ0;M0R203;M0QYM5;M0QZV6;M0R0K8;M0QYI8,Q9BUJ2;A0A0A0MRA5;B7Z4B8;M0R3F1;M0QYZ0,13;13;13;12;7;1;1;1;1;1,13;13;13;12;7;1;1;1;1;1,13;13;13;12;7;1;1;1;1;1,Heterogeneous nuclear ribonucleoprotein U-like protein 1,HNRNPUL1,sp|Q9BUJ2|HNRL1_HUMAN Heterogeneous nuclear ribonucleoprotein U-like protein 1 OS=Homo sapiens OX=9606 GN=HNRNPUL1 PE=1 SV=2;tr|A0A0A0MRA5|A0A0A0MRA5_HUMAN Heterogeneous nuclear ribonucleoprotein U-like protein 1 OS=Homo sapiens OX=9606 GN=HNRNPUL1 PE=1 SV,13,13,16.5,856
EPB41L3,0.4092584412,0.169931104072889,0,Q9Y2J2;A8K968;A0A0A0MRA8;A0A1B0GTF8;A0A0A0MSA4;J3KT37;Q9H4G0;Q4VXN0;A0A0C4DH22;A0A1B0GTW6;J3QS55;A0A0J9YW31;Q4VXN1;A0A0J9YY18;A0A2R8Y6T6;A0A3B3ITC5,Q9Y2J2;A8K968;A0A0A0MRA8;A0A1B0GTF8;A0A0A0MSA4,11;11;11;9;8;4;2;2;2;2;1;1;1;1;1;1,9;9;9;7;7;3;1;1;1;1;1;1;1;1;1;1,7;7;7;5;6;2;0;0;0;0;1;1;0;1;0;0,"Band 4.1-like protein 3;Band 4.1-like protein 3, N-terminally processed",EPB41L3,sp|Q9Y2J2|E41L3_HUMAN Band 4.1-like protein 3 OS=Homo sapiens OX=9606 GN=EPB41L3 PE=1 SV=2;tr|A8K968|A8K968_HUMAN Band 4.1-like protein 3 OS=Homo sapiens OX=9606 GN=EPB41L3 PE=1 SV=1;tr|A0A0A0MRA8|A0A0A0MRA8_HUMAN Band 4.1-like protein 3 OS=Homo sapiens OX,11,7,12.5,1087
PCMT1,0.003162036,0.986302138286728,0,P22061;A0A3F2YNX8;A0A0A0MRJ6;H7BY58;F6S8N6;H7C4X2;F8WDT3;F8WAV5;F8WAX2;C9J0F2,P22061;A0A3F2YNX8;A0A0A0MRJ6;H7BY58;F6S8N6,5;5;5;5;4;1;1;1;1;1,5;5;5;5;4;1;1;1;1;1,5;5;5;5;4;1;1;1;1;1,Protein-L-isoaspartate(D-aspartate) O-methyltransferase;Protein-L-isoaspartate O-methyltransferase,PCMT1,sp|P22061|PIMT_HUMAN Protein-L-isoaspartate(D-aspartate) O-methyltransferase OS=Homo sapiens OX=9606 GN=PCMT1 PE=1 SV=4;tr|A0A3F2YNX8|A0A3F2YNX8_HUMAN Protein-L-isoaspartate O-methyltransferase OS=Homo sapiens OX=9606 GN=PCMT1 PE=1 SV=1;tr|A0A0A0MRJ6|A0A0A,5,5,44.1,227
NOLC1,0.0859379758,0.51755272362021,0,Q14978;A0A0A0MRM9;S4R349;S4R402;S4R3C2,Q14978;A0A0A0MRM9,13;13;5;3;1,13;13;5;3;1,10;10;2;0;1,Nucleolar and coiled-body phosphoprotein 1,NOLC1,sp|Q14978|NOLC1_HUMAN Nucleolar and coiled-body phosphoprotein 1 OS=Homo sapiens OX=9606 GN=NOLC1 PE=1 SV=2;tr|A0A0A0MRM9|A0A0A0MRM9_HUMAN Nucleolar and coiled-body phosphoprotein 1 (Fragment) OS=Homo sapiens OX=9606 GN=NOLC1 PE=1 SV=1,13,10,23.2,699
ABI1,0.0332740564,0.835338660144009,0,Q8IZP0;B6VEX4;A0A0A0MRT6,Q8IZP0;B6VEX4;A0A0A0MRT6,4;4;4,4;4;4,4;4;4,Abl interactor 1,ABI1,sp|Q8IZP0|ABI1_HUMAN Abl interactor 1 OS=Homo sapiens OX=9606 GN=ABI1 PE=1 SV=4;tr|B6VEX4|B6VEX4_HUMAN Abl interactor 1 OS=Homo sapiens OX=9606 GN=ABI1 PE=1 SV=1;tr|A0A0A0MRT6|A0A0A0MRT6_HUMAN Abl interactor 1 OS=Homo sapiens OX=9606 GN=ABI1 PE=1 SV=1,4,4,11.2,508
HADH,-0.397903459,0.188710771867162,0,Q16836;A0A1W2PQV5;A0A1W2PNM1;A0A0A0MSE2;A0A0D9SFP2;E9PF18;A0A1W2PQ78;A0A1W2PQC2;A0A1W2PRT2,Q16836;A0A1W2PQV5;A0A1W2PNM1;A0A0A0MSE2;A0A0D9SFP2;E9PF18;A0A1W2PQ78,3;3;3;3;3;3;2;1;1,3;3;3;3;3;3;2;1;1,3;3;3;3;3;3;2;1;1,"Hydroxyacyl-coenzyme A dehydrogenase, mitochondrial",HADH,"sp|Q16836|HCDH_HUMAN Hydroxyacyl-coenzyme A dehydrogenase, mitochondrial OS=Homo sapiens OX=9606 GN=HADH PE=1 SV=3;tr|A0A1W2PQV5|A0A1W2PQV5_HUMAN Hydroxyacyl-coenzyme A dehydrogenase, mitochondrial OS=Homo sapiens OX=9606 GN=HADH PE=1 SV=1;tr|A0A1W2PNM1|A0",3,3,14,314
NUP214,0.1576202041,0.427684687943587,0,P35658;A0A0A0MSW3;A0A494C1F2;H0YF36;E9PKD2;B7ZAV2;H0Y837;A0A494BZU9,P35658;A0A0A0MSW3;A0A494C1F2,8;8;8;3;2;2;2;1,8;8;8;3;2;2;2;1,8;8;8;3;2;2;2;1,Nuclear pore complex protein Nup214,NUP214,sp|P35658|NU214_HUMAN Nuclear pore complex protein Nup214 OS=Homo sapiens OX=9606 GN=NUP214 PE=1 SV=2;tr|A0A0A0MSW3|A0A0A0MSW3_HUMAN Nuclear pore complex protein Nup214 OS=Homo sapiens OX=9606 GN=NUP214 PE=1 SV=1;tr|A0A494C1F2|A0A494C1F2_HUMAN Nuclear pore,8,8,6.5,2090
