SMU1_vs_zCtl,Unnamed: 1,Unnamed: 2,Unnamed: 3,Unnamed: 4,Unnamed: 5,Unnamed: 6,Unnamed: 7,Unnamed: 8,Unnamed: 9,Unnamed: 10,Unnamed: 11,Unnamed: 12,Unnamed: 13,Unnamed: 14,Unnamed: 15
,,,,,,,,,,,,,,,
Gene_names,logFC (SMU1_vs_zCtl),P_Value (SMU1_vs_zCtl),isDifferential (SMU1_vs_zCtl),Protein_IDs,Majority_protein_IDs,Peptide_counts__all_,Peptide_counts__razor_unique_,Peptide_counts__unique_,Protein_names,Gene_names,Fasta_headers,Peptides,Unique_peptides,Sequence_coverage____,Sequence_length
CDK1;CDC2,0.399358278,0.434133948813562,0,P06493;A0A024QZP7;A0A087WZZ9;E5RIU6;Q00526;K7ELV5;E7ESI2;G3V317,P06493;A0A024QZP7;A0A087WZZ9;E5RIU6,13;13;8;7;2;2;2;1,13;13;8;7;2;2;2;1,11;11;6;5;0;0;0;0,Cyclin-dependent kinase 1,CDK1;CDC2,"sp|P06493|CDK1_HUMAN Cyclin-dependent kinase 1 OS=Homo sapiens OX=9606 GN=CDK1 PE=1 SV=3;tr|A0A024QZP7|A0A024QZP7_HUMAN Cell division cycle 2, G1 to S and G2 to M, isoform CRA_a OS=Homo sapiens OX=9606 GN=CDK1 PE=1 SV=1;tr|A0A087WZZ9|A0A087WZZ9_HUMAN Cycli",13,11,47.8,297
HDLBP,0.1022252117,0.694518515854589,0,Q00341;A0A024R4E5;C9JHZ8;C9JIZ1;C9J5E5;C9JZI8;C9JES8;C9JHS7;H0Y394;H7C0A4;C9JK79;C9JT62;C9JHN6;C9JEJ8;C9JBS3;C9JQ82;C9JMQ6;C9J739;C9JHS9,Q00341;A0A024R4E5;C9JHZ8;C9JIZ1;C9J5E5;C9JZI8;C9JES8;C9JHS7,5;5;3;3;3;3;3;3;2;2;2;2;2;2;2;2;2;1;1,5;5;3;3;3;3;3;3;2;2;2;2;2;2;2;2;2;1;1,5;5;3;3;3;3;3;3;2;2;2;2;2;2;2;2;2;1;1,Vigilin,HDLBP,"sp|Q00341|VIGLN_HUMAN Vigilin OS=Homo sapiens OX=9606 GN=HDLBP PE=1 SV=2;tr|A0A024R4E5|A0A024R4E5_HUMAN High density lipoprotein binding protein (Vigilin), isoform CRA_a OS=Homo sapiens OX=9606 GN=HDLBP PE=1 SV=1;tr|C9JHZ8|C9JHZ8_HUMAN Vigilin (Fragment) O",5,5,6.2,1268
PSMA2,0.5300296765,0.0865234316618592,0,P25787;A0A024RA52;H3BT36;C9JCK5;H7C402,P25787;A0A024RA52,8;8;3;3;1,8;8;3;3;1,8;8;3;3;1,Proteasome subunit alpha type-2;Proteasome subunit alpha type,PSMA2,sp|P25787|PSA2_HUMAN Proteasome subunit alpha type-2 OS=Homo sapiens OX=9606 GN=PSMA2 PE=1 SV=2;tr|A0A024RA52|A0A024RA52_HUMAN Proteasome subunit alpha type OS=Homo sapiens OX=9606 GN=PSMA2 PE=1 SV=1,8,8,41.5,234
BAG6;BAT3,0.835148371,0.141988750949914,0,P46379;A0A0G2JL47;A0A024RCR6;A0A0G2JK23;F6S6P2;X6REW1;A0A0G2JJM1,P46379;A0A0G2JL47;A0A024RCR6;A0A0G2JK23;F6S6P2;X6REW1;A0A0G2JJM1,3;3;3;3;2;2;2,3;3;3;3;2;2;2,3;3;3;3;2;2;2,Large proline-rich protein BAG6,BAG6;BAT3,sp|P46379|BAG6_HUMAN Large proline-rich protein BAG6 OS=Homo sapiens OX=9606 GN=BAG6 PE=1 SV=2;tr|A0A0G2JL47|A0A0G2JL47_HUMAN Large proline-rich protein BAG6 OS=Homo sapiens OX=9606 GN=BAG6 PE=1 SV=1;tr|A0A024RCR6|A0A024RCR6_HUMAN BAG6 OS=Homo sapiens OX=9,3,3,3.2,1132
TAF15,0.5861726303,0.0566795906258498,0,Q92804;A0A075B7D9;A0A075B7F4,Q92804;A0A075B7D9;A0A075B7F4,2;2;1,2;2;1,2;2;1,TATA-binding protein-associated factor 2N,TAF15,sp|Q92804|RBP56_HUMAN TATA-binding protein-associated factor 2N OS=Homo sapiens OX=9606 GN=TAF15 PE=1 SV=1;tr|A0A075B7D9|A0A075B7D9_HUMAN TATA-binding protein-associated factor 2N OS=Homo sapiens OX=9606 GN=TAF15 PE=1 SV=1;tr|A0A075B7F4|A0A075B7F4_HUMAN TA,2,2,5.9,592
TXNRD1,1.3299168581,0.00397836539486408,1,Q16881;F8W809;A0A087WSY9;A0A182DWI3;A0A087WSW9;E9PIR7;E2QRB9;E9PKD3;A0A0B4J225;E9PIZ5;E9PLT3;E9PKI4;E9PQI3;E9PRI8;A0A182DWF2;D3YTF8;A0A182DWF3;Q9NNW7;E7EWK1;A0A096LPD9;A0A096LPK7,Q16881;F8W809;A0A087WSY9;A0A182DWI3;A0A087WSW9;E9PIR7;E2QRB9;E9PKD3,19;19;19;19;19;19;16;11;6;6;4;4;3;2;1;1;1;1;1;1;1,19;19;19;19;19;19;16;11;6;6;4;4;3;2;1;1;1;1;1;1;1,19;19;19;19;19;19;16;11;6;6;4;4;3;2;1;1;1;1;1;1;1,"Thioredoxin reductase 1, cytoplasmic",TXNRD1,"sp|Q16881|TRXR1_HUMAN Thioredoxin reductase 1, cytoplasmic OS=Homo sapiens OX=9606 GN=TXNRD1 PE=1 SV=3;tr|F8W809|F8W809_HUMAN Thioredoxin reductase 1, cytoplasmic OS=Homo sapiens OX=9606 GN=TXNRD1 PE=1 SV=1;tr|A0A087WSY9|A0A087WSY9_HUMAN Thioredoxin reduct",19,19,38.4,649
EIF2B4,1.0817798212,0.255786151599865,0,Q9UI10;A0A087WTA5;E7ERK9;H7C2L8;A0A087WW69;F8W8L6,Q9UI10;A0A087WTA5;E7ERK9,3;3;3;1;1;1,3;3;3;1;1;1,3;3;3;1;1;1,Translation initiation factor eIF-2B subunit delta,EIF2B4,sp|Q9UI10|EI2BD_HUMAN Translation initiation factor eIF-2B subunit delta OS=Homo sapiens OX=9606 GN=EIF2B4 PE=1 SV=2;tr|A0A087WTA5|A0A087WTA5_HUMAN Translation initiation factor eIF-2B subunit delta OS=Homo sapiens OX=9606 GN=EIF2B4 PE=1 SV=1;tr|E7ERK9|E7E,3,3,7.6,523
KHSRP,-0.0745958094,0.798833764478532,0,Q92945;A0A087WTP3;M0R0I5;M0QYH3;M0QXW7;M0R3J3,Q92945;A0A087WTP3;M0R0I5,17;17;11;8;5;2,15;15;9;6;4;2,15;15;9;6;4;2,Far upstream element-binding protein 2,KHSRP,sp|Q92945|FUBP2_HUMAN Far upstream element-binding protein 2 OS=Homo sapiens OX=9606 GN=KHSRP PE=1 SV=4;tr|A0A087WTP3|A0A087WTP3_HUMAN Far upstream element-binding protein 2 OS=Homo sapiens OX=9606 GN=KHSRP PE=1 SV=1;tr|M0R0I5|M0R0I5_HUMAN Far upstream ele,17,15,32.2,711
PYCR2,0.1210026691,0.674957737886946,0,Q96C36;A0A087WTV6;J3KR12;A0A087WZR9;A0A087WX69;A0A087WZF0,Q96C36;A0A087WTV6;J3KR12;A0A087WZR9,4;4;3;2;1;1,3;3;2;1;1;1,3;3;2;1;1;1,Pyrroline-5-carboxylate reductase 2;Pyrroline-5-carboxylate reductase,PYCR2,sp|Q96C36|P5CR2_HUMAN Pyrroline-5-carboxylate reductase 2 OS=Homo sapiens OX=9606 GN=PYCR2 PE=1 SV=1;tr|A0A087WTV6|A0A087WTV6_HUMAN Pyrroline-5-carboxylate reductase 2 OS=Homo sapiens OX=9606 GN=PYCR2 PE=1 SV=1;tr|J3KR12|J3KR12_HUMAN Uncharacterized protei,4,3,16.9,320
POLA1,-2.4348478863,0.00023277295257918,1,P09884;A0A087WU64;A6NMQ1,P09884;A0A087WU64;A6NMQ1,1;1;1,1;1;1,1;1;1,DNA polymerase alpha catalytic subunit;DNA polymerase,POLA1,sp|P09884|DPOLA_HUMAN DNA polymerase alpha catalytic subunit OS=Homo sapiens OX=9606 GN=POLA1 PE=1 SV=2;tr|A0A087WU64|A0A087WU64_HUMAN DNA polymerase OS=Homo sapiens OX=9606 GN=POLA1 PE=1 SV=1;tr|A6NMQ1|A6NMQ1_HUMAN DNA polymerase OS=Homo sapiens OX=9606 G,1,1,0.5,1462
HNRNPDL,1.4384321541,0.00266091053556777,1,O14979;A0A087WUK2,O14979;A0A087WUK2,8;8,6;6,6;6,Heterogeneous nuclear ribonucleoprotein D-like,HNRNPDL,sp|O14979|HNRDL_HUMAN Heterogeneous nuclear ribonucleoprotein D-like OS=Homo sapiens OX=9606 GN=HNRNPDL PE=1 SV=3;tr|A0A087WUK2|A0A087WUK2_HUMAN Heterogeneous nuclear ribonucleoprotein D-like OS=Homo sapiens OX=9606 GN=HNRNPDL PE=1 SV=1,8,6,19,420
SLIRP,-0.290254814,0.62884166341843,0,Q9GZT3;A0A087WUN7;H0YJ40;G3V4X6;G3V2S9;H0YJW7;H0YJI1,Q9GZT3;A0A087WUN7;H0YJ40;G3V4X6;G3V2S9;H0YJW7,4;4;4;4;4;3;1,4;4;4;4;4;3;1,4;4;4;4;4;3;1,"SRA stem-loop-interacting RNA-binding protein, mitochondrial",SLIRP,"sp|Q9GZT3|SLIRP_HUMAN SRA stem-loop-interacting RNA-binding protein, mitochondrial OS=Homo sapiens OX=9606 GN=SLIRP PE=1 SV=1;tr|A0A087WUN7|A0A087WUN7_HUMAN SRA stem-loop-interacting RNA-binding protein, mitochondrial OS=Homo sapiens OX=9606 GN=SLIRP PE=1 ",4,4,34.9,109
EIF5B,0.6363198591,0.387130303707116,0,O60841;A0A087WUT6,O60841;A0A087WUT6,7;7,7;7,7;7,Eukaryotic translation initiation factor 5B,EIF5B,sp|O60841|IF2P_HUMAN Eukaryotic translation initiation factor 5B OS=Homo sapiens OX=9606 GN=EIF5B PE=1 SV=4;tr|A0A087WUT6|A0A087WUT6_HUMAN Eukaryotic translation initiation factor 5B OS=Homo sapiens OX=9606 GN=EIF5B PE=1 SV=1,7,7,9.7,1220
BSG,0.1493402858,0.570880106941874,0,P35613;A0A087WUV8;A0A087X2B5;R4GMX5;I3L192;R4GN83,P35613;A0A087WUV8;A0A087X2B5;R4GMX5;I3L192,5;5;5;3;3;2,5;5;5;3;3;2,5;5;5;3;3;2,Basigin,BSG,sp|P35613|BASI_HUMAN Basigin OS=Homo sapiens OX=9606 GN=BSG PE=1 SV=2;tr|A0A087WUV8|A0A087WUV8_HUMAN Basigin OS=Homo sapiens OX=9606 GN=BSG PE=1 SV=1;tr|A0A087X2B5|A0A087X2B5_HUMAN Basigin (Fragment) OS=Homo sapiens OX=9606 GN=BSG PE=1 SV=1;tr|R4GMX5|R4GMX,5,5,17.4,385
SPTBN1,0.5406318249,0.0686537851998412,0,Q01082;A0A087WUZ3;F8W6C1,Q01082;A0A087WUZ3,26;26;8,26;26;8,26;26;8,"Spectrin beta chain, non-erythrocytic 1",SPTBN1,"sp|Q01082|SPTB2_HUMAN Spectrin beta chain, non-erythrocytic 1 OS=Homo sapiens OX=9606 GN=SPTBN1 PE=1 SV=2;tr|A0A087WUZ3|A0A087WUZ3_HUMAN Spectrin beta chain OS=Homo sapiens OX=9606 GN=SPTBN1 PE=1 SV=1",26,26,16.2,2364
RRBP1,1.1029688495,0.0135917308520511,1,Q9P2E9;F8W7S5;A0A087WVV2,Q9P2E9;F8W7S5;A0A087WVV2,4;4;4,4;4;4,3;3;3,Ribosome-binding protein 1,RRBP1,sp|Q9P2E9|RRBP1_HUMAN Ribosome-binding protein 1 OS=Homo sapiens OX=9606 GN=RRBP1 PE=1 SV=5;tr|F8W7S5|F8W7S5_HUMAN Ribosome-binding protein 1 OS=Homo sapiens OX=9606 GN=RRBP1 PE=1 SV=1;tr|A0A087WVV2|A0A087WVV2_HUMAN Ribosome-binding protein 1 OS=Homo sapie,4,3,3.5,1410
TPM3,0.361991109,0.173995305371372,0,A0A087WWU8;D6R904;A0A494C0G0;Q5VU61;H0YL80,A0A087WWU8;D6R904,26;15;8;7;5,26;15;8;7;5,10;10;3;7;0,,TPM3,tr|A0A087WWU8|A0A087WWU8_HUMAN Tropomyosin alpha-3 chain OS=Homo sapiens OX=9606 GN=TPM3 PE=1 SV=1;tr|D6R904|D6R904_HUMAN Tropomyosin alpha-3 chain OS=Homo sapiens OX=9606 GN=TPM3 PE=1 SV=1,26,10,75.8,227
TARDBP;TDP43,-0.0994211144,0.75264236132053,0,Q13148;A0A087WX29;A0A087WYY0;A0A087X260;G3V162;B1AKP7;K7EJM5;A0A0A0N0M3;A0A087WV68;A0A087WXQ5;A0A087WXV3;K7EN94;A0A1W2PNU8;A0A087WX67;A0A087WW61;K7EL26;A0A087WZC9;A0A087WYE7;A0A087WTZ4,Q13148;A0A087WX29;A0A087WYY0;A0A087X260;G3V162;B1AKP7;K7EJM5;A0A0A0N0M3;A0A087WV68;A0A087WXQ5,7;7;5;5;5;5;4;4;4;4;3;3;2;2;2;1;1;1;1,7;7;5;5;5;5;4;4;4;4;3;3;2;2;2;1;1;1;1,7;7;5;5;5;5;4;4;4;4;3;3;2;2;2;1;1;1;1,TAR DNA-binding protein 43,TARDBP;TDP43,sp|Q13148|TADBP_HUMAN TAR DNA-binding protein 43 OS=Homo sapiens OX=9606 GN=TARDBP PE=1 SV=1;tr|A0A087WX29|A0A087WX29_HUMAN TAR DNA-binding protein 43 (Fragment) OS=Homo sapiens OX=9606 GN=TARDBP PE=1 SV=1;tr|A0A087WYY0|A0A087WYY0_HUMAN TAR DNA-binding pro,7,7,22.5,414
RPL17;RPL17-C18orf32,0.9861063787,0.0372163334018193,0,P18621;A0A087WXM6;J3QQT2;J3KRX5;A0A0A6YYL6;J3KRB3;A0A087WWH0;J3QS96;A0A087WY81;J3QLC8;A0A0A0MRF8;J3KSJ0,P18621;A0A087WXM6;J3QQT2;J3KRX5;A0A0A6YYL6;J3KRB3;A0A087WWH0;J3QS96;A0A087WY81;J3QLC8;A0A0A0MRF8,12;12;12;12;12;11;11;11;9;9;8;5,12;12;12;12;12;11;11;11;9;9;8;5,12;12;12;12;12;11;11;11;9;9;8;5,60S ribosomal protein L17,RPL17;RPL17-C18orf32,sp|P18621|RL17_HUMAN 60S ribosomal protein L17 OS=Homo sapiens OX=9606 GN=RPL17 PE=1 SV=3;tr|A0A087WXM6|A0A087WXM6_HUMAN 60S ribosomal protein L17 (Fragment) OS=Homo sapiens OX=9606 GN=RPL17 PE=1 SV=1;tr|J3QQT2|J3QQT2_HUMAN 60S ribosomal protein L17 (Fragm,12,12,56.5,184
ITGB6,-1.5177647995,0.00229103663010782,1,P18564;A0A087WXP3;E9PEE8,P18564;A0A087WXP3;E9PEE8,1;1;1,1;1;1,1;1;1,Integrin beta-6;Integrin beta,ITGB6,sp|P18564|ITB6_HUMAN Integrin beta-6 OS=Homo sapiens OX=9606 GN=ITGB6 PE=1 SV=2;tr|A0A087WXP3|A0A087WXP3_HUMAN Integrin beta OS=Homo sapiens OX=9606 GN=ITGB6 PE=1 SV=1;tr|E9PEE8|E9PEE8_HUMAN Integrin beta OS=Homo sapiens OX=9606 GN=ITGB6 PE=1 SV=1,1,1,1.1,788
PSMB3,0.2153609878,0.767760365718743,0,P49720;A0A087WXQ8;A0A087WY10;A0A087WUL2,P49720;A0A087WXQ8;A0A087WY10;A0A087WUL2,7;7;7;5,7;7;7;5,7;7;7;5,Proteasome subunit beta type-3,PSMB3,sp|P49720|PSB3_HUMAN Proteasome subunit beta type-3 OS=Homo sapiens OX=9606 GN=PSMB3 PE=1 SV=2;tr|A0A087WXQ8|A0A087WXQ8_HUMAN Proteasome subunit beta type-3 OS=Homo sapiens OX=9606 GN=PSMB3 PE=1 SV=1;tr|A0A087WY10|A0A087WY10_HUMAN Proteasome subunit beta t,7,7,29.3,205
VTA1,0.5662527087,0.182255759962355,0,Q9NP79;A0A087WY55;Q5TGM0,Q9NP79;A0A087WY55,5;5;2,5;5;2,5;5;2,Vacuolar protein sorting-associated protein VTA1 homolog,VTA1,"sp|Q9NP79|VTA1_HUMAN Vacuolar protein sorting-associated protein VTA1 homolog OS=Homo sapiens OX=9606 GN=VTA1 PE=1 SV=1;tr|A0A087WY55|A0A087WY55_HUMAN Chromosome 6 open reading frame 55, isoform CRA_b OS=Homo sapiens OX=9606 GN=VTA1 PE=1 SV=1",5,5,18.9,307
UBE2D3;UBE2D2,-0.7210344781,0.185261730874233,0,P61077;P62837;D6RAW0;D6RFM0;D6RAH7;H9KV45;A0A0A0MQU3;A0A087WY85,P61077;P62837;D6RAW0;D6RFM0;D6RAH7;H9KV45;A0A0A0MQU3;A0A087WY85,2;2;2;2;2;2;2;2,2;2;2;2;2;2;2;2,1;1;1;1;1;1;1;1,Ubiquitin-conjugating enzyme E2 D3;Ubiquitin-conjugating enzyme E2 D2,UBE2D3;UBE2D2,sp|P61077|UB2D3_HUMAN Ubiquitin-conjugating enzyme E2 D3 OS=Homo sapiens OX=9606 GN=UBE2D3 PE=1 SV=1;sp|P62837|UB2D2_HUMAN Ubiquitin-conjugating enzyme E2 D2 OS=Homo sapiens OX=9606 GN=UBE2D2 PE=1 SV=1;tr|D6RAW0|D6RAW0_HUMAN Ubiquitin-conjugating enzyme E2,2,1,19.7,147
UGP2,2.1873443036,0.00148206314529944,1,Q16851;A0A087WYS1;E7EUC7;C9JNZ1;C9JWG0;C9JVG3;C9JQU9;C9JTZ5;C9JUW1;F2Z3H1,Q16851;A0A087WYS1;E7EUC7;C9JNZ1,12;12;12;7;4;4;4;3;3;1,12;12;12;7;4;4;4;3;3;1,12;12;12;7;4;4;4;3;3;1,UTP--glucose-1-phosphate uridylyltransferase,UGP2,sp|Q16851|UGPA_HUMAN UTP--glucose-1-phosphate uridylyltransferase OS=Homo sapiens OX=9606 GN=UGP2 PE=1 SV=5;tr|A0A087WYS1|A0A087WYS1_HUMAN UTP--glucose-1-phosphate uridylyltransferase OS=Homo sapiens OX=9606 GN=UGP2 PE=1 SV=1;tr|E7EUC7|E7EUC7_HUMAN UTP--gl,12,12,25.8,508
PTGES3,-0.0868944711,0.721087922494422,0,Q15185;A0A087WYT3,Q15185;A0A087WYT3,5;5,5;5,5;5,Prostaglandin E synthase 3,PTGES3,sp|Q15185|TEBP_HUMAN Prostaglandin E synthase 3 OS=Homo sapiens OX=9606 GN=PTGES3 PE=1 SV=1;tr|A0A087WYT3|A0A087WYT3_HUMAN Prostaglandin E synthase 3 OS=Homo sapiens OX=9606 GN=PTGES3 PE=1 SV=1,5,5,26.2,160
ACOT1;ACOT2,0.3830259053,0.374704114683356,0,Q86TX2;A0A087X0W7;P49753;G3V4F2;A0A087WT95;A0A2R8Y7H3,Q86TX2;A0A087X0W7;P49753;G3V4F2;A0A087WT95,8;8;7;7;7;2,8;8;7;7;7;2,8;8;7;7;7;2,"Acyl-coenzyme A thioesterase 1;Acyl-coenzyme A thioesterase 2, mitochondrial",ACOT1;ACOT2,"sp|Q86TX2|ACOT1_HUMAN Acyl-coenzyme A thioesterase 1 OS=Homo sapiens OX=9606 GN=ACOT1 PE=1 SV=1;tr|A0A087X0W7|A0A087X0W7_HUMAN Acyl-coenzyme A thioesterase 2, mitochondrial OS=Homo sapiens OX=9606 GN=ACOT2 PE=1 SV=1;sp|P49753|ACOT2_HUMAN Acyl-coenzyme A th",8,8,27.8,421
NEB,7.6740046449,1.3318926911517e-06,1,P20929;A0A087X1N7;H0Y3P5;H7BZD5;H0Y786,P20929;A0A087X1N7;H0Y3P5;H7BZD5;H0Y786,2;2;1;1;1,2;2;1;1;1,2;2;1;1;1,Nebulin,NEB,sp|P20929|NEBU_HUMAN Nebulin OS=Homo sapiens OX=9606 GN=NEB PE=1 SV=5;tr|A0A087X1N7|A0A087X1N7_HUMAN Nebulin OS=Homo sapiens OX=9606 GN=NEB PE=1 SV=1;tr|H0Y3P5|H0Y3P5_HUMAN Nebulin (Fragment) OS=Homo sapiens OX=9606 GN=NEB PE=1 SV=1;tr|H7BZD5|H7BZD5_HUMAN ,2,2,0.3,6669
PSME2,-0.538554895,0.0818788513569073,0,Q9UL46;A0A087X1Z3;H0YM70,Q9UL46;A0A087X1Z3;H0YM70,6;6;4,6;6;4,6;6;4,Proteasome activator complex subunit 2,PSME2,sp|Q9UL46|PSME2_HUMAN Proteasome activator complex subunit 2 OS=Homo sapiens OX=9606 GN=PSME2 PE=1 SV=4;tr|A0A087X1Z3|A0A087X1Z3_HUMAN Proteasome activator complex subunit 2 OS=Homo sapiens OX=9606 GN=PSME2 PE=1 SV=1;tr|H0YM70|H0YM70_HUMAN Proteasome activ,6,6,29.7,239
SRSF3,-1.1053192967,0.00588674602615671,1,P84103;A0A087X2D0,P84103;A0A087X2D0,5;5,5;5,5;5,Serine/arginine-rich splicing factor 3,SRSF3,sp|P84103|SRSF3_HUMAN Serine/arginine-rich splicing factor 3 OS=Homo sapiens OX=9606 GN=SRSF3 PE=1 SV=1;tr|A0A087X2D0|A0A087X2D0_HUMAN Serine/arginine-rich-splicing factor 3 OS=Homo sapiens OX=9606 GN=SRSF3 PE=1 SV=1,5,5,38.4,164
DDX1,0.5223802999,0.060586858958397,0,Q92499;A0A087X2G1;F1T0B3,Q92499;A0A087X2G1;F1T0B3,18;18;18,18;18;18,18;18;18,ATP-dependent RNA helicase DDX1,DDX1,sp|Q92499|DDX1_HUMAN ATP-dependent RNA helicase DDX1 OS=Homo sapiens OX=9606 GN=DDX1 PE=1 SV=2;tr|A0A087X2G1|A0A087X2G1_HUMAN ATP-dependent RNA helicase DDX1 OS=Homo sapiens OX=9606 GN=DDX1 PE=1 SV=1;tr|F1T0B3|F1T0B3_HUMAN ATP-dependent RNA helicase DDX1 O,18,18,38,740
GPS1,0.8200678105,0.0412570933686053,0,Q13098;C9JFE4;A0A096LP07;A0A096LPJ3;A8K070;J3QS84;J3QS88;J3KTB0;J3QLE8;J3QLT0;J3QL53;J3KRE8;J3KSA5;J3KRJ4;J3QQX0,Q13098;C9JFE4;A0A096LP07;A0A096LPJ3;A8K070;J3QS84;J3QS88;J3KTB0;J3QLE8;J3QLT0;J3QL53;J3KRE8;J3KSA5;J3KRJ4,4;4;4;4;4;3;3;3;3;3;3;3;3;3;1,4;4;4;4;4;3;3;3;3;3;3;3;3;3;1,4;4;4;4;4;3;3;3;3;3;3;3;3;3;1,COP9 signalosome complex subunit 1,GPS1,sp|Q13098|CSN1_HUMAN COP9 signalosome complex subunit 1 OS=Homo sapiens OX=9606 GN=GPS1 PE=1 SV=4;tr|C9JFE4|C9JFE4_HUMAN COP9 signalosome complex subunit 1 OS=Homo sapiens OX=9606 GN=GPS1 PE=1 SV=2;tr|A0A096LP07|A0A096LP07_HUMAN COP9 signalosome complex su,4,4,8.4,491
PYCRL,0.4351891583,0.110500312490247,0,Q53H96;A0A0A0MQS1;F8WEI0;B5MD87,Q53H96;A0A0A0MQS1;F8WEI0;B5MD87,2;2;1;1,2;2;1;1,2;2;1;1,Pyrroline-5-carboxylate reductase 3;Pyrroline-5-carboxylate reductase,PYCRL,sp|Q53H96|P5CR3_HUMAN Pyrroline-5-carboxylate reductase 3 OS=Homo sapiens OX=9606 GN=PYCR3 PE=1 SV=3;tr|A0A0A0MQS1|A0A0A0MQS1_HUMAN Pyrroline-5-carboxylate reductase OS=Homo sapiens OX=9606 GN=PYCR3 PE=1 SV=1;tr|F8WEI0|F8WEI0_HUMAN Pyrroline-5-carboxylate ,2,2,8.8,274
GSTZ1,2.3356948615,0.00119558781304911,1,O43708;G3V3B9;A0A0A0MR33;G3V267;G3V5T0;A0A0C4DFM0;G3V4T6,O43708;G3V3B9;A0A0A0MR33;G3V267;G3V5T0;A0A0C4DFM0;G3V4T6,3;3;3;3;3;3;3,3;3;3;3;3;3;3,3;3;3;3;3;3;3,Maleylacetoacetate isomerase,GSTZ1,sp|O43708|MAAI_HUMAN Maleylacetoacetate isomerase OS=Homo sapiens OX=9606 GN=GSTZ1 PE=1 SV=3;tr|G3V3B9|G3V3B9_HUMAN Maleylacetoacetate isomerase OS=Homo sapiens OX=9606 GN=GSTZ1 PE=1 SV=1;tr|A0A0A0MR33|A0A0A0MR33_HUMAN Maleylacetoacetate isomerase OS=Homo ,3,3,19,216
TTN,1.6087036221,0.318804896342684,0,Q8WZ42;A0A0A0MRA3;A0A0A0MTS7,Q8WZ42;A0A0A0MRA3;A0A0A0MTS7,4;4;4,4;4;4,4;4;4,Titin,TTN,sp|Q8WZ42|TITIN_HUMAN Titin OS=Homo sapiens OX=9606 GN=TTN PE=1 SV=4;tr|A0A0A0MRA3|A0A0A0MRA3_HUMAN Titin OS=Homo sapiens OX=9606 GN=TTN PE=1 SV=1;tr|A0A0A0MTS7|A0A0A0MTS7_HUMAN Titin OS=Homo sapiens OX=9606 GN=TTN PE=1 SV=1,4,4,0.2,34350
HNRNPUL1,-0.1193447142,0.749462828840317,0,Q9BUJ2;M0R3F1;A0A0A0MRA5;B7Z4B8;M0QYZ0,Q9BUJ2;M0R3F1;A0A0A0MRA5;B7Z4B8;M0QYZ0,8;8;8;8;4,8;8;8;8;4,8;8;8;8;4,Heterogeneous nuclear ribonucleoprotein U-like protein 1,HNRNPUL1,sp|Q9BUJ2|HNRL1_HUMAN Heterogeneous nuclear ribonucleoprotein U-like protein 1 OS=Homo sapiens OX=9606 GN=HNRNPUL1 PE=1 SV=2;tr|M0R3F1|M0R3F1_HUMAN Heterogeneous nuclear ribonucleoprotein U-like protein 1 (Fragment) OS=Homo sapiens OX=9606 GN=HNRNPUL1 PE=1,8,8,11.9,856
NOLC1,0.7448821616,0.363366863669682,0,Q14978;A0A0A0MRM9;S4R402;S4R341;S4R349,Q14978;A0A0A0MRM9,5;5;1;1;1,5;5;1;1;1,5;5;1;1;1,Nucleolar and coiled-body phosphoprotein 1,NOLC1,sp|Q14978|NOLC1_HUMAN Nucleolar and coiled-body phosphoprotein 1 OS=Homo sapiens OX=9606 GN=NOLC1 PE=1 SV=2;tr|A0A0A0MRM9|A0A0A0MRM9_HUMAN Nucleolar and coiled-body phosphoprotein 1 (Fragment) OS=Homo sapiens OX=9606 GN=NOLC1 PE=1 SV=1,5,5,8.3,699
SMARCA1;SMARCA5,4.1444179216,0.00276691427907242,1,P28370;A0A0A0MRP6;B7ZLQ5;O60264,P28370;A0A0A0MRP6;B7ZLQ5;O60264,4;4;4;3,4;4;4;3,4;4;4;3,Probable global transcription activator SNF2L1;SWI/SNF-related matrix-associated actin-dependent regulator of chromatin subfamily A member 5,SMARCA1;SMARCA5,sp|P28370|SMCA1_HUMAN Probable global transcription activator SNF2L1 OS=Homo sapiens OX=9606 GN=SMARCA1 PE=1 SV=2;tr|A0A0A0MRP6|A0A0A0MRP6_HUMAN Probable global transcription activator SNF2L1 OS=Homo sapiens OX=9606 GN=SMARCA1 PE=1 SV=1;tr|B7ZLQ5|B7ZLQ5_HU,4,4,5.2,1054
ABI1,1.6454485131,0.00145715627860872,1,Q8IZP0;B6VEX4;A0A0A0MRT6,Q8IZP0;B6VEX4;A0A0A0MRT6,3;3;3,3;3;3,3;3;3,Abl interactor 1,ABI1,sp|Q8IZP0|ABI1_HUMAN Abl interactor 1 OS=Homo sapiens OX=9606 GN=ABI1 PE=1 SV=4;tr|B6VEX4|B6VEX4_HUMAN Abl interactor 1 OS=Homo sapiens OX=9606 GN=ABI1 PE=1 SV=1;tr|A0A0A0MRT6|A0A0A0MRT6_HUMAN Abl interactor 1 OS=Homo sapiens OX=9606 GN=ABI1 PE=1 SV=1,3,3,7.7,508
HADH,0.1107711121,0.845821995503941,0,Q16836;A0A1W2PQV5;A0A1W2PNM1;A0A0A0MSE2;A0A0D9SFP2;E9PF18;A0A1W2PQ78;A0A1W2PQC2;A0A1W2PRT2,Q16836;A0A1W2PQV5;A0A1W2PNM1;A0A0A0MSE2;A0A0D9SFP2;E9PF18;A0A1W2PQ78,3;3;3;3;3;3;2;1;1,3;3;3;3;3;3;2;1;1,3;3;3;3;3;3;2;1;1,"Hydroxyacyl-coenzyme A dehydrogenase, mitochondrial",HADH,"sp|Q16836|HCDH_HUMAN Hydroxyacyl-coenzyme A dehydrogenase, mitochondrial OS=Homo sapiens OX=9606 GN=HADH PE=1 SV=3;tr|A0A1W2PQV5|A0A1W2PQV5_HUMAN Hydroxyacyl-coenzyme A dehydrogenase, mitochondrial OS=Homo sapiens OX=9606 GN=HADH PE=1 SV=1;tr|A0A1W2PNM1|A0",3,3,14,314
PLS3,0.8322369241,0.0427302623950306,0,P13797;A0A0A0MSQ0;H7C4N2,P13797;A0A0A0MSQ0,6;6;2,5;5;2,3;3;1,Plastin-3,PLS3,sp|P13797|PLST_HUMAN Plastin-3 OS=Homo sapiens OX=9606 GN=PLS3 PE=1 SV=4;tr|A0A0A0MSQ0|A0A0A0MSQ0_HUMAN Plastin-3 OS=Homo sapiens OX=9606 GN=PLS3 PE=1 SV=1,6,3,11.1,630
PITPNB,0.156062305,0.737618723880219,0,P48739;A0A0A0MSW4;B3KYB6;B3KYB7,P48739;A0A0A0MSW4;B3KYB6;B3KYB7,5;5;3;3,5;5;3;3,4;4;2;2,Phosphatidylinositol transfer protein beta isoform,PITPNB,sp|P48739|PIPNB_HUMAN Phosphatidylinositol transfer protein beta isoform OS=Homo sapiens OX=9606 GN=PITPNB PE=1 SV=2;tr|A0A0A0MSW4|A0A0A0MSW4_HUMAN Phosphatidylinositol transfer protein beta isoform OS=Homo sapiens OX=9606 GN=PITPNB PE=1 SV=1;tr|B3KYB6|B3K,5,4,19.9,271
ILK,1.1248095778,0.0132229627093483,1,Q13418;A0A0A0MTH3;E9PQ52;A0A087WW45;A0A087WWY6,Q13418;A0A0A0MTH3,3;3;1;1;1,3;3;1;1;1,3;3;1;1;1,Integrin-linked protein kinase,ILK,sp|Q13418|ILK_HUMAN Integrin-linked protein kinase OS=Homo sapiens OX=9606 GN=ILK PE=1 SV=2;tr|A0A0A0MTH3|A0A0A0MTH3_HUMAN Integrin-linked protein kinase OS=Homo sapiens OX=9606 GN=ILK PE=1 SV=1,3,3,7.3,452
ADSL,0.6388589733,0.106247608973406,0,P30566;A0A1B0GWJ0;A0A1B0GTJ7;A0A0A6YY92;A0A096LNY6;A0A1B0GWF8;A0A096LNY5;A0A1B0GTG9;B4DEP1;A0A1W2PRX2;A0A096LP72;A0A096LNY4;V9GY96;A0A096LP92;A0A096LP76;A0A096LPA2,P30566;A0A1B0GWJ0;A0A1B0GTJ7;A0A0A6YY92;A0A096LNY6;A0A1B0GWF8,7;7;7;7;5;4;3;3;2;2;2;2;1;1;1;1,7;7;7;7;5;4;3;3;2;2;2;2;1;1;1;1,7;7;7;7;5;4;3;3;2;2;2;2;1;1;1;1,Adenylosuccinate lyase,ADSL,sp|P30566|PUR8_HUMAN Adenylosuccinate lyase OS=Homo sapiens OX=9606 GN=ADSL PE=1 SV=2;tr|A0A1B0GWJ0|A0A1B0GWJ0_HUMAN Adenylosuccinate lyase OS=Homo sapiens OX=9606 GN=ADSL PE=1 SV=1;tr|A0A1B0GTJ7|A0A1B0GTJ7_HUMAN Adenylosuccinate lyase OS=Homo sapiens OX=9,7,7,21.5,484
TMED7;TMED7-TICAM2,0.3360197838,0.311781339364504,0,Q9Y3B3;A0A0A6YYA0,Q9Y3B3;A0A0A6YYA0,2;2,2;2,2;2,Transmembrane emp24 domain-containing protein 7,TMED7;TMED7-TICAM2,sp|Q9Y3B3|TMED7_HUMAN Transmembrane emp24 domain-containing protein 7 OS=Homo sapiens OX=9606 GN=TMED7 PE=1 SV=2;tr|A0A0A6YYA0|A0A0A6YYA0_HUMAN Protein TMED7-TICAM2 OS=Homo sapiens OX=9606 GN=TMED7-TICAM2 PE=3 SV=1,2,2,10.3,224
NAA15,0.8324639331,0.0178693586470086,0,Q9BXJ9;A0A0B4J1W3;Q6N069,Q9BXJ9;A0A0B4J1W3,6;6;1,6;6;1,6;6;1,"N-alpha-acetyltransferase 15, NatA auxiliary subunit",NAA15,"sp|Q9BXJ9|NAA15_HUMAN N-alpha-acetyltransferase 15, NatA auxiliary subunit OS=Homo sapiens OX=9606 GN=NAA15 PE=1 SV=1;tr|A0A0B4J1W3|A0A0B4J1W3_HUMAN N-alpha-acetyltransferase 15, NatA auxiliary subunit OS=Homo sapiens OX=9606 GN=NAA15 PE=1 SV=1",6,6,8,866
SRSF7,0.7538995831,0.153204613619247,0,Q16629;A0A0B4J1Z1;C9JAB2,Q16629;A0A0B4J1Z1;C9JAB2,6;6;6,6;6;6,6;6;6,Serine/arginine-rich splicing factor 7,SRSF7,sp|Q16629|SRSF7_HUMAN Serine/arginine-rich splicing factor 7 OS=Homo sapiens OX=9606 GN=SRSF7 PE=1 SV=1;tr|A0A0B4J1Z1|A0A0B4J1Z1_HUMAN Serine/arginine-rich-splicing factor 7 OS=Homo sapiens OX=9606 GN=SRSF7 PE=1 SV=1;tr|C9JAB2|C9JAB2_HUMAN Serine/arginine-,6,6,29,238
LARP1,0.3201420621,0.234492437902987,0,Q6PKG0;A0A0B4J210;E5RH50;H0YC33;H0YC73;H0YBW1,Q6PKG0;A0A0B4J210;E5RH50,4;4;3;1;1;1,4;4;3;1;1;1,4;4;3;1;1;1,La-related protein 1,LARP1,sp|Q6PKG0|LARP1_HUMAN La-related protein 1 OS=Homo sapiens OX=9606 GN=LARP1 PE=1 SV=2;tr|A0A0B4J210|A0A0B4J210_HUMAN La-related protein 1 (Fragment) OS=Homo sapiens OX=9606 GN=LARP1 PE=1 SV=5;tr|E5RH50|E5RH50_HUMAN La-related protein 1 (Fragment) OS=Homo s,4,4,7.3,1096
TPT1,0.0393830987,0.915089442680579,0,P13693;Q5W0H4;A0A0B4J2C3;J3KPG2;E9PJF7;Q56UQ5;Q9HAU6;H0YCX0,P13693;Q5W0H4;A0A0B4J2C3;J3KPG2;E9PJF7,9;9;9;5;5;2;1;1,9;9;9;5;5;2;1;1,9;9;9;5;5;2;1;1,Translationally-controlled tumor protein,TPT1,sp|P13693|TCTP_HUMAN Translationally-controlled tumor protein OS=Homo sapiens OX=9606 GN=TPT1 PE=1 SV=1;tr|Q5W0H4|Q5W0H4_HUMAN Translationally-controlled tumor protein OS=Homo sapiens OX=9606 GN=TPT1 PE=1 SV=1;tr|A0A0B4J2C3|A0A0B4J2C3_HUMAN Translationally,9,9,35.5,172
PWP2,0.45755956,0.163519840747366,0,Q15269;A0A0B4J2E5;C9J544,Q15269;A0A0B4J2E5;C9J544,2;2;1,2;2;1,1;1;1,Periodic tryptophan protein 2 homolog,PWP2,sp|Q15269|PWP2_HUMAN Periodic tryptophan protein 2 homolog OS=Homo sapiens OX=9606 GN=PWP2 PE=2 SV=2;tr|A0A0B4J2E5|A0A0B4J2E5_HUMAN Uncharacterized protein OS=Homo sapiens OX=9606 GN=LOC102724159 PE=1 SV=1;tr|C9J544|C9J544_HUMAN Periodic tryptophan protein,2,1,2.6,919
SET;SETSIP,-0.4535658882,0.122837900810304,0,Q01105;A0A0C4DFV9;P0DME0;A0A087X027,Q01105;A0A0C4DFV9;P0DME0;A0A087X027,9;9;6;6,9;9;6;6,9;9;6;6,Protein SET;Protein SETSIP,SET;SETSIP,sp|Q01105|SET_HUMAN Protein SET OS=Homo sapiens OX=9606 GN=SET PE=1 SV=3;tr|A0A0C4DFV9|A0A0C4DFV9_HUMAN Protein SET OS=Homo sapiens OX=9606 GN=SET PE=1 SV=1;sp|P0DME0|SETLP_HUMAN Protein SETSIP OS=Homo sapiens OX=9606 GN=SETSIP PE=1 SV=1;tr|A0A087X027|A0A0,9,9,32.1,290
RPSA,0.0055512541,0.986011283770834,0,P08865;C9J9K3;A0A0C4DG17;F8WD59,P08865;C9J9K3;A0A0C4DG17;F8WD59,21;21;21;12,21;21;21;12,21;21;21;12,40S ribosomal protein SA,RPSA,sp|P08865|RSSA_HUMAN 40S ribosomal protein SA OS=Homo sapiens OX=9606 GN=RPSA PE=1 SV=4;tr|C9J9K3|C9J9K3_HUMAN 40S ribosomal protein SA (Fragment) OS=Homo sapiens OX=9606 GN=RPSA PE=1 SV=8;tr|A0A0C4DG17|A0A0C4DG17_HUMAN 40S ribosomal protein SA OS=Homo sap,21,21,68.8,295
CAPNS1,0.957206581,0.0914109222376601,0,P04632;A0A0C4DGQ5;K7ELJ7;K7EM73;K7EIV0;A0A075B7C0;U3KQE2;K7EKD8;U3KPR7;K7EMQ1;K7ES78,P04632;A0A0C4DGQ5;K7ELJ7;K7EM73;K7EIV0;A0A075B7C0;U3KQE2;K7EKD8,9;9;8;7;7;7;6;6;4;2;1,9;9;8;7;7;7;6;6;4;2;1,9;9;8;7;7;7;6;6;4;2;1,Calpain small subunit 1,CAPNS1,sp|P04632|CPNS1_HUMAN Calpain small subunit 1 OS=Homo sapiens OX=9606 GN=CAPNS1 PE=1 SV=1;tr|A0A0C4DGQ5|A0A0C4DGQ5_HUMAN Calpain small subunit 1 OS=Homo sapiens OX=9606 GN=CAPNS1 PE=1 SV=1;tr|K7ELJ7|K7ELJ7_HUMAN Calpain small subunit 1 OS=Homo sapiens OX=9,9,9,41.4,268
DDOST,0.2305493882,0.411879152425091,0,P39656;A0A0C4DGS1;U3KQ84,P39656;A0A0C4DGS1;U3KQ84,10;10;6,10;10;6,10;10;6,Dolichyl-diphosphooligosaccharide--protein glycosyltransferase 48 kDa subunit,DDOST,sp|P39656|OST48_HUMAN Dolichyl-diphosphooligosaccharide--protein glycosyltransferase 48 kDa subunit OS=Homo sapiens OX=9606 GN=DDOST PE=1 SV=4;tr|A0A0C4DGS1|A0A0C4DGS1_HUMAN Dolichyl-diphosphooligosaccharide--protein glycosyltransferase 48 kDa subunit OS=H,10,10,21.5,456
