DCAF6_vs_zBirA,Unnamed: 1,Unnamed: 2,Unnamed: 3,Unnamed: 4,Unnamed: 5,Unnamed: 6,Unnamed: 7,Unnamed: 8,Unnamed: 9,Unnamed: 10,Unnamed: 11,Unnamed: 12,Unnamed: 13,Unnamed: 14,Unnamed: 15
,,,,,,,,,,,,,,,
Gene_names,logFC (DCAF6_vs_zBirA),P_Value (DCAF6_vs_zBirA),isDifferential (DCAF6_vs_zBirA),Protein_IDs,Majority_protein_IDs,Peptide_counts__all_,Peptide_counts__razor_unique_,Peptide_counts__unique_,Protein_names,Gene_names,Fasta_headers,Peptides,Unique_peptides,Sequence_coverage____,Sequence_length
HDLBP,-0.263299805,0.166116037596229,0,Q00341;A0A024R4E5;H0Y394;C9JHZ8;H7C0A4;C9JIZ1;C9J5E5;C9JZI8;C9JES8;C9JK79;C9JHS7;C9JT62;C9JHN6;C9JEJ8;C9JBS3;C9JQ82;C9JMQ6;C9J739;C9JHS9,Q00341;A0A024R4E5;H0Y394,5;5;3;2;2;2;2;2;2;2;2;2;2;2;2;2;2;1;1,5;5;3;2;2;2;2;2;2;2;2;2;2;2;2;2;2;1;1,5;5;3;2;2;2;2;2;2;2;2;2;2;2;2;2;2;1;1,Vigilin,HDLBP,"sp|Q00341|VIGLN_HUMAN Vigilin OS=Homo sapiens OX=9606 GN=HDLBP PE=1 SV=2;tr|A0A024R4E5|A0A024R4E5_HUMAN High density lipoprotein binding protein (Vigilin), isoform CRA_a OS=Homo sapiens OX=9606 GN=HDLBP PE=1 SV=1;tr|H0Y394|H0Y394_HUMAN Vigilin (Fragment) O",5,5,4.5,1268
PSMA2,0.0630590231,0.824674974687455,0,P25787;A0A024RA52;C9JCK5;H3BT36;H7C402,P25787;A0A024RA52,11;11;4;3;1,11;11;4;3;1,11;11;4;3;1,Proteasome subunit alpha type-2;Proteasome subunit alpha type,PSMA2,sp|P25787|PSA2_HUMAN Proteasome subunit alpha type-2 OS=Homo sapiens OX=9606 GN=PSMA2 PE=1 SV=2;tr|A0A024RA52|A0A024RA52_HUMAN Proteasome subunit alpha type OS=Homo sapiens OX=9606 GN=PSMA2 PE=1 SV=1,11,11,53.8,234
BAG6;BAT3,0.5899140843,0.0052372310456341,0,P46379;A0A0G2JL47;A0A024RCR6;A0A0G2JK23;F6S6P2;X6REW1;A0A0G2JJM1;F6UR09;F6U1F2;F6XTU0;A0A0G2JJR8;A0A1B0GX79;F6WML8;F6VEM6;F6X9W3;F6U341,P46379;A0A0G2JL47;A0A024RCR6;A0A0G2JK23;F6S6P2;X6REW1;A0A0G2JJM1,4;4;4;4;3;3;3;1;1;1;1;1;1;1;1;1,4;4;4;4;3;3;3;1;1;1;1;1;1;1;1;1,4;4;4;4;3;3;3;1;1;1;1;1;1;1;1;1,Large proline-rich protein BAG6,BAG6;BAT3,sp|P46379|BAG6_HUMAN Large proline-rich protein BAG6 OS=Homo sapiens OX=9606 GN=BAG6 PE=1 SV=2;tr|A0A0G2JL47|A0A0G2JL47_HUMAN Large proline-rich protein BAG6 OS=Homo sapiens OX=9606 GN=BAG6 PE=1 SV=1;tr|A0A024RCR6|A0A024RCR6_HUMAN BAG6 OS=Homo sapiens OX=9,4,4,4.5,1132
TAF15,0.0828801405,0.545642786276755,0,Q92804;A0A075B7D9;A0A075B7F4,Q92804;A0A075B7D9,5;5;1,2;2;1,2;2;1,TATA-binding protein-associated factor 2N,TAF15,sp|Q92804|RBP56_HUMAN TATA-binding protein-associated factor 2N OS=Homo sapiens OX=9606 GN=TAF15 PE=1 SV=1;tr|A0A075B7D9|A0A075B7D9_HUMAN TATA-binding protein-associated factor 2N OS=Homo sapiens OX=9606 GN=TAF15 PE=1 SV=1,5,2,7.6,592
TXNRD1,0.3286990305,0.122407254100381,0,Q16881;A0A087WSY9;A0A182DWI3;A0A087WSW9;E9PIR7;F8W809;E2QRB9;E9PKD3;A0A0B4J225;E9PIZ5;E9PLT3;E9PKI4;E9PQI3;D3YTF8;A0A182DWF3;E9PRI8;A0A182DWF2;Q9NNW7;E7EWK1;A0A096LPD9;A0A096LPK7,Q16881;A0A087WSY9;A0A182DWI3;A0A087WSW9;E9PIR7;F8W809;E2QRB9;E9PKD3,18;18;18;18;18;18;15;10;5;5;4;4;3;1;1;1;1;1;1;1;1,18;18;18;18;18;18;15;10;5;5;4;4;3;1;1;1;1;1;1;1;1,18;18;18;18;18;18;15;10;5;5;4;4;3;1;1;1;1;1;1;1;1,"Thioredoxin reductase 1, cytoplasmic",TXNRD1,"sp|Q16881|TRXR1_HUMAN Thioredoxin reductase 1, cytoplasmic OS=Homo sapiens OX=9606 GN=TXNRD1 PE=1 SV=3;tr|A0A087WSY9|A0A087WSY9_HUMAN Thioredoxin reductase 1, cytoplasmic OS=Homo sapiens OX=9606 GN=TXNRD1 PE=1 SV=2;tr|A0A182DWI3|A0A182DWI3_HUMAN Thioredoxi",18,18,41.9,649
HMOX2,-0.4366231618,0.0749977710587872,0,P30519;I3L159;I3L1F5;A0A087WT44;I3L276;I3L4P8;A0A1B0GXH0;I3L463;I3L1Y2,P30519;I3L159;I3L1F5;A0A087WT44,5;5;5;5;2;2;2;2;1,5;5;5;5;2;2;2;2;1,5;5;5;5;2;2;2;2;1,Heme oxygenase 2,HMOX2,sp|P30519|HMOX2_HUMAN Heme oxygenase 2 OS=Homo sapiens OX=9606 GN=HMOX2 PE=1 SV=2;tr|I3L159|I3L159_HUMAN Heme oxygenase 2 (Fragment) OS=Homo sapiens OX=9606 GN=HMOX2 PE=1 SV=1;tr|I3L1F5|I3L1F5_HUMAN Heme oxygenase 2 (Fragment) OS=Homo sapiens OX=9606 GN=HM,5,5,21.5,316
EIF2B4,-0.9721952481,0.162399831731964,0,Q9UI10;A0A087WTA5;E7ERK9;H7C2L8;A0A087WW69;F8W8L6,Q9UI10;A0A087WTA5;E7ERK9,5;5;5;2;2;1,5;5;5;2;2;1,5;5;5;2;2;1,Translation initiation factor eIF-2B subunit delta,EIF2B4,sp|Q9UI10|EI2BD_HUMAN Translation initiation factor eIF-2B subunit delta OS=Homo sapiens OX=9606 GN=EIF2B4 PE=1 SV=2;tr|A0A087WTA5|A0A087WTA5_HUMAN Translation initiation factor eIF-2B subunit delta OS=Homo sapiens OX=9606 GN=EIF2B4 PE=1 SV=1;tr|E7ERK9|E7E,5,5,13.2,523
KHSRP,0.0601552685,0.606636903358944,0,Q92945;A0A087WTP3;M0R0I5;M0QYH3;M0QXW7;M0R3J3,Q92945;A0A087WTP3;M0R0I5,22;22;13;8;5;2,20;20;11;6;4;2,20;20;11;6;4;2,Far upstream element-binding protein 2,KHSRP,sp|Q92945|FUBP2_HUMAN Far upstream element-binding protein 2 OS=Homo sapiens OX=9606 GN=KHSRP PE=1 SV=4;tr|A0A087WTP3|A0A087WTP3_HUMAN Far upstream element-binding protein 2 OS=Homo sapiens OX=9606 GN=KHSRP PE=1 SV=1;tr|M0R0I5|M0R0I5_HUMAN Far upstream ele,22,20,35.7,711
PYCR2,-0.2681578612,0.138329810250921,0,Q96C36;A0A087WTV6;J3KR12;A0A087WX69;A0A087WZF0;A0A087WZR9,Q96C36;A0A087WTV6;J3KR12;A0A087WX69;A0A087WZF0,4;4;4;2;2;1,3;3;3;2;2;0,3;3;3;2;2;0,Pyrroline-5-carboxylate reductase 2,PYCR2,sp|Q96C36|P5CR2_HUMAN Pyrroline-5-carboxylate reductase 2 OS=Homo sapiens OX=9606 GN=PYCR2 PE=1 SV=1;tr|A0A087WTV6|A0A087WTV6_HUMAN Pyrroline-5-carboxylate reductase 2 OS=Homo sapiens OX=9606 GN=PYCR2 PE=1 SV=1;tr|J3KR12|J3KR12_HUMAN Uncharacterized protei,4,3,11.6,320
HNRNPDL,-0.4735723321,0.0359610218064689,0,A0A087WU03,A0A087WU03,2,2,2,,HNRNPDL,tr|A0A087WU03|A0A087WU03_HUMAN Heterogeneous nuclear ribonucleoprotein D-like OS=Homo sapiens OX=9606 GN=HNRNPDL PE=1 SV=1,2,2,40.4,57
POLA1,0.1796433509,0.486508814521335,0,P09884;A0A087WU64;A6NMQ1,P09884;A0A087WU64;A6NMQ1,2;2;2,2;2;2,2;2;2,DNA polymerase alpha catalytic subunit;DNA polymerase,POLA1,sp|P09884|DPOLA_HUMAN DNA polymerase alpha catalytic subunit OS=Homo sapiens OX=9606 GN=POLA1 PE=1 SV=2;tr|A0A087WU64|A0A087WU64_HUMAN DNA polymerase OS=Homo sapiens OX=9606 GN=POLA1 PE=1 SV=1;tr|A6NMQ1|A6NMQ1_HUMAN DNA polymerase OS=Homo sapiens OX=9606 G,2,2,1.2,1462
CTNNBL1,-0.1769397495,0.169902900555598,0,Q8WYA6;A0A087WUB9;A2A2P1,Q8WYA6;A0A087WUB9,7;7;1,7;7;1,7;7;1,Beta-catenin-like protein 1,CTNNBL1,sp|Q8WYA6|CTBL1_HUMAN Beta-catenin-like protein 1 OS=Homo sapiens OX=9606 GN=CTNNBL1 PE=1 SV=1;tr|A0A087WUB9|A0A087WUB9_HUMAN Beta-catenin-like protein 1 OS=Homo sapiens OX=9606 GN=CTNNBL1 PE=1 SV=1,7,7,15.8,563
SPCS2,0.5352368915,0.00549533440352778,0,Q15005;E9PRB9;E9PL01;A0A087WUC6;E9PI68,Q15005;E9PRB9;E9PL01;A0A087WUC6;E9PI68,2;2;2;2;2,2;2;2;2;2,2;2;2;2;2,Signal peptidase complex subunit 2,SPCS2,sp|Q15005|SPCS2_HUMAN Signal peptidase complex subunit 2 OS=Homo sapiens OX=9606 GN=SPCS2 PE=1 SV=3;tr|E9PRB9|E9PRB9_HUMAN Signal peptidase complex subunit 2 OS=Homo sapiens OX=9606 GN=SPCS2 PE=1 SV=1;tr|E9PL01|E9PL01_HUMAN Signal peptidase complex subunit,2,2,12.4,226
GMPPA,-0.0109003758,0.967581087833614,0,Q96IJ6;A0A087WUI8;C9J255;F8WD54;A0A0U1RRC2;C9JAH0,Q96IJ6;A0A087WUI8;C9J255;F8WD54,3;3;2;2;1;1,3;3;2;2;1;1,3;3;2;2;1;1,Mannose-1-phosphate guanyltransferase alpha,GMPPA,sp|Q96IJ6|GMPPA_HUMAN Mannose-1-phosphate guanyltransferase alpha OS=Homo sapiens OX=9606 GN=GMPPA PE=1 SV=1;tr|A0A087WUI8|A0A087WUI8_HUMAN Mannose-1-phosphate guanyltransferase alpha OS=Homo sapiens OX=9606 GN=GMPPA PE=1 SV=1;tr|C9J255|C9J255_HUMAN Mannos,3,3,11,420
HNRNPDL,-0.2748513449,0.0515589398154757,0,O14979;A0A087WUK2,O14979;A0A087WUK2,17;17,15;15,14;14,Heterogeneous nuclear ribonucleoprotein D-like,HNRNPDL,sp|O14979|HNRDL_HUMAN Heterogeneous nuclear ribonucleoprotein D-like OS=Homo sapiens OX=9606 GN=HNRNPDL PE=1 SV=3;tr|A0A087WUK2|A0A087WUK2_HUMAN Heterogeneous nuclear ribonucleoprotein D-like OS=Homo sapiens OX=9606 GN=HNRNPDL PE=1 SV=1,17,14,23.1,420
SLIRP,-0.1066165887,0.400951009364207,0,Q9GZT3;A0A087WUN7;H0YJ40;G3V4X6;G3V2S9;H0YJW7;H0YJ07;H0YJU7;H0YJI1,Q9GZT3;A0A087WUN7;H0YJ40;G3V4X6;G3V2S9;H0YJW7,6;6;6;6;6;5;2;2;1,6;6;6;6;6;5;2;2;1,6;6;6;6;6;5;2;2;1,"SRA stem-loop-interacting RNA-binding protein, mitochondrial",SLIRP,"sp|Q9GZT3|SLIRP_HUMAN SRA stem-loop-interacting RNA-binding protein, mitochondrial OS=Homo sapiens OX=9606 GN=SLIRP PE=1 SV=1;tr|A0A087WUN7|A0A087WUN7_HUMAN SRA stem-loop-interacting RNA-binding protein, mitochondrial OS=Homo sapiens OX=9606 GN=SLIRP PE=1 ",6,6,55,109
EIF5B,0.6003861215,0.00954982776724056,0,O60841;A0A087WUT6,O60841;A0A087WUT6,8;8,8;8,8;8,Eukaryotic translation initiation factor 5B,EIF5B,sp|O60841|IF2P_HUMAN Eukaryotic translation initiation factor 5B OS=Homo sapiens OX=9606 GN=EIF5B PE=1 SV=4;tr|A0A087WUT6|A0A087WUT6_HUMAN Eukaryotic translation initiation factor 5B OS=Homo sapiens OX=9606 GN=EIF5B PE=1 SV=1,8,8,11.1,1220
POLR2E,-0.8129163965,0.00392307560495905,0,P19388;A0A087WVZ9;A0A087WWX0;A0A0A0MQR7;K7EQN2;K7EJ87;A0A087WVN5,P19388;A0A087WVZ9;A0A087WWX0;A0A0A0MQR7,3;3;2;2;1;1;1,3;3;2;2;1;1;1,3;3;2;2;1;1;1,"DNA-directed RNA polymerases I, II, and III subunit RPABC1",POLR2E,"sp|P19388|RPAB1_HUMAN DNA-directed RNA polymerases I, II, and III subunit RPABC1 OS=Homo sapiens OX=9606 GN=POLR2E PE=1 SV=4;tr|A0A087WVZ9|A0A087WVZ9_HUMAN DNA-directed RNA polymerases I, II, and III subunit RPABC1 OS=Homo sapiens OX=9606 GN=POLR2E PE=1 SV",3,3,19.5,210
NOMO2;NOMO1;NOMO3,-0.0204206347,0.949152676723868,0,Q5JPE7;Q15155;P69849;A0A0G2JP90;A0A087WW46;J3KN36;A0A0G2JN29;A0A087X117;A0A087WTD5,Q5JPE7;Q15155;P69849;A0A0G2JP90;A0A087WW46;J3KN36;A0A0G2JN29;A0A087X117,5;5;5;5;5;5;5;5;2,5;5;5;5;5;5;5;5;2,5;5;5;5;5;5;5;5;2,Nodal modulator 2;Nodal modulator 1;Nodal modulator 3,NOMO2;NOMO1;NOMO3,sp|Q5JPE7|NOMO2_HUMAN Nodal modulator 2 OS=Homo sapiens OX=9606 GN=NOMO2 PE=1 SV=1;sp|Q15155|NOMO1_HUMAN Nodal modulator 1 OS=Homo sapiens OX=9606 GN=NOMO1 PE=1 SV=5;sp|P69849|NOMO3_HUMAN Nodal modulator 3 OS=Homo sapiens OX=9606 GN=NOMO3 PE=1 SV=2;tr|A0A0,5,5,7.7,1267
TPM3,0.1802139524,0.14693908178578,0,A0A087WWU8;D6R904;A0A494C0G0;Q5VU61,A0A087WWU8;D6R904,29;18;11;7,29;18;11;7,11;11;4;7,,TPM3,tr|A0A087WWU8|A0A087WWU8_HUMAN Tropomyosin alpha-3 chain OS=Homo sapiens OX=9606 GN=TPM3 PE=1 SV=1;tr|D6R904|D6R904_HUMAN Tropomyosin alpha-3 chain OS=Homo sapiens OX=9606 GN=TPM3 PE=1 SV=1,29,11,77.5,227
TARDBP;TDP43,-0.0599521509,0.72111170961108,0,Q13148;A0A087WX29;A0A087WYY0;A0A087X260;G3V162;B1AKP7;A0A0A0N0M3;K7EJM5;K7EN94;A0A087WXQ5;A0A087WV68;A0A1W2PNU8;A0A087WXV3;A0A087WX67;A0A087WW61;A0A0A0MSV7;K7EJ99;K7EL26;A0A087WZC9;A0A087WYE7;A0A087WTZ4,Q13148;A0A087WX29;A0A087WYY0;A0A087X260;G3V162;B1AKP7;A0A0A0N0M3;K7EJM5;K7EN94,11;11;9;9;9;9;8;8;7;5;5;5;3;3;3;3;3;1;1;1;1,11;11;9;9;9;9;8;8;7;5;5;5;3;3;3;3;3;1;1;1;1,11;11;9;9;9;9;8;8;7;5;5;5;3;3;3;3;3;1;1;1;1,TAR DNA-binding protein 43,TARDBP;TDP43,sp|Q13148|TADBP_HUMAN TAR DNA-binding protein 43 OS=Homo sapiens OX=9606 GN=TARDBP PE=1 SV=1;tr|A0A087WX29|A0A087WX29_HUMAN TAR DNA-binding protein 43 (Fragment) OS=Homo sapiens OX=9606 GN=TARDBP PE=1 SV=1;tr|A0A087WYY0|A0A087WYY0_HUMAN TAR DNA-binding pro,11,11,35.5,414
RPL17;RPL17-C18orf32,0.3557332496,0.0715366414186379,0,P18621;A0A087WXM6;J3QQT2;J3KRX5;A0A0A6YYL6;J3KRB3;A0A087WWH0;J3QS96;A0A087WY81;J3QLC8;A0A0A0MRF8;J3KSJ0,P18621;A0A087WXM6;J3QQT2;J3KRX5;A0A0A6YYL6;J3KRB3;A0A087WWH0;J3QS96;A0A087WY81;J3QLC8;A0A0A0MRF8,17;17;17;17;17;16;16;16;15;13;12;6,17;17;17;17;17;16;16;16;15;13;12;6,17;17;17;17;17;16;16;16;15;13;12;6,60S ribosomal protein L17,RPL17;RPL17-C18orf32,sp|P18621|RL17_HUMAN 60S ribosomal protein L17 OS=Homo sapiens OX=9606 GN=RPL17 PE=1 SV=3;tr|A0A087WXM6|A0A087WXM6_HUMAN 60S ribosomal protein L17 (Fragment) OS=Homo sapiens OX=9606 GN=RPL17 PE=1 SV=1;tr|J3QQT2|J3QQT2_HUMAN 60S ribosomal protein L17 (Fragm,17,17,64.1,184
ITGB6,-0.1038245724,0.437346232451393,0,P18564;A0A087WXP3;E9PEE8,P18564;A0A087WXP3;E9PEE8,1;1;1,1;1;1,1;1;1,Integrin beta-6;Integrin beta,ITGB6,sp|P18564|ITB6_HUMAN Integrin beta-6 OS=Homo sapiens OX=9606 GN=ITGB6 PE=1 SV=2;tr|A0A087WXP3|A0A087WXP3_HUMAN Integrin beta OS=Homo sapiens OX=9606 GN=ITGB6 PE=1 SV=1;tr|E9PEE8|E9PEE8_HUMAN Integrin beta OS=Homo sapiens OX=9606 GN=ITGB6 PE=1 SV=1,1,1,1.1,788
PSMB3,0.1594997043,0.302569057260306,0,P49720;A0A087WXQ8;A0A087WY10;A0A087WUL2,P49720;A0A087WXQ8;A0A087WY10;A0A087WUL2,9;9;9;7,9;9;9;7,9;9;9;7,Proteasome subunit beta type-3,PSMB3,sp|P49720|PSB3_HUMAN Proteasome subunit beta type-3 OS=Homo sapiens OX=9606 GN=PSMB3 PE=1 SV=2;tr|A0A087WXQ8|A0A087WXQ8_HUMAN Proteasome subunit beta type-3 OS=Homo sapiens OX=9606 GN=PSMB3 PE=1 SV=1;tr|A0A087WY10|A0A087WY10_HUMAN Proteasome subunit beta t,9,9,42,205
VTA1,-0.1545769846,0.255777637175642,0,Q9NP79;A0A087WY55;Q5TGM0,Q9NP79;A0A087WY55;Q5TGM0,4;4;2,4;4;2,4;4;2,Vacuolar protein sorting-associated protein VTA1 homolog,VTA1,"sp|Q9NP79|VTA1_HUMAN Vacuolar protein sorting-associated protein VTA1 homolog OS=Homo sapiens OX=9606 GN=VTA1 PE=1 SV=1;tr|A0A087WY55|A0A087WY55_HUMAN Chromosome 6 open reading frame 55, isoform CRA_b OS=Homo sapiens OX=9606 GN=VTA1 PE=1 SV=1;tr|Q5TGM0|Q5T",4,4,16,307
UBE2D3;UBE2D2;UBE2D4;UBE2D1,-0.4272442634,0.0304553783264562,0,P61077;P62837;D6RAW0;D6RFM0;D6RAH7;H9KV45;A0A0A0MQU3;A0A087WY85;Q9Y2X8;P51668;D6RA11;A0A087WW00;C9J9H9,P61077;P62837;D6RAW0;D6RFM0;D6RAH7;H9KV45;A0A0A0MQU3;A0A087WY85;Q9Y2X8;P51668;D6RA11;A0A087WW00;C9J9H9,2;2;2;2;2;2;2;2;1;1;1;1;1,2;2;2;2;2;2;2;2;1;1;1;1;1,2;2;2;2;2;2;2;2;1;1;1;1;1,Ubiquitin-conjugating enzyme E2 D3;Ubiquitin-conjugating enzyme E2 D2;Ubiquitin-conjugating enzyme E2 D4;Ubiquitin-conjugating enzyme E2 D1,UBE2D3;UBE2D2;UBE2D4;UBE2D1,sp|P61077|UB2D3_HUMAN Ubiquitin-conjugating enzyme E2 D3 OS=Homo sapiens OX=9606 GN=UBE2D3 PE=1 SV=1;sp|P62837|UB2D2_HUMAN Ubiquitin-conjugating enzyme E2 D2 OS=Homo sapiens OX=9606 GN=UBE2D2 PE=1 SV=1;tr|D6RAW0|D6RAW0_HUMAN Ubiquitin-conjugating enzyme E2,2,2,19.7,147
POLD1,0.1327452869,0.296433883840285,0,P28340;M0QZR8;A0A087WYJ2;M0R2B7;A0A2R8Y7K6;M0QXE6;A0A2R8Y705,P28340;M0QZR8;A0A087WYJ2;M0R2B7;A0A2R8Y7K6,3;3;3;3;2;1;1,3;3;3;3;2;1;1,3;3;3;3;2;1;1,DNA polymerase delta catalytic subunit;DNA polymerase,POLD1,sp|P28340|DPOD1_HUMAN DNA polymerase delta catalytic subunit OS=Homo sapiens OX=9606 GN=POLD1 PE=1 SV=2;tr|M0QZR8|M0QZR8_HUMAN DNA polymerase OS=Homo sapiens OX=9606 GN=POLD1 PE=1 SV=1;tr|A0A087WYJ2|A0A087WYJ2_HUMAN DNA polymerase OS=Homo sapiens OX=9606 G,3,3,4.1,1107
EIF3H,-0.0084609595,0.938644617319558,0,O15372;A0A087WZK9;B3KS98;E5RJT0;E5RGU4,O15372;A0A087WZK9;B3KS98;E5RJT0,3;3;3;2;1,3;3;3;2;1,2;2;2;1;0,Eukaryotic translation initiation factor 3 subunit H,EIF3H,sp|O15372|EIF3H_HUMAN Eukaryotic translation initiation factor 3 subunit H OS=Homo sapiens OX=9606 GN=EIF3H PE=1 SV=1;tr|A0A087WZK9|A0A087WZK9_HUMAN Eukaryotic translation initiation factor 3 subunit H OS=Homo sapiens OX=9606 GN=EIF3H PE=1 SV=1;tr|B3KS98|B,3,2,15.6,352
SBDS,-0.7086052456,0.00164173915925803,0,Q9Y3A5;A0A087X020;F8WE72,Q9Y3A5;A0A087X020;F8WE72,4;4;3,4;4;3,4;4;3,Ribosome maturation protein SBDS,SBDS,sp|Q9Y3A5|SBDS_HUMAN Ribosome maturation protein SBDS OS=Homo sapiens OX=9606 GN=SBDS PE=1 SV=4;tr|A0A087X020|A0A087X020_HUMAN Ribosome maturation protein SBDS OS=Homo sapiens OX=9606 GN=SBDS PE=1 SV=1;tr|F8WE72|F8WE72_HUMAN Ribosome maturation protein SBD,4,4,18,250
OGFR,-0.1516607452,0.383008699681112,0,Q9NZT2;A0A087X028;A0A0A0MRN5,Q9NZT2;A0A087X028;A0A0A0MRN5,5;5;5,5;5;5,5;5;5,Opioid growth factor receptor,OGFR,sp|Q9NZT2|OGFR_HUMAN Opioid growth factor receptor OS=Homo sapiens OX=9606 GN=OGFR PE=1 SV=3;tr|A0A087X028|A0A087X028_HUMAN Opioid growth factor receptor OS=Homo sapiens OX=9606 GN=OGFR PE=1 SV=1;tr|A0A0A0MRN5|A0A0A0MRN5_HUMAN Opioid growth factor receptor,5,5,6.6,677
HYOU1,-0.1050002942,0.58764891212903,0,Q9Y4L1;A0A087X054;A0A494C039;E9PJ21;A0A087WWI4;K7EQK2;J3KTF1;Q9BST8;J3QQH7;J3QLE9;J3QL06;A0A087WW13,Q9Y4L1;A0A087X054;A0A494C039;E9PJ21;A0A087WWI4;K7EQK2,17;17;17;15;15;15;4;3;3;3;3;1,17;17;17;15;15;15;4;3;3;3;3;1,17;17;17;15;15;15;4;3;3;3;3;1,Hypoxia up-regulated protein 1,HYOU1,sp|Q9Y4L1|HYOU1_HUMAN Hypoxia up-regulated protein 1 OS=Homo sapiens OX=9606 GN=HYOU1 PE=1 SV=1;tr|A0A087X054|A0A087X054_HUMAN Hypoxia up-regulated protein 1 OS=Homo sapiens OX=9606 GN=HYOU1 PE=1 SV=1;tr|A0A494C039|A0A494C039_HUMAN Hypoxia up-regulated pro,17,17,22,999
ACOT1;ACOT2,-0.0108787316,0.946183642812512,0,Q86TX2;A0A087X0W7;P49753;G3V4F2;A0A087WT95;A0A2R8Y7H3,Q86TX2;A0A087X0W7;P49753;G3V4F2;A0A087WT95,11;11;10;10;10;2,11;11;10;10;10;2,11;11;10;10;10;2,"Acyl-coenzyme A thioesterase 1;Acyl-coenzyme A thioesterase 2, mitochondrial",ACOT1;ACOT2,"sp|Q86TX2|ACOT1_HUMAN Acyl-coenzyme A thioesterase 1 OS=Homo sapiens OX=9606 GN=ACOT1 PE=1 SV=1;tr|A0A087X0W7|A0A087X0W7_HUMAN Acyl-coenzyme A thioesterase 2, mitochondrial OS=Homo sapiens OX=9606 GN=ACOT2 PE=1 SV=1;sp|P49753|ACOT2_HUMAN Acyl-coenzyme A th",11,11,34.4,421
RAB18,-0.0555095128,0.706618365722702,0,Q9NP72;A0A087X163;H0Y6T8;Q5W0J0,Q9NP72;A0A087X163;H0Y6T8;Q5W0J0,4;4;3;2,4;4;3;2,4;4;3;2,Ras-related protein Rab-18,RAB18,sp|Q9NP72|RAB18_HUMAN Ras-related protein Rab-18 OS=Homo sapiens OX=9606 GN=RAB18 PE=1 SV=1;tr|A0A087X163|A0A087X163_HUMAN Ras-related protein Rab-18 OS=Homo sapiens OX=9606 GN=RAB18 PE=1 SV=1;tr|H0Y6T8|H0Y6T8_HUMAN Ras-related protein Rab-18 (Fragment) OS,4,4,20.9,206
PSME2,0.1274975108,0.323863723648759,0,Q9UL46;A0A087X1Z3;H0YM70;H0YLG1;H0YLD2,Q9UL46;A0A087X1Z3;H0YM70,7;7;4;1;1,7;7;4;1;1,7;7;4;1;1,Proteasome activator complex subunit 2,PSME2,sp|Q9UL46|PSME2_HUMAN Proteasome activator complex subunit 2 OS=Homo sapiens OX=9606 GN=PSME2 PE=1 SV=4;tr|A0A087X1Z3|A0A087X1Z3_HUMAN Proteasome activator complex subunit 2 OS=Homo sapiens OX=9606 GN=PSME2 PE=1 SV=1;tr|H0YM70|H0YM70_HUMAN Proteasome activ,7,7,29.7,239
BSG,-0.1489848819,0.325695258313982,0,P35613;A0A087X2B5;A0A087WUV8;I3L192;R4GMX5;R4GN83;A0A2R8YDZ0,P35613;A0A087X2B5;A0A087WUV8;I3L192;R4GMX5,6;6;5;4;3;2;1,6;6;5;4;3;2;1,6;6;5;4;3;2;1,Basigin,BSG,sp|P35613|BASI_HUMAN Basigin OS=Homo sapiens OX=9606 GN=BSG PE=1 SV=2;tr|A0A087X2B5|A0A087X2B5_HUMAN Basigin (Fragment) OS=Homo sapiens OX=9606 GN=BSG PE=1 SV=1;tr|A0A087WUV8|A0A087WUV8_HUMAN Basigin OS=Homo sapiens OX=9606 GN=BSG PE=1 SV=1;tr|I3L192|I3L19,6,6,21.8,385
MRPL45,0.7611115221,0.132581297763141,0,Q9BRJ2;A0A087X2D5;A0A0G2JMS5;A0A087WU62,Q9BRJ2;A0A087X2D5;A0A0G2JMS5;A0A087WU62,4;4;3;3,4;4;3;3,4;4;3;3,"39S ribosomal protein L45, mitochondrial",MRPL45,"sp|Q9BRJ2|RM45_HUMAN 39S ribosomal protein L45, mitochondrial OS=Homo sapiens OX=9606 GN=MRPL45 PE=1 SV=2;tr|A0A087X2D5|A0A087X2D5_HUMAN 39S ribosomal protein L45, mitochondrial OS=Homo sapiens OX=9606 GN=MRPL45 PE=1 SV=1;tr|A0A0G2JMS5|A0A0G2JMS5_HUMAN 39S",4,4,19.3,306
DDX1,-0.1973820305,0.11695606248208,0,Q92499;A0A087X2G1;F1T0B3,Q92499;A0A087X2G1;F1T0B3,23;23;23,23;23;23,23;23;23,ATP-dependent RNA helicase DDX1,DDX1,sp|Q92499|DDX1_HUMAN ATP-dependent RNA helicase DDX1 OS=Homo sapiens OX=9606 GN=DDX1 PE=1 SV=2;tr|A0A087X2G1|A0A087X2G1_HUMAN ATP-dependent RNA helicase DDX1 OS=Homo sapiens OX=9606 GN=DDX1 PE=1 SV=1;tr|F1T0B3|F1T0B3_HUMAN ATP-dependent RNA helicase DDX1 O,23,23,41.1,740
GPS1,-0.600839845,0.0366992385726163,0,Q13098;C9JFE4;A0A096LP07;A0A096LPJ3;A8K070;J3QS84;J3QS88;J3KTB0;J3QLE8;J3QLT0;J3QL53;J3KRE8;J3KSA5;J3KRJ4;J3QQX0,Q13098;C9JFE4;A0A096LP07;A0A096LPJ3;A8K070;J3QS84;J3QS88;J3KTB0;J3QLE8;J3QLT0;J3QL53;J3KRE8;J3KSA5;J3KRJ4,4;4;4;4;4;3;3;3;3;3;3;3;3;3;1,4;4;4;4;4;3;3;3;3;3;3;3;3;3;1,4;4;4;4;4;3;3;3;3;3;3;3;3;3;1,COP9 signalosome complex subunit 1,GPS1,sp|Q13098|CSN1_HUMAN COP9 signalosome complex subunit 1 OS=Homo sapiens OX=9606 GN=GPS1 PE=1 SV=4;tr|C9JFE4|C9JFE4_HUMAN COP9 signalosome complex subunit 1 OS=Homo sapiens OX=9606 GN=GPS1 PE=1 SV=2;tr|A0A096LP07|A0A096LP07_HUMAN COP9 signalosome complex su,4,4,8.4,491
WDR18,-1.0096174158,0.216790706771926,0,Q9BV38;U3KQC1;A0A0A0MQU0;K7EIR0;U3KQK3,Q9BV38;U3KQC1;A0A0A0MQU0;K7EIR0,3;3;3;2;1,3;3;3;2;1,3;3;3;2;1,WD repeat-containing protein 18,WDR18,sp|Q9BV38|WDR18_HUMAN WD repeat-containing protein 18 OS=Homo sapiens OX=9606 GN=WDR18 PE=1 SV=2;tr|U3KQC1|U3KQC1_HUMAN WD repeat-containing protein 18 (Fragment) OS=Homo sapiens OX=9606 GN=WDR18 PE=1 SV=1;tr|A0A0A0MQU0|A0A0A0MQU0_HUMAN WD repeat-containin,3,3,6.7,432
HNRNPUL1,-0.7410626361,0.0102872399952873,0,Q9BUJ2;M0R3F1;A0A0A0MRA5;B7Z4B8;M0QYZ0;M0QYM5;M0QYI8;M0R0K8,Q9BUJ2;M0R3F1;A0A0A0MRA5;B7Z4B8;M0QYZ0,12;12;12;12;6;2;2;1,12;12;12;12;6;2;2;1,12;12;12;12;6;2;2;1,Heterogeneous nuclear ribonucleoprotein U-like protein 1,HNRNPUL1,sp|Q9BUJ2|HNRL1_HUMAN Heterogeneous nuclear ribonucleoprotein U-like protein 1 OS=Homo sapiens OX=9606 GN=HNRNPUL1 PE=1 SV=2;tr|M0R3F1|M0R3F1_HUMAN Heterogeneous nuclear ribonucleoprotein U-like protein 1 (Fragment) OS=Homo sapiens OX=9606 GN=HNRNPUL1 PE=1,12,12,15.9,856
NOLC1,0.2173731979,0.209145486258909,0,Q14978;A0A0A0MRM9;S4R349;S4R402;S4R3C2,Q14978;A0A0A0MRM9,15;15;4;3;1,15;15;4;3;1,12;12;1;0;1,Nucleolar and coiled-body phosphoprotein 1,NOLC1,sp|Q14978|NOLC1_HUMAN Nucleolar and coiled-body phosphoprotein 1 OS=Homo sapiens OX=9606 GN=NOLC1 PE=1 SV=2;tr|A0A0A0MRM9|A0A0A0MRM9_HUMAN Nucleolar and coiled-body phosphoprotein 1 (Fragment) OS=Homo sapiens OX=9606 GN=NOLC1 PE=1 SV=1,15,12,19.6,699
LAMA3,-2.1233743232,0.0116671867942924,1,Q16787;K7EIP4;A0A0A0MTS5;A0A0A6YYF2;A0A3B3ITG1;A0A0A0MSA0,Q16787;K7EIP4;A0A0A0MTS5;A0A0A6YYF2;A0A3B3ITG1;A0A0A0MSA0,3;3;3;3;3;3,3;3;3;3;3;3,3;3;3;3;3;3,Laminin subunit alpha-3,LAMA3,"sp|Q16787|LAMA3_HUMAN Laminin subunit alpha-3 OS=Homo sapiens OX=9606 GN=LAMA3 PE=1 SV=2;tr|K7EIP4|K7EIP4_HUMAN Laminin subunit alpha-3 (Fragment) OS=Homo sapiens OX=9606 GN=LAMA3 PE=1 SV=2;tr|A0A0A0MTS5|A0A0A0MTS5_HUMAN HCG1811249, isoform CRA_f OS=Homo s",3,3,1.7,3333
,-0.2391223852,0.429591113036421,0,A0A0A0MSA4,A0A0A0MSA4,7,5,1,,,tr|A0A0A0MSA4|A0A0A0MSA4_HUMAN Band 4.1-like protein 3 OS=Homo sapiens OX=9606 GN=EPB41L3 PE=1 SV=1,7,1,8.4,1046
HADH,-0.1126624751,0.675270608756771,0,Q16836;A0A1W2PQV5;A0A1W2PNM1;A0A0A0MSE2;A0A0D9SFP2;E9PF18;A0A1W2PQ78;A0A1W2PQC2;A0A1W2PRT2,Q16836;A0A1W2PQV5;A0A1W2PNM1;A0A0A0MSE2;A0A0D9SFP2;E9PF18;A0A1W2PQ78,3;3;3;3;3;3;2;1;1,3;3;3;3;3;3;2;1;1,3;3;3;3;3;3;2;1;1,"Hydroxyacyl-coenzyme A dehydrogenase, mitochondrial",HADH,"sp|Q16836|HCDH_HUMAN Hydroxyacyl-coenzyme A dehydrogenase, mitochondrial OS=Homo sapiens OX=9606 GN=HADH PE=1 SV=3;tr|A0A1W2PQV5|A0A1W2PQV5_HUMAN Hydroxyacyl-coenzyme A dehydrogenase, mitochondrial OS=Homo sapiens OX=9606 GN=HADH PE=1 SV=1;tr|A0A1W2PNM1|A0",3,3,14,314
PRDX1,0.048126461,0.696872849631414,0,Q06830;A0A0A0MSI0;A0A0A0MRQ5,Q06830;A0A0A0MSI0,23;23;7,23;23;7,20;20;4,Peroxiredoxin-1,PRDX1,sp|Q06830|PRDX1_HUMAN Peroxiredoxin-1 OS=Homo sapiens OX=9606 GN=PRDX1 PE=1 SV=1;tr|A0A0A0MSI0|A0A0A0MSI0_HUMAN Peroxiredoxin-1 (Fragment) OS=Homo sapiens OX=9606 GN=PRDX1 PE=1 SV=1,23,20,65.3,199
DDX42,0.2331720415,0.414346937055833,0,Q86XP3;A0A0A0MSJ0;J3KRE3,Q86XP3;A0A0A0MSJ0,8;8;1,8;8;1,8;8;1,ATP-dependent RNA helicase DDX42,DDX42,sp|Q86XP3|DDX42_HUMAN ATP-dependent RNA helicase DDX42 OS=Homo sapiens OX=9606 GN=DDX42 PE=1 SV=1;tr|A0A0A0MSJ0|A0A0A0MSJ0_HUMAN ATP-dependent RNA helicase DDX42 OS=Homo sapiens OX=9606 GN=DDX42 PE=1 SV=1,8,8,12.5,938
PITPNB,-0.4811512033,0.132515171466108,0,P48739;A0A0A0MSW4;B3KYB6;B3KYB7;I3L3W1;I3L2X8;I3L471;I3L4C0;I3L4U7;I3L459,P48739;A0A0A0MSW4;B3KYB6;B3KYB7,4;4;3;3;1;1;1;1;1;1,4;4;3;3;1;1;1;1;1;1,3;3;2;2;0;0;0;0;0;0,Phosphatidylinositol transfer protein beta isoform,PITPNB,sp|P48739|PIPNB_HUMAN Phosphatidylinositol transfer protein beta isoform OS=Homo sapiens OX=9606 GN=PITPNB PE=1 SV=2;tr|A0A0A0MSW4|A0A0A0MSW4_HUMAN Phosphatidylinositol transfer protein beta isoform OS=Homo sapiens OX=9606 GN=PITPNB PE=1 SV=1;tr|B3KYB6|B3K,4,3,10.7,271
SMARCA4,0.2934996066,0.508256316754585,0,P51532;Q9HBD4;A0A0A0MT49;A0A2R8Y4P4;A0A2R8Y7S2;A0A2R8YGP5;A0A2R8YGG3;A0A2R8YCY3;A0A2R8YG32;A0A2R8Y440;A0A2R8Y7F3;A0A2R8Y6N0;A0A2R8Y7Y7;A0A2R8Y526;A0A2R8YF58;A0A2R8Y4C5;A0A2R8Y6V2;A0A2R8YDA1;A0A2R8YF80;P51531;A0A0U1RQZ9;A0A2R8Y523;A0A2R8YFV8,P51532;Q9HBD4;A0A0A0MT49;A0A2R8Y4P4;A0A2R8Y7S2;A0A2R8YGP5;A0A2R8YGG3;A0A2R8YCY3;A0A2R8YG32;A0A2R8Y440;A0A2R8Y7F3;A0A2R8Y6N0;A0A2R8Y7Y7;A0A2R8Y526;A0A2R8YF58;A0A2R8Y4C5;A0A2R8Y6V2;A0A2R8YDA1;A0A2R8YF80,4;4;4;4;4;4;3;2;2;2;2;2;2;2;2;2;2;2;2;1;1;1;1,4;4;4;4;4;4;3;2;2;2;2;2;2;2;2;2;2;2;2;1;1;1;1,3;3;3;3;3;3;2;1;1;1;1;1;1;1;1;1;1;1;1;0;0;0;0,Transcription activator BRG1,SMARCA4,sp|P51532|SMCA4_HUMAN Transcription activator BRG1 OS=Homo sapiens OX=9606 GN=SMARCA4 PE=1 SV=2;tr|Q9HBD4|Q9HBD4_HUMAN SMARCA4 isoform 2 OS=Homo sapiens OX=9606 GN=SMARCA4 PE=1 SV=1;tr|A0A0A0MT49|A0A0A0MT49_HUMAN Transcription activator BRG1 OS=Homo sapien,4,3,3,1647
IVD,-0.1008673286,0.525238062983302,0,P26440;A0A0A0MT83;A0A0S2Z4K7;H0YLC3;H7C4G6;H0YKV0;H0YN10;A0A087WVD3,P26440;A0A0A0MT83;A0A0S2Z4K7;H0YLC3;H7C4G6,8;8;7;5;4;2;2;1,8;8;7;5;4;2;2;1,8;8;7;5;4;2;2;1,"Isovaleryl-CoA dehydrogenase, mitochondrial",IVD,"sp|P26440|IVD_HUMAN Isovaleryl-CoA dehydrogenase, mitochondrial OS=Homo sapiens OX=9606 GN=IVD PE=1 SV=2;tr|A0A0A0MT83|A0A0A0MT83_HUMAN Isovaleryl-CoA dehydrogenase isoform 1 OS=Homo sapiens OX=9606 GN=IVD PE=1 SV=2;tr|A0A0S2Z4K7|A0A0S2Z4K7_HUMAN Isovalery",8,8,22.5,426
ILK,-0.1825388848,0.49128621057459,0,Q13418;A0A0A0MTH3;E9PQ52;A0A087WW45;A0A087WWY6,Q13418;A0A0A0MTH3,3;3;1;1;1,3;3;1;1;1,3;3;1;1;1,Integrin-linked protein kinase,ILK,sp|Q13418|ILK_HUMAN Integrin-linked protein kinase OS=Homo sapiens OX=9606 GN=ILK PE=1 SV=2;tr|A0A0A0MTH3|A0A0A0MTH3_HUMAN Integrin-linked protein kinase OS=Homo sapiens OX=9606 GN=ILK PE=1 SV=1,3,3,7.3,452
ELOVL5,-0.9775261747,0.00140888398963954,0,Q9NYP7;A0A0A0MTI6,Q9NYP7;A0A0A0MTI6,2;2,2;2,2;2,Elongation of very long chain fatty acids protein 5;Elongation of very long chain fatty acids protein,ELOVL5,sp|Q9NYP7|ELOV5_HUMAN Elongation of very long chain fatty acids protein 5 OS=Homo sapiens OX=9606 GN=ELOVL5 PE=1 SV=1;tr|A0A0A0MTI6|A0A0A0MTI6_HUMAN Elongation of very long chain fatty acids protein OS=Homo sapiens OX=9606 GN=ELOVL5 PE=1 SV=1,2,2,12,299
FKBP8,-0.5140303187,0.128256727069434,0,Q14318;U3KQI1;A0A0A0MTJ1;U3KQ64,Q14318;U3KQI1;A0A0A0MTJ1;U3KQ64,2;2;2;1,2;2;2;1,2;2;2;1,Peptidyl-prolyl cis-trans isomerase FKBP8,FKBP8,sp|Q14318|FKBP8_HUMAN Peptidyl-prolyl cis-trans isomerase FKBP8 OS=Homo sapiens OX=9606 GN=FKBP8 PE=1 SV=2;tr|U3KQI1|U3KQI1_HUMAN Peptidyl-prolyl cis-trans isomerase FKBP8 (Fragment) OS=Homo sapiens OX=9606 GN=FKBP8 PE=1 SV=1;tr|A0A0A0MTJ1|A0A0A0MTJ1_HUMAN,2,2,7.3,412
