RPS28,0.2572938745,0.100104653042325,0,P62857,P62857,11,11,11,40S ribosomal protein S28,RPS28,sp|P62857|RS28_HUMAN 40S ribosomal protein S28 OS=Homo sapiens OX=9606 GN=RPS28 PE=1 SV=1,11,11,95.7,69
FAU,-0.1950062455,0.128926998693729,0,P62861;E9PR30,P62861;E9PR30,5;4,5;4,5;4,40S ribosomal protein S30,FAU,sp|P62861|RS30_HUMAN 40S ribosomal protein S30 OS=Homo sapiens OX=9606 GN=FAU PE=1 SV=1;tr|E9PR30|E9PR30_HUMAN 40S ribosomal protein S30 OS=Homo sapiens OX=9606 GN=FAU PE=1 SV=1,5,5,35.6,59
GNB1,-0.2467442312,0.126533178767829,0,P62873;F6UT28;F6X3N5;B1AKQ8;B3KVK2;P16520;F5H8J8;F5H100;E9PCP0,P62873;F6UT28;F6X3N5;B1AKQ8,16;10;9;8;7;2;2;2;2,8;4;3;2;5;0;0;0;0,7;3;2;2;5;0;0;0;0,Guanine nucleotide-binding protein G(I)/G(S)/G(T) subunit beta-1,GNB1,sp|P62873|GBB1_HUMAN Guanine nucleotide-binding protein G(I)/G(S)/G(T) subunit beta-1 OS=Homo sapiens OX=9606 GN=GNB1 PE=1 SV=3;tr|F6UT28|F6UT28_HUMAN Guanine nucleotide-binding protein G(I)/G(S)/G(T) subunit beta-1 (Fragment) OS=Homo sapiens OX=9606 GN=GN,16,7,59.4,340
GNB2,-0.3170155041,0.0353886982672112,0,P62879;E7EP32;C9JIS1;C9JXA5;C9JZN1,P62879;E7EP32;C9JIS1;C9JXA5;C9JZN1,20;17;15;15;12,20;17;15;15;12,10;8;7;7;4,Guanine nucleotide-binding protein G(I)/G(S)/G(T) subunit beta-2,GNB2,sp|P62879|GBB2_HUMAN Guanine nucleotide-binding protein G(I)/G(S)/G(T) subunit beta-2 OS=Homo sapiens OX=9606 GN=GNB2 PE=1 SV=3;tr|E7EP32|E7EP32_HUMAN Guanine nucleotide-binding protein G(I)/G(S)/G(T) subunit beta-2 OS=Homo sapiens OX=9606 GN=GNB2 PE=1 SV=,20,10,67.1,340
RPL39;RPL39P5,0.2773667104,0.160330944104859,0,P62891;Q59GN2;Q96EH5,P62891;Q59GN2,3;2;1,3;2;1,3;2;1,60S ribosomal protein L39;Putative 60S ribosomal protein L39-like 5,RPL39;RPL39P5,sp|P62891|RL39_HUMAN 60S ribosomal protein L39 OS=Homo sapiens OX=9606 GN=RPL39 PE=1 SV=2;sp|Q59GN2|R39L5_HUMAN Putative 60S ribosomal protein L39-like 5 OS=Homo sapiens OX=9606 GN=RPL39P5 PE=5 SV=2,3,3,33.3,51
RPL31,0.2965189026,0.0526932809036152,0,P62899;H7C2W9;C9JU56;B7Z4E3;B7Z4C8;B8ZZK4,P62899;H7C2W9;C9JU56;B7Z4E3;B7Z4C8;B8ZZK4,15;14;14;14;14;13,15;14;14;14;14;13,15;14;14;14;14;13,60S ribosomal protein L31,RPL31,sp|P62899|RL31_HUMAN 60S ribosomal protein L31 OS=Homo sapiens OX=9606 GN=RPL31 PE=1 SV=1;tr|H7C2W9|H7C2W9_HUMAN 60S ribosomal protein L31 (Fragment) OS=Homo sapiens OX=9606 GN=RPL31 PE=1 SV=1;tr|C9JU56|C9JU56_HUMAN 60S ribosomal protein L31 (Fragment) OS=,15,15,63.2,125
RPL10A,0.3895633648,0.0783262224136753,0,P62906,P62906,20,20,20,60S ribosomal protein L10a,RPL10A,sp|P62906|RL10A_HUMAN 60S ribosomal protein L10a OS=Homo sapiens OX=9606 GN=RPL10A PE=1 SV=2,20,20,52.5,217
RPL11,0.3160411854,0.0517001297767267,0,P62913;Q5VVC8,P62913;Q5VVC8,20;18,20;18,20;18,60S ribosomal protein L11,RPL11,sp|P62913|RL11_HUMAN 60S ribosomal protein L11 OS=Homo sapiens OX=9606 GN=RPL11 PE=1 SV=2;tr|Q5VVC8|Q5VVC8_HUMAN 60S ribosomal protein L11 OS=Homo sapiens OX=9606 GN=RPL11 PE=1 SV=2,20,20,66.9,178
RPL8,0.111405571,0.440862963307814,0,P62917;E9PKZ0;E9PKU4;G3V1A1;E9PP36,P62917;E9PKZ0;E9PKU4;G3V1A1,24;20;20;16;11,24;20;20;16;11,24;20;20;16;11,60S ribosomal protein L8,RPL8,sp|P62917|RL8_HUMAN 60S ribosomal protein L8 OS=Homo sapiens OX=9606 GN=RPL8 PE=1 SV=2;tr|E9PKZ0|E9PKZ0_HUMAN 60S ribosomal protein L8 (Fragment) OS=Homo sapiens OX=9606 GN=RPL8 PE=1 SV=1;tr|E9PKU4|E9PKU4_HUMAN 60S ribosomal protein L8 (Fragment) OS=Homo s,24,24,62.6,257
PPIA,-0.1516180295,0.236756597854753,0,P62937;F8WE65;C9J5S7;F5H284;Q9Y536;E5RIZ5;P0DN26;A0A0H2UH34;A0A0B4J2A2;A0A075B767;A0A075B759;P0DN37,P62937;F8WE65;C9J5S7,28;15;15;2;2;2;2;2;2;2;2;1,28;15;15;2;2;2;2;2;2;2;2;1,28;15;15;2;2;2;2;2;2;2;2;1,"Peptidyl-prolyl cis-trans isomerase A;Peptidyl-prolyl cis-trans isomerase A, N-terminally processed;Peptidyl-prolyl cis-trans isomerase",PPIA,sp|P62937|PPIA_HUMAN Peptidyl-prolyl cis-trans isomerase A OS=Homo sapiens OX=9606 GN=PPIA PE=1 SV=2;tr|F8WE65|F8WE65_HUMAN Peptidyl-prolyl cis-trans isomerase OS=Homo sapiens OX=9606 GN=PPIA PE=1 SV=1;tr|C9J5S7|C9J5S7_HUMAN Peptidyl-prolyl cis-trans isome,28,28,98.2,165
FKBP1A;FKBP12-Exin;FKBP12-Exip2,-0.2122255547,0.192754147072481,0,P62942;Q1JUQ3;Q1JUQ5;A0A087WTS4;Q5W0X3;A0A087WV48;A0A087WZM5,P62942;Q1JUQ3;Q1JUQ5;A0A087WTS4;Q5W0X3;A0A087WV48;A0A087WZM5,4;2;2;2;2;2;2,4;2;2;2;2;2;2,4;2;2;2;2;2;2,Peptidyl-prolyl cis-trans isomerase FKBP1A;Peptidyl-prolyl cis-trans isomerase,FKBP1A;FKBP12-Exin;FKBP12-Exip2,sp|P62942|FKB1A_HUMAN Peptidyl-prolyl cis-trans isomerase FKBP1A OS=Homo sapiens OX=9606 GN=FKBP1A PE=1 SV=2;tr|Q1JUQ3|Q1JUQ3_HUMAN FK506 binding protein12 OS=Homo sapiens OX=9606 GN=FKBP1A PE=2 SV=1;tr|Q1JUQ5|Q1JUQ5_HUMAN Peptidylprolyl isomerase OS=Homo ,4,4,38,108
RPS27A;UBC;UBB,1.2080009041,0.00765771516402575,1,P62979;J3QTR3;P0CG48;B4DV12;Q96C32;Q5PY61;J3QKN0;F5GXK7;F5H747;F5H388;F5H2Z3;P0CG47;F5GYU3;F5H6Q2;J3QS39;F5H265;Q49A90;M0R1V7;F5GZ39;J3QSA3,P62979;J3QTR3;P0CG48;B4DV12;Q96C32;Q5PY61;J3QKN0;F5GXK7;F5H747;F5H388;F5H2Z3;P0CG47;F5GYU3;F5H6Q2;J3QS39;F5H265,16;9;8;8;8;8;8;8;8;8;8;8;8;8;8;8;6;6;5;4,16;9;8;8;8;8;8;8;8;8;8;8;8;8;8;8;6;6;5;4,5;1;0;0;0;0;0;0;0;0;0;0;0;0;0;0;0;0;0;0,Ubiquitin-40S ribosomal protein S27a;Ubiquitin;40S ribosomal protein S27a;Polyubiquitin-C;Ubiquitin;Polyubiquitin-B;Ubiquitin,RPS27A;UBC;UBB,sp|P62979|RS27A_HUMAN Ubiquitin-40S ribosomal protein S27a OS=Homo sapiens OX=9606 GN=RPS27A PE=1 SV=2;tr|J3QTR3|J3QTR3_HUMAN Ubiquitin-40S ribosomal protein S27a (Fragment) OS=Homo sapiens OX=9606 GN=RPS27A PE=1 SV=1;sp|P0CG48|UBC_HUMAN Polyubiquitin-C OS,16,5,75.6,156
GRB2,0.2709026416,0.392559043577778,0,P62993;J3KT38;J3QRL5,P62993,3;1;1,3;1;1,3;1;1,Growth factor receptor-bound protein 2,GRB2,sp|P62993|GRB2_HUMAN Growth factor receptor-bound protein 2 OS=Homo sapiens OX=9606 GN=GRB2 PE=1 SV=1,3,3,9.2,217
RAC1;RAC3,-0.0042767726,0.968184079907231,0,P63000;P60763;P15153;J3KSC4;J3QLK0;B1AH77;B1AH78;B1AH80;B1AH79,P63000;P60763,11;7;5;4;4;3;3;3;2,11;7;5;4;4;3;3;3;2,10;6;4;4;4;3;2;3;1,Ras-related C3 botulinum toxin substrate 1;Ras-related C3 botulinum toxin substrate 3,RAC1;RAC3,sp|P63000|RAC1_HUMAN Ras-related C3 botulinum toxin substrate 1 OS=Homo sapiens OX=9606 GN=RAC1 PE=1 SV=1;sp|P60763|RAC3_HUMAN Ras-related C3 botulinum toxin substrate 3 OS=Homo sapiens OX=9606 GN=RAC3 PE=1 SV=1,11,10,46.4,192
GNAS;GNAL,-0.1442863877,0.266256286194908,0,P63092;Q5JWF2;A0A0A0MR13;A0A590UJY2;A0A590UJF0;B0AZR9;A0A590UJ58;P38405;A0A590UJB0,P63092;Q5JWF2;A0A0A0MR13;A0A590UJY2;A0A590UJF0;B0AZR9;A0A590UJ58;P38405,6;6;4;4;4;4;4;3;2,4;4;4;4;4;4;4;1;2,4;4;4;4;4;4;4;1;2,Guanine nucleotide-binding protein G(s) subunit alpha isoforms short;Guanine nucleotide-binding protein G(s) subunit alpha isoforms XLas;Guanine nucleotide-binding protein G(olf) subunit alpha,GNAS;GNAL,sp|P63092|GNAS2_HUMAN Guanine nucleotide-binding protein G(s) subunit alpha isoforms short OS=Homo sapiens OX=9606 GN=GNAS PE=1 SV=1;sp|Q5JWF2|GNAS1_HUMAN Guanine nucleotide-binding protein G(s) subunit alpha isoforms XLas OS=Homo sapiens OX=9606 GN=GNAS P,6,4,17,394
YWHAZ,-0.140266629,0.234906174425121,0,P63104;E7EX29;E7ESK7;B0AZS6;E5RIR4;E9PD24;E7EVZ2;H0YB80;E5RGE1;B7Z2E6;A2IDB2,P63104;E7EX29;E7ESK7;B0AZS6,27;23;19;15;12;12;12;10;9;8;4,27;23;19;15;12;12;12;10;9;8;4,20;16;15;10;10;10;10;5;8;5;0,14-3-3 protein zeta/delta,YWHAZ,sp|P63104|1433Z_HUMAN 14-3-3 protein zeta/delta OS=Homo sapiens OX=9606 GN=YWHAZ PE=1 SV=1;tr|E7EX29|E7EX29_HUMAN 14-3-3 protein zeta/delta (Fragment) OS=Homo sapiens OX=9606 GN=YWHAZ PE=1 SV=1;tr|E7ESK7|E7ESK7_HUMAN 14-3-3 protein zeta/delta (Fragment) OS,27,20,66.1,245
PPP2R2A,0.257496582,0.425374976527159,0,P63151;A0A590UJY3;A0A590UJJ1;E5RFR9;Q66LE6;E5RHQ2;E5RJV2;E5RIY1,P63151;A0A590UJY3;A0A590UJJ1,7;6;4;2;1;1;1;1,7;6;4;2;1;1;1;1,7;6;4;2;1;1;1;1,Serine/threonine-protein phosphatase 2A 55 kDa regulatory subunit B alpha isoform,PPP2R2A,sp|P63151|2ABA_HUMAN Serine/threonine-protein phosphatase 2A 55 kDa regulatory subunit B alpha isoform OS=Homo sapiens OX=9606 GN=PPP2R2A PE=1 SV=1;tr|A0A590UJY3|A0A590UJY3_HUMAN Serine/threonine-protein phosphatase 2A 55 kDa regulatory subunit B OS=Homo s,7,7,27.7,447
DYNLL1,-0.6015493879,0.0286456783164876,0,P63167;F8VXI7;F8VXL2;F8VRV5,P63167,4;1;1;1,4;1;1;1,1;1;1;1,"Dynein light chain 1, cytoplasmic",DYNLL1,"sp|P63167|DYL1_HUMAN Dynein light chain 1, cytoplasmic OS=Homo sapiens OX=9606 GN=DYNLL1 PE=1 SV=1",4,1,42.7,89
RPL38,0.2419509686,0.28831280344623,0,P63173;J3KT73;J3QL01;J3KSP2,P63173;J3KT73;J3QL01,4;3;3;1,4;3;3;1,4;3;3;1,60S ribosomal protein L38,RPL38,sp|P63173|RL38_HUMAN 60S ribosomal protein L38 OS=Homo sapiens OX=9606 GN=RPL38 PE=1 SV=2;tr|J3KT73|J3KT73_HUMAN 60S ribosomal protein L38 OS=Homo sapiens OX=9606 GN=RPL38 PE=1 SV=1;tr|J3QL01|J3QL01_HUMAN 60S ribosomal protein L38 OS=Homo sapiens OX=9606 G,4,4,57.1,70
RPS21,0.0120855126,0.914309062769057,0,P63220;Q8WVC2;Q9BYK1;Q9BYK2,P63220;Q8WVC2;Q9BYK1,12;10;7;2,12;10;7;2,12;10;7;2,40S ribosomal protein S21,RPS21,sp|P63220|RS21_HUMAN 40S ribosomal protein S21 OS=Homo sapiens OX=9606 GN=RPS21 PE=1 SV=1;tr|Q8WVC2|Q8WVC2_HUMAN 40S ribosomal protein S21 OS=Homo sapiens OX=9606 GN=RPS21 PE=1 SV=1;tr|Q9BYK1|Q9BYK1_HUMAN 40S ribosomal protein S21 OS=Homo sapiens OX=9606 G,12,12,92.8,83
GNB2L1,0.0163292763,0.882824901670191,0,P63244;D6RHH4;J3KPE3;D6RAC2;D6REE5;D6R9L0;H0Y8W2;D6R9Z1;H0YAM7;D6RFX4;D6RBD0;E9PD14;D6RAU2;D6RFZ9;H0YAF8;H0Y8R5;D6RGK8;D6R909;D6RF23;D6RHJ5;D6RDI0;H0Y9P0,P63244;D6RHH4;J3KPE3;D6RAC2;D6REE5;D6R9L0;H0Y8W2;D6R9Z1;H0YAM7;D6RFX4;D6RBD0;E9PD14;D6RAU2;D6RFZ9;H0YAF8,30;26;25;21;20;20;20;20;18;18;17;17;17;16;16;10;9;9;5;5;4;3,30;26;25;21;20;20;20;20;18;18;17;17;17;16;16;10;9;9;5;5;4;3,30;26;25;21;20;20;20;20;18;18;17;17;17;16;16;10;9;9;5;5;4;3,"Guanine nucleotide-binding protein subunit beta-2-like 1;Guanine nucleotide-binding protein subunit beta-2-like 1, N-terminally processed",GNB2L1,sp|P63244|RACK1_HUMAN Receptor of activated protein C kinase 1 OS=Homo sapiens OX=9606 GN=RACK1 PE=1 SV=3;tr|D6RHH4|D6RHH4_HUMAN Receptor of-activated protein C kinase 1 OS=Homo sapiens OX=9606 GN=RACK1 PE=1 SV=1;tr|J3KPE3|J3KPE3_HUMAN Receptor of-activate,30,30,77,317
ACTG1,0.0141969155,0.933394297597969,0,P63261;I3L3I0;I3L1U9;I3L4N8;I3L3R2;J3KT65;K7EM38,P63261;I3L3I0;I3L1U9;I3L4N8,57;31;31;29;20;19;17,57;31;31;29;20;19;17,3;3;3;3;3;3;3,"Actin, cytoplasmic 2;Actin, cytoplasmic 2, N-terminally processed",ACTG1,"sp|P63261|ACTG_HUMAN Actin, cytoplasmic 2 OS=Homo sapiens OX=9606 GN=ACTG1 PE=1 SV=1;tr|I3L3I0|I3L3I0_HUMAN Actin, cytoplasmic 2 (Fragment) OS=Homo sapiens OX=9606 GN=ACTG1 PE=1 SV=1;tr|I3L1U9|I3L1U9_HUMAN Actin, cytoplasmic 2 (Fragment) OS=Homo sapiens OX",57,3,99.5,375
SUPT4H1,-0.6305424599,0.00746552432883957,0,P63272;J3KSQ6;D3DTZ5;J3QSB9,P63272;J3KSQ6;D3DTZ5;J3QSB9,4;2;2;2,4;2;2;2,4;2;2;2,Transcription elongation factor SPT4,SUPT4H1,sp|P63272|SPT4H_HUMAN Transcription elongation factor SPT4 OS=Homo sapiens OX=9606 GN=SUPT4H1 PE=1 SV=1;tr|J3KSQ6|J3KSQ6_HUMAN Transcription elongation factor SPT4 OS=Homo sapiens OX=9606 GN=SUPT4H1 PE=1 SV=1;tr|D3DTZ5|D3DTZ5_HUMAN Suppressor of Ty 4 homol,4,4,35.9,117
TMSB10,-0.0653867319,0.661143745319798,0,P63313,P63313,3,3,3,Thymosin beta-10,TMSB10,sp|P63313|TYB10_HUMAN Thymosin beta-10 OS=Homo sapiens OX=9606 GN=TMSB10 PE=1 SV=2,3,3,68.2,44
CSNK2B;CSNK2B-LY6G5B-1181;CSNK2B-LY6G5B--991,0.1359714871,0.758914872764632,0,P67870;Q5SRQ6;Q5SRQ3;N0E472;A0A0G2JM12;N0E644;A0A0G2JM58,P67870;Q5SRQ6;Q5SRQ3;N0E472;A0A0G2JM12,5;5;4;4;4;1;1,5;5;4;4;4;1;1,5;5;4;4;4;1;1,Casein kinase II subunit beta,CSNK2B;CSNK2B-LY6G5B-1181;CSNK2B-LY6G5B--991,sp|P67870|CSK2B_HUMAN Casein kinase II subunit beta OS=Homo sapiens OX=9606 GN=CSNK2B PE=1 SV=1;tr|Q5SRQ6|Q5SRQ6_HUMAN Casein kinase II subunit beta OS=Homo sapiens OX=9606 GN=CSNK2B PE=1 SV=2;tr|Q5SRQ3|Q5SRQ3_HUMAN Casein kinase II subunit beta OS=Homo sa,5,5,27,215
ACTA1;ACTC1,0.1479926426,0.372053574393721,0,P68133;P68032;A6NL76,P68133;P68032;A6NL76,33;33;26,5;5;5,2;2;2,"Actin, alpha skeletal muscle;Actin, alpha cardiac muscle 1",ACTA1;ACTC1,"sp|P68133|ACTS_HUMAN Actin, alpha skeletal muscle OS=Homo sapiens OX=9606 GN=ACTA1 PE=1 SV=1;sp|P68032|ACTC_HUMAN Actin, alpha cardiac muscle 1 OS=Homo sapiens OX=9606 GN=ACTC1 PE=1 SV=1;tr|A6NL76|A6NL76_HUMAN Actin, alpha skeletal muscle OS=Homo sapiens O",33,2,39,377
EEF1A1;EEF1A1P5,-0.0507146876,0.672751346238247,0,P68104;Q5VTE0;A0A087WVQ9;A0A087WV01;Q5JR01;A6PW80,P68104;Q5VTE0;A0A087WVQ9;A0A087WV01,38;37;34;24;11;10,38;37;34;24;11;10,18;18;18;11;4;4,Elongation factor 1-alpha 1;Putative elongation factor 1-alpha-like 3;Elongation factor 1-alpha,EEF1A1;EEF1A1P5,sp|P68104|EF1A1_HUMAN Elongation factor 1-alpha 1 OS=Homo sapiens OX=9606 GN=EEF1A1 PE=1 SV=1;sp|Q5VTE0|EF1A3_HUMAN Putative elongation factor 1-alpha-like 3 OS=Homo sapiens OX=9606 GN=EEF1A1P5 PE=5 SV=1;tr|A0A087WVQ9|A0A087WVQ9_HUMAN Elongation factor 1-a,38,18,68,462
TUBA1B;TUBA4A,-0.0290542642,0.809676487018309,0,P68363;P68366;C9JDS9,P68363;P68366,46;29;11,46;29;11,4;4;0,Tubulin alpha-1B chain;Tubulin alpha-4A chain,TUBA1B;TUBA4A,sp|P68363|TBA1B_HUMAN Tubulin alpha-1B chain OS=Homo sapiens OX=9606 GN=TUBA1B PE=1 SV=1;sp|P68366|TBA4A_HUMAN Tubulin alpha-4A chain OS=Homo sapiens OX=9606 GN=TUBA4A PE=1 SV=1,46,4,73.2,451
TUBB4B,0.0034552539,0.975120662908253,0,P68371,P68371,41,41,2,Tubulin beta-4B chain,TUBB4B,sp|P68371|TBB4B_HUMAN Tubulin beta-4B chain OS=Homo sapiens OX=9606 GN=TUBB4B PE=1 SV=1,41,2,70.6,445
EIF4G2,0.0309586084,0.784395006357591,0,P78344;D3DQV9;H0Y3P2;H0YCH5;E9PKF8;H0YD77;H0YE22,P78344;D3DQV9;H0Y3P2;H0YCH5,8;7;6;4;2;2;1,8;7;6;4;2;2;1,8;7;6;4;2;2;1,Eukaryotic translation initiation factor 4 gamma 2,EIF4G2,sp|P78344|IF4G2_HUMAN Eukaryotic translation initiation factor 4 gamma 2 OS=Homo sapiens OX=9606 GN=EIF4G2 PE=1 SV=1;tr|D3DQV9|D3DQV9_HUMAN Eukaryotic translation initiation factor 4 gamma 2 (Fragment) OS=Homo sapiens OX=9606 GN=EIF4G2 PE=1 SV=1;tr|H0Y3P2|,8,8,12,907
CCT2,-0.0986445469,0.418088097280343,0,P78371;F5GWF6;F8VQ14,P78371;F5GWF6;F8VQ14,51;49;44,51;49;44,51;49;44,T-complex protein 1 subunit beta,CCT2,sp|P78371|TCPB_HUMAN T-complex protein 1 subunit beta OS=Homo sapiens OX=9606 GN=CCT2 PE=1 SV=4;tr|F5GWF6|F5GWF6_HUMAN T-complex protein 1 subunit beta OS=Homo sapiens OX=9606 GN=CCT2 PE=1 SV=2;tr|F8VQ14|F8VQ14_HUMAN T-complex protein 1 subunit beta OS=Hom,51,51,82.4,535
RAE1,-0.4234388772,0.086702420097244,0,P78406;E9PPG9;E9PQ57;B0QZ36,P78406;E9PPG9;E9PQ57,5;4;4;1,5;4;4;1,5;4;4;1,mRNA export factor,RAE1,sp|P78406|RAE1L_HUMAN mRNA export factor OS=Homo sapiens OX=9606 GN=RAE1 PE=1 SV=1;tr|E9PPG9|E9PPG9_HUMAN mRNA export factor OS=Homo sapiens OX=9606 GN=RAE1 PE=1 SV=1;tr|E9PQ57|E9PQ57_HUMAN mRNA export factor OS=Homo sapiens OX=9606 GN=RAE1 PE=1 SV=1,5,5,15.2,368
GSTO1,-0.0785027593,0.675978939819104,0,P78417;Q5TA02;Q5TA01,P78417;Q5TA02;Q5TA01,9;7;6,9;7;6,9;7;6,Glutathione S-transferase omega-1,GSTO1,sp|P78417|GSTO1_HUMAN Glutathione S-transferase omega-1 OS=Homo sapiens OX=9606 GN=GSTO1 PE=1 SV=2;tr|Q5TA02|Q5TA02_HUMAN Glutathione S-transferase omega-1 (Fragment) OS=Homo sapiens OX=9606 GN=GSTO1 PE=1 SV=1;tr|Q5TA01|Q5TA01_HUMAN Glutathione S-transfera,9,9,28.2,241
PRKDC,0.0024349632,0.986686882166888,0,P78527;H0YG84,P78527,87;2,87;2,87;2,DNA-dependent protein kinase catalytic subunit,PRKDC,sp|P78527|PRKDC_HUMAN DNA-dependent protein kinase catalytic subunit OS=Homo sapiens OX=9606 GN=PRKDC PE=1 SV=3,87,87,23.4,4128
SRPX,-0.3242505613,0.66668295033616,0,P78539,P78539,3,3,3,Sushi repeat-containing protein SRPX,SRPX,sp|P78539|SRPX_HUMAN Sushi repeat-containing protein SRPX OS=Homo sapiens OX=9606 GN=SRPX PE=1 SV=1,3,3,12.5,464
MRPS5,0.2978518704,0.0795222049433902,0,P82675,P82675,5,5,5,"28S ribosomal protein S5, mitochondrial",MRPS5,"sp|P82675|RT05_HUMAN 28S ribosomal protein S5, mitochondrial OS=Homo sapiens OX=9606 GN=MRPS5 PE=1 SV=2",5,5,14.7,430
MRPS9,0.0307249204,0.794025549491741,0,P82933,P82933,10,10,10,"28S ribosomal protein S9, mitochondrial",MRPS9,"sp|P82933|RT09_HUMAN 28S ribosomal protein S9, mitochondrial OS=Homo sapiens OX=9606 GN=MRPS9 PE=1 SV=2",10,10,32.3,396
SARNP,-0.1387908732,0.348074548748287,0,P82979;F8VZQ9;H0YHG0;F8VS12,P82979;F8VZQ9;H0YHG0,13;11;11;5,13;11;11;5,13;11;11;5,SAP domain-containing ribonucleoprotein,SARNP,sp|P82979|SARNP_HUMAN SAP domain-containing ribonucleoprotein OS=Homo sapiens OX=9606 GN=SARNP PE=1 SV=3;tr|F8VZQ9|F8VZQ9_HUMAN SAP domain-containing ribonucleoprotein OS=Homo sapiens OX=9606 GN=SARNP PE=1 SV=1;tr|H0YHG0|H0YHG0_HUMAN Uncharacterized protei,13,13,49,210
LACTB,0.0406417898,0.743600897973024,0,P83111;H0YNN5,P83111;H0YNN5,4;2,4;2,4;2,"Serine beta-lactamase-like protein LACTB, mitochondrial",LACTB,"sp|P83111|LACTB_HUMAN Serine beta-lactamase-like protein LACTB, mitochondrial OS=Homo sapiens OX=9606 GN=LACTB PE=1 SV=2;tr|H0YNN5|H0YNN5_HUMAN Serine beta-lactamase-like protein LACTB, mitochondrial (Fragment) OS=Homo sapiens OX=9606 GN=LACTB PE=1 SV=1",4,4,7.3,547
RPL24,0.1032243795,0.43394203379312,0,P83731;C9JXB8;C9JNW5,P83731;C9JXB8;C9JNW5,16;13;13,16;13;13,16;13;13,60S ribosomal protein L24,RPL24,sp|P83731|RL24_HUMAN 60S ribosomal protein L24 OS=Homo sapiens OX=9606 GN=RPL24 PE=1 SV=1;tr|C9JXB8|C9JXB8_HUMAN 60S ribosomal protein L24 OS=Homo sapiens OX=9606 GN=RPL24 PE=1 SV=1;tr|C9JNW5|C9JNW5_HUMAN 60S ribosomal protein L24 OS=Homo sapiens OX=9606 G,16,16,55.4,157
RPL36AL;RPL36A;RPL36A-HNRNPH2,0.1835505267,0.284881826597189,0,Q969Q0;P83881;H0Y5B4;H7BZ11;J3KQN4;H7BY91;H0Y3V9;R4GN19,Q969Q0;P83881;H0Y5B4;H7BZ11;J3KQN4,7;7;6;6;6;3;3;1,7;7;6;6;6;3;3;1,7;7;6;6;6;3;3;1,60S ribosomal protein L36a-like;60S ribosomal protein L36a,RPL36AL;RPL36A;RPL36A-HNRNPH2,sp|Q969Q0|RL36L_HUMAN 60S ribosomal protein L36a-like OS=Homo sapiens OX=9606 GN=RPL36AL PE=1 SV=3;sp|P83881|RL36A_HUMAN 60S ribosomal protein L36a OS=Homo sapiens OX=9606 GN=RPL36A PE=1 SV=2;tr|H0Y5B4|H0Y5B4_HUMAN 60S ribosomal protein L36a OS=Homo sapien,7,7,42.5,106
ARF1;ARF3,0.0483450629,0.745202005724174,0,P84077;P61204;F5H423;F5H0C7;P84085;C9J1Z8;F5H1V1;F5H6T5;F8WDB3;H0YGG7,P84077;P61204;F5H423,7;6;5;3;2;2;1;1;1;1,7;6;5;3;2;2;1;1;1;1,5;4;3;1;0;0;0;0;0;1,ADP-ribosylation factor 1;ADP-ribosylation factor 3,ARF1;ARF3,sp|P84077|ARF1_HUMAN ADP-ribosylation factor 1 OS=Homo sapiens OX=9606 GN=ARF1 PE=1 SV=2;sp|P61204|ARF3_HUMAN ADP-ribosylation factor 3 OS=Homo sapiens OX=9606 GN=ARF3 PE=1 SV=2;tr|F5H423|F5H423_HUMAN Uncharacterized protein OS=Homo sapiens OX=9606 PE=3 SV,7,5,68.5,181
ERH,-0.0154558076,0.911220360234652,0,P84090;G3V279,P84090;G3V279,9;5,9;5,9;5,Enhancer of rudimentary homolog,ERH,sp|P84090|ERH_HUMAN Enhancer of rudimentary homolog OS=Homo sapiens OX=9606 GN=ERH PE=1 SV=1;tr|G3V279|G3V279_HUMAN Enhancer of rudimentary homolog OS=Homo sapiens OX=9606 GN=ERH PE=1 SV=1,9,9,62.5,104
RHOG,-0.0329373282,0.766003753881969,0,P84095,P84095,4,3,3,Rho-related GTP-binding protein RhoG,RHOG,sp|P84095|RHOG_HUMAN Rho-related GTP-binding protein RhoG OS=Homo sapiens OX=9606 GN=RHOG PE=1 SV=1,4,3,31.9,191
SRSF3,-0.0314497534,0.797654473515779,0,P84103;A0A087X2D0,P84103;A0A087X2D0,9;7,8;6,8;6,Serine/arginine-rich splicing factor 3,SRSF3,sp|P84103|SRSF3_HUMAN Serine/arginine-rich splicing factor 3 OS=Homo sapiens OX=9606 GN=SRSF3 PE=1 SV=1;tr|A0A087X2D0|A0A087X2D0_HUMAN Serine/arginine-rich-splicing factor 3 OS=Homo sapiens OX=9606 GN=SRSF3 PE=1 SV=1,9,8,51.2,164
FOXK1,-0.339054206,0.0300765234029982,0,P85037,P85037,4,4,4,Forkhead box protein K1,FOXK1,sp|P85037|FOXK1_HUMAN Forkhead box protein K1 OS=Homo sapiens OX=9606 GN=FOXK1 PE=1 SV=1,4,4,4.1,733
RBM10,-0.3280050681,0.270894847768202,0,P98175;P78332;E9PGM9,P98175,5;1;1,5;1;1,5;1;1,RNA-binding protein 10,RBM10,sp|P98175|RBM10_HUMAN RNA-binding protein 10 OS=Homo sapiens OX=9606 GN=RBM10 PE=1 SV=3,5,5,8.3,930
RBM3,0.2257062226,0.259104588913956,0,P98179,P98179,6,6,6,RNA-binding protein 3,RBM3,sp|P98179|RBM3_HUMAN RNA-binding protein 3 OS=Homo sapiens OX=9606 GN=RBM3 PE=1 SV=1,6,6,36.3,157
TFAM,-0.3343979816,0.199050758890649,0,Q00059;H7BYN3,Q00059;H7BYN3,9;7,9;7,9;7,"Transcription factor A, mitochondrial",TFAM,"sp|Q00059|TFAM_HUMAN Transcription factor A, mitochondrial OS=Homo sapiens OX=9606 GN=TFAM PE=1 SV=1;tr|H7BYN3|H7BYN3_HUMAN Transcription factor A, mitochondrial (Fragment) OS=Homo sapiens OX=9606 GN=TFAM PE=1 SV=1",9,9,27.2,246
PURA,0.0735257243,0.536901292039113,0,Q00577,Q00577,4,3,3,Transcriptional activator protein Pur-alpha,PURA,sp|Q00577|PURA_HUMAN Transcriptional activator protein Pur-alpha OS=Homo sapiens OX=9606 GN=PURA PE=1 SV=2,4,3,11.2,322
CLTC,-0.168842812,0.170461558249287,0,Q00610;A0A087WVQ6;J3KS13;P53675;A0A087WX41;K7EJJ5;J3KSQ2;J3KRF5;J3QL20;F5H5N6,Q00610;A0A087WVQ6,89;88;30;18;18;10;6;5;3;1,89;88;30;18;18;10;6;5;3;1,89;88;30;18;18;10;6;5;3;1,Clathrin heavy chain 1;Clathrin heavy chain,CLTC,sp|Q00610|CLH1_HUMAN Clathrin heavy chain 1 OS=Homo sapiens OX=9606 GN=CLTC PE=1 SV=5;tr|A0A087WVQ6|A0A087WVQ6_HUMAN Clathrin heavy chain OS=Homo sapiens OX=9606 GN=CLTC PE=1 SV=1,89,89,50.1,1675
FKBP3,0.0836580503,0.608037458904231,0,Q00688;G3V5F2,Q00688,10;2,10;2,10;2,Peptidyl-prolyl cis-trans isomerase FKBP3,FKBP3,sp|Q00688|FKBP3_HUMAN Peptidyl-prolyl cis-trans isomerase FKBP3 OS=Homo sapiens OX=9606 GN=FKBP3 PE=1 SV=1,10,10,40.6,224
SORD,-0.1147911072,0.523216403574399,0,Q00796;H0YLA4;H0YKB3,Q00796;H0YLA4,7;5;3,7;5;3,7;5;3,Sorbitol dehydrogenase,SORD,sp|Q00796|DHSO_HUMAN Sorbitol dehydrogenase OS=Homo sapiens OX=9606 GN=SORD PE=1 SV=4;tr|H0YLA4|H0YLA4_HUMAN Sorbitol dehydrogenase OS=Homo sapiens OX=9606 GN=SORD PE=1 SV=1,7,7,33.1,357
HNRNPU,-0.1054397628,0.353970071596584,0,Q00839;A0A1W2PPS1;A0A1X7SBS1;A0A1W2PP35;Q5RI18;A0A1W2PPH7;A0A1W2PQL0;A0A1W2PP34;A0A1W2PPL4;A0A1W2PQ74;A0A1W2PRZ7;A0A1W2PQD4;A0A1W2PPE9;A0A1W2PRI6;A0A1W2PP22;A0A1W2PNG3,Q00839;A0A1W2PPS1;A0A1X7SBS1;A0A1W2PP35;Q5RI18;A0A1W2PPH7;A0A1W2PQL0;A0A1W2PP34;A0A1W2PPL4;A0A1W2PQ74;A0A1W2PRZ7;A0A1W2PQD4,56;55;53;51;48;45;44;44;43;42;40;31;6;5;3;2,56;55;53;51;48;45;44;44;43;42;40;31;6;5;3;2,56;55;53;51;48;45;44;44;43;42;40;31;6;5;3;2,Heterogeneous nuclear ribonucleoprotein U,HNRNPU,sp|Q00839|HNRPU_HUMAN Heterogeneous nuclear ribonucleoprotein U OS=Homo sapiens OX=9606 GN=HNRNPU PE=1 SV=6;tr|A0A1W2PPS1|A0A1W2PPS1_HUMAN Heterogeneous nuclear ribonucleoprotein U OS=Homo sapiens OX=9606 GN=HNRNPU PE=1 SV=1;tr|A0A1X7SBS1|A0A1X7SBS1_HUMAN ,56,56,49.8,825
SPTBN1,-0.2101847941,0.185668264748123,0,Q01082;A0A087WUZ3;F8W6C1,Q01082;A0A087WUZ3,51;50;12,51;50;12,51;50;12,"Spectrin beta chain, non-erythrocytic 1",SPTBN1,"sp|Q01082|SPTB2_HUMAN Spectrin beta chain, non-erythrocytic 1 OS=Homo sapiens OX=9606 GN=SPTBN1 PE=1 SV=2;tr|A0A087WUZ3|A0A087WUZ3_HUMAN Spectrin beta chain OS=Homo sapiens OX=9606 GN=SPTBN1 PE=1 SV=1",51,51,29.4,2364
FABP5,-0.1325096343,0.594117164363039,0,Q01469;I6L8B7;A8MUU1,Q01469;I6L8B7,13;9;3,13;9;3,13;9;3,"Fatty acid-binding protein, epidermal",FABP5,sp|Q01469|FABP5_HUMAN Fatty acid-binding protein 5 OS=Homo sapiens OX=9606 GN=FABP5 PE=1 SV=3;tr|I6L8B7|I6L8B7_HUMAN Fatty acid-binding protein 5 OS=Homo sapiens OX=9606 GN=FABP5 PE=1 SV=1,13,13,93.3,135
CAP1,-0.1075362818,0.45327114257773,0,Q01518;Q5T0R7;Q5T0R6;Q5T0R5;Q5T0R4;Q5T0R3;Q5T0R2;Q5T0R1;Q5T0R9;Q5T0S3;Q5T0R8,Q01518;Q5T0R7;Q5T0R6;Q5T0R5;Q5T0R4;Q5T0R3;Q5T0R2;Q5T0R1;Q5T0R9,18;10;10;10;10;10;10;10;9;6;5,18;10;10;10;10;10;10;10;9;6;5,18;10;10;10;10;10;10;10;9;6;5,Adenylyl cyclase-associated protein 1;Adenylyl cyclase-associated protein,CAP1,sp|Q01518|CAP1_HUMAN Adenylyl cyclase-associated protein 1 OS=Homo sapiens OX=9606 GN=CAP1 PE=1 SV=5;tr|Q5T0R7|Q5T0R7_HUMAN Adenylyl cyclase-associated protein 1 (Fragment) OS=Homo sapiens OX=9606 GN=CAP1 PE=1 SV=1;tr|Q5T0R6|Q5T0R6_HUMAN Adenylyl cyclase-a,18,18,44.6,475
HMGCS1,-0.2797378885,0.166845191445118,0,Q01581;D6RIW1,Q01581,12;3,12;3,12;3,"Hydroxymethylglutaryl-CoA synthase, cytoplasmic",HMGCS1,"sp|Q01581|HMCS1_HUMAN Hydroxymethylglutaryl-CoA synthase, cytoplasmic OS=Homo sapiens OX=9606 GN=HMGCS1 PE=1 SV=2",12,12,38.8,520
ALDH6A1,-0.6256168575,0.00291913285477749,0,Q02252;G3V4Z4,Q02252,4;1,4;1,4;1,"Methylmalonate-semialdehyde dehydrogenase [acylating], mitochondrial",ALDH6A1,"sp|Q02252|MMSA_HUMAN Methylmalonate-semialdehyde dehydrogenase [acylating], mitochondrial OS=Homo sapiens OX=9606 GN=ALDH6A1 PE=1 SV=2",4,4,12.9,535
RPL18A,0.2428879767,0.0845637538694578,0,Q02543;M0R117;M0R1A7;M0R3D6;M0R0P7,Q02543;M0R117;M0R1A7;M0R3D6;M0R0P7,27;25;24;23;18,27;25;24;23;18,27;25;24;23;18,60S ribosomal protein L18a,RPL18A,sp|Q02543|RL18A_HUMAN 60S ribosomal protein L18a OS=Homo sapiens OX=9606 GN=RPL18A PE=1 SV=2;tr|M0R117|M0R117_HUMAN 60S ribosomal protein L18a OS=Homo sapiens OX=9606 GN=RPL18A PE=1 SV=1;tr|M0R1A7|M0R1A7_HUMAN 60S ribosomal protein L18a OS=Homo sapiens OX=,27,27,83,176
FKBP4,-0.0137488201,0.902194498796893,0,Q02790;H0YFG2;F5H1U3,Q02790,26;9;3,26;9;3,26;9;3,"Peptidyl-prolyl cis-trans isomerase FKBP4;Peptidyl-prolyl cis-trans isomerase FKBP4, N-terminally processed",FKBP4,sp|Q02790|FKBP4_HUMAN Peptidyl-prolyl cis-trans isomerase FKBP4 OS=Homo sapiens OX=9606 GN=FKBP4 PE=1 SV=3,26,26,54.2,459
RPL6,0.2645912869,0.0758469959150965,0,Q02878;F8VZ45;U3KQR5;F8VR69;F8VZA3;F8VWR1;F8VU16,Q02878,24;7;7;5;2;2;2,24;7;7;5;2;2;2,24;7;7;5;2;2;2,60S ribosomal protein L6,RPL6,sp|Q02878|RL6_HUMAN 60S ribosomal protein L6 OS=Homo sapiens OX=9606 GN=RPL6 PE=1 SV=3,24,24,58,288
LMNB2,0.0010721825,0.995466081842536,0,Q03252,Q03252,26,19,19,Lamin-B2,LMNB2,sp|Q03252|LMNB2_HUMAN Lamin-B2 OS=Homo sapiens OX=9606 GN=LMNB2 PE=1 SV=4,26,19,36.6,620
GLO1,0.10966,0.520293836579938,0,Q04760,Q04760,7,7,7,Lactoylglutathione lyase,GLO1,sp|Q04760|LGUL_HUMAN Lactoylglutathione lyase OS=Homo sapiens OX=9606 GN=GLO1 PE=1 SV=4,7,7,26.1,184
YWHAH,0.0990539324,0.448992627068035,0,Q04917;F8WEB6;A2IDB1,Q04917,10;3;3,5;3;3,5;3;3,14-3-3 protein eta,YWHAH,sp|Q04917|1433F_HUMAN 14-3-3 protein eta OS=Homo sapiens OX=9606 GN=YWHAH PE=1 SV=4,10,5,31.3,246
CSTF1,-0.3415734816,0.0654768094132582,0,Q05048;A0A0A0MSZ9,Q05048,7;3,7;3,7;3,Cleavage stimulation factor subunit 1,CSTF1,sp|Q05048|CSTF1_HUMAN Cleavage stimulation factor subunit 1 OS=Homo sapiens OX=9606 GN=CSTF1 PE=1 SV=1,7,7,21.3,431
