PPP1CC,-0.1167504162,0.44934098249086,0,P36873;F8VYE8;F8W0W8;F8VR82;A0A087WYY5,P36873;F8VYE8;F8W0W8;F8VR82,13;13;12;11;4,1;1;0;1;1,1;1;0;1;1,Serine/threonine-protein phosphatase PP1-gamma catalytic subunit;Serine/threonine-protein phosphatase,PPP1CC,sp|P36873|PP1G_HUMAN Serine/threonine-protein phosphatase PP1-gamma catalytic subunit OS=Homo sapiens OX=9606 GN=PPP1CC PE=1 SV=1;tr|F8VYE8|F8VYE8_HUMAN Serine/threonine-protein phosphatase OS=Homo sapiens OX=9606 GN=PPP1CC PE=1 SV=1;tr|F8W0W8|F8W0W8_HUMAN,13,1,33.1,323
AK2,0.1014305047,0.392615959111799,0,P54819;F8W1A4;F8VZG5;A0A5F9ZHP2;F8VY04;A0A5K1VW67;G3V213;F8VPP1,P54819;F8W1A4;F8VZG5;A0A5F9ZHP2;F8VY04;A0A5K1VW67;G3V213,16;16;11;11;11;11;10;3,16;16;11;11;11;11;10;3,16;16;11;11;11;11;10;3,"Adenylate kinase 2, mitochondrial;Adenylate kinase 2, mitochondrial, N-terminally processed;Adenylate kinase 2, mitochondrial",AK2,"sp|P54819|KAD2_HUMAN Adenylate kinase 2, mitochondrial OS=Homo sapiens OX=9606 GN=AK2 PE=1 SV=2;tr|F8W1A4|F8W1A4_HUMAN Adenylate kinase 2, mitochondrial OS=Homo sapiens OX=9606 GN=AK2 PE=1 SV=1;tr|F8VZG5|F8VZG5_HUMAN Adenylate kinase 2, mitochondrial OS=Ho",16,16,72.4,239
MYL6,-0.0686571405,0.668034193883711,0,P60660;F8W1R7;G3V1V0;J3KND3;G8JLA2;B7Z6Z4;F8VPF3;G3V1Y7;F8VZU9;F8W180;P14649;F8W1I5;H0YI43;F8VXL3,P60660;F8W1R7;G3V1V0;J3KND3;G8JLA2;B7Z6Z4;F8VPF3;G3V1Y7,14;14;14;11;11;11;9;7;4;4;3;3;2;1,14;14;14;11;11;11;9;7;4;4;3;3;2;1,14;14;14;11;11;11;9;7;4;4;3;3;2;1,Myosin light polypeptide 6,MYL6,sp|P60660|MYL6_HUMAN Myosin light polypeptide 6 OS=Homo sapiens OX=9606 GN=MYL6 PE=1 SV=2;tr|F8W1R7|F8W1R7_HUMAN Myosin light polypeptide 6 OS=Homo sapiens OX=9606 GN=MYL6 PE=1 SV=1;tr|G3V1V0|G3V1V0_HUMAN Myosin light polypeptide 6 OS=Homo sapiens OX=9606 ,14,14,67.5,151
HNRNPA1,-0.0599068667,0.674939059091019,0,P09651;F8W6I7;F8VZ49;A0A2R8Y4L2;F8VTQ5;F8W646;Q32P51;H0YH80;F8VYN5,P09651;F8W6I7;F8VZ49;A0A2R8Y4L2;F8VTQ5;F8W646,27;27;20;16;14;14;13;11;9,27;27;20;16;14;14;13;11;9,27;27;20;16;14;14;13;11;9,"Heterogeneous nuclear ribonucleoprotein A1;Heterogeneous nuclear ribonucleoprotein A1, N-terminally processed",HNRNPA1,sp|P09651|ROA1_HUMAN Heterogeneous nuclear ribonucleoprotein A1 OS=Homo sapiens OX=9606 GN=HNRNPA1 PE=1 SV=5;tr|F8W6I7|F8W6I7_HUMAN Heterogeneous nuclear ribonucleoprotein A1 OS=Homo sapiens OX=9606 GN=HNRNPA1 PE=1 SV=2;tr|F8VZ49|F8VZ49_HUMAN Heterogeneous,27,27,56.5,372
MRE11A,-0.691324733,0.00465255839164375,0,P49959;F8W7U8;F5GXT0,P49959;F8W7U8,3;3;1,3;3;1,3;3;1,Double-strand break repair protein MRE11A,MRE11A,sp|P49959|MRE11_HUMAN Double-strand break repair protein MRE11 OS=Homo sapiens OX=9606 GN=MRE11 PE=1 SV=3;tr|F8W7U8|F8W7U8_HUMAN Double-strand break repair protein OS=Homo sapiens OX=9606 GN=MRE11 PE=1 SV=1,3,3,6.2,708
IGF2BP2,-1.9787913071,0.000207717678812283,1,Q9Y6M1;F8W930,Q9Y6M1;F8W930,4;4,4;4,4;4,Insulin-like growth factor 2 mRNA-binding protein 2,IGF2BP2,sp|Q9Y6M1|IF2B2_HUMAN Insulin-like growth factor 2 mRNA-binding protein 2 OS=Homo sapiens OX=9606 GN=IGF2BP2 PE=1 SV=2;tr|F8W930|F8W930_HUMAN Insulin-like growth factor 2 mRNA-binding protein 2 OS=Homo sapiens OX=9606 GN=IGF2BP2 PE=1 SV=1,4,4,8,599
EIF2A,0.1671226208,0.352329023491563,0,Q9BY44;F8WAE5;F8WF18;F8WAT3;C9IZE1;H7C5R5;H7C5Q3,Q9BY44;F8WAE5;F8WF18;F8WAT3;C9IZE1;H7C5R5,4;4;2;2;2;2;1,4;4;2;2;2;2;1,4;4;2;2;2;2;1,"Eukaryotic translation initiation factor 2A;Eukaryotic translation initiation factor 2A, N-terminally processed",EIF2A,sp|Q9BY44|EIF2A_HUMAN Eukaryotic translation initiation factor 2A OS=Homo sapiens OX=9606 GN=EIF2A PE=1 SV=3;tr|F8WAE5|F8WAE5_HUMAN Eukaryotic translation initiation factor 2A OS=Homo sapiens OX=9606 GN=EIF2A PE=1 SV=1;tr|F8WF18|F8WF18_HUMAN Eukaryotic tra,4,4,10.9,585
NDUFA5,-0.1012258238,0.602583678830039,0,Q16718;F8WAS3,Q16718;F8WAS3,2;2,2;2,2;2,NADH dehydrogenase [ubiquinone] 1 alpha subcomplex subunit 5,NDUFA5,sp|Q16718|NDUA5_HUMAN NADH dehydrogenase [ubiquinone] 1 alpha subcomplex subunit 5 OS=Homo sapiens OX=9606 GN=NDUFA5 PE=1 SV=3;tr|F8WAS3|F8WAS3_HUMAN NADH dehydrogenase [ubiquinone] 1 alpha subcomplex subunit 5 OS=Homo sapiens OX=9606 GN=NDUFA5 PE=1 SV=1,2,2,19,116
NDRG3,0.0475075091,0.829101311916792,0,Q9UGV2;F8WBF9;Q5TH30,Q9UGV2;F8WBF9;Q5TH30,1;1;1,1;1;1,1;1;1,Protein NDRG3,NDRG3,"sp|Q9UGV2|NDRG3_HUMAN Protein NDRG3 OS=Homo sapiens OX=9606 GN=NDRG3 PE=1 SV=2;tr|F8WBF9|F8WBF9_HUMAN Protein NDRG3 OS=Homo sapiens OX=9606 GN=NDRG3 PE=1 SV=1;tr|Q5TH30|Q5TH30_HUMAN NDRG family member 3, isoform CRA_c OS=Homo sapiens OX=9606 GN=NDRG3 PE=1 ",1,1,2.7,375
NDUFV1,0.3851940374,0.0245423539557209,0,P49821;G3V0I5;B4DE93;E9PLC6;E9PQP1;E9PPS5;E9PJL9;H0YE81;E9PPR0;E9PMX3,P49821;G3V0I5;B4DE93;E9PLC6;E9PQP1,4;4;3;2;2;1;1;1;1;1,4;4;3;2;2;1;1;1;1;1,4;4;3;2;2;1;1;1;1;1,"NADH dehydrogenase [ubiquinone] flavoprotein 1, mitochondrial",NDUFV1,"sp|P49821|NDUV1_HUMAN NADH dehydrogenase [ubiquinone] flavoprotein 1, mitochondrial OS=Homo sapiens OX=9606 GN=NDUFV1 PE=1 SV=4;tr|G3V0I5|G3V0I5_HUMAN NADH dehydrogenase [ubiquinone] flavoprotein 1, mitochondrial OS=Homo sapiens OX=9606 GN=NDUFV1 PE=1 SV=1",4,4,8.4,464
CAPRIN1,-0.4927237278,0.0190811317767365,0,Q14444;G3V153;E9PLA9,Q14444;G3V153;E9PLA9,9;9;6,9;9;6,9;9;6,Caprin-1,CAPRIN1,sp|Q14444|CAPR1_HUMAN Caprin-1 OS=Homo sapiens OX=9606 GN=CAPRIN1 PE=1 SV=2;tr|G3V153|G3V153_HUMAN Caprin-1 OS=Homo sapiens OX=9606 GN=CAPRIN1 PE=1 SV=1;tr|E9PLA9|E9PLA9_HUMAN Caprin-1 (Fragment) OS=Homo sapiens OX=9606 GN=CAPRIN1 PE=1 SV=1,9,9,11.1,709
PARP2,-0.4594182029,0.0937812904736827,0,Q9UGN5;H0YH02;G3V167,Q9UGN5;H0YH02;G3V167,1;1;1,1;1;1,1;1;1,Poly [ADP-ribose] polymerase 2,PARP2,sp|Q9UGN5|PARP2_HUMAN Poly [ADP-ribose] polymerase 2 OS=Homo sapiens OX=9606 GN=PARP2 PE=1 SV=2;tr|H0YH02|H0YH02_HUMAN Poly [ADP-ribose] polymerase (Fragment) OS=Homo sapiens OX=9606 GN=PARP2 PE=1 SV=1;tr|G3V167|G3V167_HUMAN Poly [ADP-ribose] polymerase OS,1,1,2.2,583
API5,-0.3299293416,0.121091470136824,0,Q9BZZ5;G3V1C3;H0YER7;E9PQK6,Q9BZZ5;G3V1C3,8;8;3;2,8;8;3;2,8;8;3;2,Apoptosis inhibitor 5,API5,sp|Q9BZZ5|API5_HUMAN Apoptosis inhibitor 5 OS=Homo sapiens OX=9606 GN=API5 PE=1 SV=3;tr|G3V1C3|G3V1C3_HUMAN Apoptosis inhibitor 5 OS=Homo sapiens OX=9606 GN=API5 PE=1 SV=1,8,8,17.4,524
GOLT1B,-0.0369053954,0.791718644449195,0,Q9Y3E0;G3V1U5;F5H6U7,Q9Y3E0;G3V1U5;F5H6U7,3;3;2,3;3;2,3;3;2,Vesicle transport protein GOT1B,GOLT1B,"sp|Q9Y3E0|GOT1B_HUMAN Vesicle transport protein GOT1B OS=Homo sapiens OX=9606 GN=GOLT1B PE=1 SV=1;tr|G3V1U5|G3V1U5_HUMAN Golgi transport 1 homolog B (S. cerevisiae), isoform CRA_c OS=Homo sapiens OX=9606 GN=GOLT1B PE=1 SV=1;tr|F5H6U7|F5H6U7_HUMAN Vesicle t",3,3,20.3,138
NUMB,0.5334855653,0.0102707916766994,0,P49757;G3V3M5;G3V3R1;G3V3Z8;Q9Y6R0;M0QXQ4;M0QYC2;A0A0C4DGH3,P49757;G3V3M5;G3V3R1;G3V3Z8,3;3;3;2;1;1;1;1,3;3;3;2;1;1;1;1,3;3;3;2;1;1;1;1,Protein numb homolog,NUMB,sp|P49757|NUMB_HUMAN Protein numb homolog OS=Homo sapiens OX=9606 GN=NUMB PE=1 SV=2;tr|G3V3M5|G3V3M5_HUMAN Protein numb homolog (Fragment) OS=Homo sapiens OX=9606 GN=NUMB PE=1 SV=8;tr|G3V3R1|G3V3R1_HUMAN Protein numb homolog (Fragment) OS=Homo sapiens OX=9,3,3,7.2,651
PSMA6,-0.1635671024,0.293654781359295,0,P60900;G3V5Z7;G3V295;G3V3I1;G3V3U4;G3V4S5;G3V2S7;H0YJC4,P60900;G3V5Z7;G3V295;G3V3I1;G3V3U4,13;13;12;11;7;3;3;1,13;13;12;11;7;3;3;1,13;13;12;11;7;3;3;1,Proteasome subunit alpha type-6;Proteasome subunit alpha type,PSMA6,sp|P60900|PSA6_HUMAN Proteasome subunit alpha type-6 OS=Homo sapiens OX=9606 GN=PSMA6 PE=1 SV=1;tr|G3V5Z7|G3V5Z7_HUMAN Proteasome subunit alpha type OS=Homo sapiens OX=9606 GN=PSMA6 PE=1 SV=1;tr|G3V295|G3V295_HUMAN Proteasome subunit alpha type OS=Homo sap,13,13,49.2,246
CTNNA1,-0.4365588175,0.526559997950368,0,P35221;G3XAM7;E5RIB1;P26232;E5RJZ2;E5RIT8;E5RFM3;E5RJL0;E5RIE0;E5RHV7;H0YBB8;E5RGY6;E5RG03;E5RJ41,P35221;G3XAM7,8;8;2;1;1;1;1;1;1;1;1;1;1;1,8;8;2;1;1;1;1;1;1;1;1;1;1;1,8;8;2;1;1;1;1;1;1;1;1;1;1;1,Catenin alpha-1,CTNNA1,"sp|P35221|CTNA1_HUMAN Catenin alpha-1 OS=Homo sapiens OX=9606 GN=CTNNA1 PE=1 SV=1;tr|G3XAM7|G3XAM7_HUMAN Catenin (Cadherin-associated protein), alpha 1, 102kDa, isoform CRA_a OS=Homo sapiens OX=9606 GN=CTNNA1 PE=1 SV=1",8,8,9.7,906
MRPS22,0.2544758439,0.132205350896896,0,P82650;G5E9W7;G5E9V5;H7C5L9;H7C5H3;H7C5F2,P82650;G5E9W7;G5E9V5;H7C5L9;H7C5H3,9;9;9;7;5;3,9;9;9;7;5;3,9;9;9;7;5;3,"28S ribosomal protein S22, mitochondrial",MRPS22,"sp|P82650|RT22_HUMAN 28S ribosomal protein S22, mitochondrial OS=Homo sapiens OX=9606 GN=MRPS22 PE=1 SV=1;tr|G5E9W7|G5E9W7_HUMAN 28S ribosomal protein S22, mitochondrial OS=Homo sapiens OX=9606 GN=MRPS22 PE=1 SV=1;tr|G5E9V5|G5E9V5_HUMAN 28S ribosomal prote",9,9,20.3,360
CELF1,-0.2780528653,0.126605567648907,0,G5EA30;Q92879;F5H0D8;E9PKU1;F5H4Y5;E9PQK4;E9PSH0;F5H3J7;E9PKA1,G5EA30;Q92879;F5H0D8;E9PKU1,8;7;4;4;3;3;3;1;1,8;7;4;4;3;3;3;1;1,4;3;2;2;1;1;1;1;1,CUGBP Elav-like family member 1,CELF1,"tr|G5EA30|G5EA30_HUMAN CUG triplet repeat, RNA binding protein 1, isoform CRA_c OS=Homo sapiens OX=9606 GN=CELF1 PE=1 SV=1;sp|Q92879|CELF1_HUMAN CUGBP Elav-like family member 1 OS=Homo sapiens OX=9606 GN=CELF1 PE=1 SV=2;tr|F5H0D8|F5H0D8_HUMAN CUGBP Elav-li",8,4,17.7,514
HNRNPH1,-0.2174603162,0.215506146867774,0,P31943;G8JLB6;E9PCY7;H0YB39;D6RBM0;E5RGV0;D6RIU0;D6RIT2;D6RAM1;D6R9T0;D6RFM3;E7EN40;E7EQJ0;D6RDU3;D6RJ04;D6RIH9;H0YBD7;H0YBG7;E5RGH4;D6RDL0;D6RF17;H0YAQ2;D6R9D3;E5RJ94,P31943;G8JLB6;E9PCY7;H0YB39;D6RBM0;E5RGV0,17;17;16;10;10;9;8;8;7;7;7;7;7;7;7;7;6;5;5;4;4;3;3;2,15;15;14;8;10;9;8;8;7;7;7;7;7;7;7;7;4;3;5;4;4;3;3;2,10;10;9;4;6;5;6;7;6;6;6;4;6;6;6;6;3;2;2;4;4;2;3;2,"Heterogeneous nuclear ribonucleoprotein H;Heterogeneous nuclear ribonucleoprotein H, N-terminally processed",HNRNPH1,sp|P31943|HNRH1_HUMAN Heterogeneous nuclear ribonucleoprotein H OS=Homo sapiens OX=9606 GN=HNRNPH1 PE=1 SV=4;tr|G8JLB6|G8JLB6_HUMAN Heterogeneous nuclear ribonucleoprotein H OS=Homo sapiens OX=9606 GN=HNRNPH1 PE=1 SV=1;tr|E9PCY7|E9PCY7_HUMAN Heterogeneous ,17,10,45.2,449
ZYX,0.4608130463,0.0852813783134011,0,Q15942;H0Y2Y8;C9IZ41;C9JJK5,Q15942;H0Y2Y8,5;5;2;2,5;5;2;2,5;5;2;2,Zyxin,ZYX,sp|Q15942|ZYX_HUMAN Zyxin OS=Homo sapiens OX=9606 GN=ZYX PE=1 SV=1;tr|H0Y2Y8|H0Y2Y8_HUMAN Zyxin (Fragment) OS=Homo sapiens OX=9606 GN=ZYX PE=1 SV=1,5,5,14.7,572
,-1.0291888885,0.00119473443459377,1,H0Y858;Q9NR96;H7C5I2,H0Y858,3;1;1,1;1;0,1;1;0,,,tr|H0Y858|H0Y858_HUMAN Uncharacterized protein (Fragment) OS=Homo sapiens OX=9606 PE=4 SV=1,3,1,2.2,1186
HNRNPD,-0.0671138625,0.568913689002514,0,Q14103;H0YA96;H0Y8G5;D6RAF8;D6RF44;D6RBQ9;D6RD83,Q14103;H0YA96;H0Y8G5;D6RAF8;D6RF44,23;23;23;14;12;8;5,23;23;23;14;12;8;5,21;21;21;12;10;6;5,Heterogeneous nuclear ribonucleoprotein D0,HNRNPD,sp|Q14103|HNRPD_HUMAN Heterogeneous nuclear ribonucleoprotein D0 OS=Homo sapiens OX=9606 GN=HNRNPD PE=1 SV=1;tr|H0YA96|H0YA96_HUMAN Heterogeneous nuclear ribonucleoprotein D0 (Fragment) OS=Homo sapiens OX=9606 GN=HNRNPD PE=1 SV=1;tr|H0Y8G5|H0Y8G5_HUMAN Het,23,21,38.3,355
DLAT,0.117650935,0.335722149460952,0,P10515;H0YDD4;E9PEJ4,P10515;H0YDD4;E9PEJ4,17;17;16,17;17;16,17;17;16,"Dihydrolipoyllysine-residue acetyltransferase component of pyruvate dehydrogenase complex, mitochondrial;Acetyltransferase component of pyruvate dehydrogenase complex",DLAT,"sp|P10515|ODP2_HUMAN Dihydrolipoyllysine-residue acetyltransferase component of pyruvate dehydrogenase complex, mitochondrial OS=Homo sapiens OX=9606 GN=DLAT PE=1 SV=3;tr|H0YDD4|H0YDD4_HUMAN Acetyltransferase component of pyruvate dehydrogenase complex (Fr",17,17,26,647
HADHA,-0.0082667953,0.948346810286512,0,P40939;H0YFD6;A0A2R8Y4F5;A0A2R8YG21;A0A2R8Y688,P40939;H0YFD6;A0A2R8Y4F5;A0A2R8YG21,33;33;27;20;13,33;33;27;20;13,33;33;27;20;13,"Trifunctional enzyme subunit alpha, mitochondrial;Long-chain enoyl-CoA hydratase;Long chain 3-hydroxyacyl-CoA dehydrogenase",HADHA,"sp|P40939|ECHA_HUMAN Trifunctional enzyme subunit alpha, mitochondrial OS=Homo sapiens OX=9606 GN=HADHA PE=1 SV=2;tr|H0YFD6|H0YFD6_HUMAN Trifunctional enzyme subunit alpha, mitochondrial OS=Homo sapiens OX=9606 GN=HADHA PE=1 SV=2;tr|A0A2R8Y4F5|A0A2R8Y4F5_H",33,33,48,763
TMOD3,0.4377890284,0.0752749017251403,0,Q9NYL9;H0YKU1;H0YNJ8,Q9NYL9;H0YKU1;H0YNJ8,3;3;3,3;3;3,3;3;3,Tropomodulin-3,TMOD3,sp|Q9NYL9|TMOD3_HUMAN Tropomodulin-3 OS=Homo sapiens OX=9606 GN=TMOD3 PE=1 SV=1;tr|H0YKU1|H0YKU1_HUMAN Tropomodulin-3 (Fragment) OS=Homo sapiens OX=9606 GN=TMOD3 PE=1 SV=1;tr|H0YNJ8|H0YNJ8_HUMAN Tropomodulin-3 OS=Homo sapiens OX=9606 GN=TMOD3 PE=1 SV=1,3,3,13.6,352
RPS27;RPS27L,-0.1529783656,0.222526461896093,0,P42677;Q71UM5;H0YMV8;C9J1C5;C9JLI6,P42677;Q71UM5;H0YMV8;C9J1C5;C9JLI6,2;2;2;1;1,2;2;2;1;1,2;2;2;1;1,40S ribosomal protein S27;40S ribosomal protein S27-like,RPS27;RPS27L,sp|P42677|RS27_HUMAN 40S ribosomal protein S27 OS=Homo sapiens OX=9606 GN=RPS27 PE=1 SV=3;sp|Q71UM5|RS27L_HUMAN 40S ribosomal protein S27-like OS=Homo sapiens OX=9606 GN=RPS27L PE=1 SV=3;tr|H0YMV8|H0YMV8_HUMAN 40S ribosomal protein S27 OS=Homo sapiens OX=9,2,2,25,84
ANP32A,-0.0526188248,0.833335744035703,0,P39687;H0YN26;H7BZ09;O43423,P39687;H0YN26,8;8;2;1,8;8;2;1,7;7;2;1,Acidic leucine-rich nuclear phosphoprotein 32 family member A,ANP32A,sp|P39687|AN32A_HUMAN Acidic leucine-rich nuclear phosphoprotein 32 family member A OS=Homo sapiens OX=9606 GN=ANP32A PE=1 SV=1;tr|H0YN26|H0YN26_HUMAN Acidic leucine-rich nuclear phosphoprotein 32 family member A OS=Homo sapiens OX=9606 GN=ANP32A PE=1 SV=1,8,7,28.5,249
DUT,0.2157445237,0.317328404390988,0,P33316;H0YNW5;A0A0C4DGL3;H0YKC5;H0YMM5;H0YNJ9;H0YKI0;H0YMP1,P33316;H0YNW5;A0A0C4DGL3;H0YKC5;H0YMM5;H0YNJ9;H0YKI0;H0YMP1,8;8;7;7;6;6;6;5,8;8;7;7;6;6;6;5,8;8;7;7;6;6;6;5,"Deoxyuridine 5-triphosphate nucleotidohydrolase, mitochondrial",DUT,"sp|P33316|DUT_HUMAN Deoxyuridine 5-triphosphate nucleotidohydrolase, mitochondrial OS=Homo sapiens OX=9606 GN=DUT PE=1 SV=4;tr|H0YNW5|H0YNW5_HUMAN Deoxyuridine 5-triphosphate nucleotidohydrolase OS=Homo sapiens OX=9606 GN=DUT PE=1 SV=1;tr|A0A0C4DGL3|A0A0",8,8,36.5,252
RNPS1,-0.2654692117,0.111480765345023,0,Q15287;H3BV80;H3BMM9;H3BTC0;H3BPG5;H3BMS0,Q15287;H3BV80;H3BMM9;H3BTC0;H3BPG5;H3BMS0,3;3;3;3;2;2,3;3;3;3;2;2,3;3;3;3;2;2,RNA-binding protein with serine-rich domain 1,RNPS1,sp|Q15287|RNPS1_HUMAN RNA-binding protein with serine-rich domain 1 OS=Homo sapiens OX=9606 GN=RNPS1 PE=1 SV=1;tr|H3BV80|H3BV80_HUMAN RNA-binding protein with serine-rich domain 1 OS=Homo sapiens OX=9606 GN=RNPS1 PE=1 SV=2;tr|H3BMM9|H3BMM9_HUMAN RNA-bindin,3,3,10.8,305
HN1L,0.0593731433,0.677022722044259,0,Q9H910;H3BMV3;H3BMM8;B4E1P3;A6NGP5;H3BMT0;H3BTV5;H3BU16;H3BS08,Q9H910;H3BMV3;H3BMM8;B4E1P3;A6NGP5;H3BMT0;H3BTV5;H3BU16,6;6;4;4;4;3;3;3;2,6;6;4;4;4;3;3;3;2,6;6;4;4;4;3;3;3;2,Hematological and neurological expressed 1-like protein,HN1L,sp|Q9H910|JUPI2_HUMAN Jupiter microtubule associated homolog 2 OS=Homo sapiens OX=9606 GN=JPT2 PE=1 SV=1;tr|H3BMV3|H3BMV3_HUMAN Jupiter microtubule-associated homolog 2 (Fragment) OS=Homo sapiens OX=9606 GN=JPT2 PE=1 SV=1;tr|H3BMM8|H3BMM8_HUMAN Jupiter mic,6,6,45.8,190
,-0.5082632356,0.0198503200153499,0,H3BN98;Q15041;H3BPJ2,H3BN98,14;4;4,4;4;4,4;4;4,,,tr|H3BN98|H3BN98_HUMAN Uncharacterized protein (Fragment) OS=Homo sapiens OX=9606 PE=4 SV=2,14,4,41.4,237
RPS17,0.1207975957,0.436036894600303,0,P08708;H3BNC9;H0YN88;A0A075B716;H0YN73;A0A0J9YYC4,P08708;H3BNC9;H0YN88;A0A075B716,14;14;12;12;6;2,14;14;12;12;6;2,14;14;12;12;6;2,40S ribosomal protein S17,RPS17,sp|P08708|RS17_HUMAN 40S ribosomal protein S17 OS=Homo sapiens OX=9606 GN=RPS17 PE=1 SV=2;tr|H3BNC9|H3BNC9_HUMAN Uncharacterized protein OS=Homo sapiens OX=9606 PE=3 SV=2;tr|H0YN88|H0YN88_HUMAN 40S ribosomal protein S17 OS=Homo sapiens OX=9606 GN=RPS17 PE=,14,14,81.5,135
HEXA,-0.1576185033,0.442346446220089,0,P06865;H3BS10;H3BP20;H3BU85;H3BTD4,P06865;H3BS10;H3BP20;H3BU85;H3BTD4,3;3;3;2;2,3;3;3;2;2,3;3;3;2;2,Beta-hexosaminidase subunit alpha;Beta-hexosaminidase,HEXA,sp|P06865|HEXA_HUMAN Beta-hexosaminidase subunit alpha OS=Homo sapiens OX=9606 GN=HEXA PE=1 SV=2;tr|H3BS10|H3BS10_HUMAN Beta-hexosaminidase OS=Homo sapiens OX=9606 GN=HEXA PE=1 SV=1;tr|H3BP20|H3BP20_HUMAN Beta-hexosaminidase OS=Homo sapiens OX=9606 GN=HEXA,3,3,9.1,529
FUS,-0.0713425646,0.527178728678413,0,P35637;H3BPE7,P35637;H3BPE7,11;11,11;11,8;8,RNA-binding protein FUS,FUS,sp|P35637|FUS_HUMAN RNA-binding protein FUS OS=Homo sapiens OX=9606 GN=FUS PE=1 SV=1;tr|H3BPE7|H3BPE7_HUMAN RNA-binding protein FUS OS=Homo sapiens OX=9606 GN=FUS PE=1 SV=1,11,8,16,526
NDUFB10,0.1088755275,0.3785209605033,0,O96000;H3BPJ9;H3BV16,O96000;H3BPJ9,3;3;1,3;3;1,3;3;1,NADH dehydrogenase [ubiquinone] 1 beta subcomplex subunit 10,NDUFB10,sp|O96000|NDUBA_HUMAN NADH dehydrogenase [ubiquinone] 1 beta subcomplex subunit 10 OS=Homo sapiens OX=9606 GN=NDUFB10 PE=1 SV=3;tr|H3BPJ9|H3BPJ9_HUMAN NADH dehydrogenase [ubiquinone] 1 beta subcomplex subunit 10 OS=Homo sapiens OX=9606 GN=NDUFB10 PE=1 SV=1,3,3,17.4,172
HACD3,0.0005569344,0.996359803082047,0,Q9P035;H3BS72;H3BPZ1;H3BMZ1;H3BRL8,Q9P035;H3BS72;H3BPZ1,3;3;2;1;1,3;3;2;1;1,3;3;2;1;1,Very-long-chain (3R)-3-hydroxyacyl-CoA dehydratase 3,HACD3,sp|Q9P035|HACD3_HUMAN Very-long-chain (3R)-3-hydroxyacyl-CoA dehydratase 3 OS=Homo sapiens OX=9606 GN=HACD3 PE=1 SV=2;tr|H3BS72|H3BS72_HUMAN Very-long-chain (3R)-3-hydroxyacyl-CoA dehydratase OS=Homo sapiens OX=9606 GN=HACD3 PE=1 SV=1;tr|H3BPZ1|H3BPZ1_HUMA,3,3,9.9,362
NOB1,-0.9748838693,0.000468434629837037,0,Q9ULX3;H3BUR4,Q9ULX3;H3BUR4,3;3,3;3,3;3,RNA-binding protein NOB1,NOB1,sp|Q9ULX3|NOB1_HUMAN RNA-binding protein NOB1 OS=Homo sapiens OX=9606 GN=NOB1 PE=1 SV=1;tr|H3BUR4|H3BUR4_HUMAN RNA-binding protein NOB1 OS=Homo sapiens OX=9606 GN=NOB1 PE=1 SV=1,3,3,8.3,412
DHX30,-0.0761728445,0.625066477111874,0,Q7L2E3;H7BXY3,Q7L2E3;H7BXY3,22;22,22;22,22;22,Putative ATP-dependent RNA helicase DHX30,DHX30,sp|Q7L2E3|DHX30_HUMAN ATP-dependent RNA helicase DHX30 OS=Homo sapiens OX=9606 GN=DHX30 PE=1 SV=1;tr|H7BXY3|H7BXY3_HUMAN ATP-dependent RNA helicase DHX30 OS=Homo sapiens OX=9606 GN=DHX30 PE=1 SV=1,22,22,23.2,1194
PDIA3,-0.0964818702,0.414773506022101,0,H7BZJ3,H7BZJ3,11,1,1,,PDIA3,tr|H7BZJ3|H7BZJ3_HUMAN Protein disulfide-isomerase A3 (Fragment) OS=Homo sapiens OX=9606 GN=PDIA3 PE=1 SV=1,11,1,58.5,123
C7orf50,-2.3301348718,0.00418341263841448,1,Q9BRJ6;H7C0T1;H7C2R9;C9JQV0,Q9BRJ6;H7C0T1;H7C2R9;C9JQV0,4;4;4;3,4;4;4;3,4;4;4;3,Uncharacterized protein C7orf50,C7orf50,sp|Q9BRJ6|CG050_HUMAN Uncharacterized protein C7orf50 OS=Homo sapiens OX=9606 GN=C7orf50 PE=1 SV=1;tr|H7C0T1|H7C0T1_HUMAN Uncharacterized protein C7orf50 (Fragment) OS=Homo sapiens OX=9606 GN=C7orf50 PE=1 SV=1;tr|H7C2R9|H7C2R9_HUMAN Uncharacterized protein,4,4,23.2,194
EBNA1BP2,0.309008983,0.0392467106049065,0,Q99848;H7C2Q8,Q99848;H7C2Q8,3;3,3;3,3;3,Probable rRNA-processing protein EBP2,EBNA1BP2,"sp|Q99848|EBP2_HUMAN Probable rRNA-processing protein EBP2 OS=Homo sapiens OX=9606 GN=EBNA1BP2 PE=1 SV=2;tr|H7C2Q8|H7C2Q8_HUMAN EBNA1 binding protein 2, isoform CRA_d OS=Homo sapiens OX=9606 GN=EBNA1BP2 PE=1 SV=1",3,3,12.4,306
DDX19A;DDX19B,-0.6988498613,0.0299950304437731,0,Q9NUU7;I3L0H8;Q9UMR2;F6QDS0;H3BQK0;I3L352;H3BN59;H3BTB3;H3BMQ5;H3BP36;H3BP50;J3QRH0;H3BSL8,Q9NUU7;I3L0H8;Q9UMR2;F6QDS0;H3BQK0;I3L352;H3BN59,8;8;7;7;7;5;4;3;3;1;1;1;1,8;8;7;7;7;5;4;3;3;1;1;1;1,8;8;7;7;7;5;4;3;3;1;1;1;1,ATP-dependent RNA helicase DDX19A;ATP-dependent RNA helicase DDX19B,DDX19A;DDX19B,sp|Q9NUU7|DD19A_HUMAN ATP-dependent RNA helicase DDX19A OS=Homo sapiens OX=9606 GN=DDX19A PE=1 SV=1;tr|I3L0H8|I3L0H8_HUMAN ATP-dependent RNA helicase DDX19A OS=Homo sapiens OX=9606 GN=DDX19A PE=1 SV=1;sp|Q9UMR2|DD19B_HUMAN ATP-dependent RNA helicase DDX19B,8,8,24.3,478
NSF,0.0704295636,0.637612386919681,0,P46459;I3L0N3;K7EQD6;I3L2G1;I3L0L3,P46459;I3L0N3,10;10;3;2;2,10;10;3;2;2,10;10;3;2;2,Vesicle-fusing ATPase,NSF,sp|P46459|NSF_HUMAN Vesicle-fusing ATPase OS=Homo sapiens OX=9606 GN=NSF PE=1 SV=3;tr|I3L0N3|I3L0N3_HUMAN Vesicle-fusing ATPase OS=Homo sapiens OX=9606 GN=NSF PE=1 SV=1,10,10,15.1,744
SLC25A11,-0.2810691025,0.275344501101253,0,Q02978;I3L1P8,Q02978;I3L1P8,1;1,1;1,1;1,Mitochondrial 2-oxoglutarate/malate carrier protein,SLC25A11,sp|Q02978|M2OM_HUMAN Mitochondrial 2-oxoglutarate/malate carrier protein OS=Homo sapiens OX=9606 GN=SLC25A11 PE=1 SV=3;tr|I3L1P8|I3L1P8_HUMAN Mitochondrial 2-oxoglutarate/malate carrier protein (Fragment) OS=Homo sapiens OX=9606 GN=SLC25A11 PE=1 SV=1,1,1,5.1,314
EIF5A;EIF5A2;EIF5AL1,-0.3292129413,0.169791384633424,0,P63241;I3L397;I3L504;Q9GZV4;F8WCJ1;C9J7B5;C9J4W5;Q6IS14,P63241;I3L397;I3L504;Q9GZV4;F8WCJ1;C9J7B5;C9J4W5;Q6IS14,13;13;13;11;11;11;11;10,13;13;13;11;11;11;11;10,13;13;13;11;11;11;11;10,Eukaryotic translation initiation factor 5A-1;Eukaryotic translation initiation factor 5A;Eukaryotic translation initiation factor 5A-2;Eukaryotic translation initiation factor 5A-1-like,EIF5A;EIF5A2;EIF5AL1,sp|P63241|IF5A1_HUMAN Eukaryotic translation initiation factor 5A-1 OS=Homo sapiens OX=9606 GN=EIF5A PE=1 SV=2;tr|I3L397|I3L397_HUMAN Eukaryotic translation initiation factor 5A (Fragment) OS=Homo sapiens OX=9606 GN=EIF5A PE=1 SV=8;tr|I3L504|I3L504_HUMAN E,13,13,51.9,154
SRSF2,-0.0639994553,0.579214965360323,0,Q01130;J3QL05;J3KP15;Q9BRL6,Q01130;J3QL05;J3KP15,8;8;8;2,8;8;8;2,8;8;8;2,Serine/arginine-rich splicing factor 2,SRSF2,sp|Q01130|SRSF2_HUMAN Serine/arginine-rich splicing factor 2 OS=Homo sapiens OX=9606 GN=SRSF2 PE=1 SV=4;tr|J3QL05|J3QL05_HUMAN Serine/arginine-rich-splicing factor 2 (Fragment) OS=Homo sapiens OX=9606 GN=SRSF2 PE=1 SV=1;tr|J3KP15|J3KP15_HUMAN Serine/argini,8,8,29.4,221
PTRH2,-0.1694892086,0.216160746620088,0,Q9Y3E5;J3KQ48,Q9Y3E5;J3KQ48,3;3,3;3,3;3,"Peptidyl-tRNA hydrolase 2, mitochondrial",PTRH2,"sp|Q9Y3E5|PTH2_HUMAN Peptidyl-tRNA hydrolase 2, mitochondrial OS=Homo sapiens OX=9606 GN=PTRH2 PE=1 SV=1;tr|J3KQ48|J3KQ48_HUMAN Peptidyl-tRNA hydrolase 2, mitochondrial OS=Homo sapiens OX=9606 GN=PTRH2 PE=1 SV=1",3,3,21.8,179
SUMF2,-0.080768163,0.596835155638022,0,Q8NBJ7;J3KQJ1;C9JL30;A8MXB9;A0A494C1B1;C9J660;H7C3B2;F8WA42;E9PBT8;J3QT17;F8WEX5;E9PG02;F8WEV7;F8WES7,Q8NBJ7;J3KQJ1;C9JL30;A8MXB9;A0A494C1B1;C9J660;H7C3B2;F8WA42;E9PBT8,7;7;6;6;6;6;5;5;4;3;2;2;1;1,7;7;6;6;6;6;5;5;4;3;2;2;1;1,7;7;6;6;6;6;5;5;4;3;2;2;1;1,Sulfatase-modifying factor 2,SUMF2,sp|Q8NBJ7|SUMF2_HUMAN Inactive C-alpha-formylglycine-generating enzyme 2 OS=Homo sapiens OX=9606 GN=SUMF2 PE=1 SV=2;tr|J3KQJ1|J3KQJ1_HUMAN Inactive C-alpha-formylglycine-generating enzyme 2 OS=Homo sapiens OX=9606 GN=SUMF2 PE=1 SV=1;tr|C9JL30|C9JL30_HUMAN ,7,7,26.2,301
IARS,0.3248885681,0.0289902694450713,0,P41252;J3KR24;A0A0A0MSX9;Q5TCD1;Q5TCC6,P41252;J3KR24;A0A0A0MSX9,23;23;22;2;1,23;23;22;2;1,23;23;22;2;1,"Isoleucine--tRNA ligase, cytoplasmic",IARS,"sp|P41252|SYIC_HUMAN Isoleucine--tRNA ligase, cytoplasmic OS=Homo sapiens OX=9606 GN=IARS1 PE=1 SV=2;tr|J3KR24|J3KR24_HUMAN Isoleucine--tRNA ligase, cytoplasmic OS=Homo sapiens OX=9606 GN=IARS1 PE=1 SV=1;tr|A0A0A0MSX9|A0A0A0MSX9_HUMAN Isoleucine--tRNA liga",23,23,17.6,1262
CBX1,-0.2201241269,0.306923484341434,0,P83916;J3KS05;K7ELA4;B5MD17;C9JWS9,P83916;J3KS05;K7ELA4;B5MD17;C9JWS9,5;5;4;4;3,4;4;3;3;3,4;4;3;3;3,Chromobox protein homolog 1,CBX1,sp|P83916|CBX1_HUMAN Chromobox protein homolog 1 OS=Homo sapiens OX=9606 GN=CBX1 PE=1 SV=1;tr|J3KS05|J3KS05_HUMAN Chromobox protein homolog 1 (Fragment) OS=Homo sapiens OX=9606 GN=CBX1 PE=1 SV=8;tr|K7ELA4|K7ELA4_HUMAN Chromobox protein homolog 1 OS=Homo sa,5,4,36.8,185
MRPS7,-0.1706711331,0.163219380741374,0,Q9Y2R9;J3KSI8;J3QQS1;J3QLS3;J3QKW2,Q9Y2R9;J3KSI8;J3QQS1;J3QLS3,4;4;4;4;1,4;4;4;4;1,4;4;4;4;1,"28S ribosomal protein S7, mitochondrial",MRPS7,"sp|Q9Y2R9|RT07_HUMAN 28S ribosomal protein S7, mitochondrial OS=Homo sapiens OX=9606 GN=MRPS7 PE=1 SV=2;tr|J3KSI8|J3KSI8_HUMAN 28S ribosomal protein S7, mitochondrial (Fragment) OS=Homo sapiens OX=9606 GN=MRPS7 PE=1 SV=1;tr|J3QQS1|J3QQS1_HUMAN 28S ribosoma",4,4,15.7,242
NUP85,-0.5558425665,0.00944266473273082,0,Q9BW27;J3KT10;F5H0W7;J3QLH0;J3QL54;J3QL91;J3QS63;J3KSH3;J3KRC0;J3QLD4,Q9BW27;J3KT10;F5H0W7;J3QLH0;J3QL54;J3QL91,4;4;3;3;3;2;1;1;1;1,4;4;3;3;3;2;1;1;1;1,4;4;3;3;3;2;1;1;1;1,Nuclear pore complex protein Nup85,NUP85,sp|Q9BW27|NUP85_HUMAN Nuclear pore complex protein Nup85 OS=Homo sapiens OX=9606 GN=NUP85 PE=1 SV=1;tr|J3KT10|J3KT10_HUMAN Nuclear pore complex protein Nup85 OS=Homo sapiens OX=9606 GN=NUP85 PE=1 SV=1;tr|F5H0W7|F5H0W7_HUMAN Nuclear pore complex protein Nup,4,4,7.3,656
DDX5,-0.3200135875,0.085572940478936,0,P17844;J3KTA4;J3KRZ1;J3QSF1;J3QRQ7;J3KRX8;J3KTQ4;J3QR02;X6RLV5;J3QRN5;J3QLG9;J3QR62,P17844;J3KTA4,46;46;20;15;14;6;6;5;3;2;1;1,46;46;20;15;14;6;6;5;3;2;1;1,32;32;7;9;9;6;6;5;3;2;1;1,Probable ATP-dependent RNA helicase DDX5,DDX5,sp|P17844|DDX5_HUMAN Probable ATP-dependent RNA helicase DDX5 OS=Homo sapiens OX=9606 GN=DDX5 PE=1 SV=1;tr|J3KTA4|J3KTA4_HUMAN Probable ATP-dependent RNA helicase DDX5 OS=Homo sapiens OX=9606 GN=DDX5 PE=1 SV=1,46,32,60.6,614
RPL19,0.079356284,0.473893629099744,0,P84098;J3QR09;J3KTE4,P84098;J3QR09;J3KTE4,20;20;20,20;20;20,20;20;20,60S ribosomal protein L19;Ribosomal protein L19,RPL19,sp|P84098|RL19_HUMAN 60S ribosomal protein L19 OS=Homo sapiens OX=9606 GN=RPL19 PE=1 SV=1;tr|J3QR09|J3QR09_HUMAN Ribosomal protein L19 OS=Homo sapiens OX=9606 GN=RPL19 PE=1 SV=1;tr|J3KTE4|J3KTE4_HUMAN Ribosomal protein L19 OS=Homo sapiens OX=9606 GN=RPL19 ,20,20,50.5,196
SRSF1,-0.0010030068,0.993460087117319,0,Q07955;J3KTL2;J3KSR8;J3QQV5;J3KSW7,Q07955;J3KTL2,18;18;7;6;6,18;18;7;6;6,17;17;7;6;6,Serine/arginine-rich splicing factor 1,SRSF1,sp|Q07955|SRSF1_HUMAN Serine/arginine-rich splicing factor 1 OS=Homo sapiens OX=9606 GN=SRSF1 PE=1 SV=2;tr|J3KTL2|J3KTL2_HUMAN Serine/arginine-rich-splicing factor 1 OS=Homo sapiens OX=9606 GN=SRSF1 PE=1 SV=1,18,17,62.9,248
CHERP,0.5126801669,0.00829681435240242,0,Q8IWX8;J3QK89,Q8IWX8;J3QK89,7;7,7;7,7;7,Calcium homeostasis endoplasmic reticulum protein,CHERP,sp|Q8IWX8|CHERP_HUMAN Calcium homeostasis endoplasmic reticulum protein OS=Homo sapiens OX=9606 GN=CHERP PE=1 SV=3;tr|J3QK89|J3QK89_HUMAN Calcium homeostasis endoplasmic reticulum protein OS=Homo sapiens OX=9606 GN=CHERP PE=1 SV=1,7,7,10.2,916
