PCMT1,0.5060559189,0.0384658834775842,0,P22061;A0A3F2YNX8;A0A0A0MRJ6;H7BY58;F6S8N6;H7C4X2;F8WDT3;F8WAV5;F8WAX2;C9J0F2,P22061;A0A3F2YNX8;A0A0A0MRJ6;H7BY58;F6S8N6,6;5;5;5;4;2;2;2;2;1,6;5;5;5;4;2;2;2;2;1,6;5;5;5;4;2;2;2;2;1,Protein-L-isoaspartate(D-aspartate) O-methyltransferase;Protein-L-isoaspartate O-methyltransferase,PCMT1,sp|P22061|PIMT_HUMAN Protein-L-isoaspartate(D-aspartate) O-methyltransferase OS=Homo sapiens OX=9606 GN=PCMT1 PE=1 SV=4;tr|A0A3F2YNX8|A0A3F2YNX8_HUMAN Protein-L-isoaspartate O-methyltransferase OS=Homo sapiens OX=9606 GN=PCMT1 PE=1 SV=1;tr|A0A0A0MRJ6|A0A0A,6,6,45.4,227
FBL,0.177454103,0.168206011684146,0,P22087;M0QXL5;M0R2Q4;M0R0P1;M0R299;M0R2U2;M0R1H0;M0R2B0,P22087;M0QXL5;M0R2Q4;M0R0P1;M0R299;M0R2U2;M0R1H0;M0R2B0,16;15;15;14;13;8;8;8,16;15;15;14;13;8;8;8,15;14;14;13;12;8;8;8,rRNA 2-O-methyltransferase fibrillarin,FBL,sp|P22087|FBRL_HUMAN rRNA 2-O-methyltransferase fibrillarin OS=Homo sapiens OX=9606 GN=FBL PE=1 SV=2;tr|M0QXL5|M0QXL5_HUMAN rRNA 2-O-methyltransferase fibrillarin (Fragment) OS=Homo sapiens OX=9606 GN=FBL PE=1 SV=1;tr|M0R2Q4|M0R2Q4_HUMAN rRNA 2-O-methyl,16,15,57.9,321
GART,0.131978235,0.353403591996868,0,P22102;F8WD69;C9JBJ1;C9JTV6;C9JZG2;C9JKQ7;H7C366;A0A140TA71,P22102,26;11;9;9;5;5;4;1,26;11;9;9;5;5;4;1,26;11;9;9;5;5;4;1,Trifunctional purine biosynthetic protein adenosine-3;Phosphoribosylamine--glycine ligase;Phosphoribosylformylglycinamidine cyclo-ligase;Phosphoribosylglycinamide formyltransferase,GART,sp|P22102|PUR2_HUMAN Trifunctional purine biosynthetic protein adenosine-3 OS=Homo sapiens OX=9606 GN=GART PE=1 SV=1,26,26,36.8,1010
PAICS,0.2336136022,0.217073359302027,0,P22234;E9PBS1;D6RF62,P22234;E9PBS1;D6RF62,25;24;17,25;24;17,25;24;17,Multifunctional protein ADE2;Phosphoribosylaminoimidazole-succinocarboxamide synthase;Phosphoribosylaminoimidazole carboxylase,PAICS,sp|P22234|PUR6_HUMAN Multifunctional protein ADE2 OS=Homo sapiens OX=9606 GN=PAICS PE=1 SV=3;tr|E9PBS1|E9PBS1_HUMAN Multifunctional protein ADE2 (Fragment) OS=Homo sapiens OX=9606 GN=PAICS PE=1 SV=1;tr|D6RF62|D6RF62_HUMAN Multifunctional protein ADE2 OS=Ho,25,25,50.4,425
UBA1,-0.2385463412,0.0823273299623947,0,P22314;Q5JRR6;Q5JRR9;Q5JRS0;Q5JRS2;Q5JRS1;Q5JRS3,P22314,40;13;10;10;8;7;7,40;13;10;10;8;7;7,40;13;10;10;8;7;7,Ubiquitin-like modifier-activating enzyme 1,UBA1,sp|P22314|UBA1_HUMAN Ubiquitin-like modifier-activating enzyme 1 OS=Homo sapiens OX=9606 GN=UBA1 PE=1 SV=3,40,40,45.7,1058
FDXR,0.0699985073,0.823289517443247,0,P22570;A0A0C4DFN8;A0A0A0MSZ4;A0A0A0MT64;A0A0A0MTN9;A0A0A0MTR6;A0A0C4DGN7;J3QQX3;J3QKZ8;J3QQW7;J3KS64,P22570;A0A0C4DFN8;A0A0A0MSZ4;A0A0A0MT64;A0A0A0MTN9;A0A0A0MTR6;A0A0C4DGN7;J3QQX3,33;30;30;30;29;28;28;27;7;3;1,33;30;30;30;29;28;28;27;7;3;1,33;30;30;30;29;28;28;27;7;3;1,"NADPH:adrenodoxin oxidoreductase, mitochondrial",FDXR,"sp|P22570|ADRO_HUMAN NADPH:adrenodoxin oxidoreductase, mitochondrial OS=Homo sapiens OX=9606 GN=FDXR PE=1 SV=3;tr|A0A0C4DFN8|A0A0C4DFN8_HUMAN NADPH:adrenodoxin oxidoreductase, mitochondrial OS=Homo sapiens OX=9606 GN=FDXR PE=1 SV=1;tr|A0A0A0MSZ4|A0A0A0MSZ4",33,33,72.1,491
HNRNPA2B1,0.0102073065,0.938357070504362,0,P22626;A0A087WUI2,P22626;A0A087WUI2,39;28,39;28,39;28,Heterogeneous nuclear ribonucleoproteins A2/B1,HNRNPA2B1,sp|P22626|ROA2_HUMAN Heterogeneous nuclear ribonucleoproteins A2/B1 OS=Homo sapiens OX=9606 GN=HNRNPA2B1 PE=1 SV=2;tr|A0A087WUI2|A0A087WUI2_HUMAN Heterogeneous nuclear ribonucleoproteins A2/B1 OS=Homo sapiens OX=9606 GN=HNRNPA2B1 PE=1 SV=1,39,39,77.9,353
UQCRC2,0.2844991857,0.0858890467605002,0,P22695;H3BRG4;H3BSJ9;H3BP04;H3BUE4;H3BUI9;A0A087WVZ4,P22695;H3BRG4;H3BSJ9;H3BP04,18;17;16;10;4;4;3,18;17;16;10;4;4;3,18;17;16;10;4;4;3,"Cytochrome b-c1 complex subunit 2, mitochondrial",UQCRC2,"sp|P22695|QCR2_HUMAN Cytochrome b-c1 complex subunit 2, mitochondrial OS=Homo sapiens OX=9606 GN=UQCRC2 PE=1 SV=3;tr|H3BRG4|H3BRG4_HUMAN Cytochrome b-c1 complex subunit 2, mitochondrial OS=Homo sapiens OX=9606 GN=UQCRC2 PE=1 SV=1;tr|H3BSJ9|H3BSJ9_HUMAN Cyt",18,18,44.8,453
SFPQ,0.061335487,0.628859533654746,0,P23246;H0Y9K7;H0Y9U2,P23246,34;7;1,32;7;1,32;7;1,"Splicing factor, proline- and glutamine-rich",SFPQ,"sp|P23246|SFPQ_HUMAN Splicing factor, proline- and glutamine-rich OS=Homo sapiens OX=9606 GN=SFPQ PE=1 SV=2",34,32,41.6,707
TUBG1;TUBG2,0.5231464241,0.0589447640388334,0,P23258;Q9NRH3;K7EKE5;K7EIS0,P23258;Q9NRH3,5;4;2;2,5;4;2;2,5;4;2;2,Tubulin gamma-1 chain;Tubulin gamma-2 chain,TUBG1;TUBG2,sp|P23258|TBG1_HUMAN Tubulin gamma-1 chain OS=Homo sapiens OX=9606 GN=TUBG1 PE=1 SV=2;sp|Q9NRH3|TBG2_HUMAN Tubulin gamma-2 chain OS=Homo sapiens OX=9606 GN=TUBG2 PE=2 SV=1,5,5,17.5,451
PPIB,0.0184112323,0.867767881956174,0,P23284,P23284,21,21,21,Peptidyl-prolyl cis-trans isomerase B,PPIB,sp|P23284|PPIB_HUMAN Peptidyl-prolyl cis-trans isomerase B OS=Homo sapiens OX=9606 GN=PPIB PE=1 SV=2,21,21,65.3,216
RPS3,0.1545310912,0.278725761507319,0,P23396;E9PL09;F2Z2S8;E9PPU1;H0YCJ7;H0YF32;E9PQ96;E9PJH4;E9PK82;H0YEU2;E9PSF4;E9PQX2;H0YES8;E9PJN9,P23396;E9PL09;F2Z2S8;E9PPU1;H0YCJ7,31;27;21;20;19;15;14;14;14;14;7;6;1;1,31;27;21;20;19;15;14;14;14;14;7;6;1;1,31;27;21;20;19;15;14;14;14;14;7;6;1;1,40S ribosomal protein S3,RPS3,sp|P23396|RS3_HUMAN 40S ribosomal protein S3 OS=Homo sapiens OX=9606 GN=RPS3 PE=1 SV=2;tr|E9PL09|E9PL09_HUMAN 40S ribosomal protein S3 OS=Homo sapiens OX=9606 GN=RPS3 PE=1 SV=1;tr|F2Z2S8|F2Z2S8_HUMAN 40S ribosomal protein S3 OS=Homo sapiens OX=9606 GN=RPS3,31,31,90.5,243
AHCY,-0.0934646953,0.448343191558653,0,P23526,P23526,20,20,20,Adenosylhomocysteinase,AHCY,sp|P23526|SAHH_HUMAN Adenosylhomocysteinase OS=Homo sapiens OX=9606 GN=AHCY PE=1 SV=4,20,20,42.6,432
CFL1,-0.1199494836,0.346805271460941,0,P23528;E9PP50;E9PK25;G3V1A4;E9PQB7;E9PS23;E9PLJ3,P23528;E9PP50;E9PK25;G3V1A4;E9PQB7,21;19;18;17;13;8;6,21;19;18;17;13;8;6,11;9;8;8;4;7;4,Cofilin-1,CFL1,sp|P23528|COF1_HUMAN Cofilin-1 OS=Homo sapiens OX=9606 GN=CFL1 PE=1 SV=3;tr|E9PP50|E9PP50_HUMAN Cofilin-1 (Fragment) OS=Homo sapiens OX=9606 GN=CFL1 PE=1 SV=8;tr|E9PK25|E9PK25_HUMAN Cofilin-1 OS=Homo sapiens OX=9606 GN=CFL1 PE=1 SV=1;tr|G3V1A4|G3V1A4_HUMAN,21,11,91.6,166
DTYMK,-0.0526761952,0.766524778619271,0,P23919;G5E9E9;H7C3A4;H7BZ20;H7C312,P23919;G5E9E9,5;4;2;2;1,5;4;2;2;1,5;4;2;2;1,Thymidylate kinase,DTYMK,"sp|P23919|KTHY_HUMAN Thymidylate kinase OS=Homo sapiens OX=9606 GN=DTYMK PE=1 SV=4;tr|G5E9E9|G5E9E9_HUMAN Deoxythymidylate kinase (Thymidylate kinase), isoform CRA_d OS=Homo sapiens OX=9606 GN=DTYMK PE=1 SV=1",5,5,20.8,212
EEF1B2,-0.2638236856,0.269501041389396,0,P24534;F2Z2G2;C9JZW3;F8WF65,P24534,8;2;2;1,7;2;2;1,7;2;2;1,Elongation factor 1-beta,EEF1B2,sp|P24534|EF1B_HUMAN Elongation factor 1-beta OS=Homo sapiens OX=9606 GN=EEF1B2 PE=1 SV=3,8,7,36,225
ATP5F1,-0.1243400012,0.296465594822602,0,P24539;Q5QNZ2,P24539;Q5QNZ2,9;7,9;7,9;7,"ATP synthase F(0) complex subunit B1, mitochondrial",ATP5F1,"sp|P24539|AT5F1_HUMAN ATP synthase F(0) complex subunit B1, mitochondrial OS=Homo sapiens OX=9606 GN=ATP5PB PE=1 SV=2;tr|Q5QNZ2|Q5QNZ2_HUMAN ATP synthase F(0) complex subunit B1, mitochondrial OS=Homo sapiens OX=9606 GN=ATP5PB PE=1 SV=1",9,9,42.2,256
ACAT1,0.1833353211,0.298880783872781,0,P24752;A0A5F9ZHL1;A0A5F9ZHJ7;A0A5F9ZHJ0;A0A5F9ZHD4;A0A5F9ZI66;A0A5F9ZHH9;A0A5F9ZHL7;H0YEL7;E9PRQ6,P24752;A0A5F9ZHL1;A0A5F9ZHJ7;A0A5F9ZHJ0;A0A5F9ZHD4;A0A5F9ZI66,11;10;9;8;6;6;5;3;3;3,11;10;9;8;6;6;5;3;3;3,11;10;9;8;6;6;5;3;3;3,"Acetyl-CoA acetyltransferase, mitochondrial",ACAT1,"sp|P24752|THIL_HUMAN Acetyl-CoA acetyltransferase, mitochondrial OS=Homo sapiens OX=9606 GN=ACAT1 PE=1 SV=1;tr|A0A5F9ZHL1|A0A5F9ZHL1_HUMAN Acetyl-CoA acetyltransferase, mitochondrial OS=Homo sapiens OX=9606 GN=ACAT1 PE=1 SV=1;tr|A0A5F9ZHJ7|A0A5F9ZHJ7_HUMAN",11,11,31.1,427
POLR2A,6.7912302751,1.04787775038092e-06,1,P24928,P24928,5,5,5,DNA-directed RNA polymerase II subunit RPB1,POLR2A,sp|P24928|RPB1_HUMAN DNA-directed RNA polymerase II subunit RPB1 OS=Homo sapiens OX=9606 GN=POLR2A PE=1 SV=2,5,5,4.1,1970
MCM3,-0.2408744785,0.174286085174978,0,P25205;J3KQ69;A0A499FHX9;Q7Z6P5,P25205;J3KQ69;A0A499FHX9,31;25;25;4,31;25;25;4,31;25;25;4,DNA replication licensing factor MCM3,MCM3,sp|P25205|MCM3_HUMAN DNA replication licensing factor MCM3 OS=Homo sapiens OX=9606 GN=MCM3 PE=1 SV=3;tr|J3KQ69|J3KQ69_HUMAN DNA replication licensing factor MCM3 OS=Homo sapiens OX=9606 GN=MCM3 PE=1 SV=3;tr|A0A499FHX9|A0A499FHX9_HUMAN DNA replication licen,31,31,40,808
RPS12,-0.0494802612,0.725655140050883,0,P25398,P25398,15,15,15,40S ribosomal protein S12,RPS12,sp|P25398|RS12_HUMAN 40S ribosomal protein S12 OS=Homo sapiens OX=9606 GN=RPS12 PE=1 SV=3,15,15,90.9,132
DNAJB1,0.3333228933,0.35314075840483,0,P25685;M0R080;M0QYT3;M0QXK0;M0R128;A0A1B0GX60;M0R1D6;M0QZD0,P25685;M0R080,7;4;2;2;1;1;1;1,7;4;2;2;1;1;1;1,7;4;2;2;1;1;1;1,DnaJ homolog subfamily B member 1,DNAJB1,sp|P25685|DNJB1_HUMAN DnaJ homolog subfamily B member 1 OS=Homo sapiens OX=9606 GN=DNAJB1 PE=1 SV=4;tr|M0R080|M0R080_HUMAN DnaJ homolog subfamily B member 1 (Fragment) OS=Homo sapiens OX=9606 GN=DNAJB1 PE=1 SV=1,7,7,25.3,340
ATP5A1,0.0965313926,0.40247586013317,0,P25705;K7EK77;K7ENJ4;K7ERX7;K7EJP1;K7EQH4;K7ESA0,P25705;K7EK77,52;26;22;18;14;8;2,52;26;22;18;14;8;2,52;26;22;18;14;8;2,"ATP synthase subunit alpha, mitochondrial",ATP5A1,"sp|P25705|ATPA_HUMAN ATP synthase subunit alpha, mitochondrial OS=Homo sapiens OX=9606 GN=ATP5F1A PE=1 SV=1;tr|K7EK77|K7EK77_HUMAN ATP synthase subunit alpha, mitochondrial (Fragment) OS=Homo sapiens OX=9606 GN=ATP5F1A PE=1 SV=1",52,52,70,553
PSMA1,-0.0590074691,0.608954389769028,0,P25786;F5GX11;B4DEV8,P25786;F5GX11;B4DEV8,16;12;8,16;12;8,16;12;8,Proteasome subunit alpha type-1;Proteasome subunit alpha type,PSMA1,sp|P25786|PSA1_HUMAN Proteasome subunit alpha type-1 OS=Homo sapiens OX=9606 GN=PSMA1 PE=1 SV=1;tr|F5GX11|F5GX11_HUMAN Proteasome endopeptidase complex OS=Homo sapiens OX=9606 GN=PSMA1 PE=1 SV=1;tr|B4DEV8|B4DEV8_HUMAN Proteasome subunit alpha type OS=Homo ,16,16,69.6,263
PSMA3,-0.1487456393,0.424870439447162,0,P25788;G3V4X5;G3V3W4;G3V5N4;H0YJ03,P25788;G3V4X5,12;6;2;2;1,12;6;2;2;1,12;6;2;2;1,Proteasome subunit alpha type-3,PSMA3,sp|P25788|PSA3_HUMAN Proteasome subunit alpha type-3 OS=Homo sapiens OX=9606 GN=PSMA3 PE=1 SV=2;tr|G3V4X5|G3V4X5_HUMAN Proteasome endopeptidase complex OS=Homo sapiens OX=9606 GN=PSMA3 PE=1 SV=1,12,12,50.2,255
PSMA4,-0.4169998503,0.153176172848459,0,P25789;H0YMZ1;H0YL69;H0YMI6;H0YMA1;H0YN18;H0YKT8;H0YKS0;H0YLS6;H0YLC2,P25789;H0YMZ1;H0YL69;H0YMI6;H0YMA1;H0YN18;H0YKT8,8;7;7;6;6;6;4;3;3;3,8;7;7;6;6;6;4;3;3;3,8;7;7;6;6;6;4;3;3;3,Proteasome subunit alpha type-4;Proteasome subunit alpha type;Proteasome subunit beta type,PSMA4,sp|P25789|PSA4_HUMAN Proteasome subunit alpha type-4 OS=Homo sapiens OX=9606 GN=PSMA4 PE=1 SV=1;tr|H0YMZ1|H0YMZ1_HUMAN Proteasome subunit alpha type (Fragment) OS=Homo sapiens OX=9606 GN=PSMA4 PE=1 SV=8;tr|H0YL69|H0YL69_HUMAN Proteasome subunit alpha type ,8,8,40.2,261
ITGA3,0.0931029808,0.562558404214522,0,P26006;D6R9X8;K7EMU3;H0YA49;H0YA32,P26006,14;4;2;2;1,14;4;2;2;1,14;4;2;2;1,Integrin alpha-3;Integrin alpha-3 heavy chain;Integrin alpha-3 light chain,ITGA3,sp|P26006|ITA3_HUMAN Integrin alpha-3 OS=Homo sapiens OX=9606 GN=ITGA3 PE=1 SV=5,14,14,16.8,1051
MSN,0.0367848148,0.750405574777912,0,P26038;V9GZ54,P26038,41;10,31;7,29;7,Moesin,MSN,sp|P26038|MOES_HUMAN Moesin OS=Homo sapiens OX=9606 GN=MSN PE=1 SV=3,41,29,62.9,577
DDX6,0.0310210718,0.805014753013456,0,P26196;Q8IV96,P26196,5;1,5;1,5;1,Probable ATP-dependent RNA helicase DDX6,DDX6,sp|P26196|DDX6_HUMAN Probable ATP-dependent RNA helicase DDX6 OS=Homo sapiens OX=9606 GN=DDX6 PE=1 SV=2,5,5,13.9,483
U2AF2,0.0968875283,0.566498897637118,0,P26368;K7ELP8,P26368,6;1,6;1,3;1,Splicing factor U2AF 65 kDa subunit,U2AF2,sp|P26368|U2AF2_HUMAN Splicing factor U2AF 65 kDa subunit OS=Homo sapiens OX=9606 GN=U2AF2 PE=1 SV=4,6,3,24.8,475
RPL13,0.4050544642,0.0310029817978194,0,P26373;J3QSB4;H3BTH3;H3BUK8;J3KS98,P26373;J3QSB4,20;15;6;2;2,20;15;6;2;2,20;15;6;2;2,60S ribosomal protein L13,RPL13,sp|P26373|RL13_HUMAN 60S ribosomal protein L13 OS=Homo sapiens OX=9606 GN=RPL13 PE=1 SV=4;tr|J3QSB4|J3QSB4_HUMAN 60S ribosomal protein L13 (Fragment) OS=Homo sapiens OX=9606 GN=RPL13 PE=1 SV=1,20,20,61.6,211
HMGB2,0.682129343,0.0682899344915826,0,P26583;D6R9A6,P26583;D6R9A6,10;7,4;2,4;2,High mobility group protein B2,HMGB2,sp|P26583|HMGB2_HUMAN High mobility group protein B2 OS=Homo sapiens OX=9606 GN=HMGB2 PE=1 SV=2;tr|D6R9A6|D6R9A6_HUMAN High mobility group protein B2 (Fragment) OS=Homo sapiens OX=9606 GN=HMGB2 PE=1 SV=1,10,4,41.6,209
PTBP1,0.106478648,0.481539077688439,0,P26599;A0A0U1RRM4;A6NLN1;A0A0D9SF20;K7EKJ7;K7EK45;K7ES59;A0A087WUW5;K7ELW5;A0A087WU68,P26599;A0A0U1RRM4;A6NLN1;A0A0D9SF20,30;29;28;18;9;9;7;5;4;4,30;29;28;18;9;9;7;5;4;4,26;25;24;17;7;8;5;5;2;3,Polypyrimidine tract-binding protein 1,PTBP1,sp|P26599|PTBP1_HUMAN Polypyrimidine tract-binding protein 1 OS=Homo sapiens OX=9606 GN=PTBP1 PE=1 SV=1;tr|A0A0U1RRM4|A0A0U1RRM4_HUMAN Polypyrimidine tract-binding protein 1 OS=Homo sapiens OX=9606 GN=PTBP1 PE=1 SV=1;tr|A6NLN1|A6NLN1_HUMAN Polypyrimidine t,30,26,65.5,531
TARS,0.192863368,0.14627712028682,0,P26639;D6R9F8;D6RCA5;D6RDJ6;D6RJ97;D6RHV7;D6RCS6;F6S7Q7;U3KQG0,P26639,28;3;2;2;1;1;1;1;1,28;3;2;2;1;1;1;1;1,24;3;2;2;1;1;1;0;0,"Threonine--tRNA ligase, cytoplasmic",TARS,"sp|P26639|SYTC_HUMAN Threonine--tRNA ligase 1, cytoplasmic OS=Homo sapiens OX=9606 GN=TARS1 PE=1 SV=3",28,24,40.9,723
VARS,0.2777421994,0.0587129383187078,0,P26640;A0A140T936;A0A140T954;A2ABF4;A0A0G2JJT9;A0A140T904;H0Y426,P26640;A0A140T936,27;24;6;5;5;2;1,27;24;6;5;5;2;1,27;24;6;5;5;2;1,Valine--tRNA ligase,VARS,sp|P26640|SYVC_HUMAN Valine--tRNA ligase OS=Homo sapiens OX=9606 GN=VARS1 PE=1 SV=4;tr|A0A140T936|A0A140T936_HUMAN Valine--tRNA ligase (Fragment) OS=Homo sapiens OX=9606 GN=VARS1 PE=1 SV=1,27,27,27.6,1264
EEF1G,0.1967074282,0.126689814881506,0,P26641,P26641,25,25,25,Elongation factor 1-gamma,EEF1G,sp|P26641|EF1G_HUMAN Elongation factor 1-gamma OS=Homo sapiens OX=9606 GN=EEF1G PE=1 SV=3,25,25,44.6,437
STOM,0.9674407807,0.00433061233900199,0,P27105;F8VSL7,P27105;F8VSL7,2;1,2;1,2;1,Erythrocyte band 7 integral membrane protein,STOM,sp|P27105|STOM_HUMAN Erythrocyte band 7 integral membrane protein OS=Homo sapiens OX=9606 GN=STOM PE=1 SV=3;tr|F8VSL7|F8VSL7_HUMAN Erythrocyte band 7 integral membrane protein OS=Homo sapiens OX=9606 GN=STOM PE=1 SV=1,2,2,9.4,288
AK4,0.3050191774,0.0982240696086409,0,P27144;F8VS11,P27144;F8VS11,5;3,5;3,5;3,"Adenylate kinase 4, mitochondrial",AK4,"sp|P27144|KAD4_HUMAN Adenylate kinase 4, mitochondrial OS=Homo sapiens OX=9606 GN=AK4 PE=1 SV=1;tr|F8VS11|F8VS11_HUMAN Adenylate kinase 4, mitochondrial OS=Homo sapiens OX=9606 GN=AK4 PE=1 SV=1",5,5,29.6,223
YWHAQ,0.0658200338,0.547316828569689,0,P27348;E9PG15,P27348;E9PG15,20;17,13;13,13;13,14-3-3 protein theta,YWHAQ,sp|P27348|1433T_HUMAN 14-3-3 protein theta OS=Homo sapiens OX=9606 GN=YWHAQ PE=1 SV=1;tr|E9PG15|E9PG15_HUMAN 14-3-3 protein theta (Fragment) OS=Homo sapiens OX=9606 GN=YWHAQ PE=1 SV=1,20,13,53.9,245
RPL10,0.1812009204,0.20182138380848,0,P27635;X1WI28;F8W7C6;A0A087WV22;Q96L21;H7C123;B8A6G2;H7C2C5;A6QRI9;H7C2U2,P27635;X1WI28;F8W7C6;A0A087WV22,24;21;19;19;10;9;9;9;9;1,24;21;19;19;10;9;9;9;9;1,24;21;19;19;10;9;9;9;9;1,60S ribosomal protein L10,RPL10,sp|P27635|RL10_HUMAN 60S ribosomal protein L10 OS=Homo sapiens OX=9606 GN=RPL10 PE=1 SV=4;tr|X1WI28|X1WI28_HUMAN 60S ribosomal protein L10 (Fragment) OS=Homo sapiens OX=9606 GN=RPL10 PE=1 SV=7;tr|F8W7C6|F8W7C6_HUMAN 60S ribosomal protein L10 OS=Homo sapien,24,24,80.4,214
RPA1,0.078224597,0.588311569090443,0,P27694;I3L4R8,P27694;I3L4R8,3;2,3;2,3;2,"Replication protein A 70 kDa DNA-binding subunit;Replication protein A 70 kDa DNA-binding subunit, N-terminally processed",RPA1,sp|P27694|RFA1_HUMAN Replication protein A 70 kDa DNA-binding subunit OS=Homo sapiens OX=9606 GN=RPA1 PE=1 SV=2;tr|I3L4R8|I3L4R8_HUMAN Replication protein A 70 kDa DNA-binding subunit (Fragment) OS=Homo sapiens OX=9606 GN=RPA1 PE=1 SV=1,3,3,8.6,616
APEX1,-0.0812316225,0.468866951691159,0,P27695;G3V5Q1;G3V3M6;H7C4A8;G3V5D9;A0A0C4DGK8;G3V3C7;G3V5M0;G3V359,P27695;G3V5Q1;G3V3M6;H7C4A8,10;7;7;5;3;3;3;2;2,10;7;7;5;3;3;3;2;2,10;7;7;5;3;3;3;2;2,"DNA-(apurinic or apyrimidinic site) lyase;DNA-(apurinic or apyrimidinic site) lyase, mitochondrial",APEX1,sp|P27695|APEX1_HUMAN DNA-(apurinic or apyrimidinic site) endonuclease OS=Homo sapiens OX=9606 GN=APEX1 PE=1 SV=2;tr|G3V5Q1|G3V5Q1_HUMAN DNA-(apurinic or apyrimidinic site) lyase (Fragment) OS=Homo sapiens OX=9606 GN=APEX1 PE=1 SV=1;tr|G3V3M6|G3V3M6_HUMAN ,10,10,35.2,318
CALR,-0.1875147084,0.136092072071559,0,P27797;K7EJB9;K7EL50,P27797;K7EJB9,21;16;1,21;16;1,21;16;1,Calreticulin,CALR,sp|P27797|CALR_HUMAN Calreticulin OS=Homo sapiens OX=9606 GN=CALR PE=1 SV=1;tr|K7EJB9|K7EJB9_HUMAN Calreticulin (Fragment) OS=Homo sapiens OX=9606 GN=CALR PE=1 SV=1,21,21,51.8,417
CANX,-0.1341252484,0.415986560077168,0,P27824;D6RDP7;D6RAU8;D6RB85;H0Y9Q7;D6RGY2;D6RFL1;D6RAQ8;H0Y9H1;D6RHJ3;D6RD16;O14967,P27824,16;7;6;6;6;6;5;4;3;2;2;1,16;7;6;6;6;6;5;4;3;2;2;1,16;7;6;6;6;6;5;4;3;2;2;1,Calnexin,CANX,sp|P27824|CALX_HUMAN Calnexin OS=Homo sapiens OX=9606 GN=CANX PE=1 SV=2,16,16,35.5,592
PSMA5,-0.6414972575,0.0273470354256538,0,P28066,P28066,10,10,10,Proteasome subunit alpha type-5,PSMA5,sp|P28066|PSA5_HUMAN Proteasome subunit alpha type-5 OS=Homo sapiens OX=9606 GN=PSMA5 PE=1 SV=3,10,10,39,241
PSMB4,0.4432900686,0.0269904000148589,0,P28070,P28070,4,4,4,Proteasome subunit beta type-4,PSMB4,sp|P28070|PSB4_HUMAN Proteasome subunit beta type-4 OS=Homo sapiens OX=9606 GN=PSMB4 PE=1 SV=4,4,4,14,264
PSMB6,0.2430135667,0.165189141904739,0,P28072;I3L3X7;A0A087X2I4,P28072,7;3;3,7;3;3,7;3;3,Proteasome subunit beta type-6,PSMB6,sp|P28072|PSB6_HUMAN Proteasome subunit beta type-6 OS=Homo sapiens OX=9606 GN=PSMB6 PE=1 SV=4,7,7,21.3,239
PSMB5,0.1517560746,0.358342119937424,0,P28074;H0YJM8;G8JLC2;G3V3K3,P28074,9;4;1;1,9;4;1;1,9;4;1;1,Proteasome subunit beta type-5,PSMB5,sp|P28074|PSB5_HUMAN Proteasome subunit beta type-5 OS=Homo sapiens OX=9606 GN=PSMB5 PE=1 SV=3,9,9,35,263
NDUFS1,0.525316055,0.0421508328605501,0,P28331;B4DJ81;C9JPQ5;F8WDL5,P28331;B4DJ81,11;9;2;1,11;9;2;1,11;9;2;1,"NADH-ubiquinone oxidoreductase 75 kDa subunit, mitochondrial",NDUFS1,"sp|P28331|NDUS1_HUMAN NADH-ubiquinone oxidoreductase 75 kDa subunit, mitochondrial OS=Homo sapiens OX=9606 GN=NDUFS1 PE=1 SV=3;tr|B4DJ81|B4DJ81_HUMAN NADH-ubiquinone oxidoreductase 75 kDa subunit, mitochondrial OS=Homo sapiens OX=9606 GN=NDUFS1 PE=1 SV=1",11,11,20.6,727
GRN,-1.0309789878,0.0149488138579432,1,P28799;K7EKL3;K7EMR1;K7EQI0;K7EQ05;K7EPL0,P28799;K7EKL3;K7EMR1,5;4;3;2;2;1,5;4;3;2;2;1,5;4;3;2;2;1,Granulins;Acrogranin;Paragranulin;Granulin-1;Granulin-2;Granulin-3;Granulin-4;Granulin-5;Granulin-6;Granulin-7,GRN,sp|P28799|GRN_HUMAN Progranulin OS=Homo sapiens OX=9606 GN=GRN PE=1 SV=2;tr|K7EKL3|K7EKL3_HUMAN Progranulin (Fragment) OS=Homo sapiens OX=9606 GN=GRN PE=1 SV=1;tr|K7EMR1|K7EMR1_HUMAN Progranulin (Fragment) OS=Homo sapiens OX=9606 GN=GRN PE=1 SV=1,5,5,11.8,593
LAP3,0.0007789249,0.996435591525952,0,P28838;H0Y9Q1,P28838,14;6,14;6,14;6,Cytosol aminopeptidase,LAP3,sp|P28838|AMPL_HUMAN Cytosol aminopeptidase OS=Homo sapiens OX=9606 GN=LAP3 PE=1 SV=3,14,14,36.2,519
TKT,-0.0495609183,0.67980933930529,0,P29401;A0A0B4J1R6;E9PFF2;F8W888;F8WAX4,P29401;A0A0B4J1R6;E9PFF2,40;32;21;7;3,40;32;21;7;3,40;32;21;7;3,Transketolase,TKT,sp|P29401|TKT_HUMAN Transketolase OS=Homo sapiens OX=9606 GN=TKT PE=1 SV=3;tr|A0A0B4J1R6|A0A0B4J1R6_HUMAN Transketolase OS=Homo sapiens OX=9606 GN=TKT PE=1 SV=1;tr|E9PFF2|E9PFF2_HUMAN Transketolase OS=Homo sapiens OX=9606 GN=TKT PE=1 SV=1,40,40,75.3,623
ERP29,-0.0558480816,0.693631285168934,0,P30040;F8VY02;F8W1G0,P30040;F8VY02,16;12;2,16;12;2,16;12;2,Endoplasmic reticulum resident protein 29,ERP29,sp|P30040|ERP29_HUMAN Endoplasmic reticulum resident protein 29 OS=Homo sapiens OX=9606 GN=ERP29 PE=1 SV=4;tr|F8VY02|F8VY02_HUMAN Endoplasmic reticulum resident protein 29 OS=Homo sapiens OX=9606 GN=ERP29 PE=1 SV=1,16,16,60.5,261
PRDX6,0.1418761166,0.291528751446307,0,P30041,P30041,17,17,17,Peroxiredoxin-6,PRDX6,sp|P30041|PRDX6_HUMAN Peroxiredoxin-6 OS=Homo sapiens OX=9606 GN=PRDX6 PE=1 SV=3,17,17,61.6,224
BLVRB,0.0187418831,0.890514512613208,0,P30043;M0R192;A0A2R8YEP4;A0A2R8Y7Y9;M0QZL1,P30043;M0R192;A0A2R8YEP4,5;4;4;1;1,5;4;4;1;1,5;4;4;1;1,Flavin reductase (NADPH),BLVRB,sp|P30043|BLVRB_HUMAN Flavin reductase (NADPH) OS=Homo sapiens OX=9606 GN=BLVRB PE=1 SV=3;tr|M0R192|M0R192_HUMAN Flavin reductase (NADPH) OS=Homo sapiens OX=9606 GN=BLVRB PE=1 SV=1;tr|A0A2R8YEP4|A0A2R8YEP4_HUMAN Flavin reductase (NADPH) OS=Homo sapiens OX=,5,5,27.2,206
PRDX5,-0.4535506567,0.056152187933213,0,P30044,P30044,8,8,8,"Peroxiredoxin-5, mitochondrial",PRDX5,"sp|P30044|PRDX5_HUMAN Peroxiredoxin-5, mitochondrial OS=Homo sapiens OX=9606 GN=PRDX5 PE=1 SV=4",8,8,38.3,214
PRDX3,0.1446567902,0.317767198855455,0,P30048,P30048,8,8,8,"Thioredoxin-dependent peroxide reductase, mitochondrial",PRDX3,"sp|P30048|PRDX3_HUMAN Thioredoxin-dependent peroxide reductase, mitochondrial OS=Homo sapiens OX=9606 GN=PRDX3 PE=1 SV=3",8,8,39.1,256
ATP5D,0.2807063823,0.456530649208447,0,P30049,P30049,4,4,4,"ATP synthase subunit delta, mitochondrial",ATP5D,"sp|P30049|ATPD_HUMAN ATP synthase subunit delta, mitochondrial OS=Homo sapiens OX=9606 GN=ATP5F1D PE=1 SV=2",4,4,39.3,168
RPL12,0.3467192872,0.0261427905026993,0,P30050,P30050,15,15,15,60S ribosomal protein L12,RPL12,sp|P30050|RL12_HUMAN 60S ribosomal protein L12 OS=Homo sapiens OX=9606 GN=RPL12 PE=1 SV=1,15,15,78.8,165
ECHS1,-0.0611979032,0.709329730531968,0,P30084,P30084,12,12,12,"Enoyl-CoA hydratase, mitochondrial",ECHS1,"sp|P30084|ECHM_HUMAN Enoyl-CoA hydratase, mitochondrial OS=Homo sapiens OX=9606 GN=ECHS1 PE=1 SV=4",12,12,34.8,290
PEBP1,-0.361740248,0.0265772410858207,0,P30086,P30086,8,8,8,Phosphatidylethanolamine-binding protein 1;Hippocampal cholinergic neurostimulating peptide,PEBP1,sp|P30086|PEBP1_HUMAN Phosphatidylethanolamine-binding protein 1 OS=Homo sapiens OX=9606 GN=PEBP1 PE=1 SV=3,8,8,63.1,187
PDIA3,-0.0188652729,0.866781996012583,0,P30101,P30101,39,39,29,Protein disulfide-isomerase A3,PDIA3,sp|P30101|PDIA3_HUMAN Protein disulfide-isomerase A3 OS=Homo sapiens OX=9606 GN=PDIA3 PE=1 SV=4,39,29,62.4,505
PPP2R1A,-0.1075849434,0.368040153558128,0,P30153;C9J9C1;B3KQV6;E9PH38;E9PPI5;E9PNM7;E9PHZ6,P30153;C9J9C1,18;13;8;4;3;3;3,18;13;8;4;3;3;3,13;8;7;4;0;0;0,Serine/threonine-protein phosphatase 2A 65 kDa regulatory subunit A alpha isoform,PPP2R1A,sp|P30153|2AAA_HUMAN Serine/threonine-protein phosphatase 2A 65 kDa regulatory subunit A alpha isoform OS=Homo sapiens OX=9606 GN=PPP2R1A PE=1 SV=4;tr|C9J9C1|C9J9C1_HUMAN Serine/threonine-protein phosphatase 2A 65 kDa regulatory subunit A alpha isoform (Fr,18,13,35.5,589
PPIF,0.2939907851,0.131761641967894,0,P30405;R4GN99;H0Y548,P30405;R4GN99;H0Y548,13;8;8,13;8;8,13;8;8,"Peptidyl-prolyl cis-trans isomerase F, mitochondrial;Peptidyl-prolyl cis-trans isomerase",PPIF,"sp|P30405|PPIF_HUMAN Peptidyl-prolyl cis-trans isomerase F, mitochondrial OS=Homo sapiens OX=9606 GN=PPIF PE=1 SV=1;tr|R4GN99|R4GN99_HUMAN Peptidyl-prolyl cis-trans isomerase OS=Homo sapiens OX=9606 GN=PPIF PE=1 SV=1;tr|H0Y548|H0Y548_HUMAN Peptidyl-prolyl ",13,13,55.6,207
ALDH1B1,0.2275154547,0.0872836008148798,0,P30837;P00352;P47895;O94788;H0Y2X5;H0YMG7,P30837,16;1;1;1;1;1,16;1;1;1;1;1,15;0;0;0;0;0,"Aldehyde dehydrogenase X, mitochondrial",ALDH1B1,"sp|P30837|AL1B1_HUMAN Aldehyde dehydrogenase X, mitochondrial OS=Homo sapiens OX=9606 GN=ALDH1B1 PE=1 SV=3",16,15,35.6,517
SDHA,-0.4036824085,0.032192245766589,0,P31040;D6RFM5;A0A494C1T6;A0A087X1I3;H0Y8X1,P31040;D6RFM5;A0A494C1T6;A0A087X1I3,20;17;14;12;1,20;17;14;12;1,20;17;14;12;1,"Succinate dehydrogenase [ubiquinone] flavoprotein subunit, mitochondrial",SDHA,"sp|P31040|SDHA_HUMAN Succinate dehydrogenase [ubiquinone] flavoprotein subunit, mitochondrial OS=Homo sapiens OX=9606 GN=SDHA PE=1 SV=2;tr|D6RFM5|D6RFM5_HUMAN Succinate dehydrogenase [ubiquinone] flavoprotein subunit, mitochondrial OS=Homo sapiens OX=9606 ",20,20,36.7,664
MAT2A,-0.0582510292,0.749405539030596,0,P31153;Q00266,P31153,13;1,13;1,13;1,S-adenosylmethionine synthase isoform type-2,MAT2A,sp|P31153|METK2_HUMAN S-adenosylmethionine synthase isoform type-2 OS=Homo sapiens OX=9606 GN=MAT2A PE=1 SV=1,13,13,31.4,395
DNAJA1,0.2621061928,0.185746198812393,0,P31689,P31689,4,4,4,DnaJ homolog subfamily A member 1,DNAJA1,sp|P31689|DNJA1_HUMAN DnaJ homolog subfamily A member 1 OS=Homo sapiens OX=9606 GN=DNAJA1 PE=1 SV=2,4,4,19.4,397
UQCRC1,0.2115345849,0.103673815939916,0,P31930,P31930,22,22,22,"Cytochrome b-c1 complex subunit 1, mitochondrial",UQCRC1,"sp|P31930|QCR1_HUMAN Cytochrome b-c1 complex subunit 1, mitochondrial OS=Homo sapiens OX=9606 GN=UQCRC1 PE=1 SV=3",22,22,52.9,480
ATIC,-0.1994035093,0.141124289453968,0,P31939;C9JLK0;F8WEF0;H7C1S2,P31939,18;6;4;4,18;6;4;4,18;6;4;4,Bifunctional purine biosynthesis protein PURH;Phosphoribosylaminoimidazolecarboxamide formyltransferase;IMP cyclohydrolase,ATIC,sp|P31939|PUR9_HUMAN Bifunctional purine biosynthesis protein ATIC OS=Homo sapiens OX=9606 GN=ATIC PE=1 SV=3,18,18,38.7,592
HNRNPH3,-0.1822350469,0.151826546189135,0,P31942,P31942,15,15,15,Heterogeneous nuclear ribonucleoprotein H3,HNRNPH3,sp|P31942|HNRH3_HUMAN Heterogeneous nuclear ribonucleoprotein H3 OS=Homo sapiens OX=9606 GN=HNRNPH3 PE=1 SV=2,15,15,62.4,346
YWHAB,-0.1349707526,0.248109940397627,0,P31946;Q4VY20;Q4VY19;A0A0J9YWE8;A0A0J9YWZ2,P31946;Q4VY20;Q4VY19;A0A0J9YWE8,21;12;12;12;6,15;10;10;10;4,12;9;9;9;4,"14-3-3 protein beta/alpha;14-3-3 protein beta/alpha, N-terminally processed",YWHAB,sp|P31946|1433B_HUMAN 14-3-3 protein beta/alpha OS=Homo sapiens OX=9606 GN=YWHAB PE=1 SV=3;tr|Q4VY20|Q4VY20_HUMAN 14-3-3 protein beta/alpha (Fragment) OS=Homo sapiens OX=9606 GN=YWHAB PE=1 SV=1;tr|Q4VY19|Q4VY19_HUMAN 14-3-3 protein beta/alpha (Fragment) OS,21,12,61.8,246
SFN,-0.1349968481,0.492364392066541,0,P31947,P31947,19,15,15,14-3-3 protein sigma,SFN,sp|P31947|1433S_HUMAN 14-3-3 protein sigma OS=Homo sapiens OX=9606 GN=SFN PE=1 SV=1,19,15,63.3,248
