WSB1_vs_zCtl,Unnamed: 1,Unnamed: 2,Unnamed: 3,Unnamed: 4,Unnamed: 5,Unnamed: 6,Unnamed: 7,Unnamed: 8,Unnamed: 9,Unnamed: 10,Unnamed: 11,Unnamed: 12,Unnamed: 13,Unnamed: 14,Unnamed: 15
,,,,,,,,,,,,,,,
Gene_names,logFC (WSB1_vs_zCtl),P_Value (WSB1_vs_zCtl),isDifferential (WSB1_vs_zCtl),Protein_IDs,Majority_protein_IDs,Peptide_counts__all_,Peptide_counts__razor_unique_,Peptide_counts__unique_,Protein_names,Gene_names,Fasta_headers,Peptides,Unique_peptides,Sequence_coverage____,Sequence_length
SERPINB6,-0.7871493403,0.00282839908688125,0,P35237;A0A024QZX5;A0A087X1N8;A0A2R8YD12;A0A2R8Y6A7;A0A2R8Y5S1;A0A2R8YDD0;A0A2R8Y517;A0A2R8Y6N4,P35237;A0A024QZX5;A0A087X1N8;A0A2R8YD12;A0A2R8Y6A7,5;5;5;4;3;1;1;1;1,5;5;5;4;3;1;1;1;1,5;5;5;4;3;1;1;1;1,Serpin B6,SERPINB6,sp|P35237|SPB6_HUMAN Serpin B6 OS=Homo sapiens OX=9606 GN=SERPINB6 PE=1 SV=3;tr|A0A024QZX5|A0A024QZX5_HUMAN Serpin B6 OS=Homo sapiens OX=9606 GN=SERPINB6 PE=1 SV=1;tr|A0A087X1N8|A0A087X1N8_HUMAN Serpin B6 OS=Homo sapiens OX=9606 GN=SERPINB6 PE=1 SV=1;tr|A0,5,5,20.7,376
HDLBP,0.0659898274,0.663771472948741,0,Q00341;A0A024R4E5;C9JHS7;C9JIZ1;C9J5E5;C9JZI8;C9JES8;C9JHZ8;C9JK79;C9JT62;C9JHN6;C9JEJ8;C9JBS3;C9JQ82;C9JMQ6;H7C0A4;H0Y394;C9J739;C9JHS9,Q00341;A0A024R4E5;C9JHS7;C9JIZ1;C9J5E5;C9JZI8;C9JES8;C9JHZ8;C9JK79;C9JT62,5;5;3;3;3;3;3;3;3;3;2;2;2;2;2;2;2;1;1,5;5;3;3;3;3;3;3;3;3;2;2;2;2;2;2;2;1;1,5;5;3;3;3;3;3;3;3;3;2;2;2;2;2;2;2;1;1,Vigilin,HDLBP,"sp|Q00341|VIGLN_HUMAN Vigilin OS=Homo sapiens OX=9606 GN=HDLBP PE=1 SV=2;tr|A0A024R4E5|A0A024R4E5_HUMAN High density lipoprotein binding protein (Vigilin), isoform CRA_a OS=Homo sapiens OX=9606 GN=HDLBP PE=1 SV=1;tr|C9JHS7|C9JHS7_HUMAN Vigilin (Fragment) O",5,5,5,1268
PSMA2,-0.1899225581,0.150791776571262,0,P25787;A0A024RA52;C9JCK5;H3BT36;H7C402,P25787;A0A024RA52;C9JCK5,10;10;5;3;1,10;10;5;3;1,10;10;5;3;1,Proteasome subunit alpha type-2;Proteasome subunit alpha type,PSMA2,sp|P25787|PSA2_HUMAN Proteasome subunit alpha type-2 OS=Homo sapiens OX=9606 GN=PSMA2 PE=1 SV=2;tr|A0A024RA52|A0A024RA52_HUMAN Proteasome subunit alpha type OS=Homo sapiens OX=9606 GN=PSMA2 PE=1 SV=1;tr|C9JCK5|C9JCK5_HUMAN Proteasome endopeptidase complex ,10,10,49.6,234
BAG6;BAT3,-0.1173812672,0.354912754012979,0,P46379;A0A0G2JL47;A0A024RCR6;A0A0G2JK23;F6S6P2;X6REW1;A0A0G2JJM1,P46379;A0A0G2JL47;A0A024RCR6;A0A0G2JK23;F6S6P2;X6REW1;A0A0G2JJM1,3;3;3;3;2;2;2,3;3;3;3;2;2;2,3;3;3;3;2;2;2,Large proline-rich protein BAG6,BAG6;BAT3,sp|P46379|BAG6_HUMAN Large proline-rich protein BAG6 OS=Homo sapiens OX=9606 GN=BAG6 PE=1 SV=2;tr|A0A0G2JL47|A0A0G2JL47_HUMAN Large proline-rich protein BAG6 OS=Homo sapiens OX=9606 GN=BAG6 PE=1 SV=1;tr|A0A024RCR6|A0A024RCR6_HUMAN BAG6 OS=Homo sapiens OX=9,3,3,3.2,1132
TAF15,-0.1459406467,0.288969111275762,0,Q92804;A0A075B7D9;A0A075B7F4,Q92804;A0A075B7D9,3;3;1,2;2;1,2;2;1,TATA-binding protein-associated factor 2N,TAF15,sp|Q92804|RBP56_HUMAN TATA-binding protein-associated factor 2N OS=Homo sapiens OX=9606 GN=TAF15 PE=1 SV=1;tr|A0A075B7D9|A0A075B7D9_HUMAN TATA-binding protein-associated factor 2N OS=Homo sapiens OX=9606 GN=TAF15 PE=1 SV=1,3,2,8.3,592
TXNRD1,0.7273054492,0.00751178533931449,0,Q16881;E9PIR7;F8W809;A0A087WSW9;A0A182DWI3;A0A087WSY9;E2QRB9;E9PKD3;A0A0B4J225;E9PIZ5;E9PLT3;E9PKI4;E9PQI3;E9PRI8;A0A096LPK7,Q16881;E9PIR7;F8W809;A0A087WSW9;A0A182DWI3;A0A087WSY9;E2QRB9;E9PKD3,18;18;18;18;18;18;15;10;5;5;4;4;3;1;1,18;18;18;18;18;18;15;10;5;5;4;4;3;1;1,17;17;17;17;17;17;14;9;4;4;3;3;3;1;0,"Thioredoxin reductase 1, cytoplasmic",TXNRD1,"sp|Q16881|TRXR1_HUMAN Thioredoxin reductase 1, cytoplasmic OS=Homo sapiens OX=9606 GN=TXNRD1 PE=1 SV=3;tr|E9PIR7|E9PIR7_HUMAN Thioredoxin reductase 1, cytoplasmic OS=Homo sapiens OX=9606 GN=TXNRD1 PE=1 SV=1;tr|F8W809|F8W809_HUMAN Thioredoxin reductase 1, c",18,17,41.9,649
HMOX2,-0.2791262236,0.178995132320696,0,P30519;I3L159;I3L1F5;A0A087WT44;I3L1Y2;I3L4P8;A0A1B0GXH0;I3L463,P30519;I3L159;I3L1F5;A0A087WT44,4;4;4;4;1;1;1;1,4;4;4;4;1;1;1;1,4;4;4;4;1;1;1;1,Heme oxygenase 2,HMOX2,sp|P30519|HMOX2_HUMAN Heme oxygenase 2 OS=Homo sapiens OX=9606 GN=HMOX2 PE=1 SV=2;tr|I3L159|I3L159_HUMAN Heme oxygenase 2 (Fragment) OS=Homo sapiens OX=9606 GN=HMOX2 PE=1 SV=1;tr|I3L1F5|I3L1F5_HUMAN Heme oxygenase 2 (Fragment) OS=Homo sapiens OX=9606 GN=HM,4,4,20.3,316
EIF2B4,-0.9487886582,0.181485452418241,0,Q9UI10;A0A087WTA5;E7ERK9;H7C2L8;A0A087WW69;F8W8L6,Q9UI10;A0A087WTA5;E7ERK9,5;5;5;2;2;1,5;5;5;2;2;1,5;5;5;2;2;1,Translation initiation factor eIF-2B subunit delta,EIF2B4,sp|Q9UI10|EI2BD_HUMAN Translation initiation factor eIF-2B subunit delta OS=Homo sapiens OX=9606 GN=EIF2B4 PE=1 SV=2;tr|A0A087WTA5|A0A087WTA5_HUMAN Translation initiation factor eIF-2B subunit delta OS=Homo sapiens OX=9606 GN=EIF2B4 PE=1 SV=1;tr|E7ERK9|E7E,5,5,15.7,523
KHSRP,-0.2168125493,0.0947148132350785,0,Q92945;A0A087WTP3;M0R0I5;M0QYH3;M0QXW7;M0R3J3,Q92945;A0A087WTP3;M0R0I5,19;19;10;7;5;4,15;15;8;5;4;2,15;15;8;5;4;2,Far upstream element-binding protein 2,KHSRP,sp|Q92945|FUBP2_HUMAN Far upstream element-binding protein 2 OS=Homo sapiens OX=9606 GN=KHSRP PE=1 SV=4;tr|A0A087WTP3|A0A087WTP3_HUMAN Far upstream element-binding protein 2 OS=Homo sapiens OX=9606 GN=KHSRP PE=1 SV=1;tr|M0R0I5|M0R0I5_HUMAN Far upstream ele,19,15,36,711
PABPC1,0.1712605964,0.229745447425972,0,P11940;A0A087WTT1;E7EQV3;E7ERJ7;H0YAR2;Q9H361;H0YBN4;E5RJB9;E5RGH3;H0YAP2;E5RH24;H0YB86;Q4VXU2;E5RHG7;H0YAS6;H0YB75;Q5JQF8;H0YAS7;Q96DU9;E5RFD8;E5RGC4;H0YC10,P11940;A0A087WTT1;E7EQV3;E7ERJ7;H0YAR2,32;32;31;29;17;15;11;10;10;9;9;7;5;3;3;3;3;2;2;1;1;1,32;32;31;29;17;15;11;10;10;9;9;7;5;3;3;3;3;2;2;1;1;1,19;19;18;17;12;11;4;3;3;9;3;5;4;1;2;2;1;1;2;1;1;1,Polyadenylate-binding protein 1;Polyadenylate-binding protein,PABPC1,sp|P11940|PABP1_HUMAN Polyadenylate-binding protein 1 OS=Homo sapiens OX=9606 GN=PABPC1 PE=1 SV=2;tr|A0A087WTT1|A0A087WTT1_HUMAN Polyadenylate-binding protein OS=Homo sapiens OX=9606 GN=PABPC1 PE=1 SV=1;tr|E7EQV3|E7EQV3_HUMAN Polyadenylate-binding protein ,32,19,44.8,636
PYCR2,-0.829350517,0.00190785889398536,0,Q96C36;A0A087WTV6;J3KR12;A0A087WZR9;A0A087WX69;A0A087WZF0,Q96C36;A0A087WTV6;J3KR12;A0A087WZR9,4;4;3;2;1;1,3;3;2;1;1;1,3;3;2;1;1;1,Pyrroline-5-carboxylate reductase 2;Pyrroline-5-carboxylate reductase,PYCR2,sp|Q96C36|P5CR2_HUMAN Pyrroline-5-carboxylate reductase 2 OS=Homo sapiens OX=9606 GN=PYCR2 PE=1 SV=1;tr|A0A087WTV6|A0A087WTV6_HUMAN Pyrroline-5-carboxylate reductase 2 OS=Homo sapiens OX=9606 GN=PYCR2 PE=1 SV=1;tr|J3KR12|J3KR12_HUMAN Uncharacterized protei,4,3,16.9,320
HNRNPDL,-0.0752987268,0.643291610721085,0,A0A087WU03,A0A087WU03,2,2,2,,HNRNPDL,tr|A0A087WU03|A0A087WU03_HUMAN Heterogeneous nuclear ribonucleoprotein D-like OS=Homo sapiens OX=9606 GN=HNRNPDL PE=1 SV=1,2,2,40.4,57
MRPL45,-0.5991287939,0.227156556195962,0,Q9BRJ2;A0A0G2JMS5;A0A087WU62;A0A087X2D5,Q9BRJ2;A0A0G2JMS5;A0A087WU62;A0A087X2D5,2;2;2;2,2;2;2;2,2;2;2;2,"39S ribosomal protein L45, mitochondrial",MRPL45,"sp|Q9BRJ2|RM45_HUMAN 39S ribosomal protein L45, mitochondrial OS=Homo sapiens OX=9606 GN=MRPL45 PE=1 SV=2;tr|A0A0G2JMS5|A0A0G2JMS5_HUMAN 39S ribosomal protein L45, mitochondrial OS=Homo sapiens OX=9606 GN=MRPL45 PE=1 SV=1;tr|A0A087WU62|A0A087WU62_HUMAN 39S",2,2,11.1,306
POLA1,0.4022338096,0.0602425936706478,0,P09884;A0A087WU64;A6NMQ1,P09884;A0A087WU64;A6NMQ1,3;3;3,3;3;3,3;3;3,DNA polymerase alpha catalytic subunit;DNA polymerase,POLA1,sp|P09884|DPOLA_HUMAN DNA polymerase alpha catalytic subunit OS=Homo sapiens OX=9606 GN=POLA1 PE=1 SV=2;tr|A0A087WU64|A0A087WU64_HUMAN DNA polymerase OS=Homo sapiens OX=9606 GN=POLA1 PE=1 SV=1;tr|A6NMQ1|A6NMQ1_HUMAN DNA polymerase OS=Homo sapiens OX=9606 G,3,3,4.4,1462
CTNNBL1,-0.2567995955,0.0497486797631367,0,Q8WYA6;A0A087WUB9;A2A2P1,Q8WYA6;A0A087WUB9,5;5;1,5;5;1,5;5;1,Beta-catenin-like protein 1,CTNNBL1,sp|Q8WYA6|CTBL1_HUMAN Beta-catenin-like protein 1 OS=Homo sapiens OX=9606 GN=CTNNBL1 PE=1 SV=1;tr|A0A087WUB9|A0A087WUB9_HUMAN Beta-catenin-like protein 1 OS=Homo sapiens OX=9606 GN=CTNNBL1 PE=1 SV=1,5,5,13,563
HNRNPDL,-0.1848942635,0.175931101636957,0,O14979;A0A087WUK2,O14979;A0A087WUK2,11;11,9;9,9;9,Heterogeneous nuclear ribonucleoprotein D-like,HNRNPDL,sp|O14979|HNRDL_HUMAN Heterogeneous nuclear ribonucleoprotein D-like OS=Homo sapiens OX=9606 GN=HNRNPDL PE=1 SV=3;tr|A0A087WUK2|A0A087WUK2_HUMAN Heterogeneous nuclear ribonucleoprotein D-like OS=Homo sapiens OX=9606 GN=HNRNPDL PE=1 SV=1,11,9,28.8,420
SLIRP,-0.3437272125,0.0436371410841275,0,Q9GZT3;A0A087WUN7;H0YJ40;G3V4X6;G3V2S9;H0YJW7;H0YJI1;H0YJ07;H0YJU7,Q9GZT3;A0A087WUN7;H0YJ40;G3V4X6;G3V2S9;H0YJW7,6;6;6;6;6;5;1;1;1,6;6;6;6;6;5;1;1;1,6;6;6;6;6;5;1;1;1,"SRA stem-loop-interacting RNA-binding protein, mitochondrial",SLIRP,"sp|Q9GZT3|SLIRP_HUMAN SRA stem-loop-interacting RNA-binding protein, mitochondrial OS=Homo sapiens OX=9606 GN=SLIRP PE=1 SV=1;tr|A0A087WUN7|A0A087WUN7_HUMAN SRA stem-loop-interacting RNA-binding protein, mitochondrial OS=Homo sapiens OX=9606 GN=SLIRP PE=1 ",6,6,67.9,109
EIF5B,-0.0587247648,0.692784976409808,0,O60841;A0A087WUT6,O60841;A0A087WUT6,10;10,10;10,10;10,Eukaryotic translation initiation factor 5B,EIF5B,sp|O60841|IF2P_HUMAN Eukaryotic translation initiation factor 5B OS=Homo sapiens OX=9606 GN=EIF5B PE=1 SV=4;tr|A0A087WUT6|A0A087WUT6_HUMAN Eukaryotic translation initiation factor 5B OS=Homo sapiens OX=9606 GN=EIF5B PE=1 SV=1,10,10,13.4,1220
SPTBN1,-0.3026938602,0.0517934607455334,0,Q01082;A0A087WUZ3;F8W6C1;O15020;A4QPE4,Q01082;A0A087WUZ3,36;36;10;1;1,36;36;10;1;1,35;35;9;0;0,"Spectrin beta chain, non-erythrocytic 1",SPTBN1,"sp|Q01082|SPTB2_HUMAN Spectrin beta chain, non-erythrocytic 1 OS=Homo sapiens OX=9606 GN=SPTBN1 PE=1 SV=2;tr|A0A087WUZ3|A0A087WUZ3_HUMAN Spectrin beta chain OS=Homo sapiens OX=9606 GN=SPTBN1 PE=1 SV=1",36,35,21.4,2364
MTHFD1L,0.0911561066,0.506957725550806,0,Q6UB35;A0A087WVM4;B7ZM99;Q4VXM0;Q4VXM1;Q4VXV2,Q6UB35;A0A087WVM4;B7ZM99,7;7;7;2;1;1,6;6;6;2;1;1,6;6;6;2;1;1,"Monofunctional C1-tetrahydrofolate synthase, mitochondrial",MTHFD1L,"sp|Q6UB35|C1TM_HUMAN Monofunctional C1-tetrahydrofolate synthase, mitochondrial OS=Homo sapiens OX=9606 GN=MTHFD1L PE=1 SV=1;tr|A0A087WVM4|A0A087WVM4_HUMAN Monofunctional C1-tetrahydrofolate synthase, mitochondrial OS=Homo sapiens OX=9606 GN=MTHFD1L PE=1 S",7,6,8.6,978
POLR2E,-0.2122632847,0.231992863917838,0,P19388;A0A087WVZ9;A0A0A0MQR7;K7EQN2;K7EJ87;A0A087WVN5;A0A087WWX0,P19388;A0A087WVZ9;A0A0A0MQR7;K7EQN2;K7EJ87;A0A087WVN5;A0A087WWX0,2;2;2;1;1;1;1,2;2;2;1;1;1;1,2;2;2;1;1;1;1,"DNA-directed RNA polymerases I, II, and III subunit RPABC1",POLR2E,"sp|P19388|RPAB1_HUMAN DNA-directed RNA polymerases I, II, and III subunit RPABC1 OS=Homo sapiens OX=9606 GN=POLR2E PE=1 SV=4;tr|A0A087WVZ9|A0A087WVZ9_HUMAN DNA-directed RNA polymerases I, II, and III subunit RPABC1 OS=Homo sapiens OX=9606 GN=POLR2E PE=1 SV",2,2,12.4,210
NOMO2;NOMO1;NOMO3,-0.5620970366,0.152579842926326,0,Q5JPE7;Q15155;P69849;A0A0G2JP90;A0A087WW46;J3KN36;A0A0G2JN29;A0A087X117,Q5JPE7;Q15155;P69849;A0A0G2JP90;A0A087WW46;J3KN36;A0A0G2JN29;A0A087X117,4;4;4;4;4;4;4;4,4;4;4;4;4;4;4;4,4;4;4;4;4;4;4;4,Nodal modulator 2;Nodal modulator 1;Nodal modulator 3,NOMO2;NOMO1;NOMO3,sp|Q5JPE7|NOMO2_HUMAN Nodal modulator 2 OS=Homo sapiens OX=9606 GN=NOMO2 PE=1 SV=1;sp|Q15155|NOMO1_HUMAN Nodal modulator 1 OS=Homo sapiens OX=9606 GN=NOMO1 PE=1 SV=5;sp|P69849|NOMO3_HUMAN Nodal modulator 3 OS=Homo sapiens OX=9606 GN=NOMO3 PE=1 SV=2;tr|A0A0,4,4,5.8,1267
POLD2,-0.4184268477,0.381051616542918,0,P49005;F8W8R3;A0A087WWF6;C9JHC7;C9IZD2;C9J8Z7;C9JLE1;H7C1B3,P49005;F8W8R3;A0A087WWF6;C9JHC7;C9IZD2;C9J8Z7;C9JLE1,4;4;4;3;2;2;2;1,4;4;4;3;2;2;2;1,4;4;4;3;2;2;2;1,DNA polymerase delta subunit 2,POLD2,sp|P49005|DPOD2_HUMAN DNA polymerase delta subunit 2 OS=Homo sapiens OX=9606 GN=POLD2 PE=1 SV=1;tr|F8W8R3|F8W8R3_HUMAN DNA polymerase delta subunit 2 OS=Homo sapiens OX=9606 GN=POLD2 PE=1 SV=1;tr|A0A087WWF6|A0A087WWF6_HUMAN DNA polymerase delta subunit 2 O,4,4,11.5,469
TPM3,-0.0420722573,0.675339960111879,0,A0A087WWU8;D6R904;A0A494C0G0;Q5VU61,A0A087WWU8;D6R904,29;17;9;8,29;17;9;8,12;12;4;8,,TPM3,tr|A0A087WWU8|A0A087WWU8_HUMAN Tropomyosin alpha-3 chain OS=Homo sapiens OX=9606 GN=TPM3 PE=1 SV=1;tr|D6R904|D6R904_HUMAN Tropomyosin alpha-3 chain OS=Homo sapiens OX=9606 GN=TPM3 PE=1 SV=1,29,12,75.8,227
SRP19,0.207164598,0.795889210061226,0,P09132;A0A087WWU9;A0A087WYR0;D6RBG4;A0A2R8Y4M3;A0A2U3TZN1,P09132;A0A087WWU9;A0A087WYR0;D6RBG4;A0A2R8Y4M3;A0A2U3TZN1,2;2;2;1;1;1,2;2;2;1;1;1,2;2;2;1;1;1,Signal recognition particle 19 kDa protein,SRP19,"sp|P09132|SRP19_HUMAN Signal recognition particle 19 kDa protein OS=Homo sapiens OX=9606 GN=SRP19 PE=1 SV=3;tr|A0A087WWU9|A0A087WWU9_HUMAN HCG2039564, isoform CRA_a OS=Homo sapiens OX=9606 GN=SRP19 PE=1 SV=1;tr|A0A087WYR0|A0A087WYR0_HUMAN Signal recognitio",2,2,27.1,144
TARDBP;TDP43,-0.3081479329,0.0276707723428376,0,Q13148;A0A087WX29;A0A087WYY0;A0A087X260;G3V162;B1AKP7;A0A0A0N0M3;K7EJM5;K7EN94;A0A087WXQ5;A0A087WV68;A0A1W2PNU8;A0A087WXV3;A0A087WX67;A0A087WW61;A0A0A0MSV7;K7EJ99;K7EL26;A0A087WZC9;A0A087WYE7;A0A087WTZ4,Q13148;A0A087WX29;A0A087WYY0;A0A087X260;G3V162;B1AKP7;A0A0A0N0M3;K7EJM5;K7EN94,9;9;7;7;7;7;6;6;5;4;4;4;3;3;3;2;2;1;1;1;1,9;9;7;7;7;7;6;6;5;4;4;4;3;3;3;2;2;1;1;1;1,9;9;7;7;7;7;6;6;5;4;4;4;3;3;3;2;2;1;1;1;1,TAR DNA-binding protein 43,TARDBP;TDP43,sp|Q13148|TADBP_HUMAN TAR DNA-binding protein 43 OS=Homo sapiens OX=9606 GN=TARDBP PE=1 SV=1;tr|A0A087WX29|A0A087WX29_HUMAN TAR DNA-binding protein 43 (Fragment) OS=Homo sapiens OX=9606 GN=TARDBP PE=1 SV=1;tr|A0A087WYY0|A0A087WYY0_HUMAN TAR DNA-binding pro,9,9,24.6,414
RPL17;RPL17-C18orf32,0.2280892648,0.190895987582397,0,P18621;A0A087WXM6;J3QQT2;J3KRX5;A0A0A6YYL6;J3KRB3;A0A087WWH0;J3QS96;J3QLC8;A0A0A0MRF8;A0A087WY81;J3KSJ0,P18621;A0A087WXM6;J3QQT2;J3KRX5;A0A0A6YYL6;J3KRB3;A0A087WWH0;J3QS96;J3QLC8;A0A0A0MRF8;A0A087WY81,13;13;13;13;13;11;11;11;10;10;8;4,13;13;13;13;13;11;11;11;10;10;8;4,13;13;13;13;13;11;11;11;10;10;8;4,60S ribosomal protein L17,RPL17;RPL17-C18orf32,sp|P18621|RL17_HUMAN 60S ribosomal protein L17 OS=Homo sapiens OX=9606 GN=RPL17 PE=1 SV=3;tr|A0A087WXM6|A0A087WXM6_HUMAN 60S ribosomal protein L17 (Fragment) OS=Homo sapiens OX=9606 GN=RPL17 PE=1 SV=1;tr|J3QQT2|J3QQT2_HUMAN 60S ribosomal protein L17 (Fragm,13,13,57.6,184
ITGB6,-0.12149817,0.340131645916479,0,P18564;A0A087WXP3;E9PEE8,P18564;A0A087WXP3;E9PEE8,1;1;1,1;1;1,1;1;1,Integrin beta-6;Integrin beta,ITGB6,sp|P18564|ITB6_HUMAN Integrin beta-6 OS=Homo sapiens OX=9606 GN=ITGB6 PE=1 SV=2;tr|A0A087WXP3|A0A087WXP3_HUMAN Integrin beta OS=Homo sapiens OX=9606 GN=ITGB6 PE=1 SV=1;tr|E9PEE8|E9PEE8_HUMAN Integrin beta OS=Homo sapiens OX=9606 GN=ITGB6 PE=1 SV=1,1,1,1.1,788
VTA1,0.1756891805,0.155969832870634,0,Q9NP79;A0A087WY55;Q5TGM0,Q9NP79;A0A087WY55;Q5TGM0,5;5;3,5;5;3,5;5;3,Vacuolar protein sorting-associated protein VTA1 homolog,VTA1,"sp|Q9NP79|VTA1_HUMAN Vacuolar protein sorting-associated protein VTA1 homolog OS=Homo sapiens OX=9606 GN=VTA1 PE=1 SV=1;tr|A0A087WY55|A0A087WY55_HUMAN Chromosome 6 open reading frame 55, isoform CRA_b OS=Homo sapiens OX=9606 GN=VTA1 PE=1 SV=1;tr|Q5TGM0|Q5T",5,5,20.5,307
AP2M1,-0.1635400567,0.491480182746877,0,Q96CW1;A0A087WY71;E9PFW3;C9JTK4;C9JGT8;C9JJ47,Q96CW1;A0A087WY71;E9PFW3;C9JTK4;C9JGT8;C9JJ47,2;2;2;1;1;1,2;2;2;1;1;1,2;2;2;1;1;1,AP-2 complex subunit mu,AP2M1,sp|Q96CW1|AP2M1_HUMAN AP-2 complex subunit mu OS=Homo sapiens OX=9606 GN=AP2M1 PE=1 SV=2;tr|A0A087WY71|A0A087WY71_HUMAN AP-2 complex subunit mu OS=Homo sapiens OX=9606 GN=AP2M1 PE=1 SV=1;tr|E9PFW3|E9PFW3_HUMAN AP-2 complex subunit mu OS=Homo sapiens OX=960,2,2,6.7,435
UBE2D3;UBE2D2,-0.6460327731,0.0047462071399498,0,P61077;P62837;D6RAW0;D6RFM0;D6RAH7;H9KV45;A0A0A0MQU3;A0A087WY85;D6RA11,P61077;P62837;D6RAW0;D6RFM0;D6RAH7;H9KV45;A0A0A0MQU3;A0A087WY85;D6RA11,2;2;2;2;2;2;2;2;1,2;2;2;2;2;2;2;2;1,1;1;1;1;1;1;1;1;0,Ubiquitin-conjugating enzyme E2 D3;Ubiquitin-conjugating enzyme E2 D2,UBE2D3;UBE2D2,sp|P61077|UB2D3_HUMAN Ubiquitin-conjugating enzyme E2 D3 OS=Homo sapiens OX=9606 GN=UBE2D3 PE=1 SV=1;sp|P62837|UB2D2_HUMAN Ubiquitin-conjugating enzyme E2 D2 OS=Homo sapiens OX=9606 GN=UBE2D2 PE=1 SV=1;tr|D6RAW0|D6RAW0_HUMAN Ubiquitin-conjugating enzyme E2,2,1,19.7,147
POLD1,-0.5003017467,0.0288938831760103,0,P28340;M0QZR8;A0A087WYJ2;M0R2B7;A0A2R8Y705;A0A2R8Y7K6;M0QXE6,P28340;M0QZR8;A0A087WYJ2;M0R2B7;A0A2R8Y705;A0A2R8Y7K6,3;3;3;3;2;2;1,3;3;3;3;2;2;1,3;3;3;3;2;2;1,DNA polymerase delta catalytic subunit;DNA polymerase,POLD1,sp|P28340|DPOD1_HUMAN DNA polymerase delta catalytic subunit OS=Homo sapiens OX=9606 GN=POLD1 PE=1 SV=2;tr|M0QZR8|M0QZR8_HUMAN DNA polymerase OS=Homo sapiens OX=9606 GN=POLD1 PE=1 SV=1;tr|A0A087WYJ2|A0A087WYJ2_HUMAN DNA polymerase OS=Homo sapiens OX=9606 G,3,3,4.1,1107
UGP2,-0.0485283616,0.68590678295119,0,Q16851;A0A087WYS1;E7EUC7;C9JQU9,Q16851;A0A087WYS1;E7EUC7,18;18;18;7,18;18;18;7,6;6;6;0,UTP--glucose-1-phosphate uridylyltransferase,UGP2,sp|Q16851|UGPA_HUMAN UTP--glucose-1-phosphate uridylyltransferase OS=Homo sapiens OX=9606 GN=UGP2 PE=1 SV=5;tr|A0A087WYS1|A0A087WYS1_HUMAN UTP--glucose-1-phosphate uridylyltransferase OS=Homo sapiens OX=9606 GN=UGP2 PE=1 SV=1;tr|E7EUC7|E7EUC7_HUMAN UTP--gl,18,6,39,508
PTGES3,-0.039700297,0.738089082085154,0,Q15185;A0A087WYT3,Q15185;A0A087WYT3,5;5,5;5,5;5,Prostaglandin E synthase 3,PTGES3,sp|Q15185|TEBP_HUMAN Prostaglandin E synthase 3 OS=Homo sapiens OX=9606 GN=PTGES3 PE=1 SV=1;tr|A0A087WYT3|A0A087WYT3_HUMAN Prostaglandin E synthase 3 OS=Homo sapiens OX=9606 GN=PTGES3 PE=1 SV=1,5,5,26.2,160
EIF3H,0.1209241873,0.325387098459035,0,O15372;A0A087WZK9;B3KS98;E5RJT0;E5RGU4,O15372;A0A087WZK9;B3KS98;E5RJT0,7;7;7;5;2,7;7;7;5;2,6;6;6;4;1,Eukaryotic translation initiation factor 3 subunit H,EIF3H,sp|O15372|EIF3H_HUMAN Eukaryotic translation initiation factor 3 subunit H OS=Homo sapiens OX=9606 GN=EIF3H PE=1 SV=1;tr|A0A087WZK9|A0A087WZK9_HUMAN Eukaryotic translation initiation factor 3 subunit H OS=Homo sapiens OX=9606 GN=EIF3H PE=1 SV=1;tr|B3KS98|B,7,6,28.7,352
SBDS,0.3141919684,0.159863360208738,0,Q9Y3A5;A0A087X020;F8WE72,Q9Y3A5;A0A087X020;F8WE72,4;4;2,4;4;2,4;4;2,Ribosome maturation protein SBDS,SBDS,sp|Q9Y3A5|SBDS_HUMAN Ribosome maturation protein SBDS OS=Homo sapiens OX=9606 GN=SBDS PE=1 SV=4;tr|A0A087X020|A0A087X020_HUMAN Ribosome maturation protein SBDS OS=Homo sapiens OX=9606 GN=SBDS PE=1 SV=1;tr|F8WE72|F8WE72_HUMAN Ribosome maturation protein SBD,4,4,18.4,250
HYOU1,-0.0719604539,0.634537523363788,0,Q9Y4L1;A0A087X054;A0A494C039;E9PJ21;A0A087WWI4;K7EQK2;J3KTF1;Q9BST8;J3QQH7;J3QLE9;J3QL06;A0A087WW13;A0A087X214,Q9Y4L1;A0A087X054;A0A494C039;E9PJ21;A0A087WWI4;K7EQK2,14;14;14;12;12;12;4;3;3;3;3;2;1,14;14;14;12;12;12;4;3;3;3;3;2;1,14;14;14;12;12;12;4;3;3;3;3;2;1,Hypoxia up-regulated protein 1,HYOU1,sp|Q9Y4L1|HYOU1_HUMAN Hypoxia up-regulated protein 1 OS=Homo sapiens OX=9606 GN=HYOU1 PE=1 SV=1;tr|A0A087X054|A0A087X054_HUMAN Hypoxia up-regulated protein 1 OS=Homo sapiens OX=9606 GN=HYOU1 PE=1 SV=1;tr|A0A494C039|A0A494C039_HUMAN Hypoxia up-regulated pro,14,14,18.4,999
RYR3,-1.3154166244,0.160062113956127,0,Q15413;A0A087X080;A0A0U1RRH1;A0A0X1KG73;A0A1B0GVS2;A0A0U1RR54;A0A1B0GTF2,Q15413;A0A087X080;A0A0U1RRH1;A0A0X1KG73,6;6;5;5;1;1;1,6;6;5;5;1;1;1,6;6;5;5;1;1;1,Ryanodine receptor 3,RYR3,sp|Q15413|RYR3_HUMAN Ryanodine receptor 3 OS=Homo sapiens OX=9606 GN=RYR3 PE=1 SV=3;tr|A0A087X080|A0A087X080_HUMAN Ryanodine receptor 3 OS=Homo sapiens OX=9606 GN=RYR3 PE=1 SV=1;tr|A0A0U1RRH1|A0A0U1RRH1_HUMAN Ryanodine receptor 3 OS=Homo sapiens OX=9606 GN,6,6,2.9,4870
SNX12,-0.8397262388,0.00622228086760486,0,Q9UMY4;A0A087X0R6,Q9UMY4;A0A087X0R6,6;6,6;6,5;5,Sorting nexin-12,SNX12,sp|Q9UMY4|SNX12_HUMAN Sorting nexin-12 OS=Homo sapiens OX=9606 GN=SNX12 PE=1 SV=4;tr|A0A087X0R6|A0A087X0R6_HUMAN Sorting nexin-12 OS=Homo sapiens OX=9606 GN=SNX12 PE=1 SV=1,6,5,40.1,162
ACOT2;ACOT1,-0.8954374197,0.0103770710136894,0,A0A087X0W7;P49753;Q86TX2;A0A087WT95;G3V4F2;A0A2R8Y7H3,A0A087X0W7;P49753;Q86TX2;A0A087WT95;G3V4F2,12;11;11;11;10;2,12;11;11;11;10;2,12;11;11;11;10;2,"Acyl-coenzyme A thioesterase 2, mitochondrial;Acyl-coenzyme A thioesterase 1",ACOT2;ACOT1,"tr|A0A087X0W7|A0A087X0W7_HUMAN Acyl-coenzyme A thioesterase 2, mitochondrial OS=Homo sapiens OX=9606 GN=ACOT2 PE=1 SV=1;sp|P49753|ACOT2_HUMAN Acyl-coenzyme A thioesterase 2, mitochondrial OS=Homo sapiens OX=9606 GN=ACOT2 PE=1 SV=6;sp|Q86TX2|ACOT1_HUMAN Acy",12,12,45.4,421
RELA,-0.6580437271,0.0159398601049785,0,Q04206;Q2TAM5;A0A087X0W8;E9PKV4;A0A087WVP0;E9PKH5;E9PMD5;E9PI38;E9PQS6;E9PNV4;E9PM47;E9PNK5;E9PJR1;E9PRX2;E9PN69,Q04206;Q2TAM5;A0A087X0W8;E9PKV4;A0A087WVP0;E9PKH5;E9PMD5;E9PI38;E9PQS6,5;5;5;4;4;4;3;3;3;2;1;1;1;1;1,5;5;5;4;4;4;3;3;3;2;1;1;1;1;1,5;5;5;4;4;4;3;3;3;2;1;1;1;1;1,Transcription factor p65,RELA,sp|Q04206|TF65_HUMAN Transcription factor p65 OS=Homo sapiens OX=9606 GN=RELA PE=1 SV=2;tr|Q2TAM5|Q2TAM5_HUMAN RELA protein OS=Homo sapiens OX=9606 GN=RELA PE=1 SV=1;tr|A0A087X0W8|A0A087X0W8_HUMAN Transcription factor p65 OS=Homo sapiens OX=9606 GN=RELA PE,5,5,16.2,551
SEPT8,-0.2712505322,0.186179455041465,0,Q92599;A0A087X142;A6NMH6;A6NFQ9;F8W8I8;C9JV02;A0A0A0MRP8;C9J4G8,Q92599;A0A087X142;A6NMH6;A6NFQ9;F8W8I8,8;8;8;8;8;2;1;1,6;6;6;6;6;1;1;1,6;6;6;6;6;1;1;1,Septin-8,SEPT8,sp|Q92599|SEPT8_HUMAN Septin-8 OS=Homo sapiens OX=9606 GN=SEPTIN8 PE=1 SV=4;tr|A0A087X142|A0A087X142_HUMAN Septin-8 OS=Homo sapiens OX=9606 GN=SEPTIN8 PE=1 SV=1;tr|A6NMH6|A6NMH6_HUMAN Septin-8 OS=Homo sapiens OX=9606 GN=SEPTIN8 PE=1 SV=1;tr|A6NFQ9|A6NFQ9_H,8,6,28.4,483
STAU1,0.2711829853,0.359757992078041,0,O95793;A0A087X1A5;Q5JW30;Q5JW28,O95793;A0A087X1A5;Q5JW30,6;6;5;1,6;6;5;1,6;6;5;1,Double-stranded RNA-binding protein Staufen homolog 1,STAU1,sp|O95793|STAU1_HUMAN Double-stranded RNA-binding protein Staufen homolog 1 OS=Homo sapiens OX=9606 GN=STAU1 PE=1 SV=2;tr|A0A087X1A5|A0A087X1A5_HUMAN Double-stranded RNA-binding protein Staufen homolog 1 OS=Homo sapiens OX=9606 GN=STAU1 PE=1 SV=1;tr|Q5JW30,6,6,16.1,577
TMSB15A;TMSB15B,0.009677284,0.951260466969718,0,P0CG34;P0CG35;H3BU88;A0A087X1C1,P0CG34;P0CG35;H3BU88;A0A087X1C1,1;1;1;1,1;1;1;1,1;1;1;1,Thymosin beta-15A;Thymosin beta-15B,TMSB15A;TMSB15B,sp|P0CG34|TB15A_HUMAN Thymosin beta-15A OS=Homo sapiens OX=9606 GN=TMSB15A PE=1 SV=1;sp|P0CG35|TB15B_HUMAN Thymosin beta-15B OS=Homo sapiens OX=9606 GN=TMSB15B PE=1 SV=1;tr|H3BU88|H3BU88_HUMAN Thymosin beta-15B OS=Homo sapiens OX=9606 GN=TMSB15B PE=4 SV=1;,1,1,31.1,45
PSME2,-0.2628939846,0.0846073616021344,0,Q9UL46;A0A087X1Z3;H0YM70;H0YKU2,Q9UL46;A0A087X1Z3;H0YM70,10;10;8;2,10;10;8;2,10;10;8;2,Proteasome activator complex subunit 2,PSME2,sp|Q9UL46|PSME2_HUMAN Proteasome activator complex subunit 2 OS=Homo sapiens OX=9606 GN=PSME2 PE=1 SV=4;tr|A0A087X1Z3|A0A087X1Z3_HUMAN Proteasome activator complex subunit 2 OS=Homo sapiens OX=9606 GN=PSME2 PE=1 SV=1;tr|H0YM70|H0YM70_HUMAN Proteasome activ,10,10,51.9,239
BSG,-0.2449997603,0.134238789688677,0,P35613;A0A087X2B5;A0A087WUV8;I3L192;R4GMX5;R4GN83;A0A2R8YDZ0,P35613;A0A087X2B5;A0A087WUV8;I3L192;R4GMX5,6;6;5;4;3;2;1,6;6;5;4;3;2;1,6;6;5;4;3;2;1,Basigin,BSG,sp|P35613|BASI_HUMAN Basigin OS=Homo sapiens OX=9606 GN=BSG PE=1 SV=2;tr|A0A087X2B5|A0A087X2B5_HUMAN Basigin (Fragment) OS=Homo sapiens OX=9606 GN=BSG PE=1 SV=1;tr|A0A087WUV8|A0A087WUV8_HUMAN Basigin OS=Homo sapiens OX=9606 GN=BSG PE=1 SV=1;tr|I3L192|I3L19,6,6,21,385
SRSF3,-0.0315717912,0.789077395460371,0,P84103;A0A087X2D0,P84103;A0A087X2D0,5;5,5;5,5;5,Serine/arginine-rich splicing factor 3,SRSF3,sp|P84103|SRSF3_HUMAN Serine/arginine-rich splicing factor 3 OS=Homo sapiens OX=9606 GN=SRSF3 PE=1 SV=1;tr|A0A087X2D0|A0A087X2D0_HUMAN Serine/arginine-rich-splicing factor 3 OS=Homo sapiens OX=9606 GN=SRSF3 PE=1 SV=1,5,5,38.4,164
GPS1,-0.4393200999,0.0730319500659869,0,Q13098;C9JFE4;A0A096LP07;A0A096LPJ3;A8K070;J3QS84;J3QS88;J3KTB0;J3QLE8;J3QLT0;J3QL53;J3KRE8;J3KSA5;J3KRJ4;J3QQX0,Q13098;C9JFE4;A0A096LP07;A0A096LPJ3;A8K070;J3QS84;J3QS88;J3KTB0;J3QLE8;J3QLT0;J3QL53;J3KRE8;J3KSA5;J3KRJ4,4;4;4;4;4;3;3;3;3;3;3;3;3;3;1,4;4;4;4;4;3;3;3;3;3;3;3;3;3;1,4;4;4;4;4;3;3;3;3;3;3;3;3;3;1,COP9 signalosome complex subunit 1,GPS1,sp|Q13098|CSN1_HUMAN COP9 signalosome complex subunit 1 OS=Homo sapiens OX=9606 GN=GPS1 PE=1 SV=4;tr|C9JFE4|C9JFE4_HUMAN COP9 signalosome complex subunit 1 OS=Homo sapiens OX=9606 GN=GPS1 PE=1 SV=2;tr|A0A096LP07|A0A096LP07_HUMAN COP9 signalosome complex su,4,4,8.4,491
PYCRL,-0.2962663722,0.0847923003335239,0,Q53H96;A0A0A0MQS1;F8WEI0;B5MD87,Q53H96;A0A0A0MQS1;F8WEI0;B5MD87,2;2;1;1,2;2;1;1,2;2;1;1,Pyrroline-5-carboxylate reductase 3;Pyrroline-5-carboxylate reductase,PYCRL,sp|Q53H96|P5CR3_HUMAN Pyrroline-5-carboxylate reductase 3 OS=Homo sapiens OX=9606 GN=PYCR3 PE=1 SV=3;tr|A0A0A0MQS1|A0A0A0MQS1_HUMAN Pyrroline-5-carboxylate reductase OS=Homo sapiens OX=9606 GN=PYCR3 PE=1 SV=1;tr|F8WEI0|F8WEI0_HUMAN Pyrroline-5-carboxylate ,2,2,8.8,274
WDR18,-0.3030182338,0.603846062538697,0,Q9BV38;U3KQC1;A0A0A0MQU0;K7EIR0;A0A087X237;K7EKX5;K7EML4,Q9BV38;U3KQC1;A0A0A0MQU0;K7EIR0,3;3;3;2;1;1;1,3;3;3;2;1;1;1,3;3;3;2;1;1;1,WD repeat-containing protein 18,WDR18,sp|Q9BV38|WDR18_HUMAN WD repeat-containing protein 18 OS=Homo sapiens OX=9606 GN=WDR18 PE=1 SV=2;tr|U3KQC1|U3KQC1_HUMAN WD repeat-containing protein 18 (Fragment) OS=Homo sapiens OX=9606 GN=WDR18 PE=1 SV=1;tr|A0A0A0MQU0|A0A0A0MQU0_HUMAN WD repeat-containin,3,3,8.1,432
VDAC2,0.2247279309,0.0804845958636961,0,P45880;A0A0A0MR02;Q5JSD2;Q5JSD1;A2A3S1,P45880;A0A0A0MR02;Q5JSD2;Q5JSD1,14;14;10;10;6,14;14;10;10;6,14;14;10;10;6,Voltage-dependent anion-selective channel protein 2,VDAC2,sp|P45880|VDAC2_HUMAN Voltage-dependent anion-selective channel protein 2 OS=Homo sapiens OX=9606 GN=VDAC2 PE=1 SV=2;tr|A0A0A0MR02|A0A0A0MR02_HUMAN Voltage-dependent anion-selective channel protein 2 (Fragment) OS=Homo sapiens OX=9606 GN=VDAC2 PE=1 SV=1;tr,14,14,47.3,294
GSTZ1,0.0439957357,0.923619366826055,0,O43708;A0A0A0MR33;G3V267;G3V5T0;A0A0C4DFM0;G3V3B9;G3V4T6,O43708;A0A0A0MR33;G3V267;G3V5T0;A0A0C4DFM0;G3V3B9;G3V4T6,4;4;4;4;4;3;3,4;4;4;4;4;3;3,4;4;4;4;4;3;3,Maleylacetoacetate isomerase,GSTZ1,sp|O43708|MAAI_HUMAN Maleylacetoacetate isomerase OS=Homo sapiens OX=9606 GN=GSTZ1 PE=1 SV=3;tr|A0A0A0MR33|A0A0A0MR33_HUMAN Maleylacetoacetate isomerase OS=Homo sapiens OX=9606 GN=GSTZ1 PE=1 SV=1;tr|G3V267|G3V267_HUMAN Maleylacetoacetate isomerase OS=Homo ,4,4,25,216
