PRKAR2A,0.1133168478,0.660257028113164,0,P13861;H7C1L0;H7C330;P31323;H7C4A9;C9J830,P13861;H7C1L0,13;8;4;3;1;1,13;8;4;3;1;1,13;8;4;3;1;1,cAMP-dependent protein kinase type II-alpha regulatory subunit,PRKAR2A,sp|P13861|KAP2_HUMAN cAMP-dependent protein kinase type II-alpha regulatory subunit OS=Homo sapiens OX=9606 GN=PRKAR2A PE=1 SV=2;tr|H7C1L0|H7C1L0_HUMAN cAMP-dependent protein kinase type II-alpha regulatory subunit (Fragment) OS=Homo sapiens OX=9606 GN=PRK,13,13,40.3,404
MTHFD2,0.1446021997,0.35966238001173,0,P13995;B8ZZU9;B9A062,P13995;B8ZZU9;B9A062,10;7;5,10;7;5,10;7;5,"Bifunctional methylenetetrahydrofolate dehydrogenase/cyclohydrolase, mitochondrial;NAD-dependent methylenetetrahydrofolate dehydrogenase;Methenyltetrahydrofolate cyclohydrolase",MTHFD2,"sp|P13995|MTDC_HUMAN Bifunctional methylenetetrahydrofolate dehydrogenase/cyclohydrolase, mitochondrial OS=Homo sapiens OX=9606 GN=MTHFD2 PE=1 SV=2;tr|B8ZZU9|B8ZZU9_HUMAN Bifunctional methylenetetrahydrofolate dehydrogenase/cyclohydrolase, mitochondrial OS",10,10,45.4,350
MIF,-0.545687081,0.00472171210067645,0,P14174,P14174,6,6,6,Macrophage migration inhibitory factor,MIF,sp|P14174|MIF_HUMAN Macrophage migration inhibitory factor OS=Homo sapiens OX=9606 GN=MIF PE=1 SV=4,6,6,45.2,115
FDPS,0.1543947729,0.396896811796957,0,P14324;A0A087X090;A0A087X1D8;A0A087WVN4;A0A087WTP2,P14324;A0A087X090,7;4;3;3;1,7;4;3;3;1,7;4;3;3;1,Farnesyl pyrophosphate synthase,FDPS,"sp|P14324|FPPS_HUMAN Farnesyl pyrophosphate synthase OS=Homo sapiens OX=9606 GN=FDPS PE=1 SV=4;tr|A0A087X090|A0A087X090_HUMAN Farnesyl diphosphate synthase (Farnesyl pyrophosphate synthetase, dimethylallyltranstransferase, geranyltranstransferase), isoform",7,7,16.7,419
AKR1A1,-0.4948500453,0.0483729706466309,0,P14550;Q5T621;V9GYG2;V9GYP9,P14550,18;8;6;6,18;8;6;6,18;8;6;6,Alcohol dehydrogenase [NADP(+)],AKR1A1,sp|P14550|AK1A1_HUMAN Aldo-keto reductase family 1 member A1 OS=Homo sapiens OX=9606 GN=AKR1A1 PE=1 SV=3,18,18,64,325
PKM,-0.1748314313,0.15551928318573,0,P14618;B4DNK4,P14618;B4DNK4,54;45,54;45,5;5,Pyruvate kinase PKM;Pyruvate kinase,PKM,sp|P14618|KPYM_HUMAN Pyruvate kinase PKM OS=Homo sapiens OX=9606 GN=PKM PE=1 SV=4;tr|B4DNK4|B4DNK4_HUMAN Pyruvate kinase OS=Homo sapiens OX=9606 GN=PKM PE=1 SV=1,54,5,86.8,531
HSP90B1,0.0991839673,0.352552560620225,0,P14625;Q96GW1;A0A1W2PRR1;H0YIV0;Q58FF3;F8W026,P14625,41;12;12;9;5;4,39;10;10;9;5;2,39;10;10;9;5;2,Endoplasmin,HSP90B1,sp|P14625|ENPL_HUMAN Endoplasmin OS=Homo sapiens OX=9606 GN=HSP90B1 PE=1 SV=1,41,39,49.7,803
CCNB1,0.4740571514,0.0809519239197057,0,P14635;E9PC90;D6RHI0,P14635;E9PC90,3;2;1,3;2;1,3;2;1,G2/mitotic-specific cyclin-B1,CCNB1,sp|P14635|CCNB1_HUMAN G2/mitotic-specific cyclin-B1 OS=Homo sapiens OX=9606 GN=CCNB1 PE=1 SV=1;tr|E9PC90|E9PC90_HUMAN G2/mitotic-specific cyclin-B1 (Fragment) OS=Homo sapiens OX=9606 GN=CCNB1 PE=1 SV=1,3,3,8.1,433
COX6B1,0.0930581489,0.429290759745547,0,P14854;A0A494C160;K7EQD3,P14854;A0A494C160,5;3;1,5;3;1,5;3;1,Cytochrome c oxidase subunit 6B1,COX6B1,sp|P14854|CX6B1_HUMAN Cytochrome c oxidase subunit 6B1 OS=Homo sapiens OX=9606 GN=COX6B1 PE=1 SV=2;tr|A0A494C160|A0A494C160_HUMAN Cytochrome c oxidase subunit 6B1 (Fragment) OS=Homo sapiens OX=9606 GN=COX6B1 PE=1 SV=1,5,5,89.5,86
HNRNPL,-0.3147050579,0.0414613160532434,0,P14866;M0QXS5;A0A3B3ITJ4;B4DVF8;M0R1W6,P14866;M0QXS5;A0A3B3ITJ4,19;18;18;2;2,19;18;18;2;2,7;6;6;2;2,Heterogeneous nuclear ribonucleoprotein L,HNRNPL,sp|P14866|HNRPL_HUMAN Heterogeneous nuclear ribonucleoprotein L OS=Homo sapiens OX=9606 GN=HNRNPL PE=1 SV=2;tr|M0QXS5|M0QXS5_HUMAN Heterogeneous nuclear ribonucleoprotein L (Fragment) OS=Homo sapiens OX=9606 GN=HNRNPL PE=1 SV=1;tr|A0A3B3ITJ4|A0A3B3ITJ4_HUM,19,7,40.4,589
DARS,-0.3019971391,0.0507850133065036,0,P14868;H7BZ35;C9J7S3;C9JLC1;H7C278;C9JQM9,P14868,27;11;9;9;6;5,27;11;9;9;6;5,27;11;9;9;6;5,"Aspartate--tRNA ligase, cytoplasmic",DARS,"sp|P14868|SYDC_HUMAN Aspartate--tRNA ligase, cytoplasmic OS=Homo sapiens OX=9606 GN=DARS1 PE=1 SV=2",27,27,65.1,501
UQCRB,0.0163231089,0.930116434687613,0,P14927;B7Z2R2;E5RHG9,P14927;B7Z2R2,6;4;2,6;4;2,6;4;2,Cytochrome b-c1 complex subunit 7,UQCRB,sp|P14927|QCR7_HUMAN Cytochrome b-c1 complex subunit 7 OS=Homo sapiens OX=9606 GN=UQCRB PE=1 SV=2;tr|B7Z2R2|B7Z2R2_HUMAN Cytochrome b-c1 complex subunit 7 OS=Homo sapiens OX=9606 GN=UQCRB PE=1 SV=1,6,6,58.6,111
AKR1B1,-0.0621679839,0.533658199629584,0,P15121;E9PCX2;E9PEF9,P15121;E9PCX2,17;12;6,17;12;6,16;12;6,Aldose reductase,AKR1B1,sp|P15121|ALDR_HUMAN Aldo-keto reductase family 1 member B1 OS=Homo sapiens OX=9606 GN=AKR1B1 PE=1 SV=3;tr|E9PCX2|E9PCX2_HUMAN Aldo-keto reductase family 1 member B1 OS=Homo sapiens OX=9606 GN=AKR1B1 PE=1 SV=1,17,16,69.9,316
GSPT1;GSPT2,-0.1665817482,0.245739210019605,0,P15170;H3BR35;Q8IYD1;H3BSV8,P15170;H3BR35;Q8IYD1,12;11;8;3,12;11;8;3,12;11;8;3,Eukaryotic peptide chain release factor GTP-binding subunit ERF3A;Eukaryotic peptide chain release factor GTP-binding subunit ERF3B,GSPT1;GSPT2,sp|P15170|ERF3A_HUMAN Eukaryotic peptide chain release factor GTP-binding subunit ERF3A OS=Homo sapiens OX=9606 GN=GSPT1 PE=1 SV=1;tr|H3BR35|H3BR35_HUMAN Eukaryotic peptide chain release factor GTP-binding subunit ERF3A (Fragment) OS=Homo sapiens OX=9606 G,12,12,27.1,499
EZR,0.2799256895,0.0943012394538873,0,P15311;E7EQR4,P15311;E7EQR4,38;37,31;30,28;28,Ezrin,EZR,sp|P15311|EZRI_HUMAN Ezrin OS=Homo sapiens OX=9606 GN=EZR PE=1 SV=4;tr|E7EQR4|E7EQR4_HUMAN Ezrin OS=Homo sapiens OX=9606 GN=EZR PE=1 SV=3,38,28,62.1,586
RPS2,0.4289714588,0.0102045536754181,0,P15880;H0YEN5;E9PQD7;E9PMM9;E9PPT0;I3L404;E9PM36;H3BNG3;H0YE27,P15880;H0YEN5;E9PQD7,18;15;14;8;7;6;6;1;1,18;15;14;8;7;6;6;1;1,18;15;14;8;7;6;6;1;1,40S ribosomal protein S2,RPS2,sp|P15880|RS2_HUMAN 40S ribosomal protein S2 OS=Homo sapiens OX=9606 GN=RPS2 PE=1 SV=2;tr|H0YEN5|H0YEN5_HUMAN 40S ribosomal protein S2 (Fragment) OS=Homo sapiens OX=9606 GN=RPS2 PE=1 SV=1;tr|E9PQD7|E9PQD7_HUMAN 40S ribosomal protein S2 OS=Homo sapiens OX=9,18,18,52.6,293
RPA2,-0.2466475214,0.293445783564194,0,P15927;Q5TEJ7;Q5TEJ0,P15927;Q5TEJ7,4;3;1,4;3;1,4;3;1,Replication protein A 32 kDa subunit,RPA2,sp|P15927|RFA2_HUMAN Replication protein A 32 kDa subunit OS=Homo sapiens OX=9606 GN=RPA2 PE=1 SV=1;tr|Q5TEJ7|Q5TEJ7_HUMAN Replication protein A 32 kDa subunit (Fragment) OS=Homo sapiens OX=9606 GN=RPA2 PE=1 SV=1,4,4,32.2,270
CBR1,-0.100686345,0.460693885908235,0,P16152;E9PQ63;A8MTM1,P16152;E9PQ63;A8MTM1,13;8;8,13;8;8,11;6;6,Carbonyl reductase [NADPH] 1,CBR1,sp|P16152|CBR1_HUMAN Carbonyl reductase [NADPH] 1 OS=Homo sapiens OX=9606 GN=CBR1 PE=1 SV=3;tr|E9PQ63|E9PQ63_HUMAN Carbonyl reductase [NADPH] 1 OS=Homo sapiens OX=9606 GN=CBR1 PE=1 SV=1;tr|A8MTM1|A8MTM1_HUMAN Carbonyl reductase [NADPH] 1 OS=Homo sapiens OX,13,11,56.3,277
HIST1H1C,-0.8133809815,0.00532077990405551,0,P16403,P16403,17,3,3,Histone H1.2,HIST1H1C,sp|P16403|H12_HUMAN Histone H1.2 OS=Homo sapiens OX=9606 GN=H1-2 PE=1 SV=2,17,3,46,213
FAH,0.1900896129,0.413647793863548,0,P16930;H0YLC7,P16930;H0YLC7,4;3,4;3,4;3,Fumarylacetoacetase,FAH,sp|P16930|FAAA_HUMAN Fumarylacetoacetase OS=Homo sapiens OX=9606 GN=FAH PE=1 SV=2;tr|H0YLC7|H0YLC7_HUMAN Fumarylacetoacetase (Fragment) OS=Homo sapiens OX=9606 GN=FAH PE=1 SV=1,4,4,17.9,419
STMN1,0.0050764506,0.979913705133582,0,P16949;A2A2D0,P16949;A2A2D0,11;10,11;10,7;6,Stathmin,STMN1,sp|P16949|STMN1_HUMAN Stathmin OS=Homo sapiens OX=9606 GN=STMN1 PE=1 SV=3;tr|A2A2D0|A2A2D0_HUMAN Stathmin (Fragment) OS=Homo sapiens OX=9606 GN=STMN1 PE=1 SV=8,11,7,52.3,149
HSPA6;HSPA7,0.50931038,0.00737156997471425,0,P17066;P48741,P17066;P48741,12;8,3;3,3;3,Heat shock 70 kDa protein 6;Putative heat shock 70 kDa protein 7,HSPA6;HSPA7,sp|P17066|HSP76_HUMAN Heat shock 70 kDa protein 6 OS=Homo sapiens OX=9606 GN=HSPA6 PE=1 SV=2;sp|P48741|HSP77_HUMAN Putative heat shock 70 kDa protein 7 OS=Homo sapiens OX=9606 GN=HSPA7 PE=5 SV=2,12,3,18.5,643
HMGA1,-0.2145631586,0.261219890349525,0,P17096,P17096,2,2,2,High mobility group protein HMG-I/HMG-Y,HMGA1,sp|P17096|HMGA1_HUMAN High mobility group protein HMG-I/HMG-Y OS=Homo sapiens OX=9606 GN=HMGA1 PE=1 SV=3,2,2,41.1,107
GOT1,-0.0779033087,0.49315009986725,0,P17174,P17174,28,28,28,"Aspartate aminotransferase, cytoplasmic",GOT1,"sp|P17174|AATC_HUMAN Aspartate aminotransferase, cytoplasmic OS=Homo sapiens OX=9606 GN=GOT1 PE=1 SV=3",28,28,73.1,413
CAPN2,0.0261221873,0.89281133267601,0,P17655,P17655,15,15,15,Calpain-2 catalytic subunit,CAPN2,sp|P17655|CAN2_HUMAN Calpain-2 catalytic subunit OS=Homo sapiens OX=9606 GN=CAPN2 PE=1 SV=6,15,15,26,700
PFKL,-0.4410724208,0.0161502231225459,0,P17858;F8WEU2,P17858,14;1,14;1,11;1,"ATP-dependent 6-phosphofructokinase, liver type",PFKL,"sp|P17858|PFKAL_HUMAN ATP-dependent 6-phosphofructokinase, liver type OS=Homo sapiens OX=9606 GN=PFKL PE=1 SV=6",14,11,25.1,780
TCP1,0.2414692798,0.0602072494922953,0,P17987;E7EQR6;E7ERF2;F5H282;F5GZ03;F5H136;F5GZI8;F5H676;F5GYL4;F5H726;F5H7Y1,P17987;E7EQR6;E7ERF2;F5H282,37;26;26;23;14;8;6;6;4;3;2,37;26;26;23;14;8;6;6;4;3;2,37;26;26;23;14;8;6;6;4;3;2,T-complex protein 1 subunit alpha,TCP1,sp|P17987|TCPA_HUMAN T-complex protein 1 subunit alpha OS=Homo sapiens OX=9606 GN=TCP1 PE=1 SV=1;tr|E7EQR6|E7EQR6_HUMAN T-complex protein 1 subunit alpha OS=Homo sapiens OX=9606 GN=TCP1 PE=1 SV=1;tr|E7ERF2|E7ERF2_HUMAN T-complex protein 1 subunit alpha OS=,37,37,62.6,556
PTPN1,0.0199104455,0.893883218831772,0,P18031;B4DSN5,P18031;B4DSN5,4;3,4;3,4;3,Tyrosine-protein phosphatase non-receptor type 1;Tyrosine-protein phosphatase non-receptor type,PTPN1,sp|P18031|PTN1_HUMAN Tyrosine-protein phosphatase non-receptor type 1 OS=Homo sapiens OX=9606 GN=PTPN1 PE=1 SV=1;tr|B4DSN5|B4DSN5_HUMAN Tyrosine-protein phosphatase non-receptor type OS=Homo sapiens OX=9606 GN=PTPN1 PE=1 SV=1,4,4,13.3,435
RPL35A,0.0976780104,0.419057707250726,0,P18077;F8WBS5;F8WB72;C9K025,P18077;F8WBS5;F8WB72;C9K025,6;4;4;4,6;4;4;4,6;4;4;4,60S ribosomal protein L35a,RPL35A,sp|P18077|RL35A_HUMAN 60S ribosomal protein L35a OS=Homo sapiens OX=9606 GN=RPL35A PE=1 SV=2;tr|F8WBS5|F8WBS5_HUMAN 60S ribosomal protein L35a OS=Homo sapiens OX=9606 GN=RPL35A PE=1 SV=1;tr|F8WB72|F8WB72_HUMAN 60S ribosomal protein L35a OS=Homo sapiens OX=,6,6,31.8,110
RPL7,0.3565521928,0.0262699778607339,0,P18124;A8MUD9;C9JIJ5;C9JZ88,P18124;A8MUD9,23;20;8;6,23;20;8;6,23;20;8;6,60S ribosomal protein L7,RPL7,sp|P18124|RL7_HUMAN 60S ribosomal protein L7 OS=Homo sapiens OX=9606 GN=RPL7 PE=1 SV=1;tr|A8MUD9|A8MUD9_HUMAN 60S ribosomal protein L7 OS=Homo sapiens OX=9606 GN=RPL7 PE=1 SV=1,23,23,66.1,248
VCL,0.6285139867,0.11628174426215,0,P18206;A0A096LPE1,P18206,31;2,31;2,31;2,Vinculin,VCL,sp|P18206|VINC_HUMAN Vinculin OS=Homo sapiens OX=9606 GN=VCL PE=1 SV=4,31,31,34.9,1134
SON,-0.1777962151,0.206752312939478,0,P18583;H7C1M2;J3QSZ5,P18583;H7C1M2,3;2;1,3;2;1,3;2;1,Protein SON,SON,sp|P18583|SON_HUMAN Protein SON OS=Homo sapiens OX=9606 GN=SON PE=1 SV=4;tr|H7C1M2|H7C1M2_HUMAN Protein SON (Fragment) OS=Homo sapiens OX=9606 GN=SON PE=1 SV=1,3,3,2.6,2426
PGAM1;PGAM4,0.0393970155,0.720250375780914,0,P18669;Q8N0Y7;P15259,P18669;Q8N0Y7,25;14;6,25;14;6,25;14;6,Phosphoglycerate mutase 1;Probable phosphoglycerate mutase 4,PGAM1;PGAM4,sp|P18669|PGAM1_HUMAN Phosphoglycerate mutase 1 OS=Homo sapiens OX=9606 GN=PGAM1 PE=1 SV=2;sp|Q8N0Y7|PGAM4_HUMAN Probable phosphoglycerate mutase 4 OS=Homo sapiens OX=9606 GN=PGAM4 PE=3 SV=1,25,25,81.1,254
RCC1,0.249469002,0.0719164824452537,0,P18754;C9JW69;C9JRH2;C9J3R0;C9JMJ4;C9JQZ4,P18754;C9JW69;C9JRH2;C9J3R0;C9JMJ4;C9JQZ4,6;5;4;4;4;4,6;5;4;4;4;4,6;5;4;4;4;4,Regulator of chromosome condensation,RCC1,sp|P18754|RCC1_HUMAN Regulator of chromosome condensation OS=Homo sapiens OX=9606 GN=RCC1 PE=1 SV=1;tr|C9JW69|C9JW69_HUMAN Regulator of chromosome condensation (Fragment) OS=Homo sapiens OX=9606 GN=RCC1 PE=1 SV=1;tr|C9JRH2|C9JRH2_HUMAN Regulator of chromos,6,6,19.7,421
NCL,0.1779291111,0.239417662670879,0,P19338;H7BY16;C9JYW2;C9JLB1;C9J1H7;C9JWL1,P19338;H7BY16,36;21;1;1;1;1,36;21;1;1;1;1,36;21;1;1;1;1,Nucleolin,NCL,sp|P19338|NUCL_HUMAN Nucleolin OS=Homo sapiens OX=9606 GN=NCL PE=1 SV=3;tr|H7BY16|H7BY16_HUMAN Nucleolin (Fragment) OS=Homo sapiens OX=9606 GN=NCL PE=1 SV=8,36,36,44.9,710
HK1,-0.2287298775,0.158861401065257,0,P19367;B1AR62;Q2TB90;P52790,P19367,33;4;2;2,33;4;2;2,29;3;1;0,Hexokinase-1,HK1,sp|P19367|HXK1_HUMAN Hexokinase-1 OS=Homo sapiens OX=9606 GN=HK1 PE=1 SV=3,33,29,37.5,917
EIF2AK2,-0.4773509638,0.043418338132642,0,P19525;C9JZT2;F8WBH4,P19525,5;2;1,5;2;1,5;2;1,"Interferon-induced, double-stranded RNA-activated protein kinase",EIF2AK2,"sp|P19525|E2AK2_HUMAN Interferon-induced, double-stranded RNA-activated protein kinase OS=Homo sapiens OX=9606 GN=EIF2AK2 PE=1 SV=2",5,5,13.1,551
SRM,-0.5503425616,0.00754230875035831,0,P19623;K7EKM4;K7EQ47;K7EL89;K7ESL0,P19623,10;3;3;2;2,10;3;3;2;2,10;3;3;2;2,Spermidine synthase,SRM,sp|P19623|SPEE_HUMAN Spermidine synthase OS=Homo sapiens OX=9606 GN=SRM PE=1 SV=1,10,10,32.1,302
CSNK2A2,0.041598894,0.686289000231073,0,P19784;H3BSA1;H3BNI9;H3BV19,P19784;H3BSA1,9;5;4;3,9;5;4;3,9;5;4;3,Casein kinase II subunit alpha,CSNK2A2,sp|P19784|CSK22_HUMAN Casein kinase II subunit alpha OS=Homo sapiens OX=9606 GN=CSNK2A2 PE=1 SV=1;tr|H3BSA1|H3BSA1_HUMAN Casein kinase II subunit alpha (Fragment) OS=Homo sapiens OX=9606 GN=CSNK2A2 PE=1 SV=2,9,9,36.6,350
EIF2S2,0.3092242317,0.16088755631255,0,P20042,P20042,6,6,6,Eukaryotic translation initiation factor 2 subunit 2,EIF2S2,sp|P20042|IF2B_HUMAN Eukaryotic translation initiation factor 2 subunit 2 OS=Homo sapiens OX=9606 GN=EIF2S2 PE=1 SV=2,6,6,21,333
ANXA7,0.0044093679,0.977582830654922,0,P20073,P20073,15,15,15,Annexin A7,ANXA7,sp|P20073|ANXA7_HUMAN Annexin A7 OS=Homo sapiens OX=9606 GN=ANXA7 PE=1 SV=3,15,15,39.5,488
BTF3,0.044900923,0.64817020293269,0,P20290;H0Y9Y1;D6RDG3,P20290;H0Y9Y1;D6RDG3,5;3;3,5;3;3,5;3;3,Transcription factor BTF3,BTF3,sp|P20290|BTF3_HUMAN Transcription factor BTF3 OS=Homo sapiens OX=9606 GN=BTF3 PE=1 SV=1;tr|H0Y9Y1|H0Y9Y1_HUMAN Transcription factor BTF3 (Fragment) OS=Homo sapiens OX=9606 GN=BTF3 PE=1 SV=2;tr|D6RDG3|D6RDG3_HUMAN Transcription factor BTF3 (Fragment) OS=Ho,5,5,44.2,206
PSMB1,0.1363057808,0.207081266935423,0,P20618,P20618,7,7,7,Proteasome subunit beta type-1,PSMB1,sp|P20618|PSB1_HUMAN Proteasome subunit beta type-1 OS=Homo sapiens OX=9606 GN=PSMB1 PE=1 SV=2,7,7,43.2,241
M6PR,-0.5455650951,0.00352528855345588,0,P20645;F5GX30;H0YGE9;H0YGT2;H0YF90;F5GXE0;F5GXU0;F5H883,P20645;F5GX30,5;4;2;2;2;1;1;1,5;4;2;2;2;1;1;1,5;4;2;2;2;1;1;1,Cation-dependent mannose-6-phosphate receptor,M6PR,sp|P20645|MPRD_HUMAN Cation-dependent mannose-6-phosphate receptor OS=Homo sapiens OX=9606 GN=M6PR PE=1 SV=1;tr|F5GX30|F5GX30_HUMAN Cation-dependent mannose-6-phosphate receptor OS=Homo sapiens OX=9606 GN=M6PR PE=1 SV=2,5,5,24.9,277
LMNB1,-0.1337452592,0.250494727940133,0,P20700;E9PBF6;A0A0D9SFE5;A0A0D9SFY5,P20700;E9PBF6;A0A0D9SFE5,38;33;28;14,37;32;28;14,34;31;27;13,Lamin-B1,LMNB1,"sp|P20700|LMNB1_HUMAN Lamin-B1 OS=Homo sapiens OX=9606 GN=LMNB1 PE=1 SV=2;tr|E9PBF6|E9PBF6_HUMAN Lamin-B1 OS=Homo sapiens OX=9606 GN=LMNB1 PE=1 SV=1;tr|A0A0D9SFE5|A0A0D9SFE5_HUMAN Lamin B1, isoform CRA_a OS=Homo sapiens OX=9606 GN=LMNB1 PE=1 SV=1",38,34,63.5,586
ATP6V1B2,-0.7009618979,0.00174931463725312,0,P21281;H0YC04;P15313;C9JNS9;C9JL73;E5RGH6;H0YAT8;H0YC45,P21281;H0YC04,14;9;4;4;4;3;2;1,14;9;4;4;4;3;2;1,14;9;4;4;4;3;2;1,"V-type proton ATPase subunit B, brain isoform",ATP6V1B2,"sp|P21281|VATB2_HUMAN V-type proton ATPase subunit B, brain isoform OS=Homo sapiens OX=9606 GN=ATP6V1B2 PE=1 SV=3;tr|H0YC04|H0YC04_HUMAN V-type proton ATPase subunit B, brain isoform (Fragment) OS=Homo sapiens OX=9606 GN=ATP6V1B2 PE=1 SV=1",14,14,36,511
ATP6V1C1,-1.1016710464,0.000447856135324507,1,P21283;E7EV59,P21283;E7EV59,9;6,9;6,9;6,V-type proton ATPase subunit C 1,ATP6V1C1,sp|P21283|VATC1_HUMAN V-type proton ATPase subunit C 1 OS=Homo sapiens OX=9606 GN=ATP6V1C1 PE=1 SV=4;tr|E7EV59|E7EV59_HUMAN V-type proton ATPase subunit C OS=Homo sapiens OX=9606 GN=ATP6V1C1 PE=1 SV=1,9,9,25.9,382
ACO1,0.079934153,0.652845714540144,0,P21399,P21399,21,21,21,Cytoplasmic aconitate hydratase,ACO1,sp|P21399|ACOC_HUMAN Cytoplasmic aconitate hydratase OS=Homo sapiens OX=9606 GN=ACO1 PE=1 SV=3,21,21,30.9,889
VDAC1,0.1271736482,0.263339375055306,0,P21796;C9JI87,P21796;C9JI87,26;15,26;15,26;15,Voltage-dependent anion-selective channel protein 1,VDAC1,sp|P21796|VDAC1_HUMAN Voltage-dependent anion-selective channel protein 1 OS=Homo sapiens OX=9606 GN=VDAC1 PE=1 SV=2;tr|C9JI87|C9JI87_HUMAN Voltage-dependent anion-selective channel protein 1 (Fragment) OS=Homo sapiens OX=9606 GN=VDAC1 PE=1 SV=6,26,26,83.4,283
SDHB,0.7928636198,0.0845497536283932,0,P21912;A0A087WXX8;A0A087WWT1,P21912;A0A087WXX8;A0A087WWT1,5;3;3,5;3;3,5;3;3,"Succinate dehydrogenase [ubiquinone] iron-sulfur subunit, mitochondrial",SDHB,"sp|P21912|SDHB_HUMAN Succinate dehydrogenase [ubiquinone] iron-sulfur subunit, mitochondrial OS=Homo sapiens OX=9606 GN=SDHB PE=1 SV=3;tr|A0A087WXX8|A0A087WXX8_HUMAN Succinate dehydrogenase [ubiquinone] iron-sulfur subunit, mitochondrial (Fragment) OS=Homo",5,5,21.4,280
TGM2,0.3768385868,0.0239401861264624,0,P21980;A2A299;A2A2A0,P21980,29;8;5,29;8;5,29;8;5,Protein-glutamine gamma-glutamyltransferase 2,TGM2,sp|P21980|TGM2_HUMAN Protein-glutamine gamma-glutamyltransferase 2 OS=Homo sapiens OX=9606 GN=TGM2 PE=1 SV=2,29,29,46.4,687
FBL,0.1075309477,0.337330672692384,0,P22087;M0QXL5;M0R2Q4;M0R0P1;M0R299;M0R2U2;M0R1H0;M0R2B0;A6NHQ2,P22087;M0QXL5;M0R2Q4;M0R0P1;M0R299,15;14;14;13;13;7;7;7;1,15;14;14;13;13;7;7;7;1,15;14;14;13;13;7;7;7;1,rRNA 2-O-methyltransferase fibrillarin,FBL,sp|P22087|FBRL_HUMAN rRNA 2-O-methyltransferase fibrillarin OS=Homo sapiens OX=9606 GN=FBL PE=1 SV=2;tr|M0QXL5|M0QXL5_HUMAN rRNA 2-O-methyltransferase fibrillarin (Fragment) OS=Homo sapiens OX=9606 GN=FBL PE=1 SV=1;tr|M0R2Q4|M0R2Q4_HUMAN rRNA 2-O-methyl,15,15,55.5,321
GART,-0.0597942114,0.64977451768163,0,P22102;F8WD69;C9JBJ1;C9JTV6;C9JZG2;C9JKQ7;H7C366;A0A140TA71,P22102,32;14;12;12;8;8;4;3,32;14;12;12;8;8;4;3,32;14;12;12;8;8;4;3,Trifunctional purine biosynthetic protein adenosine-3;Phosphoribosylamine--glycine ligase;Phosphoribosylformylglycinamidine cyclo-ligase;Phosphoribosylglycinamide formyltransferase,GART,sp|P22102|PUR2_HUMAN Trifunctional purine biosynthetic protein adenosine-3 OS=Homo sapiens OX=9606 GN=GART PE=1 SV=1,32,32,44.1,1010
PAICS,0.2811390109,0.0487243696902858,0,P22234;E9PBS1;D6RF62,P22234;E9PBS1;D6RF62,30;29;22,30;29;22,30;29;22,Multifunctional protein ADE2;Phosphoribosylaminoimidazole-succinocarboxamide synthase;Phosphoribosylaminoimidazole carboxylase,PAICS,sp|P22234|PUR6_HUMAN Multifunctional protein ADE2 OS=Homo sapiens OX=9606 GN=PAICS PE=1 SV=3;tr|E9PBS1|E9PBS1_HUMAN Multifunctional protein ADE2 (Fragment) OS=Homo sapiens OX=9606 GN=PAICS PE=1 SV=1;tr|D6RF62|D6RF62_HUMAN Multifunctional protein ADE2 OS=Ho,30,30,67.5,425
SCP2,-0.3574608999,0.0333838512851951,0,P22307;H0YF61,P22307,7;2,7;2,7;2,Non-specific lipid-transfer protein,SCP2,sp|P22307|NLTP_HUMAN Non-specific lipid-transfer protein OS=Homo sapiens OX=9606 GN=SCP2 PE=1 SV=2,7,7,9.9,547
UBA1,-0.4256002005,0.0120422618732214,0,P22314;Q5JRR6;Q5JRR9;Q5JRS0;Q5JRS1;Q5JRS3;Q5JRS2,P22314,43;14;11;11;9;9;9,43;14;11;11;9;9;9,43;14;11;11;9;9;9,Ubiquitin-like modifier-activating enzyme 1,UBA1,sp|P22314|UBA1_HUMAN Ubiquitin-like modifier-activating enzyme 1 OS=Homo sapiens OX=9606 GN=UBA1 PE=1 SV=3,43,43,50.7,1058
FDXR,-0.2467005947,0.42569661921236,0,P22570;A0A0C4DFN8;A0A0A0MSZ4;A0A0A0MTN9;A0A0A0MTR6;A0A0C4DGN7;A0A0A0MT64;J3QQX3;J3QKZ8;J3QQW7,P22570;A0A0C4DFN8;A0A0A0MSZ4;A0A0A0MTN9;A0A0A0MTR6;A0A0C4DGN7;A0A0A0MT64;J3QQX3,17;16;16;15;15;15;15;14;4;1,17;16;16;15;15;15;15;14;4;1,17;16;16;15;15;15;15;14;4;1,"NADPH:adrenodoxin oxidoreductase, mitochondrial",FDXR,"sp|P22570|ADRO_HUMAN NADPH:adrenodoxin oxidoreductase, mitochondrial OS=Homo sapiens OX=9606 GN=FDXR PE=1 SV=3;tr|A0A0C4DFN8|A0A0C4DFN8_HUMAN NADPH:adrenodoxin oxidoreductase, mitochondrial OS=Homo sapiens OX=9606 GN=FDXR PE=1 SV=1;tr|A0A0A0MSZ4|A0A0A0MSZ4",17,17,47.7,491
HNRNPA2B1,0.0025839456,0.980774967175419,0,P22626;A0A087WUI2,P22626;A0A087WUI2,32;22,32;22,32;22,Heterogeneous nuclear ribonucleoproteins A2/B1,HNRNPA2B1,sp|P22626|ROA2_HUMAN Heterogeneous nuclear ribonucleoproteins A2/B1 OS=Homo sapiens OX=9606 GN=HNRNPA2B1 PE=1 SV=2;tr|A0A087WUI2|A0A087WUI2_HUMAN Heterogeneous nuclear ribonucleoproteins A2/B1 OS=Homo sapiens OX=9606 GN=HNRNPA2B1 PE=1 SV=1,32,32,73.1,353
UQCRC2,0.0689337244,0.580559002660185,0,P22695;H3BRG4;H3BSJ9;H3BP04;A0A087WVZ4;H3BUE4;H3BUI9,P22695;H3BRG4;H3BSJ9;H3BP04,14;13;12;8;2;2;2,14;13;12;8;2;2;2,14;13;12;8;2;2;2,"Cytochrome b-c1 complex subunit 2, mitochondrial",UQCRC2,"sp|P22695|QCR2_HUMAN Cytochrome b-c1 complex subunit 2, mitochondrial OS=Homo sapiens OX=9606 GN=UQCRC2 PE=1 SV=3;tr|H3BRG4|H3BRG4_HUMAN Cytochrome b-c1 complex subunit 2, mitochondrial OS=Homo sapiens OX=9606 GN=UQCRC2 PE=1 SV=1;tr|H3BSJ9|H3BSJ9_HUMAN Cyt",14,14,42.8,453
ITGA6,0.7771234349,0.0150669882287998,0,P23229,P23229,3,3,3,Integrin alpha-6;Integrin alpha-6 heavy chain;Integrin alpha-6 light chain;Processed integrin alpha-6,ITGA6,sp|P23229|ITA6_HUMAN Integrin alpha-6 OS=Homo sapiens OX=9606 GN=ITGA6 PE=1 SV=5,3,3,2.9,1130
SFPQ,0.3795360581,0.0153342317201055,0,P23246;H0Y9K7;H0Y9U2,P23246,25;4;2,25;4;2,23;4;2,"Splicing factor, proline- and glutamine-rich",SFPQ,"sp|P23246|SFPQ_HUMAN Splicing factor, proline- and glutamine-rich OS=Homo sapiens OX=9606 GN=SFPQ PE=1 SV=2",25,23,33.5,707
TUBG1;TUBG2,-0.1921943668,0.546185404085349,0,P23258;Q9NRH3;K7EKE5;K7EIS0,P23258;Q9NRH3;K7EKE5;K7EIS0,3;3;2;2,3;3;2;2,3;3;2;2,Tubulin gamma-1 chain;Tubulin gamma-2 chain;Tubulin gamma chain,TUBG1;TUBG2,sp|P23258|TBG1_HUMAN Tubulin gamma-1 chain OS=Homo sapiens OX=9606 GN=TUBG1 PE=1 SV=2;sp|Q9NRH3|TBG2_HUMAN Tubulin gamma-2 chain OS=Homo sapiens OX=9606 GN=TUBG2 PE=2 SV=1;tr|K7EKE5|K7EKE5_HUMAN Tubulin gamma-1 chain OS=Homo sapiens OX=9606 GN=TUBG1 PE=4 S,3,3,9.3,451
PPIB,-0.1828314804,0.113762123086366,0,P23284,P23284,18,18,18,Peptidyl-prolyl cis-trans isomerase B,PPIB,sp|P23284|PPIB_HUMAN Peptidyl-prolyl cis-trans isomerase B OS=Homo sapiens OX=9606 GN=PPIB PE=1 SV=2,18,18,68.5,216
WARS,-0.2555890718,0.0602645949335435,0,P23381;H0YJP3;G3V3X0;G3V423;G3V3P2;G3V227;G3V5U1;G3V456;G3V2Y7;G3V277;G3V3H8;G3V3Y5;G3V5W1;G3V3S7,P23381,9;4;2;2;2;2;2;2;2;2;2;2;1;1,9;4;2;2;2;2;2;2;2;2;2;2;1;1,9;4;2;2;2;2;2;2;2;2;2;2;1;1,"Tryptophan--tRNA ligase, cytoplasmic;T1-TrpRS;T2-TrpRS",WARS,"sp|P23381|SYWC_HUMAN Tryptophan--tRNA ligase, cytoplasmic OS=Homo sapiens OX=9606 GN=WARS1 PE=1 SV=2",9,9,28,471
RPS3,0.4936084079,0.0097755458412727,0,P23396;E9PL09;E9PPU1;H0YEU2;F2Z2S8;H0YCJ7;H0YF32;E9PQ96;E9PSF4;E9PJH4;E9PK82;E9PQX2;H0YES8,P23396;E9PL09;E9PPU1;H0YEU2;F2Z2S8;H0YCJ7,31;27;20;18;17;17;13;10;10;10;10;4;1,31;27;20;18;17;17;13;10;10;10;10;4;1,31;27;20;18;17;17;13;10;10;10;10;4;1,40S ribosomal protein S3,RPS3,sp|P23396|RS3_HUMAN 40S ribosomal protein S3 OS=Homo sapiens OX=9606 GN=RPS3 PE=1 SV=2;tr|E9PL09|E9PL09_HUMAN 40S ribosomal protein S3 OS=Homo sapiens OX=9606 GN=RPS3 PE=1 SV=1;tr|E9PPU1|E9PPU1_HUMAN 40S ribosomal protein S3 OS=Homo sapiens OX=9606 GN=RPS3,31,31,88.9,243
AHCY,0.1363939156,0.255573435464174,0,P23526,P23526,25,25,25,Adenosylhomocysteinase,AHCY,sp|P23526|SAHH_HUMAN Adenosylhomocysteinase OS=Homo sapiens OX=9606 GN=AHCY PE=1 SV=4,25,25,50.2,432
CFL1,-0.1619075613,0.193639849647344,0,P23528;E9PP50;E9PK25;G3V1A4;E9PQB7;E9PS23;E9PLJ3,P23528;E9PP50;E9PK25;G3V1A4;E9PQB7,21;19;18;17;13;9;7,21;19;18;17;13;9;7,12;10;9;9;5;8;5,Cofilin-1,CFL1,sp|P23528|COF1_HUMAN Cofilin-1 OS=Homo sapiens OX=9606 GN=CFL1 PE=1 SV=3;tr|E9PP50|E9PP50_HUMAN Cofilin-1 (Fragment) OS=Homo sapiens OX=9606 GN=CFL1 PE=1 SV=8;tr|E9PK25|E9PK25_HUMAN Cofilin-1 OS=Homo sapiens OX=9606 GN=CFL1 PE=1 SV=1;tr|G3V1A4|G3V1A4_HUMAN,21,12,91.6,166
DTYMK,-0.1931041714,0.100507536878955,0,P23919;G5E9E9;H7BZ20;H7C312;H7C3A4,P23919;G5E9E9;H7BZ20,8;4;4;3;2,8;4;4;3;2,8;4;4;3;2,Thymidylate kinase,DTYMK,"sp|P23919|KTHY_HUMAN Thymidylate kinase OS=Homo sapiens OX=9606 GN=DTYMK PE=1 SV=4;tr|G5E9E9|G5E9E9_HUMAN Deoxythymidylate kinase (Thymidylate kinase), isoform CRA_d OS=Homo sapiens OX=9606 GN=DTYMK PE=1 SV=1;tr|H7BZ20|H7BZ20_HUMAN Thymidylate kinase (Frag",8,8,34.4,212
RRM1,0.2370672899,0.188579390765166,0,P23921;E9PL69;E9PP77;H0YCY7,P23921;E9PL69,9;7;1;1,9;7;1;1,9;7;1;1,Ribonucleoside-diphosphate reductase large subunit,RRM1,sp|P23921|RIR1_HUMAN Ribonucleoside-diphosphate reductase large subunit OS=Homo sapiens OX=9606 GN=RRM1 PE=1 SV=1;tr|E9PL69|E9PL69_HUMAN Ribonucleoside-diphosphate reductase large subunit OS=Homo sapiens OX=9606 GN=RRM1 PE=1 SV=1,9,9,19.8,792
EEF1B2,0.2534536574,0.223804254008308,0,P24534;F2Z2G2;C9JZW3;F8WF65,P24534,8;3;3;2,8;3;3;2,8;3;3;2,Elongation factor 1-beta,EEF1B2,sp|P24534|EF1B_HUMAN Elongation factor 1-beta OS=Homo sapiens OX=9606 GN=EEF1B2 PE=1 SV=3,8,8,44.4,225
ATP5F1,0.0194698725,0.875567004161384,0,P24539;Q5QNZ2,P24539;Q5QNZ2,7;5,7;5,7;5,"ATP synthase F(0) complex subunit B1, mitochondrial",ATP5F1,"sp|P24539|AT5F1_HUMAN ATP synthase F(0) complex subunit B1, mitochondrial OS=Homo sapiens OX=9606 GN=ATP5PB PE=1 SV=2;tr|Q5QNZ2|Q5QNZ2_HUMAN ATP synthase F(0) complex subunit B1, mitochondrial OS=Homo sapiens OX=9606 GN=ATP5PB PE=1 SV=1",7,7,32.8,256
MCM3,-0.1964956147,0.184350667105053,0,P25205;J3KQ69;A0A499FHX9;Q7Z6P5,P25205;J3KQ69;A0A499FHX9,26;19;19;4,26;19;19;4,26;19;19;4,DNA replication licensing factor MCM3,MCM3,sp|P25205|MCM3_HUMAN DNA replication licensing factor MCM3 OS=Homo sapiens OX=9606 GN=MCM3 PE=1 SV=3;tr|J3KQ69|J3KQ69_HUMAN DNA replication licensing factor MCM3 OS=Homo sapiens OX=9606 GN=MCM3 PE=1 SV=3;tr|A0A499FHX9|A0A499FHX9_HUMAN DNA replication licen,26,26,34.9,808
RPS12,0.4146232159,0.0287376176480687,0,P25398,P25398,13,13,13,40S ribosomal protein S12,RPS12,sp|P25398|RS12_HUMAN 40S ribosomal protein S12 OS=Homo sapiens OX=9606 GN=RPS12 PE=1 SV=3,13,13,84.1,132
