RPS28,0.3494507611,0.0222804056388891,0,P62857,P62857,10,10,10,40S ribosomal protein S28,RPS28,sp|P62857|RS28_HUMAN 40S ribosomal protein S28 OS=Homo sapiens OX=9606 GN=RPS28 PE=1 SV=1,10,10,85.5,69
GNB1,-0.3582733957,0.0658286186691689,0,P62873;F6UT28;F6X3N5;B1AKQ8;B3KVK2,P62873;F6UT28;F6X3N5;B1AKQ8,11;8;7;6;4,7;4;3;2;4,6;3;2;2;4,Guanine nucleotide-binding protein G(I)/G(S)/G(T) subunit beta-1,GNB1,sp|P62873|GBB1_HUMAN Guanine nucleotide-binding protein G(I)/G(S)/G(T) subunit beta-1 OS=Homo sapiens OX=9606 GN=GNB1 PE=1 SV=3;tr|F6UT28|F6UT28_HUMAN Guanine nucleotide-binding protein G(I)/G(S)/G(T) subunit beta-1 (Fragment) OS=Homo sapiens OX=9606 GN=GN,11,6,48.2,340
RBX1,1.6586751109,0.0421316670656645,1,P62877,P62877,2,2,2,"E3 ubiquitin-protein ligase RBX1;E3 ubiquitin-protein ligase RBX1, N-terminally processed",RBX1,sp|P62877|RBX1_HUMAN E3 ubiquitin-protein ligase RBX1 OS=Homo sapiens OX=9606 GN=RBX1 PE=1 SV=1,2,2,17.6,108
GNB2,-0.3149396754,0.0260635965927597,0,P62879;C9JIS1;C9JXA5;E7EP32;C9JZN1;C9JD14,P62879;C9JIS1;C9JXA5;E7EP32;C9JZN1,16;13;13;12;10;2,16;13;13;12;10;2,10;7;7;7;4;0,Guanine nucleotide-binding protein G(I)/G(S)/G(T) subunit beta-2,GNB2,sp|P62879|GBB2_HUMAN Guanine nucleotide-binding protein G(I)/G(S)/G(T) subunit beta-2 OS=Homo sapiens OX=9606 GN=GNB2 PE=1 SV=3;tr|C9JIS1|C9JIS1_HUMAN Guanine nucleotide-binding protein G(I)/G(S)/G(T) subunit beta-2 (Fragment) OS=Homo sapiens OX=9606 GN=GN,16,10,55.3,340
RPL39;RPL39P5,0.2585050351,0.165340454088568,0,P62891;Q59GN2,P62891;Q59GN2,2;2,2;2,2;2,60S ribosomal protein L39;Putative 60S ribosomal protein L39-like 5,RPL39;RPL39P5,sp|P62891|RL39_HUMAN 60S ribosomal protein L39 OS=Homo sapiens OX=9606 GN=RPL39 PE=1 SV=2;sp|Q59GN2|R39L5_HUMAN Putative 60S ribosomal protein L39-like 5 OS=Homo sapiens OX=9606 GN=RPL39P5 PE=5 SV=2,2,2,23.5,51
RPL31,0.4672951358,0.00844839174049525,0,P62899;H7C2W9;C9JU56;B7Z4E3;B7Z4C8;B8ZZK4,P62899;H7C2W9;C9JU56;B7Z4E3;B7Z4C8;B8ZZK4,7;6;6;6;6;5,7;6;6;6;6;5,7;6;6;6;6;5,60S ribosomal protein L31,RPL31,sp|P62899|RL31_HUMAN 60S ribosomal protein L31 OS=Homo sapiens OX=9606 GN=RPL31 PE=1 SV=1;tr|H7C2W9|H7C2W9_HUMAN 60S ribosomal protein L31 (Fragment) OS=Homo sapiens OX=9606 GN=RPL31 PE=1 SV=1;tr|C9JU56|C9JU56_HUMAN 60S ribosomal protein L31 (Fragment) OS=,7,7,46.4,125
RPL10A,0.3218009967,0.0229891579526594,0,P62906,P62906,13,13,13,60S ribosomal protein L10a,RPL10A,sp|P62906|RL10A_HUMAN 60S ribosomal protein L10a OS=Homo sapiens OX=9606 GN=RPL10A PE=1 SV=2,13,13,46.5,217
RPL11,0.3162458374,0.0297485138737264,0,P62913;Q5VVC8,P62913;Q5VVC8,15;12,15;12,15;12,60S ribosomal protein L11,RPL11,sp|P62913|RL11_HUMAN 60S ribosomal protein L11 OS=Homo sapiens OX=9606 GN=RPL11 PE=1 SV=2;tr|Q5VVC8|Q5VVC8_HUMAN 60S ribosomal protein L11 OS=Homo sapiens OX=9606 GN=RPL11 PE=1 SV=2,15,15,66.9,178
RPL8,0.1513437335,0.246338203952799,0,P62917;E9PKU4;E9PKZ0;G3V1A1;E9PP36,P62917;E9PKU4;E9PKZ0;G3V1A1,17;16;13;11;7,17;16;13;11;7,17;16;13;11;7,60S ribosomal protein L8,RPL8,sp|P62917|RL8_HUMAN 60S ribosomal protein L8 OS=Homo sapiens OX=9606 GN=RPL8 PE=1 SV=2;tr|E9PKU4|E9PKU4_HUMAN 60S ribosomal protein L8 (Fragment) OS=Homo sapiens OX=9606 GN=RPL8 PE=1 SV=1;tr|E9PKZ0|E9PKZ0_HUMAN 60S ribosomal protein L8 (Fragment) OS=Homo s,17,17,62.3,257
PPIA,-0.0459437464,0.676118100383793,0,P62937;F8WE65;C9J5S7;F5H284;Q9Y536;P0DN26;A0A0H2UH34;A0A0B4J2A2;A0A075B767;A0A075B759;P0DN37;E5RIZ5,P62937;F8WE65;C9J5S7,25;15;15;3;3;3;3;3;3;3;2;2,25;15;15;3;3;3;3;3;3;3;2;2,25;15;15;3;3;3;3;3;3;3;2;2,"Peptidyl-prolyl cis-trans isomerase A;Peptidyl-prolyl cis-trans isomerase A, N-terminally processed;Peptidyl-prolyl cis-trans isomerase",PPIA,sp|P62937|PPIA_HUMAN Peptidyl-prolyl cis-trans isomerase A OS=Homo sapiens OX=9606 GN=PPIA PE=1 SV=2;tr|F8WE65|F8WE65_HUMAN Peptidyl-prolyl cis-trans isomerase OS=Homo sapiens OX=9606 GN=PPIA PE=1 SV=1;tr|C9J5S7|C9J5S7_HUMAN Peptidyl-prolyl cis-trans isome,25,25,98.2,165
FKBP1A,-0.5768502909,0.0144809587600527,0,P62942;Q5W0X3;A0A087WZM5;Q1JUQ5;Q1JUQ3;A0A087WTS4;A0A087WV48;Q5VVH2,P62942;Q5W0X3;A0A087WZM5,7;5;5;3;2;2;2;1,7;5;5;3;2;2;2;1,7;5;5;3;2;2;2;1,Peptidyl-prolyl cis-trans isomerase FKBP1A;Peptidyl-prolyl cis-trans isomerase,FKBP1A,sp|P62942|FKB1A_HUMAN Peptidyl-prolyl cis-trans isomerase FKBP1A OS=Homo sapiens OX=9606 GN=FKBP1A PE=1 SV=2;tr|Q5W0X3|Q5W0X3_HUMAN Peptidylprolyl isomerase OS=Homo sapiens OX=9606 GN=FKBP1A PE=1 SV=1;tr|A0A087WZM5|A0A087WZM5_HUMAN Peptidylprolyl isomerase,7,7,54.6,108
RPS27A,0.9493649019,0.157005115097268,0,P62979;J3QTR3;A0A2R8Y422;P0CG48;F5H265;Q96C32;Q5PY61;J3QKN0;F5GXK7;F5H747;F5H388;B4DV12;F5H2Z3;P0CG47;F5GYU3;F5H6Q2;J3QS39;P62987;M0R1M6;Q49A90;M0R1V7;M0R2S1;F5GZ39;J3QSA3,P62979;J3QTR3;A0A2R8Y422,11;6;6;5;5;5;5;5;5;5;5;5;5;5;5;5;5;5;3;3;3;3;2;2,11;6;6;5;5;5;5;5;5;5;5;5;5;5;5;5;5;5;3;3;3;3;2;2,11;6;6;5;5;5;5;5;5;5;5;5;5;5;5;5;5;5;3;3;3;3;2;2,Ubiquitin-40S ribosomal protein S27a;Ubiquitin;40S ribosomal protein S27a,RPS27A,sp|P62979|RS27A_HUMAN Ubiquitin-40S ribosomal protein S27a OS=Homo sapiens OX=9606 GN=RPS27A PE=1 SV=2;tr|J3QTR3|J3QTR3_HUMAN Ubiquitin-40S ribosomal protein S27a (Fragment) OS=Homo sapiens OX=9606 GN=RPS27A PE=1 SV=1;tr|A0A2R8Y422|A0A2R8Y422_HUMAN Ubiquit,11,11,60.9,156
GRB2,-0.0827096305,0.78980986862797,0,P62993;J3KT38;J3QRL5,P62993,5;1;1,5;1;1,5;1;1,Growth factor receptor-bound protein 2,GRB2,sp|P62993|GRB2_HUMAN Growth factor receptor-bound protein 2 OS=Homo sapiens OX=9606 GN=GRB2 PE=1 SV=1,5,5,28.1,217
RAC1,-0.4585871904,0.00669787711174233,0,P63000;P15153;B1AH77;B1AH80;B1AH78,P63000,11;5;4;4;3,11;5;4;4;3,5;1;1;1;1,Ras-related C3 botulinum toxin substrate 1,RAC1,sp|P63000|RAC1_HUMAN Ras-related C3 botulinum toxin substrate 1 OS=Homo sapiens OX=9606 GN=RAC1 PE=1 SV=1,11,5,50,192
AP2B1,0.0667383456,0.709674017064403,0,P63010;A0A087WU93;A0A087WZQ6;K7EN71;K7ERB2,P63010,11;5;5;2;2,11;5;5;2;2,1;1;1;1;1,AP-2 complex subunit beta,AP2B1,sp|P63010|AP2B1_HUMAN AP-2 complex subunit beta OS=Homo sapiens OX=9606 GN=AP2B1 PE=1 SV=1,11,1,13.3,937
YWHAZ,0.0430363866,0.662757903574216,0,P63104;E7EX29;E7ESK7;B0AZS6;E5RIR4;E9PD24;E7EVZ2;H0YB80;B7Z2E6;E5RGE1,P63104;E7EX29;E7ESK7;B0AZS6,25;22;16;15;10;10;10;10;9;8,25;22;16;15;10;10;10;10;9;8,19;16;13;11;8;8;8;6;6;7,14-3-3 protein zeta/delta,YWHAZ,sp|P63104|1433Z_HUMAN 14-3-3 protein zeta/delta OS=Homo sapiens OX=9606 GN=YWHAZ PE=1 SV=1;tr|E7EX29|E7EX29_HUMAN 14-3-3 protein zeta/delta (Fragment) OS=Homo sapiens OX=9606 GN=YWHAZ PE=1 SV=1;tr|E7ESK7|E7ESK7_HUMAN 14-3-3 protein zeta/delta (Fragment) OS,25,19,83.3,245
PPP2R2A,0.2633524617,0.420929559310595,0,P63151;A0A590UJY3;A0A590UJJ1;E5RIY1;E5RFR9;Q66LE6;Q00005;Q9Y2T4;E5RHQ2;E5RJV2;H0YB06,P63151;A0A590UJY3,11;6;5;4;4;3;2;1;1;1;1,11;6;5;4;4;3;2;1;1;1;1,11;6;5;4;4;3;2;1;1;1;1,Serine/threonine-protein phosphatase 2A 55 kDa regulatory subunit B alpha isoform,PPP2R2A,sp|P63151|2ABA_HUMAN Serine/threonine-protein phosphatase 2A 55 kDa regulatory subunit B alpha isoform OS=Homo sapiens OX=9606 GN=PPP2R2A PE=1 SV=1;tr|A0A590UJY3|A0A590UJY3_HUMAN Serine/threonine-protein phosphatase 2A 55 kDa regulatory subunit B OS=Homo s,11,11,34.2,447
DYNLL1,-0.2451759724,0.263335845124932,0,P63167;F8VXL2;F8VRV5;F8VXI7,P63167;F8VXL2;F8VRV5,6;3;3;1,6;3;3;1,3;3;3;1,"Dynein light chain 1, cytoplasmic",DYNLL1,"sp|P63167|DYL1_HUMAN Dynein light chain 1, cytoplasmic OS=Homo sapiens OX=9606 GN=DYNLL1 PE=1 SV=1;tr|F8VXL2|F8VXL2_HUMAN Dynein light chain OS=Homo sapiens OX=9606 GN=DYNLL1 PE=1 SV=1;tr|F8VRV5|F8VRV5_HUMAN Dynein light chain OS=Homo sapiens OX=9606 GN=DY",6,3,57.3,89
RPL38,0.4231029084,0.0585629824029651,0,P63173;J3KT73;J3QL01;J3KSP2,P63173;J3KT73;J3QL01,4;3;3;1,4;3;3;1,4;3;3;1,60S ribosomal protein L38,RPL38,sp|P63173|RL38_HUMAN 60S ribosomal protein L38 OS=Homo sapiens OX=9606 GN=RPL38 PE=1 SV=2;tr|J3KT73|J3KT73_HUMAN 60S ribosomal protein L38 OS=Homo sapiens OX=9606 GN=RPL38 PE=1 SV=1;tr|J3QL01|J3QL01_HUMAN 60S ribosomal protein L38 OS=Homo sapiens OX=9606 G,4,4,57.1,70
RPS21,0.4585961141,0.00943523244330463,0,P63220;Q8WVC2;Q9BYK1;Q9BYK2,P63220;Q8WVC2;Q9BYK1,11;9;7;2,11;9;7;2,11;9;7;2,40S ribosomal protein S21,RPS21,sp|P63220|RS21_HUMAN 40S ribosomal protein S21 OS=Homo sapiens OX=9606 GN=RPS21 PE=1 SV=1;tr|Q8WVC2|Q8WVC2_HUMAN 40S ribosomal protein S21 OS=Homo sapiens OX=9606 GN=RPS21 PE=1 SV=1;tr|Q9BYK1|Q9BYK1_HUMAN 40S ribosomal protein S21 OS=Homo sapiens OX=9606 G,11,11,92.8,83
GNB2L1,0.2672414075,0.0489507200567999,0,P63244;J3KPE3;D6RHH4;D6RAC2;D6REE5;D6R9L0;H0Y8W2;D6R9Z1;H0YAM7;D6RFX4;H0YAF8;D6RBD0;D6RFZ9;E9PD14;D6RAU2;H0Y8R5;D6R909;D6RGK8;D6RF23;D6RHJ5;D6RDI0;H0Y9P0,P63244;J3KPE3;D6RHH4;D6RAC2;D6REE5;D6R9L0;H0Y8W2;D6R9Z1;H0YAM7;D6RFX4;H0YAF8;D6RBD0;D6RFZ9;E9PD14;D6RAU2,29;25;23;21;20;20;20;20;18;18;17;15;15;15;15;11;8;7;5;5;4;3,29;25;23;21;20;20;20;20;18;18;17;15;15;15;15;11;8;7;5;5;4;3,29;25;23;21;20;20;20;20;18;18;17;15;15;15;15;11;8;7;5;5;4;3,"Guanine nucleotide-binding protein subunit beta-2-like 1;Guanine nucleotide-binding protein subunit beta-2-like 1, N-terminally processed",GNB2L1,sp|P63244|RACK1_HUMAN Receptor of activated protein C kinase 1 OS=Homo sapiens OX=9606 GN=RACK1 PE=1 SV=3;tr|J3KPE3|J3KPE3_HUMAN Receptor of-activated protein C kinase 1 OS=Homo sapiens OX=9606 GN=RACK1 PE=1 SV=1;tr|D6RHH4|D6RHH4_HUMAN Receptor of-activate,29,29,88,317
TMSB10,-0.1485884262,0.299711230613289,0,P63313;CON__P21752,P63313,4;1,4;1,4;1,Thymosin beta-10,TMSB10,sp|P63313|TYB10_HUMAN Thymosin beta-10 OS=Homo sapiens OX=9606 GN=TMSB10 PE=1 SV=2,4,4,68.2,44
YBX1,0.2989735125,0.0709847278238857,0,P67809;H0Y449;C9J5V9;A0A0D9SEI8,P67809;H0Y449,12;7;4;2,12;7;4;2,5;5;2;0,Nuclease-sensitive element-binding protein 1,YBX1,sp|P67809|YBOX1_HUMAN Y-box-binding protein 1 OS=Homo sapiens OX=9606 GN=YBX1 PE=1 SV=3;tr|H0Y449|H0Y449_HUMAN Y-box-binding protein 1 (Fragment) OS=Homo sapiens OX=9606 GN=YBX1 PE=1 SV=1,12,5,39.8,324
CSNK2B;CSNK2B-LY6G5B-1181;CSNK2B-LY6G5B--991,0.1984763814,0.664860254815448,0,P67870;Q5SRQ6;Q5SRQ3;N0E472;A0A0G2JM12;N0E644;A0A0G2JM58,P67870;Q5SRQ6;Q5SRQ3;N0E472;A0A0G2JM12,5;5;4;4;4;1;1,5;5;4;4;4;1;1,5;5;4;4;4;1;1,Casein kinase II subunit beta,CSNK2B;CSNK2B-LY6G5B-1181;CSNK2B-LY6G5B--991,sp|P67870|CSK2B_HUMAN Casein kinase II subunit beta OS=Homo sapiens OX=9606 GN=CSNK2B PE=1 SV=1;tr|Q5SRQ6|Q5SRQ6_HUMAN Casein kinase II subunit beta OS=Homo sapiens OX=9606 GN=CSNK2B PE=1 SV=2;tr|Q5SRQ3|Q5SRQ3_HUMAN Casein kinase II subunit beta OS=Homo sa,5,5,30.7,215
ACTC1;ACTA1,0.3205909621,0.0888589601245473,0,P68032;P68133;A6NL76,P68032;P68133;A6NL76,35;33;25,6;6;5,2;2;2,"Actin, alpha cardiac muscle 1;Actin, alpha skeletal muscle",ACTC1;ACTA1,"sp|P68032|ACTC_HUMAN Actin, alpha cardiac muscle 1 OS=Homo sapiens OX=9606 GN=ACTC1 PE=1 SV=1;sp|P68133|ACTS_HUMAN Actin, alpha skeletal muscle OS=Homo sapiens OX=9606 GN=ACTA1 PE=1 SV=1;tr|A6NL76|A6NL76_HUMAN Actin, alpha skeletal muscle OS=Homo sapiens O",35,2,51.2,377
EEF1A1;EEF1A1P5,0.4475684695,0.011052887197426,0,P68104;Q5VTE0;A0A087WVQ9;A0A087WV01;Q5JR01;A6PW80,P68104;Q5VTE0;A0A087WVQ9;A0A087WV01,32;31;29;22;10;9,32;31;29;22;10;9,16;16;16;11;4;4,Elongation factor 1-alpha 1;Putative elongation factor 1-alpha-like 3;Elongation factor 1-alpha,EEF1A1;EEF1A1P5,sp|P68104|EF1A1_HUMAN Elongation factor 1-alpha 1 OS=Homo sapiens OX=9606 GN=EEF1A1 PE=1 SV=1;sp|Q5VTE0|EF1A3_HUMAN Putative elongation factor 1-alpha-like 3 OS=Homo sapiens OX=9606 GN=EEF1A1P5 PE=5 SV=1;tr|A0A087WVQ9|A0A087WVQ9_HUMAN Elongation factor 1-a,32,16,70.6,462
TUBA1B;TUBA4A,0.2026695275,0.0919563557576503,0,P68363;P68366;C9JDS9,P68363;P68366,46;29;10,46;29;10,4;4;0,Tubulin alpha-1B chain;Tubulin alpha-4A chain,TUBA1B;TUBA4A,sp|P68363|TBA1B_HUMAN Tubulin alpha-1B chain OS=Homo sapiens OX=9606 GN=TUBA1B PE=1 SV=1;sp|P68366|TBA4A_HUMAN Tubulin alpha-4A chain OS=Homo sapiens OX=9606 GN=TUBA4A PE=1 SV=1,46,4,87.6,451
TUBB4B,0.2419511596,0.0594199235963239,0,P68371,P68371,41,41,2,Tubulin beta-4B chain,TUBB4B,sp|P68371|TBB4B_HUMAN Tubulin beta-4B chain OS=Homo sapiens OX=9606 GN=TUBB4B PE=1 SV=1,41,2,70.6,445
PAFAH1B2,-0.1452119654,0.247230665258859,0,P68402;J3KNE3,P68402;J3KNE3,4;2,4;2,4;2,Platelet-activating factor acetylhydrolase IB subunit beta,PAFAH1B2,sp|P68402|PA1B2_HUMAN Platelet-activating factor acetylhydrolase IB subunit beta OS=Homo sapiens OX=9606 GN=PAFAH1B2 PE=1 SV=1;tr|J3KNE3|J3KNE3_HUMAN Platelet-activating factor acetylhydrolase IB subunit beta (Fragment) OS=Homo sapiens OX=9606 GN=PAFAH1B2 ,4,4,41.5,229
HIST1H3A,-0.3528410609,0.0284440487858999,0,P68431,P68431,13,13,1,Histone H3.1,HIST1H3A,sp|P68431|H31_HUMAN Histone H3.1 OS=Homo sapiens OX=9606 GN=H3C1 PE=1 SV=2,13,1,59.6,136
EIF4G2,-0.3079677514,0.0734028089653924,0,P78344;D3DQV9;H0Y3P2;E9PKF8;H0YCH5;H0YE22;H0YD77,P78344;D3DQV9;H0Y3P2,13;12;11;6;4;2;2,13;12;11;6;4;2;2,13;12;11;6;4;2;2,Eukaryotic translation initiation factor 4 gamma 2,EIF4G2,sp|P78344|IF4G2_HUMAN Eukaryotic translation initiation factor 4 gamma 2 OS=Homo sapiens OX=9606 GN=EIF4G2 PE=1 SV=1;tr|D3DQV9|D3DQV9_HUMAN Eukaryotic translation initiation factor 4 gamma 2 (Fragment) OS=Homo sapiens OX=9606 GN=EIF4G2 PE=1 SV=1;tr|H0Y3P2|,13,13,19.4,907
CCT2,0.2817336705,0.0398198757281758,0,P78371;F5GWF6;F8VQ14,P78371;F5GWF6;F8VQ14,44;42;37,44;42;37,44;42;37,T-complex protein 1 subunit beta,CCT2,sp|P78371|TCPB_HUMAN T-complex protein 1 subunit beta OS=Homo sapiens OX=9606 GN=CCT2 PE=1 SV=4;tr|F5GWF6|F5GWF6_HUMAN T-complex protein 1 subunit beta OS=Homo sapiens OX=9606 GN=CCT2 PE=1 SV=2;tr|F8VQ14|F8VQ14_HUMAN T-complex protein 1 subunit beta OS=Hom,44,44,81.5,535
GSTO1,-0.9618249805,0.0111206510079187,0,P78417;Q5TA02;Q5TA01,P78417;Q5TA02;Q5TA01,15;13;10,15;13;10,15;13;10,Glutathione S-transferase omega-1,GSTO1,sp|P78417|GSTO1_HUMAN Glutathione S-transferase omega-1 OS=Homo sapiens OX=9606 GN=GSTO1 PE=1 SV=2;tr|Q5TA02|Q5TA02_HUMAN Glutathione S-transferase omega-1 (Fragment) OS=Homo sapiens OX=9606 GN=GSTO1 PE=1 SV=1;tr|Q5TA01|Q5TA01_HUMAN Glutathione S-transfera,15,15,53.9,241
PRKDC,-0.1309065109,0.390322714665664,0,P78527;F5GX40,P78527,68;2,68;2,68;2,DNA-dependent protein kinase catalytic subunit,PRKDC,sp|P78527|PRKDC_HUMAN DNA-dependent protein kinase catalytic subunit OS=Homo sapiens OX=9606 GN=PRKDC PE=1 SV=3,68,68,20.2,4128
MRPS35,-0.4755614138,0.389324296843711,0,P82673;H0YG82,P82673;H0YG82,2;1,2;1,2;1,"28S ribosomal protein S35, mitochondrial",MRPS35,"sp|P82673|RT35_HUMAN 28S ribosomal protein S35, mitochondrial OS=Homo sapiens OX=9606 GN=MRPS35 PE=1 SV=1;tr|H0YG82|H0YG82_HUMAN 28S ribosomal protein S35, mitochondrial (Fragment) OS=Homo sapiens OX=9606 GN=MRPS35 PE=1 SV=1",2,2,11.5,323
MRPS5,-0.2851783325,0.0811755133053316,0,P82675,P82675,2,2,2,"28S ribosomal protein S5, mitochondrial",MRPS5,"sp|P82675|RT05_HUMAN 28S ribosomal protein S5, mitochondrial OS=Homo sapiens OX=9606 GN=MRPS5 PE=1 SV=2",2,2,7,430
MRPS9,0.2785523821,0.108385072685893,0,P82933,P82933,6,6,6,"28S ribosomal protein S9, mitochondrial",MRPS9,"sp|P82933|RT09_HUMAN 28S ribosomal protein S9, mitochondrial OS=Homo sapiens OX=9606 GN=MRPS9 PE=1 SV=2",6,6,18.9,396
SARNP,-0.2117557114,0.187157474259347,0,P82979;F8VZQ9;H0YHG0;F8VS12,P82979;F8VZQ9;H0YHG0,9;7;7;3,9;7;7;3,9;7;7;3,SAP domain-containing ribonucleoprotein,SARNP,sp|P82979|SARNP_HUMAN SAP domain-containing ribonucleoprotein OS=Homo sapiens OX=9606 GN=SARNP PE=1 SV=3;tr|F8VZQ9|F8VZQ9_HUMAN SAP domain-containing ribonucleoprotein OS=Homo sapiens OX=9606 GN=SARNP PE=1 SV=1;tr|H0YHG0|H0YHG0_HUMAN Uncharacterized protei,9,9,35.7,210
LACTB,-0.0774948555,0.597994973332532,0,P83111;H0YNN5,P83111,6;2,6;2,6;2,"Serine beta-lactamase-like protein LACTB, mitochondrial",LACTB,"sp|P83111|LACTB_HUMAN Serine beta-lactamase-like protein LACTB, mitochondrial OS=Homo sapiens OX=9606 GN=LACTB PE=1 SV=2",6,6,13.2,547
ARF1;ARF3,-0.1796495841,0.256461148685223,0,P84077;P61204;F5H423;F5H0C7;C9J1Z8;F5H1V1;F5H6T5;F8WDB3,P84077;P61204;F5H423;F5H0C7,9;8;8;5;4;1;1;1,9;8;8;5;4;1;1;1,5;4;4;2;0;0;0;0,ADP-ribosylation factor 1;ADP-ribosylation factor 3,ARF1;ARF3,sp|P84077|ARF1_HUMAN ADP-ribosylation factor 1 OS=Homo sapiens OX=9606 GN=ARF1 PE=1 SV=2;sp|P61204|ARF3_HUMAN ADP-ribosylation factor 3 OS=Homo sapiens OX=9606 GN=ARF3 PE=1 SV=2;tr|F5H423|F5H423_HUMAN Uncharacterized protein OS=Homo sapiens OX=9606 PE=3 SV,9,5,71.3,181
ERH,0.0782399744,0.568073426187956,0,P84090;G3V279,P84090;G3V279,6;3,6;3,6;3,Enhancer of rudimentary homolog,ERH,sp|P84090|ERH_HUMAN Enhancer of rudimentary homolog OS=Homo sapiens OX=9606 GN=ERH PE=1 SV=1;tr|G3V279|G3V279_HUMAN Enhancer of rudimentary homolog OS=Homo sapiens OX=9606 GN=ERH PE=1 SV=1,6,6,54.8,104
RHOG,-0.1468131987,0.191062595623945,0,P84095,P84095,5,4,4,Rho-related GTP-binding protein RhoG,RHOG,sp|P84095|RHOG_HUMAN Rho-related GTP-binding protein RhoG OS=Homo sapiens OX=9606 GN=RHOG PE=1 SV=1,5,4,41.9,191
FOXK1,-0.135604425,0.552727527009291,0,P85037;Q01167;E9PM37;E9PPI7,P85037,6;1;1;1,6;1;1;1,6;1;1;1,Forkhead box protein K1,FOXK1,sp|P85037|FOXK1_HUMAN Forkhead box protein K1 OS=Homo sapiens OX=9606 GN=FOXK1 PE=1 SV=1,6,6,7.5,733
RBM10,-0.4860573147,0.166730371232737,0,P98175;P78332;E9PGM9,P98175,3;1;1,3;1;1,3;1;1,RNA-binding protein 10,RBM10,sp|P98175|RBM10_HUMAN RNA-binding protein 10 OS=Homo sapiens OX=9606 GN=RBM10 PE=1 SV=3,3,3,3.5,930
RBM3,-0.0200030772,0.904397557640971,0,P98179,P98179,7,7,7,RNA-binding protein 3,RBM3,sp|P98179|RBM3_HUMAN RNA-binding protein 3 OS=Homo sapiens OX=9606 GN=RBM3 PE=1 SV=1,7,7,61.1,157
TFAM,-0.2779370463,0.0476624200906786,0,Q00059;H7BYN3,Q00059;H7BYN3,6;4,6;4,6;4,"Transcription factor A, mitochondrial",TFAM,"sp|Q00059|TFAM_HUMAN Transcription factor A, mitochondrial OS=Homo sapiens OX=9606 GN=TFAM PE=1 SV=1;tr|H7BYN3|H7BYN3_HUMAN Transcription factor A, mitochondrial (Fragment) OS=Homo sapiens OX=9606 GN=TFAM PE=1 SV=1",6,6,26.8,246
PURA,-0.0516179075,0.694752652843306,0,Q00577,Q00577,4,4,4,Transcriptional activator protein Pur-alpha,PURA,sp|Q00577|PURA_HUMAN Transcriptional activator protein Pur-alpha OS=Homo sapiens OX=9606 GN=PURA PE=1 SV=2,4,4,16.5,322
CLTC,-0.3567309137,0.0159329669947773,0,Q00610;A0A087WVQ6;J3KS13;P53675;A0A087WX41;K7EJJ5;J3KRF5;J3KSQ2;J3QL20;F5H5N6,Q00610;A0A087WVQ6,93;92;33;17;17;13;7;6;3;1,93;92;33;17;17;13;7;6;3;1,93;92;33;17;17;13;7;6;3;1,Clathrin heavy chain 1;Clathrin heavy chain,CLTC,sp|Q00610|CLH1_HUMAN Clathrin heavy chain 1 OS=Homo sapiens OX=9606 GN=CLTC PE=1 SV=5;tr|A0A087WVQ6|A0A087WVQ6_HUMAN Clathrin heavy chain OS=Homo sapiens OX=9606 GN=CLTC PE=1 SV=1,93,93,50.7,1675
FKBP3,-0.2817719504,0.120182752697649,0,Q00688;G3V5F2,Q00688,15;3,15;3,15;3,Peptidyl-prolyl cis-trans isomerase FKBP3,FKBP3,sp|Q00688|FKBP3_HUMAN Peptidyl-prolyl cis-trans isomerase FKBP3 OS=Homo sapiens OX=9606 GN=FKBP3 PE=1 SV=1,15,15,63.8,224
SORD,-0.0248421159,0.812648265981924,0,Q00796;H0YLA4;H0YKB3,Q00796;H0YLA4,12;10;4,12;10;4,12;10;4,Sorbitol dehydrogenase,SORD,sp|Q00796|DHSO_HUMAN Sorbitol dehydrogenase OS=Homo sapiens OX=9606 GN=SORD PE=1 SV=4;tr|H0YLA4|H0YLA4_HUMAN Sorbitol dehydrogenase OS=Homo sapiens OX=9606 GN=SORD PE=1 SV=1,12,12,43.4,357
HNRNPU,-0.1249560796,0.240967221331809,0,Q00839;A0A1W2PPS1;A0A1X7SBS1;A0A1W2PP35;Q5RI18;A0A1W2PPL4;A0A1W2PPH7;A0A1W2PQL0;A0A1W2PP34;A0A1W2PQ74;A0A1W2PRZ7;A0A1W2PQD4;A0A1W2PPE9;A0A1W2PRI6;A0A1W2PP22;A0A1W2PNG3,Q00839;A0A1W2PPS1;A0A1X7SBS1;A0A1W2PP35;Q5RI18;A0A1W2PPL4;A0A1W2PPH7;A0A1W2PQL0;A0A1W2PP34;A0A1W2PQ74;A0A1W2PRZ7;A0A1W2PQD4,46;45;43;41;39;36;36;35;35;34;31;24;5;5;3;2,46;45;43;41;39;36;36;35;35;34;31;24;5;5;3;2,46;45;43;41;39;36;36;35;35;34;31;24;5;5;3;2,Heterogeneous nuclear ribonucleoprotein U,HNRNPU,sp|Q00839|HNRPU_HUMAN Heterogeneous nuclear ribonucleoprotein U OS=Homo sapiens OX=9606 GN=HNRNPU PE=1 SV=6;tr|A0A1W2PPS1|A0A1W2PPS1_HUMAN Heterogeneous nuclear ribonucleoprotein U OS=Homo sapiens OX=9606 GN=HNRNPU PE=1 SV=1;tr|A0A1X7SBS1|A0A1X7SBS1_HUMAN ,46,46,44.6,825
FABP5,-0.0786278558,0.666842277849415,0,Q01469;I6L8B7;A8MUU1,Q01469;I6L8B7,22;12;4,22;12;4,22;12;4,"Fatty acid-binding protein, epidermal",FABP5,sp|Q01469|FABP5_HUMAN Fatty acid-binding protein 5 OS=Homo sapiens OX=9606 GN=FABP5 PE=1 SV=3;tr|I6L8B7|I6L8B7_HUMAN Fatty acid-binding protein 5 OS=Homo sapiens OX=9606 GN=FABP5 PE=1 SV=1,22,22,94.8,135
CAP1,-0.2563394003,0.0685588389504943,0,Q01518;Q5T0R1;Q5T0R7;Q5T0R6;Q5T0R5;Q5T0R4;Q5T0R3;Q5T0R2;Q5T0R9;Q5T0R8;Q5T0S3;E9PDI2,Q01518,27;13;12;12;12;12;12;12;12;4;4;1,27;13;12;12;12;12;12;12;12;4;4;1,26;13;12;12;12;12;12;12;12;4;4;0,Adenylyl cyclase-associated protein 1,CAP1,sp|Q01518|CAP1_HUMAN Adenylyl cyclase-associated protein 1 OS=Homo sapiens OX=9606 GN=CAP1 PE=1 SV=5,27,26,71.6,475
HMGCS1,1.1797541771,0.000309485318748157,1,Q01581;D6RIW1,Q01581,19;3,19;3,17;3,"Hydroxymethylglutaryl-CoA synthase, cytoplasmic",HMGCS1,"sp|Q01581|HMCS1_HUMAN Hydroxymethylglutaryl-CoA synthase, cytoplasmic OS=Homo sapiens OX=9606 GN=HMGCS1 PE=1 SV=2",19,17,52.9,520
PFKP,0.5621901159,0.03532358513125,0,Q01813;B1APP6;H0Y757;H0Y3Y3;Q5VSR5;V9GYV7,Q01813;B1APP6,13;9;3;3;3;2,11;9;3;3;2;2,11;9;3;3;2;2,"ATP-dependent 6-phosphofructokinase, platelet type",PFKP,"sp|Q01813|PFKAP_HUMAN ATP-dependent 6-phosphofructokinase, platelet type OS=Homo sapiens OX=9606 GN=PFKP PE=1 SV=2;tr|B1APP6|B1APP6_HUMAN ATP-dependent 6-phosphofructokinase, platelet type OS=Homo sapiens OX=9606 GN=PFKP PE=1 SV=2",13,11,19.3,784
ALDH6A1,-0.1986918477,0.681316363061092,0,Q02252;G3V4Z4,Q02252;G3V4Z4,4;2,4;2,4;2,"Methylmalonate-semialdehyde dehydrogenase [acylating], mitochondrial",ALDH6A1,"sp|Q02252|MMSA_HUMAN Methylmalonate-semialdehyde dehydrogenase [acylating], mitochondrial OS=Homo sapiens OX=9606 GN=ALDH6A1 PE=1 SV=2;tr|G3V4Z4|G3V4Z4_HUMAN Methylmalonate-semialdehyde dehydrogenase [acylating], mitochondrial OS=Homo sapiens OX=9606 GN=AL",4,4,16.1,535
FKBP4,0.3942151562,0.0231509575203502,0,Q02790;H0YFG2;F5H1U3;F5H120,Q02790,35;7;6;1,35;7;6;1,35;7;6;1,"Peptidyl-prolyl cis-trans isomerase FKBP4;Peptidyl-prolyl cis-trans isomerase FKBP4, N-terminally processed",FKBP4,sp|Q02790|FKBP4_HUMAN Peptidyl-prolyl cis-trans isomerase FKBP4 OS=Homo sapiens OX=9606 GN=FKBP4 PE=1 SV=3,35,35,75.4,459
PLOD1,0.0748686263,0.630273293732438,0,Q02809;Q5JXB8;Q5JXB7,Q02809;Q5JXB8;Q5JXB7,2;1;1,2;1;1,2;1;1,"Procollagen-lysine,2-oxoglutarate 5-dioxygenase 1",PLOD1,"sp|Q02809|PLOD1_HUMAN Procollagen-lysine,2-oxoglutarate 5-dioxygenase 1 OS=Homo sapiens OX=9606 GN=PLOD1 PE=1 SV=2;tr|Q5JXB8|Q5JXB8_HUMAN Procollagen-lysine,2-oxoglutarate 5-dioxygenase 1 (Fragment) OS=Homo sapiens OX=9606 GN=PLOD1 PE=1 SV=1;tr|Q5JXB7|Q5JX",2,2,4.4,727
RPL6,0.1858306973,0.106973824127424,0,Q02878;F8VZ45;U3KQR5;F8VR69;F8VZA3;F8VWR1;F8VU16,Q02878,16;5;5;3;2;2;2,16;5;5;3;2;2;2,16;5;5;3;2;2;2,60S ribosomal protein L6,RPL6,sp|Q02878|RL6_HUMAN 60S ribosomal protein L6 OS=Homo sapiens OX=9606 GN=RPL6 PE=1 SV=3,16,16,51.4,288
LMNB2,-0.1502025862,0.443096314760815,0,Q03252,Q03252,15,11,11,Lamin-B2,LMNB2,sp|Q03252|LMNB2_HUMAN Lamin-B2 OS=Homo sapiens OX=9606 GN=LMNB2 PE=1 SV=4,15,11,26.6,620
GLO1,-0.293699585,0.0394321042394339,0,Q04760,Q04760,10,10,10,Lactoylglutathione lyase,GLO1,sp|Q04760|LGUL_HUMAN Lactoylglutathione lyase OS=Homo sapiens OX=9606 GN=GLO1 PE=1 SV=4,10,10,56,184
YWHAH,0.2516406332,0.085286513225967,0,Q04917;F8WEB6;A2IDB1,Q04917,9;3;3,5;3;3,5;3;3,14-3-3 protein eta,YWHAH,sp|Q04917|1433F_HUMAN 14-3-3 protein eta OS=Homo sapiens OX=9606 GN=YWHAH PE=1 SV=4,9,5,29.3,246
CSTF1,-0.1719149196,0.338287938747105,0,Q05048;A0A0A0MSZ9;A3KFI9,Q05048;A0A0A0MSZ9,7;5;1,7;5;1,7;5;1,Cleavage stimulation factor subunit 1,CSTF1,sp|Q05048|CSTF1_HUMAN Cleavage stimulation factor subunit 1 OS=Homo sapiens OX=9606 GN=CSTF1 PE=1 SV=1;tr|A0A0A0MSZ9|A0A0A0MSZ9_HUMAN Cleavage stimulation factor subunit 1 (Fragment) OS=Homo sapiens OX=9606 GN=CSTF1 PE=1 SV=1,7,7,23.9,431
SRSF11,-0.0692292845,0.750540268943654,0,Q05519;Q5T760;B4DWT1;S4R3C4,Q05519;Q5T760;B4DWT1,3;3;2;1,3;3;2;1,3;3;2;1,Serine/arginine-rich splicing factor 11,SRSF11,sp|Q05519|SRS11_HUMAN Serine/arginine-rich splicing factor 11 OS=Homo sapiens OX=9606 GN=SRSF11 PE=1 SV=1;tr|Q5T760|Q5T760_HUMAN Serine/arginine-rich-splicing factor 11 (Fragment) OS=Homo sapiens OX=9606 GN=SRSF11 PE=1 SV=1;tr|B4DWT1|B4DWT1_HUMAN Serine/ar,3,3,9.5,484
PTPN11,0.0969660783,0.540922657666342,0,Q06124;H0YF12;A0A1W2PPU4,Q06124,4;1;1,4;1;1,3;1;1,Tyrosine-protein phosphatase non-receptor type 11,PTPN11,sp|Q06124|PTN11_HUMAN Tyrosine-protein phosphatase non-receptor type 11 OS=Homo sapiens OX=9606 GN=PTPN11 PE=1 SV=3,4,3,9.1,593
PPAT,0.64633232,0.00186020887531579,0,Q06203;D6RCC8;D6RE15,Q06203,14;5;1,14;5;1,14;5;1,Amidophosphoribosyltransferase,PPAT,sp|Q06203|PUR1_HUMAN Amidophosphoribosyltransferase OS=Homo sapiens OX=9606 GN=PPAT PE=1 SV=1,14,14,33.7,517
GFPT1,0.1199035719,0.334246419273996,0,Q06210;O94808;E5RJP4,Q06210,19;4;2,19;4;2,19;4;2,Glutamine--fructose-6-phosphate aminotransferase [isomerizing] 1,GFPT1,sp|Q06210|GFPT1_HUMAN Glutamine--fructose-6-phosphate aminotransferase [isomerizing] 1 OS=Homo sapiens OX=9606 GN=GFPT1 PE=1 SV=3,19,19,32.9,699
PSME1,-0.3807121565,0.0167280281808021,0,Q06323;H0YLU2;H0YKK6,Q06323;H0YLU2,12;6;5,12;6;5,12;6;5,Proteasome activator complex subunit 1,PSME1,sp|Q06323|PSME1_HUMAN Proteasome activator complex subunit 1 OS=Homo sapiens OX=9606 GN=PSME1 PE=1 SV=1;tr|H0YLU2|H0YLU2_HUMAN Proteasome activator complex subunit 1 (Fragment) OS=Homo sapiens OX=9606 GN=PSME1 PE=1 SV=1,12,12,53.8,249
RING1;RNF2,1.512194062,0.12300969426142,0,Q06587;Q99496;X6RFN3,Q06587;Q99496;X6RFN3,1;1;1,1;1;1,1;1;1,E3 ubiquitin-protein ligase RING1;E3 ubiquitin-protein ligase RING2,RING1;RNF2,sp|Q06587|RING1_HUMAN E3 ubiquitin-protein ligase RING1 OS=Homo sapiens OX=9606 GN=RING1 PE=1 SV=2;sp|Q99496|RING2_HUMAN E3 ubiquitin-protein ligase RING2 OS=Homo sapiens OX=9606 GN=RNF2 PE=1 SV=1;tr|X6RFN3|X6RFN3_HUMAN E3 ubiquitin-protein ligase RING2 (F,1,1,3.4,406
